607	GO:BP	GO:0008150	biological_process	0.0087013799957033	True	"""A biological process is the execution of a genetically-encoded biological module or program. It consists of all the steps required to achieve the specific biological objective of the module. A biological process is accomplished by a particular set of molecular functions carried out by specific gene products (or macromolecular complexes), often in a highly regulated manner and in a particular temporal sequence."" [GOC:pdt]"	15627	102	100	17376	0.9803921568627452	0.0063991809048441	query_1	[]	['RBBP8', 'MICOS10', 'HUS1', 'RPA4', 'MTX3', 'MTX2', 'LMNA', 'BRIP1', 'RAD9B', 'XPA', 'NBN', 'MICOS13', 'MSH2', 'USP1', 'TP53BP1', 'POLD3', 'RAD50', 'FANCI', 'RAD52', 'DCLRE1C', 'RAD51AP1', 'LIG3', 'XRCC6', 'HLTF', 'WDR48', 'MTX1', 'CHCHD3', 'PAXIP1', 'LIG4', 'APLF', 'MLH1', 'FEN1', 'TDP1', 'POLD4', 'H2AX', 'RPA2', 'MSH3', 'MDC1', 'OGG1', 'LIG1', 'POLE4', 'BRCA2', 'POLA1', 'PRIM1', 'RAD1', 'PCNA', 'USP12', 'RPA3', 'PMS2', 'PARP1', 'APOOL', 'XRCC4', 'XRCC5', 'ERCC1', 'NHEJ1', 'RPA1', 'APTX', 'ERCC4', 'FANCD2', 'BLM', 'ATM', 'RAD9A', 'POLE3', 'MRE11', 'VDAC1', 'RAD51', 'TOP3A', 'APEX1', 'PRIM2', 'VRK1', 'EXO1', 'HUS1B', 'CARD19', 'BRCA1', 'CDK2', 'PRKDC', 'POLA2', 'XRCC1', 'APOO', 'CHCHD6', 'POLD1', 'BARD1', 'POLB', 'WRN', 'EMD', 'RMI2', 'POLE2', 'DNAJC11', 'RMI1', 'TP53', 'CHCHD10', 'SAMM50', 'PNKP', 'NEIL1', 'IMMT', 'BANF1', 'POLE', 'POLD2', 'RNF8', 'MSH6']
608	GO:BP	GO:0006997	nucleus organization	0.0089264494064503	True	"""A process that is carried out at the cellular level which results in the assembly, arrangement of constituent parts, or disassembly of the nucleus."" [GOC:dph, GOC:ems, GOC:jl, GOC:mah]"	143	102	5	17376	0.0490196078431372	0.0349650349650349	query_1	['GO:0006996']	['LMNA', 'VRK1', 'EMD', 'BANF1', 'RNF8']
609	GO:CC	GO:0000428	DNA-directed RNA polymerase complex	0.0094549780699093	True	"""A protein complex that possesses DNA-directed RNA polymerase activity."" [GOC:krc]"	109	102	4	17376	0.0392156862745098	0.036697247706422	query_1	['GO:0030880']	['POLA1', 'PRIM1', 'PRIM2', 'POLA2']
610	GO:BP	GO:0009792	embryo development ending in birth or egg hatching	0.0096270184034928	True	"""The process whose specific outcome is the progression of an embryo over time, from zygote formation until the end of the embryonic life stage. The end of the embryonic life stage is organism-specific and may be somewhat arbitrary; for mammals it is usually considered to be birth, for insects the hatching of the first instar larva from the eggshell."" [GOC:go_curators, GOC:isa_complete, GOC:mtg_sensu]"	659	102	11	17376	0.1078431372549019	0.0166919575113808	query_1	['GO:0009790']	['RBBP8', 'HUS1', 'NBN', 'MSH2', 'LIG4', 'BRCA2', 'ATM', 'BRCA1', 'PRKDC', 'POLB', 'TP53']
611	GO:BP	GO:0048609	multicellular organismal reproductive process	0.0096524741210403	True	"""The process, occurring above the cellular level, that is pertinent to the reproductive function of a multicellular organism. This includes the integrated processes at the level of tissues and organs."" [GOC:dph, GOC:jid, GOC:tb]"	868	102	13	17376	0.1274509803921568	0.0149769585253456	query_1	['GO:0022414', 'GO:0032504']	['BRIP1', 'MSH2', 'WDR48', 'MLH1', 'H2AX', 'BRCA2', 'PCNA', 'PARP1', 'ERCC1', 'FANCD2', 'ATM', 'RNF8', 'MSH6']
612	GO:BP	GO:1903131	mononuclear cell differentiation	0.0097550862411207	True	"""The process in which a relatively unspecialized cell acquires the specialized features of a mononuclear cell."" [CL:0000842, GO_REF:0000086, GOC:TermGenie, PMID:24759906]"	467	102	9	17376	0.088235294117647	0.019271948608137	query_1	['GO:0002521']	['MSH2', 'DCLRE1C', 'XRCC6', 'LIG4', 'NHEJ1', 'FANCD2', 'ATM', 'PRKDC', 'TP53']
613	GO:BP	GO:0031062	positive regulation of histone methylation	0.0101666709932971	True	"""Any process that activates or increases the frequency, rate or extent of the covalent addition of methyl groups to histones."" [GOC:mah]"	41	102	3	17376	0.0294117647058823	0.073170731707317	query_1	['GO:0016571', 'GO:0031060', 'GO:0031401']	['LMNA', 'PAXIP1', 'BRCA1']
614	GO:BP	GO:0072711	cellular response to hydroxyurea	0.010214146512458	True	"""Any process that results in a change in state or activity of a cell (in terms of movement, secretion, enzyme production, gene expression, etc.) as a result of a hydroxyurea stimulus."" [GOC:mah]"	11	102	2	17376	0.0196078431372549	0.1818181818181818	query_1	['GO:0071241', 'GO:0072710', 'GO:1901699']	['BLM', 'RAD51']
615	GO:BP	GO:0090657	telomeric loop disassembly	0.010214146512458	True	"""The telomere maintenance process in which telomeric loops are disassembled to permit efficient telomere replication."" [GOC:BHF, GOC:BHF_telomere, GOC:nc, PMID:22579284]"	11	102	2	17376	0.0196078431372549	0.1818181818181818	query_1	['GO:0000723']	['BLM', 'WRN']
616	GO:BP	GO:0034397	telomere localization	0.010214146512458	True	"""Any process in which a telomere is transported to, and/or maintained in, a specific location."" [GOC:mah, GOC:vw]"	11	102	2	17376	0.0196078431372549	0.1818181818181818	query_1	['GO:0050000']	['MLH1', 'ATM']
617	GO:BP	GO:0090220	chromosome localization to nuclear envelope involved in homologous chromosome segregation	0.010214146512458	True	"""The directed movement of a chromosome to the nuclear envelope that contributes to homologous chromosome segregation and precedes synapsis."" [GOC:ascb_2009, GOC:dph, GOC:tb, PMID:19913287]"	11	102	2	17376	0.0196078431372549	0.1818181818181818	query_1	['GO:0022414', 'GO:0045143', 'GO:0051303']	['MLH1', 'ATM']
618	GO:BP	GO:0002328	pro-B cell differentiation	0.010214146512458	True	"""The process in which a precursor cell type acquires the specialized features of a pro-B cell. Pro-B cells are the earliest stage of the B cell lineage and undergo heavy chain D and J gene rearrangements, although they are not fully committed."" [GOC:jal, ISBN:0781735149]"	11	102	2	17376	0.0196078431372549	0.1818181818181818	query_1	['GO:0002320']	['LIG4', 'PRKDC']
619	GO:CC	GO:0030880	RNA polymerase complex	0.0103163840760544	True	"""Any complex that possesses RNA polymerase activity; generally comprises a catalytic subunit and one or more additional subunits."" [GOC:mah]"	112	102	4	17376	0.0392156862745098	0.0357142857142857	query_1	['GO:0061695', 'GO:0140535']	['POLA1', 'PRIM1', 'PRIM2', 'POLA2']
620	GO:BP	GO:0035264	multicellular organism growth	0.0104099809289261	True	"""The increase in size or mass of an entire multicellular organism, as opposed to cell growth."" [GOC:bf, GOC:curators, GOC:dph, GOC:tb]"	149	102	5	17376	0.0490196078431372	0.0335570469798657	query_1	['GO:0032501', 'GO:0048589']	['WDR48', 'ERCC1', 'ATM', 'RMI1', 'TP53']
621	GO:BP	GO:0071763	nuclear membrane organization	0.0106993976331144	True	"""A process that is carried out at the cellular level which results in the assembly, arrangement of constituent parts, or disassembly of the nuclear inner or outer membrane."" [GOC:mah]"	42	102	3	17376	0.0294117647058823	0.0714285714285714	query_1	['GO:0006998', 'GO:0061024']	['VRK1', 'EMD', 'BANF1']
622	GO:BP	GO:0032781	positive regulation of ATP-dependent activity	0.0113925688716332	True	"""Any process that activates or increases the rate of an ATP-dependent activity."" [GOC:mah]"	43	102	3	17376	0.0294117647058823	0.0697674418604651	query_1	['GO:0043462', 'GO:0044093']	['MSH2', 'MSH3', 'MSH6']
623	GO:BP	GO:2000378	negative regulation of reactive oxygen species metabolic process	0.0113925688716332	True	"""Any process that stops, prevents or reduces the frequency, rate or extent of reactive oxygen species metabolic process."" [GOC:mah]"	43	102	3	17376	0.0294117647058823	0.0697674418604651	query_1	['GO:0031324', 'GO:0072593', 'GO:2000377']	['VDAC1', 'BRCA1', 'TP53']
624	GO:BP	GO:0008406	gonad development	0.0114898433558073	True	"""The process whose specific outcome is the progression of the gonad over time, from its formation to the mature structure. The gonad is an animal organ that produces gametes; in some species it also produces hormones."" [GOC:ems, ISBN:0198506732]"	224	102	6	17376	0.0588235294117647	0.0267857142857142	query_1	['GO:0045137', 'GO:0048513', 'GO:0048608']	['BRIP1', 'MSH2', 'WDR48', 'BRCA2', 'ERCC1', 'ATM']
625	GO:BP	GO:0071241	cellular response to inorganic substance	0.011718544031444	True	"""Any process that results in a change in state or activity of a cell (in terms of movement, secretion, enzyme production, gene expression, etc.) as a result of an inorganic substance stimulus."" [GOC:mah]"	225	102	6	17376	0.0588235294117647	0.0266666666666666	query_1	['GO:0010035', 'GO:0070887']	['LIG4', 'OGG1', 'PARP1', 'BLM', 'RAD51', 'CDK2']
626	GO:BP	GO:0006285	base-excision repair, AP site formation	0.0119544207656796	True	"""The formation of an AP site, a deoxyribose sugar with a missing base, by DNA glycosylase which recognizes an altered base in DNA and catalyzes its hydrolytic removal. This sugar phosphate is the substrate recognized by the AP endonuclease, which cuts the DNA phosphodiester backbone at the 5' side of the altered site to leave a gap which is subsequently repaired."" [ISBN:0815316194]"	12	102	2	17376	0.0196078431372549	0.1666666666666666	query_1	['GO:0006259', 'GO:0006284']	['OGG1', 'NEIL1']
627	GO:BP	GO:0072710	response to hydroxyurea	0.0119544207656796	True	"""Any process that results in a change in state or activity of a cell or an organism (in terms of movement, secretion, enzyme production, gene expression, etc.) as a result of a hydroxyurea stimulus."" [GOC:mah]"	12	102	2	17376	0.0196078431372549	0.1666666666666666	query_1	['GO:0010033', 'GO:1901698']	['BLM', 'RAD51']
628	GO:BP	GO:0031952	regulation of protein autophosphorylation	0.0120154988401968	True	"""Any process that modulates the frequency, rate or extent of addition of the phosphorylation by a protein of one or more of its own residues."" [GOC:mah]"	44	102	3	17376	0.0294117647058823	0.0681818181818181	query_1	['GO:0001932', 'GO:0046777']	['NBN', 'RAD50', 'MRE11']
629	REAC	REAC:R-HSA-8866654	E3 ubiquitin ligases ubiquitinate target proteins	0.0123272756890738	True	E3 ubiquitin ligases ubiquitinate target proteins	58	102	3	17376	0.0294117647058823	0.0517241379310344	query_1	['REAC:R-HSA-8852135']	['HLTF', 'PCNA', 'PRKDC']
630	REAC	REAC:R-HSA-6804114	TP53 Regulates Transcription of Genes Involved in G2 Cell Cycle Arrest	0.0124463676000543	True	TP53 Regulates Transcription of Genes Involved in G2 Cell Cycle Arrest	18	102	2	17376	0.0196078431372549	0.1111111111111111	query_1	['REAC:R-HSA-6791312']	['PCNA', 'TP53']
631	REAC	REAC:R-HSA-3232118	SUMOylation of transcription factors	0.0124463676000543	True	SUMOylation of transcription factors	18	102	2	17376	0.0196078431372549	0.1111111111111111	query_1	['REAC:R-HSA-3108232']	['TP53BP1', 'TP53']
632	REAC	REAC:R-HSA-110328	Recognition and association of DNA glycosylase with site containing an affected pyrimidine	0.0124930235312656	True	Recognition and association of DNA glycosylase with site containing an affected pyrimidine	59	102	3	17376	0.0294117647058823	0.0508474576271186	query_1	['REAC:R-HSA-73928']	['H2AX', 'OGG1', 'NEIL1']
633	REAC	REAC:R-HSA-110329	Cleavage of the damaged pyrimidine 	0.0124930235312656	True	Cleavage of the damaged pyrimidine 	59	102	3	17376	0.0294117647058823	0.0508474576271186	query_1	['REAC:R-HSA-73928']	['H2AX', 'OGG1', 'NEIL1']
634	REAC	REAC:R-HSA-73928	Depyrimidination	0.0124930235312656	True	Depyrimidination	59	102	3	17376	0.0294117647058823	0.0508474576271186	query_1	['REAC:R-HSA-73929']	['H2AX', 'OGG1', 'NEIL1']
635	GO:BP	GO:0045137	development of primary sexual characteristics	0.0126654771123466	True	"""The process whose specific outcome is the progression of the primary sexual characteristics over time, from their formation to the mature structures. The primary sexual characteristics are the testes in males and the ovaries in females and they develop in response to sex hormone secretion."" [GOC:ai]"	229	102	6	17376	0.0588235294117647	0.0262008733624454	query_1	['GO:0003006', 'GO:0007275', 'GO:0007548']	['BRIP1', 'MSH2', 'WDR48', 'BRCA2', 'ERCC1', 'ATM']
636	REAC	REAC:R-HSA-392499	Metabolism of proteins	0.0126944852860033	True	Metabolism of proteins	1854	102	20	17376	0.196078431372549	0.0107874865156418	query_1	['REAC:0000000']	['TP53BP1', 'RAD52', 'HLTF', 'WDR48', 'H2AX', 'WDR20', 'MDC1', 'PCNA', 'USP12', 'PARP1', 'XRCC4', 'RPA1', 'BLM', 'VDAC1', 'BRCA1', 'PRKDC', 'BARD1', 'POLB', 'WRN', 'TP53']
637	REAC	REAC:R-HSA-73929	Base-Excision Repair, AP Site Formation	0.0129193586965128	True	Base-Excision Repair, AP Site Formation	60	102	3	17376	0.0294117647058823	0.05	query_1	['REAC:R-HSA-73884']	['H2AX', 'OGG1', 'NEIL1']
638	REAC	REAC:R-HSA-2262752	Cellular responses to stress	0.0130858592506624	True	Cellular responses to stress	768	102	11	17376	0.1078431372549019	0.0143229166666666	query_1	['REAC:R-HSA-8953897']	['LMNA', 'NBN', 'RAD50', 'H2AX', 'RPA2', 'RPA3', 'RPA1', 'ATM', 'MRE11', 'CDK2', 'TP53']
639	REAC	REAC:R-HSA-6804760	Regulation of TP53 Activity through Methylation	0.0132152388235182	True	Regulation of TP53 Activity through Methylation	19	102	2	17376	0.0196078431372549	0.1052631578947368	query_1	['REAC:R-HSA-5633007']	['ATM', 'TP53']
640	GO:CC	GO:0033593	BRCA2-MAGE-D1 complex	0.0133797471504652	True	"""A heterodimeric protein complex formed of BRCA2 and MAGE-D1; may mediate the synergistic activities of the two proteins in regulating cell growth."" [PMID:15930293]"	1	102	1	17376	0.0098039215686274	1.0	query_1	['GO:0140535']	['BRCA2']
641	GO:CC	GO:0160045	TMEM240-body	0.0133797471504652	True	"""A multilamellar subcellular structure formed in the cytoplasm of developing neuron, composed of Tmem240 and Emd proteins."" [PMID:32535204]"	1	102	1	17376	0.0098039215686274	1.0	query_1	['GO:0043231']	['EMD']
642	GO:CC	GO:0044796	DNA polymerase processivity factor complex	0.0133797471504652	True	"""A protein complex which is capable of increasing the processivity of nucleotide polymerization by DNA polymerase as a part of DNA replication."" [GOC:bhm, GOC:jl]"	1	102	1	17376	0.0098039215686274	1.0	query_1	['GO:0150005']	['PCNA']
643	GO:CC	GO:0043626	PCNA complex	0.0133797471504652	True	"""A protein complex composed of three identical PCNA monomers, each comprising two similar domains, which are joined in a head-to-tail arrangement to form a homotrimer. Forms a ring-like structure in solution, with a central hole sufficiently large to accommodate the double helix of DNA. Originally characterized as a DNA sliding clamp for replicative DNA polymerases and as an essential component of the replisome, and has also been shown to be involved in other processes including Okazaki fragment processing, DNA repair, translesion DNA synthesis, DNA methylation, chromatin remodeling and cell cycle regulation."" [GOC:jl, PMID:12829735]"	1	102	1	17376	0.0098039215686274	1.0	query_1	['GO:0044796', 'GO:0140513']	['PCNA']
644	GO:CC	GO:0070421	DNA ligase III-XRCC1 complex	0.0133797471504652	True	"""A protein complex that contains DNA ligase III and XRCC1, and is involved in base excision repair."" [PMID:15141024, PMID:7760816]"	1	102	1	17376	0.0098039215686274	1.0	query_1	['GO:0140513', 'GO:1902494']	['LIG3']
645	GO:CC	GO:0005715	late recombination nodule	0.0133797471504652	True	"""An electron dense structure that is associated with meiotic chromosomes in pachytene during meiosis I."" [GOC:elh]"	1	102	1	17376	0.0098039215686274	1.0	query_1	['GO:0005713']	['MLH1']
646	REAC	REAC:R-HSA-9723905	Loss of function of TP53 in cancer due to loss of tetramerization ability	0.0135608259318832	True	Loss of function of TP53 in cancer due to loss of tetramerization ability	1	102	1	17376	0.0098039215686274	1.0	query_1	['REAC:R-HSA-9723907']	['TP53']
647	REAC	REAC:R-HSA-9656256	Defective OGG1 Substrate Processing	0.0135608259318832	True	Defective OGG1 Substrate Processing	1	102	1	17376	0.0098039215686274	1.0	query_1	['REAC:R-HSA-9656249']	['OGG1']
648	REAC	REAC:R-HSA-9656255	Defective OGG1 Substrate Binding	0.0135608259318832	True	Defective OGG1 Substrate Binding	1	102	1	17376	0.0098039215686274	1.0	query_1	['REAC:R-HSA-9656249']	['OGG1']
649	REAC	REAC:R-HSA-192814	vRNA Synthesis	0.0135608259318832	True	vRNA Synthesis	1	102	1	17376	0.0098039215686274	1.0	query_1	['REAC:R-HSA-168273']	['PARP1']
650	REAC	REAC:R-HSA-9616334	Defective Base Excision Repair Associated with NEIL1	0.0135608259318832	True	Defective Base Excision Repair Associated with NEIL1	1	102	1	17376	0.0098039215686274	1.0	query_1	['REAC:R-HSA-9605308']	['NEIL1']
651	REAC	REAC:R-HSA-9656249	Defective Base Excision Repair Associated with OGG1	0.0135608259318832	True	Defective Base Excision Repair Associated with OGG1	1	102	1	17376	0.0098039215686274	1.0	query_1	['REAC:R-HSA-9605308']	['OGG1']
652	REAC	REAC:R-HSA-9723907	Loss of Function of TP53 in Cancer	0.0135608259318832	True	Loss of Function of TP53 in Cancer	1	102	1	17376	0.0098039215686274	1.0	query_1	['REAC:R-HSA-9734009']	['TP53']
653	GO:BP	GO:0032504	multicellular organism reproduction	0.013796940190368	True	"""The biological process in which new individuals are produced by one or two multicellular organisms. The new individuals inherit some proportion of their genetic material from the parent or parents."" [GOC:isa_complete, GOC:jid]"	909	102	13	17376	0.1274509803921568	0.0143014301430143	query_1	['GO:0000003', 'GO:0032501']	['BRIP1', 'MSH2', 'WDR48', 'MLH1', 'H2AX', 'BRCA2', 'PCNA', 'PARP1', 'ERCC1', 'FANCD2', 'ATM', 'RNF8', 'MSH6']
654	GO:BP	GO:0002521	leukocyte differentiation	0.0138186786664996	True	"""The process in which a relatively unspecialized hemopoietic precursor cell acquires the specialized features of a leukocyte. A leukocyte is an achromatic cell of the myeloid or lymphoid lineages capable of ameboid movement, found in blood or other tissue."" [CL:0000738, GOC:add, PMID:16551264]"	593	102	10	17376	0.0980392156862745	0.0168634064080944	query_1	['GO:0030097', 'GO:0030154']	['MSH2', 'DCLRE1C', 'XRCC6', 'LIG4', 'PARP1', 'NHEJ1', 'FANCD2', 'ATM', 'PRKDC', 'TP53']
655	GO:BP	GO:1901524	regulation of mitophagy	0.0138563406622362	True	"""Any process that modulates the frequency, rate or extent of macromitophagy."" [GOC:TermGenie]"	13	102	2	17376	0.0196078431372549	0.1538461538461538	query_1	['GO:0000423', 'GO:0016241', 'GO:1903146']	['VDAC1', 'TP53']
656	GO:BP	GO:0002327	immature B cell differentiation	0.0138563406622362	True	"""The process in which a precursor cell type acquires the specialized features of an immature B cell."" [GOC:jal, ISBN:0781735149, PMID:16551251]"	13	102	2	17376	0.0196078431372549	0.1538461538461538	query_1	['GO:0030183']	['ATM', 'PRKDC']
657	REAC	REAC:R-HSA-6803204	TP53 Regulates Transcription of Genes Involved in Cytochrome C Release	0.0138916951211757	True	TP53 Regulates Transcription of Genes Involved in Cytochrome C Release	20	102	2	17376	0.0196078431372549	0.1	query_1	['REAC:R-HSA-5633008']	['ATM', 'TP53']
658	REAC	REAC:R-HSA-8953897	Cellular responses to stimuli	0.014003053598743	True	Cellular responses to stimuli	782	102	11	17376	0.1078431372549019	0.0140664961636828	query_1	['REAC:0000000']	['LMNA', 'NBN', 'RAD50', 'H2AX', 'RPA2', 'RPA3', 'RPA1', 'ATM', 'MRE11', 'CDK2', 'TP53']
659	GO:BP	GO:0002376	immune system process	0.0141303104934017	True	"""Any process involved in the development or functioning of the immune system, an organismal system for calibrated responses to potential internal or invasive threats."" [GO_REF:0000022, GOC:add]"	2399	102	25	17376	0.2450980392156862	0.0104210087536473	query_1	['GO:0008150']	['NBN', 'MSH2', 'TP53BP1', 'DCLRE1C', 'XRCC6', 'PAXIP1', 'LIG4', 'APLF', 'MLH1', 'MSH3', 'PMS2', 'PARP1', 'XRCC4', 'XRCC5', 'ERCC1', 'NHEJ1', 'FANCD2', 'ATM', 'EXO1', 'PRKDC', 'POLB', 'TP53', 'BANF1', 'RNF8', 'MSH6']
660	GO:BP	GO:0042771	intrinsic apoptotic signaling pathway in response to DNA damage by p53 class mediator	0.014246333586781	True	"""The series of molecular signals in which an intracellular signal is conveyed to trigger the apoptotic death of a cell. The pathway is induced by the cell cycle regulator phosphoprotein p53, or an equivalent protein, in response to the detection of DNA damage, and ends when the execution phase of apoptosis is triggered."" [GOC:go_curators, GOC:mtg_apoptosis]"	47	102	3	17376	0.0294117647058823	0.0638297872340425	query_1	['GO:0008630', 'GO:0072332']	['MSH2', 'BRCA2', 'TP53']
661	GO:BP	GO:0030097	hemopoiesis	0.014246333586781	True	"""The process whose specific outcome is the progression of the myeloid and lymphoid derived organ/tissue systems of the blood and other parts of the body over time, from formation to the mature structure. The site of hemopoiesis is variable during development, but occurs primarily in bone marrow or kidney in many adult vertebrates."" [GOC:dgh, ISBN:0198506732]"	914	102	13	17376	0.1274509803921568	0.0142231947483588	query_1	['GO:0048468']	['MSH2', 'DCLRE1C', 'XRCC6', 'LIG4', 'BRCA2', 'PARP1', 'XRCC5', 'ERCC1', 'NHEJ1', 'FANCD2', 'ATM', 'PRKDC', 'TP53']
662	GO:BP	GO:0007281	germ cell development	0.0147133279049705	True	"""The process whose specific outcome is the progression of an immature germ cell over time, from its formation to the mature structure (gamete). A germ cell is any reproductive cell in a multicellular organism."" [GOC:go_curators]"	319	102	7	17376	0.0686274509803921	0.0219435736677116	query_1	['GO:0003006', 'GO:0007276', 'GO:0022412', 'GO:0048468']	['BRIP1', 'MSH2', 'MLH1', 'BRCA2', 'ERCC1', 'ATM', 'RNF8']
663	GO:BP	GO:0051249	regulation of lymphocyte activation	0.0147133279049705	True	"""Any process that modulates the frequency, rate or extent of lymphocyte activation."" [GOC:ai]"	501	102	9	17376	0.088235294117647	0.0179640718562874	query_1	['GO:0002694', 'GO:0046649']	['MSH2', 'TP53BP1', 'XRCC6', 'PAXIP1', 'APLF', 'MLH1', 'FANCD2', 'ATM', 'PRKDC']
664	GO:BP	GO:0050871	positive regulation of B cell activation	0.0152104996547907	True	"""Any process that activates or increases the frequency, rate or extent of B cell activation."" [GOC:ai]"	100	102	4	17376	0.0392156862745098	0.04	query_1	['GO:0042113', 'GO:0050864', 'GO:0051251']	['MSH2', 'TP53BP1', 'PAXIP1', 'MLH1']
665	GO:BP	GO:0048477	oogenesis	0.0152104996547907	True	"""The complete process of formation and maturation of an ovum or female gamete from a primordial female germ cell. Examples of this process are found in Mus musculus and Drosophila melanogaster."" [GOC:kmv, GOC:mtg_sensu, GOC:pr]"	100	102	4	17376	0.0392156862745098	0.04	query_1	['GO:0007281', 'GO:0007292']	['MLH1', 'BRCA2', 'ERCC1', 'ATM']
666	REAC	REAC:R-HSA-69580	p53-Dependent G1/S DNA damage checkpoint	0.0154925892356161	True	p53-Dependent G1/S DNA damage checkpoint	66	102	3	17376	0.0294117647058823	0.0454545454545454	query_1	['REAC:R-HSA-69615']	['ATM', 'CDK2', 'TP53']
667	REAC	REAC:R-HSA-69563	p53-Dependent G1 DNA Damage Response	0.0154925892356161	True	p53-Dependent G1 DNA Damage Response	66	102	3	17376	0.0294117647058823	0.0454545454545454	query_1	['REAC:R-HSA-69580']	['ATM', 'CDK2', 'TP53']
668	GO:BP	GO:0051570	regulation of histone H3-K9 methylation	0.0156690956883918	True	"""Any process that modulates the frequency, rate or extent of the covalent addition of a methyl group to the lysine at position 9 of histone H3."" [GOC:ai]"	14	102	2	17376	0.0196078431372549	0.1428571428571428	query_1	['GO:0031060', 'GO:0051567']	['LMNA', 'BRCA1']
669	GO:BP	GO:0050790	regulation of catalytic activity	0.0156690956883918	True	"""Any process that modulates the activity of an enzyme."" [GOC:ai, GOC:ebc, GOC:vw]"	1766	102	20	17376	0.196078431372549	0.0113250283125707	query_1	['GO:0065009']	['NBN', 'MSH2', 'RAD50', 'XRCC6', 'MSH3', 'PCNA', 'PARP1', 'XRCC4', 'XRCC5', 'NHEJ1', 'BLM', 'MRE11', 'PRIM2', 'XRCC1', 'WRN', 'TP53', 'PNKP', 'NEIL1', 'BANF1', 'MSH6']
670	GO:BP	GO:2001034	positive regulation of double-strand break repair via nonhomologous end joining	0.0156690956883918	True	"""Any process that activates or increases the frequency, rate or extent of double-strand break repair via nonhomologous end joining."" [GOC:obol]"	14	102	2	17376	0.0196078431372549	0.1428571428571428	query_1	['GO:0006303', 'GO:2000781', 'GO:2001032']	['PRKDC', 'PNKP']
671	GO:BP	GO:1901576	organic substance biosynthetic process	0.0156690956883918	True	"""The chemical reactions and pathways resulting in the formation of an organic substance, any molecular entity containing carbon."" [GOC:pr, GOC:TermGenie]"	5345	102	45	17376	0.4411764705882353	0.0084190832553788	query_1	['GO:0009058', 'GO:0071704']	['RBBP8', 'BRIP1', 'USP1', 'TP53BP1', 'POLD3', 'RAD50', 'LIG3', 'XRCC6', 'HLTF', 'PAXIP1', 'LIG4', 'MLH1', 'POLD4', 'OGG1', 'LIG1', 'POLE4', 'BRCA2', 'POLA1', 'PRIM1', 'PCNA', 'PARP1', 'XRCC5', 'ERCC1', 'RPA1', 'FANCD2', 'BLM', 'ATM', 'POLE3', 'MRE11', 'APEX1', 'PRIM2', 'BRCA1', 'CDK2', 'PRKDC', 'POLA2', 'POLD1', 'POLB', 'WRN', 'POLE2', 'TP53', 'CHCHD10', 'PNKP', 'POLE', 'POLD2', 'RNF8']
672	GO:BP	GO:0051972	regulation of telomerase activity	0.0156690956883918	True	"""Any process that modulates the frequency, rate or extent of telomerase activity, the catalysis of the reaction: deoxynucleoside triphosphate + DNA(n) = diphosphate + DNA(n+1). Telomerases catalyze extension of the 3'- end of a DNA strand by one deoxynucleotide at a time using an internal RNA template that encodes the telomeric repeat sequence."" [EC:2.-.-.-, GOC:ai]"	49	102	3	17376	0.0294117647058823	0.0612244897959183	query_1	['GO:0051338', 'GO:2000278']	['XRCC5', 'TP53', 'PNKP']
673	GO:BP	GO:0009410	response to xenobiotic stimulus	0.0156818348621936	True	"""Any process that results in a change in state or activity of a cell or an organism (in terms of movement, secretion, enzyme production, gene expression, etc.) as a result of a stimulus from a xenobiotic, a compound foreign to the organim exposed to it. It may be synthesized by another organism (like ampicilin) or it can be a synthetic chemical."" [GOC:jl, GOC:krc]"	413	102	8	17376	0.0784313725490196	0.0193704600484261	query_1	['GO:0042221']	['OGG1', 'PCNA', 'PMS2', 'XRCC5', 'RAD51', 'APEX1', 'XRCC1', 'TP53']
