Autosomal recessive cutis laxa type 2, classic type	source	native	name	p_value	significant	description	term_size	query_size	intersection_size	effective_domain_size	precision	recall	query	parents	intersections
0	GO:BP	GO:0036258	multivesicular body assembly	2.8383022019458877e-39	True	"""The aggregation, arrangement and bonding together of a set of components to form a multivesicular body, a type of late endosome in which regions of the limiting endosomal membrane invaginate to form internal vesicles; membrane proteins that enter the internal vesicles are sequestered from the cytoplasm."" [GOC:sart, PMID:11566881, PMID:19571114]"	32	98	21	21110	0.2142857142857142	0.65625	query_1	['GO:0036257', 'GO:0070925']	['CHMP2A', 'CHMP2B', 'HGS', 'CHMP1A', 'VPS4A', 'CHMP1B', 'CHMP4B', 'STAM2', 'VTA1', 'VPS4B', 'TSG101', 'CHMP4A', 'CHMP6', 'CHMP7', 'IST1', 'STAM', 'CHMP5', 'VPS37C', 'CHMP3', 'VPS28', 'CHMP4C']
1	GO:BP	GO:0036257	multivesicular body organization	7.77811628288172e-39	True	"""A process that is carried out at the cellular level which results in the assembly, arrangement of constituent parts, or disassembly of a multivesicular body. A multivesicular body is a type of late endosome in which regions of the limiting endosomal membrane invaginate to form internal vesicles; membrane proteins that enter the internal vesicles are sequestered from the cytoplasm."" [GOC:sart, PMID:11566881]"	33	98	21	21110	0.2142857142857142	0.6363636363636364	query_1	['GO:0007032']	['CHMP2A', 'CHMP2B', 'HGS', 'CHMP1A', 'VPS4A', 'CHMP1B', 'CHMP4B', 'STAM2', 'VTA1', 'VPS4B', 'TSG101', 'CHMP4A', 'CHMP6', 'CHMP7', 'IST1', 'STAM', 'CHMP5', 'VPS37C', 'CHMP3', 'VPS28', 'CHMP4C']
2	GO:BP	GO:0007032	endosome organization	1.549690081105197e-36	True	"""A process that is carried out at the cellular level which results in the assembly, arrangement of constituent parts, or disassembly of endosomes."" [GOC:dph, GOC:jl, GOC:mah]"	95	98	26	21110	0.2653061224489796	0.2736842105263158	query_1	['GO:0010256', 'GO:0016050']	['CHMP2A', 'CHMP2B', 'HGS', 'CHMP1A', 'VPS4A', 'ATP6V0A1', 'CHMP1B', 'CHMP4B', 'STAM2', 'VTA1', 'VPS4B', 'TSG101', 'ATP6AP2', 'CHMP4A', 'CHMP6', 'CHMP7', 'IST1', 'STAM', 'CHMP5', 'VPS37C', 'CHMP3', 'VPS28', 'ATP6V1A', 'CHMP4C', 'ATP6AP1', 'ATP6V0C']
3	GO:BP	GO:0045324	late endosome to vacuole transport	9.258386170432447e-35	True	"""The directed movement of substances from late endosomes to the vacuole. In yeast, after transport to the prevacuolar compartment, endocytic content is delivered to the late endosome and on to the vacuole. This pathway is analogous to endosome to lysosome transport."" [PMID:11872141]"	37	98	20	21110	0.2040816326530612	0.5405405405405406	query_1	['GO:0007034', 'GO:0016192']	['CHMP2A', 'CHMP2B', 'HGS', 'CHMP1A', 'VPS4A', 'CHMP1B', 'CHMP4B', 'STAM2', 'VTA1', 'VPS4B', 'TSG101', 'CHMP4A', 'CHMP6', 'CHMP7', 'STAM', 'CHMP5', 'VPS37C', 'CHMP3', 'VPS28', 'CHMP4C']
4	GO:BP	GO:0032509	endosome transport via multivesicular body sorting pathway	1.5446070814041233e-33	True	"""The directed movement of substances from endosomes to lysosomes or vacuoles by a pathway in which molecules are sorted into multivesicular bodies, which then fuse with the target compartment."" [GOC:mah, PMID:12461556, PMID:16689637]"	41	98	20	21110	0.2040816326530612	0.4878048780487805	query_1	['GO:0016197', 'GO:0071985']	['CHMP2A', 'CHMP2B', 'HGS', 'CHMP1A', 'VPS4A', 'CHMP1B', 'CHMP4B', 'STAM2', 'VTA1', 'VPS4B', 'TSG101', 'CHMP4A', 'CHMP6', 'CHMP7', 'STAM', 'CHMP5', 'VPS37C', 'CHMP3', 'VPS28', 'CHMP4C']
5	GO:BP	GO:0090148	membrane fission	3.1623867564464716e-32	True	"""A process that is carried out at the cellular level which results in the separation of a single continuous membrane into two membranes."" [GOC:ascb_2009, GOC:dph, GOC:tb]"	46	98	20	21110	0.2040816326530612	0.4347826086956521	query_1	['GO:0061024']	['CHMP2A', 'CHMP2B', 'HGS', 'CHMP1A', 'VPS4A', 'CHMP1B', 'CHMP4B', 'STAM2', 'VPS4B', 'TSG101', 'CHMP4A', 'CHMP6', 'CHMP7', 'STAM', 'CHMP5', 'VPS37C', 'CHMP3', 'VPS28', 'CHMP4C', 'SPAST']
6	GO:BP	GO:0043162	ubiquitin-dependent protein catabolic process via the multivesicular body sorting pathway	5.45038881214766e-32	True	"""The chemical reactions and pathways resulting in the breakdown of a protein or peptide covalently tagged with ubiquitin, via the multivesicular body (MVB) sorting pathway; ubiquitin-tagged proteins are sorted into MVBs, and delivered to a lysosome/vacuole for degradation."" [GOC:jl, PMID:11511343]"	38	98	19	21110	0.1938775510204081	0.5	query_1	['GO:0006511']	['CHMP2A', 'CHMP2B', 'HGS', 'CHMP1A', 'VPS4A', 'CHMP1B', 'CHMP4B', 'STAM2', 'VPS4B', 'TSG101', 'CHMP4A', 'CHMP6', 'CHMP7', 'STAM', 'CHMP5', 'VPS37C', 'CHMP3', 'VPS28', 'CHMP4C']
7	GO:BP	GO:0071985	multivesicular body sorting pathway	9.370535403083612e-32	True	"""A vesicle-mediated transport process in which transmembrane proteins are ubiquitylated to facilitate their entry into luminal vesicles of multivesicular bodies (MVBs); upon subsequent fusion of MVBs with lysosomes or vacuoles, the cargo proteins are degraded."" [GOC:mah, PMID:17603537]"	48	98	20	21110	0.2040816326530612	0.4166666666666667	query_1	['GO:0016192']	['CHMP2A', 'CHMP2B', 'HGS', 'CHMP1A', 'VPS4A', 'CHMP1B', 'CHMP4B', 'STAM2', 'VTA1', 'VPS4B', 'TSG101', 'CHMP4A', 'CHMP6', 'CHMP7', 'STAM', 'CHMP5', 'VPS37C', 'CHMP3', 'VPS28', 'CHMP4C']
8	GO:BP	GO:0046755	viral budding	2.337533387585549e-30	True	"""A viral process by which enveloped viruses acquire a host-derived membrane enriched in viral proteins to form their external envelope. The process starts when nucleocapsids, assembled or in the process of being built, induce formation of a membrane curvature in the host plasma or organelle membrane and wrap up in the forming bud. The process ends when the bud is eventually pinched off by membrane scission to release the enveloped particle into the lumenal or extracellular space."" [ISBN:0781718325, VZ:1947]"	28	98	17	21110	0.173469387755102	0.6071428571428571	query_1	['GO:0016032', 'GO:0019068']	['CHMP2A', 'CHMP2B', 'CHMP1A', 'VPS4A', 'CHMP1B', 'CHMP4B', 'VTA1', 'VPS4B', 'TSG101', 'CHMP4A', 'CHMP6', 'CHMP7', 'CHMP5', 'VPS37C', 'CHMP3', 'VPS28', 'CHMP4C']
9	GO:BP	GO:0039702	viral budding via host ESCRT complex	2.081498124886123e-29	True	"""Viral budding which uses a host ESCRT protein complex, or complexes, to mediate the budding process."" [UniProtKB-KW:KW-1187, VZ:1536]"	24	98	16	21110	0.1632653061224489	0.6666666666666666	query_1	['GO:0046755']	['CHMP2A', 'CHMP2B', 'CHMP1A', 'VPS4A', 'CHMP1B', 'CHMP4B', 'VPS4B', 'TSG101', 'CHMP4A', 'CHMP6', 'CHMP7', 'CHMP5', 'VPS37C', 'CHMP3', 'VPS28', 'CHMP4C']
10	REAC	REAC:R-HSA-917729	Endosomal Sorting Complex Required For Transport (ESCRT)	2.7051263160732657e-29	True	Endosomal Sorting Complex Required For Transport (ESCRT)	31	78	18	10790	0.2307692307692307	0.5806451612903226	query_1	['REAC:R-HSA-199991']	['CHMP2A', 'CHMP2B', 'HGS', 'VPS4A', 'CHMP4B', 'STAM2', 'VTA1', 'VPS4B', 'TSG101', 'CHMP4A', 'CHMP6', 'CHMP7', 'STAM', 'CHMP5', 'VPS37C', 'CHMP3', 'VPS28', 'CHMP4C']
11	GO:CC	GO:0036452	ESCRT complex	3.191231540396433e-29	True	"""An endosomal sorting complex involved in membrane fission processes related to sorting of multivesicular bodies (MVB) in the endocytic pathway, cytokinesis and viral budding among other processes."" [PMID:16689637, VZ:1536]"	27	100	16	22122	0.16	0.5925925925925926	query_1	['GO:0005768', 'GO:0032991']	['CHMP2A', 'CHMP2B', 'HGS', 'CHMP1A', 'CHMP1B', 'CHMP4B', 'STAM2', 'TSG101', 'CHMP4A', 'CHMP6', 'CHMP7', 'STAM', 'VPS37C', 'CHMP3', 'VPS28', 'CHMP4C']
12	GO:CC	GO:0010008	endosome membrane	1.1850375245316144e-28	True	"""The lipid bilayer surrounding an endosome."" [GOC:mah]"	544	100	35	22122	0.35	0.0643382352941176	query_1	['GO:0005768', 'GO:0030659', 'GO:0098588']	['AP1G2', 'PIP4P1', 'ATP6V0A2', 'CHMP2A', 'CHMP2B', 'HGS', 'CHMP1A', 'VPS4A', 'ATP6V0A1', 'CHMP1B', 'CHMP4B', 'STAM2', 'VTA1', 'VPS4B', 'TSG101', 'ARL8A', 'ATP6AP2', 'CHMP4A', 'CHMP6', 'CHMP7', 'STAM', 'CHMP5', 'CD68', 'TCIRG1', 'VPS37C', 'ATP6V0A4', 'ATP6V0D1', 'CHMP3', 'VPS28', 'LITAF', 'CHMP4C', 'ATP6AP1', 'ATP6V0C', 'ATP6V0D2', 'MITD1']
13	GO:BP	GO:0016236	macroautophagy	1.259193999172102e-27	True	"""The major inducible pathway for the general turnover of cytoplasmic constituents in eukaryotic cells, it is also responsible for the degradation of active cytoplasmic enzymes and organelles during nutrient starvation. Macroautophagy involves the formation of double-membrane-bounded autophagosomes which enclose the cytoplasmic constituent targeted for degradation in a membrane-bounded structure. Autophagosomes then fuse with a lysosome (or vacuole) releasing single-membrane-bounded autophagic bodies that are then degraded within the lysosome (or vacuole). Some types of macroautophagy, e.g. pexophagy, mitophagy, involve selective targeting of the targets to be degraded."" [PMID:11099404, PMID:12914914, PMID:15798367, PMID:16973210, PMID:20159618, PMID:9412464]"	324	98	30	21110	0.3061224489795918	0.0925925925925925	query_1	['GO:0006914']	['ATP6V0A2', 'CHMP2A', 'CHMP2B', 'HGS', 'CHMP1A', 'VPS4A', 'ATP6V0A1', 'CHMP1B', 'CHMP4B', 'STAM2', 'VTA1', 'VPS4B', 'TSG101', 'CHMP4A', 'CHMP6', 'CHMP7', 'STAM', 'CHMP5', 'TCIRG1', 'VPS37C', 'CASP3', 'ATP6V0D1', 'CHMP3', 'ATP6V1E1', 'VPS28', 'ATP6V1A', 'CHMP4C', 'ATP6V0C', 'TP53', 'ATP6V0D2']
14	GO:BP	GO:0019068	virion assembly	1.675622393079379e-27	True	"""A late phase of the viral life cycle during which all the components necessary for the formation of a mature virion collect at a particular site in the cell and the basic structure of the virus particle is formed."" [ISBN:0121585336]"	37	98	17	21110	0.173469387755102	0.4594594594594595	query_1	['GO:0016032', 'GO:0019058']	['CHMP2A', 'CHMP2B', 'CHMP1A', 'VPS4A', 'CHMP1B', 'CHMP4B', 'VTA1', 'VPS4B', 'TSG101', 'CHMP4A', 'CHMP6', 'CHMP7', 'CHMP5', 'VPS37C', 'CHMP3', 'VPS28', 'CHMP4C']
15	GO:BP	GO:0016050	vesicle organization	1.947904483381576e-27	True	"""A process that is carried out at the cellular level which results in the assembly, arrangement of constituent parts, or disassembly of a vesicle."" [GOC:mah]"	367	98	31	21110	0.3163265306122449	0.0844686648501362	query_1	['GO:0006996']	['CHMP2A', 'CHMP2B', 'HGS', 'CHMP1A', 'VPS4A', 'ATP6V0A1', 'CHMP1B', 'CHMP4B', 'STAM2', 'VTA1', 'VPS4B', 'TSG101', 'ATP6AP2', 'CHMP4A', 'CHMP6', 'CHMP7', 'IST1', 'TFG', 'STAM', 'CHMP5', 'VPS37C', 'ATP6V0A4', 'ATP6V0D1', 'CHMP3', 'ATP6V1E1', 'VPS28', 'PLN', 'ATP6V1A', 'CHMP4C', 'ATP6AP1', 'ATP6V0C']
16	GO:CC	GO:0005768	endosome	4.672530246160544e-27	True	"""A vacuole to which materials ingested by endocytosis are delivered."" [ISBN:0198506732, PMID:19696797]"	1040	100	42	22122	0.42	0.0403846153846153	query_1	['GO:0012505', 'GO:0031410']	['AP1G2', 'PIP4P1', 'ATP6V0A2', 'CHMP2A', 'CHMP2B', 'HGS', 'MIB2', 'CHMP1A', 'VPS4A', 'ATP6V0A1', 'CHMP1B', 'CHMP4B', 'STAM2', 'VTA1', 'CCDC115', 'VPS4B', 'FLOT1', 'TSG101', 'ARL8A', 'ATP6AP2', 'CHMP4A', 'CHMP6', 'CHMP7', 'STAM', 'FLOT2', 'CHMP5', 'CD68', 'TCIRG1', 'VPS37C', 'ATP6V0A4', 'ATP6V0D1', 'CHMP3', 'ATP6V1E1', 'VPS28', 'LITAF', 'CHMP4C', 'ATP6AP1', 'ATP6V0C', 'ACE', 'SPAST', 'ATP6V0D2', 'MITD1']
17	GO:CC	GO:0005774	vacuolar membrane	8.88344214522006e-27	True	"""The lipid bilayer surrounding the vacuole and separating its contents from the cytoplasm of the cell."" [GOC:ai]"	466	100	32	22122	0.32	0.0686695278969957	query_1	['GO:0005773', 'GO:0098588']	['PIP4P1', 'ANPEP', 'ATP6V0A2', 'CHMP2A', 'CHMP2B', 'TMEM199', 'CHMP1A', 'VPS4A', 'ATP6V0A1', 'CHMP1B', 'CHMP4B', 'CCDC115', 'FLOT1', 'TM9SF1', 'ARL8A', 'ATP6AP2', 'CHMP4A', 'CHMP6', 'CHMP7', 'CHMP5', 'CD68', 'TCIRG1', 'ATP6V0A4', 'ATP6V0D1', 'CHMP3', 'ATP6V1E1', 'ATP6V1A', 'LITAF', 'TMEM79', 'CHMP4C', 'ATP6V0C', 'ATP6V0D2']
18	GO:BP	GO:0061952	midbody abscission	2.1231891301022536e-26	True	"""The process by which the midbody, the cytoplasmic bridge that connects the two prospective daughter cells, is severed at the end of mitotic cytokinesis, resulting in two separate daughter cells."" [PMID:12737809, PMID:29903934]"	19	98	14	21110	0.1428571428571428	0.7368421052631579	query_1	['GO:0061024', 'GO:1902410']	['CHMP2A', 'CHMP2B', 'CHMP1A', 'VPS4A', 'CHMP1B', 'CHMP4B', 'VPS4B', 'CHMP4A', 'CHMP6', 'CHMP7', 'CHMP5', 'CHMP3', 'CHMP4C', 'MITD1']
19	GO:CC	GO:0005764	lysosome	3.7675971120360295e-26	True	"""A small lytic vacuole that has cell cycle-independent morphology found in most animal cells and that contains a variety of hydrolases, most of which have their maximal activities in the pH range 5-6. The contained enzymes display latency if properly isolated. About 40 different lysosomal hydrolases are known and lysosomes have a great variety of morphologies and functions."" [GOC:mah, ISBN:0198506732]"	760	100	37	22122	0.37	0.0486842105263157	query_1	['GO:0000323']	['PIP4P1', 'C3', 'ANPEP', 'ATP6V0A2', 'CHMP2A', 'CHMP2B', 'TMEM199', 'HGS', 'CHMP1A', 'VPS4A', 'ATP6V0A1', 'CHMP1B', 'CHMP4B', 'CCDC115', 'FLOT1', 'TM9SF1', 'ARL8A', 'ATP6AP2', 'CHMP4A', 'CHMP6', 'CHMP7', 'IST1', 'CHMP5', 'CD68', 'TCIRG1', 'ATP6V0A4', 'ATP6V0D1', 'CHMP3', 'ATP6V1E1', 'ATP6V1A', 'LITAF', 'TMEM79', 'CHMP4C', 'ATP6V0C', 'ACE', 'ATP6V0D2', 'VMA21']
20	GO:CC	GO:0000323	lytic vacuole	3.7675971120360295e-26	True	"""A vacuole that is maintained at an acidic pH and which contains degradative enzymes, including a wide variety of acid hydrolases."" [GOC:krc]"	760	100	37	22122	0.37	0.0486842105263157	query_1	['GO:0005773']	['PIP4P1', 'C3', 'ANPEP', 'ATP6V0A2', 'CHMP2A', 'CHMP2B', 'TMEM199', 'HGS', 'CHMP1A', 'VPS4A', 'ATP6V0A1', 'CHMP1B', 'CHMP4B', 'CCDC115', 'FLOT1', 'TM9SF1', 'ARL8A', 'ATP6AP2', 'CHMP4A', 'CHMP6', 'CHMP7', 'IST1', 'CHMP5', 'CD68', 'TCIRG1', 'ATP6V0A4', 'ATP6V0D1', 'CHMP3', 'ATP6V1E1', 'ATP6V1A', 'LITAF', 'TMEM79', 'CHMP4C', 'ATP6V0C', 'ACE', 'ATP6V0D2', 'VMA21']
21	GO:BP	GO:0046761	viral budding from plasma membrane	4.811765319375015e-26	True	"""A viral budding that starts with formation of a curvature in the host plasma membrane around which the virion particle assembles."" [GOC:bf, ISBN:0072370319, PMID:9394621, VZ:1947]"	15	98	13	21110	0.1326530612244898	0.8666666666666667	query_1	['GO:0046753', 'GO:0046755']	['CHMP2A', 'CHMP2B', 'CHMP1A', 'VPS4A', 'CHMP1B', 'CHMP4B', 'VPS4B', 'CHMP4A', 'CHMP6', 'CHMP7', 'CHMP5', 'CHMP3', 'CHMP4C']
22	GO:BP	GO:0046753	non-lytic viral release	2.556673352379929e-25	True	"""The exit of a viral particle from a host cell that does not involve cell lysis."" [GOC:bf, GOC:jl, ISBN:0072370319]"	16	98	13	21110	0.1326530612244898	0.8125	query_1	['GO:0019076']	['CHMP2A', 'CHMP2B', 'CHMP1A', 'VPS4A', 'CHMP1B', 'CHMP4B', 'VPS4B', 'CHMP4A', 'CHMP6', 'CHMP7', 'CHMP5', 'CHMP3', 'CHMP4C']
23	GO:BP	GO:0032510	endosome to lysosome transport via multivesicular body sorting pathway	1.0825207096700664e-24	True	"""The directed movement of substances from endosomes to lysosomes by a pathway in which molecules are sorted into multivesicular bodies, which then fuse with the lysosome."" [GOC:mah, PMID:12461556, PMID:16689637]"	17	98	13	21110	0.1326530612244898	0.7647058823529411	query_1	['GO:0008333', 'GO:0032509']	['CHMP2A', 'CHMP2B', 'CHMP1A', 'VPS4A', 'CHMP1B', 'CHMP4B', 'VPS4B', 'CHMP4A', 'CHMP6', 'CHMP7', 'CHMP5', 'CHMP3', 'CHMP4C']
24	GO:BP	GO:0007034	vacuolar transport	1.4399004437500566e-24	True	"""The directed movement of substances into, out of or within a vacuole."" [GOC:ai]"	165	98	23	21110	0.2346938775510204	0.1393939393939394	query_1	['GO:0046907']	['AP1G2', 'CHMP2A', 'CHMP2B', 'HGS', 'CHMP1A', 'VPS4A', 'CHMP1B', 'CHMP4B', 'STAM2', 'VTA1', 'VPS4B', 'TSG101', 'CHMP4A', 'CHMP6', 'CHMP7', 'STAM', 'CHMP5', 'VPS37C', 'ATP6V0D1', 'CHMP3', 'VPS28', 'CHMP4C', 'ATP6V0D2']
25	GO:CC	GO:0030659	cytoplasmic vesicle membrane	1.5807258977994775e-24	True	"""The lipid bilayer surrounding a cytoplasmic vesicle."" [GOC:mah]"	1204	100	42	22122	0.42	0.0348837209302325	query_1	['GO:0012506', 'GO:0031410']	['AP1G2', 'PIP4P1', 'ANPEP', 'ATP6V0A2', 'CHMP2A', 'CHMP2B', 'TMEM199', 'HGS', 'CHMP1A', 'VPS4A', 'ATP6V0A1', 'CHMP1B', 'CHMP4B', 'STAM2', 'VTA1', 'VPS4B', 'TSG101', 'ARL8A', 'ATP6AP2', 'CHMP4A', 'CHMP6', 'CHMP7', 'STAM', 'TBC1D24', 'FLOT2', 'CHMP5', 'CD68', 'TCIRG1', 'VPS37C', 'ATP6V0A4', 'ATP6V0D1', 'CHMP3', 'ATP6V1E1', 'VPS28', 'ATP6V1A', 'LITAF', 'CHMP4C', 'ATP6AP1', 'ATP6V0C', 'ATP6V0D2', 'VMA21', 'MITD1']
26	GO:BP	GO:0019076	viral release from host cell	2.098292927954226e-24	True	"""The dissemination of mature viral particles from a host cell, e.g. by cell lysis or the budding of virus particles from the cell membrane."" [GOC:jl]"	31	98	15	21110	0.1530612244897959	0.4838709677419355	query_1	['GO:0016032', 'GO:0019058', 'GO:0035891']	['CHMP2A', 'CHMP2B', 'CHMP1A', 'VPS4A', 'CHMP1B', 'CHMP4B', 'VPS4B', 'TSG101', 'CHMP4A', 'CHMP6', 'CHMP7', 'IST1', 'CHMP5', 'CHMP3', 'CHMP4C']
27	GO:BP	GO:0035891	exit from host cell	2.098292927954226e-24	True	"""The movement of an organism out of a cell of the host organism. The host is defined as the larger of the organisms involved in a symbiotic interaction."" [GOC:bf, GOC:rs, PMID:19325115]"	31	98	15	21110	0.1530612244897959	0.4838709677419355	query_1	['GO:0044000']	['CHMP2A', 'CHMP2B', 'CHMP1A', 'VPS4A', 'CHMP1B', 'CHMP4B', 'VPS4B', 'TSG101', 'CHMP4A', 'CHMP6', 'CHMP7', 'IST1', 'CHMP5', 'CHMP3', 'CHMP4C']
28	GO:CC	GO:0005773	vacuole	2.4758328408478844e-24	True	"""A closed structure, found only in eukaryotic cells, that is completely surrounded by unit membrane and contains liquid material. Cells contain one or several vacuoles, that may have different functions from each other. Vacuoles have a diverse array of functions. They can act as a storage organelle for nutrients or waste products, as a degradative compartment, as a cost-effective way of increasing cell size, and as a homeostatic regulator controlling both turgor pressure and pH of the cytosol."" [GOC:mtg_sensu, ISBN:0198506732]"	855	100	37	22122	0.37	0.0432748538011695	query_1	['GO:0005737', 'GO:0043231']	['PIP4P1', 'C3', 'ANPEP', 'ATP6V0A2', 'CHMP2A', 'CHMP2B', 'TMEM199', 'HGS', 'CHMP1A', 'VPS4A', 'ATP6V0A1', 'CHMP1B', 'CHMP4B', 'CCDC115', 'FLOT1', 'TM9SF1', 'ARL8A', 'ATP6AP2', 'CHMP4A', 'CHMP6', 'CHMP7', 'IST1', 'CHMP5', 'CD68', 'TCIRG1', 'ATP6V0A4', 'ATP6V0D1', 'CHMP3', 'ATP6V1E1', 'ATP6V1A', 'LITAF', 'TMEM79', 'CHMP4C', 'ATP6V0C', 'ACE', 'ATP6V0D2', 'VMA21']
29	GO:CC	GO:0031902	late endosome membrane	2.8012194495225496e-24	True	"""The lipid bilayer surrounding a late endosome."" [GOC:pz]"	161	100	22	22122	0.22	0.1366459627329192	query_1	['GO:0005770', 'GO:0010008']	['PIP4P1', 'CHMP2A', 'CHMP2B', 'HGS', 'CHMP1A', 'VPS4A', 'CHMP1B', 'CHMP4B', 'VPS4B', 'TSG101', 'ARL8A', 'CHMP4A', 'CHMP6', 'CHMP7', 'CHMP5', 'CD68', 'VPS37C', 'CHMP3', 'VPS28', 'LITAF', 'CHMP4C', 'MITD1']
30	GO:CC	GO:0012506	vesicle membrane	2.9314178828860063e-24	True	"""The lipid bilayer surrounding any membrane-bounded vesicle in the cell."" [GOC:mah, GOC:vesicle]"	1223	100	42	22122	0.42	0.0343417825020441	query_1	['GO:0031090', 'GO:0031982']	['AP1G2', 'PIP4P1', 'ANPEP', 'ATP6V0A2', 'CHMP2A', 'CHMP2B', 'TMEM199', 'HGS', 'CHMP1A', 'VPS4A', 'ATP6V0A1', 'CHMP1B', 'CHMP4B', 'STAM2', 'VTA1', 'VPS4B', 'TSG101', 'ARL8A', 'ATP6AP2', 'CHMP4A', 'CHMP6', 'CHMP7', 'STAM', 'TBC1D24', 'FLOT2', 'CHMP5', 'CD68', 'TCIRG1', 'VPS37C', 'ATP6V0A4', 'ATP6V0D1', 'CHMP3', 'ATP6V1E1', 'VPS28', 'ATP6V1A', 'LITAF', 'CHMP4C', 'ATP6AP1', 'ATP6V0C', 'ATP6V0D2', 'VMA21', 'MITD1']
31	GO:CC	GO:0098588	bounding membrane of organelle	3.7050161836300315e-24	True	"""The lipid bilayer that forms the outer-most layer of an organelle."" [GOC:dos]"	2156	100	52	22122	0.52	0.0241187384044526	query_1	['GO:0031090']	['AP1G2', 'PIP4P1', 'ANPEP', 'ATP6V0A2', 'CHMP2A', 'CHMP2B', 'TMEM199', 'HGS', 'CHMP1A', 'VPS4A', 'ATP6V0A1', 'CHMP1B', 'CHMP4B', 'STAM2', 'VTA1', 'CCDC115', 'VPS4B', 'FLOT1', 'TM9SF1', 'TSG101', 'ARL8A', 'ATP6AP2', 'CHMP4A', 'DMPK', 'CHMP6', 'CHMP7', 'STAM', 'SLN', 'FLOT2', 'CHMP5', 'CD68', 'TCIRG1', 'VPS37C', 'ATP6V0A4', 'ATP6V0D1', 'CHMP3', 'ATP6V1E1', 'VPS28', 'PLN', 'ATP6V1A', 'LITAF', 'TMEM79', 'CHMP4C', 'ATP6AP1', 'ATL1', 'ATP2A1', 'ATP6V0C', 'RTN3', 'GCNT2', 'ATP6V0D2', 'VMA21', 'MITD1']
32	GO:CC	GO:0098852	lytic vacuole membrane	5.5483596383930815e-24	True	"""The lipid bilayer surrounding a lytic vacuole and separating its contents from the cytoplasm of the cell."" [GOC:dos]"	422	100	29	22122	0.29	0.0687203791469194	query_1	['GO:0000323', 'GO:0005774']	['PIP4P1', 'ANPEP', 'ATP6V0A2', 'CHMP2A', 'CHMP2B', 'CHMP1A', 'ATP6V0A1', 'CHMP1B', 'CHMP4B', 'FLOT1', 'TM9SF1', 'ARL8A', 'ATP6AP2', 'CHMP4A', 'CHMP6', 'CHMP7', 'CHMP5', 'CD68', 'TCIRG1', 'ATP6V0A4', 'ATP6V0D1', 'CHMP3', 'ATP6V1E1', 'ATP6V1A', 'LITAF', 'TMEM79', 'CHMP4C', 'ATP6V0C', 'ATP6V0D2']
33	GO:CC	GO:0005765	lysosomal membrane	5.5483596383930815e-24	True	"""The lipid bilayer surrounding the lysosome and separating its contents from the cell cytoplasm."" [GOC:ai]"	422	100	29	22122	0.29	0.0687203791469194	query_1	['GO:0005764', 'GO:0098852']	['PIP4P1', 'ANPEP', 'ATP6V0A2', 'CHMP2A', 'CHMP2B', 'CHMP1A', 'ATP6V0A1', 'CHMP1B', 'CHMP4B', 'FLOT1', 'TM9SF1', 'ARL8A', 'ATP6AP2', 'CHMP4A', 'CHMP6', 'CHMP7', 'CHMP5', 'CD68', 'TCIRG1', 'ATP6V0A4', 'ATP6V0D1', 'CHMP3', 'ATP6V1E1', 'ATP6V1A', 'LITAF', 'TMEM79', 'CHMP4C', 'ATP6V0C', 'ATP6V0D2']
34	GO:CC	GO:0031410	cytoplasmic vesicle	6.0980743302284405e-24	True	"""A vesicle found in the cytoplasm of a cell."" [GOC:ai, GOC:mah, GOC:vesicles]"	2510	100	55	22122	0.55	0.0219123505976095	query_1	['GO:0005737', 'GO:0097708']	['AP1G2', 'PIP4P1', 'C3', 'ANPEP', 'ATP6V0A2', 'PRG2', 'CHMP2A', 'CHMP2B', 'TMEM199', 'HGS', 'MIB2', 'CHMP1A', 'VPS4A', 'ATP6V0A1', 'CHMP1B', 'CHMP4B', 'STAM2', 'VTA1', 'CCDC115', 'FGL2', 'VPS4B', 'FLOT1', 'TM9SF1', 'TSG101', 'ARL8A', 'ATP6AP2', 'CHMP4A', 'CHMP6', 'CHMP7', 'IST1', 'STAM', 'TBC1D24', 'PDIA6', 'FLOT2', 'CHMP5', 'CD68', 'TCIRG1', 'VPS37C', 'TIMP3', 'ATP6V0A4', 'ATP6V0D1', 'CHMP3', 'ATP6V1E1', 'VPS28', 'ATP6V1A', 'LITAF', 'CHMP4C', 'ATP6AP1', 'ATP6V0C', 'ACE', 'VPS9D1', 'SPAST', 'ATP6V0D2', 'VMA21', 'MITD1']
35	GO:CC	GO:0097708	intracellular vesicle	6.4730567556841516e-24	True	"""Any vesicle that is part of the intracellular region."" [GOC:vesicles]"	2513	100	55	22122	0.55	0.0218861918026263	query_1	['GO:0031982', 'GO:0043231']	['AP1G2', 'PIP4P1', 'C3', 'ANPEP', 'ATP6V0A2', 'PRG2', 'CHMP2A', 'CHMP2B', 'TMEM199', 'HGS', 'MIB2', 'CHMP1A', 'VPS4A', 'ATP6V0A1', 'CHMP1B', 'CHMP4B', 'STAM2', 'VTA1', 'CCDC115', 'FGL2', 'VPS4B', 'FLOT1', 'TM9SF1', 'TSG101', 'ARL8A', 'ATP6AP2', 'CHMP4A', 'CHMP6', 'CHMP7', 'IST1', 'STAM', 'TBC1D24', 'PDIA6', 'FLOT2', 'CHMP5', 'CD68', 'TCIRG1', 'VPS37C', 'TIMP3', 'ATP6V0A4', 'ATP6V0D1', 'CHMP3', 'ATP6V1E1', 'VPS28', 'ATP6V1A', 'LITAF', 'CHMP4C', 'ATP6AP1', 'ATP6V0C', 'ACE', 'VPS9D1', 'SPAST', 'ATP6V0D2', 'VMA21', 'MITD1']
36	GO:BP	GO:1902410	mitotic cytokinetic process	7.9590508318671e-24	True	"""Any cytokinetic process that is involved in mitotic cell cycle."" [GOC:mtg_cell_cycle, GOC:TermGenie]"	25	98	14	21110	0.1428571428571428	0.56	query_1	['GO:0000281', 'GO:0032506', 'GO:1903047']	['CHMP2A', 'CHMP2B', 'CHMP1A', 'VPS4A', 'CHMP1B', 'CHMP4B', 'VPS4B', 'CHMP4A', 'CHMP6', 'CHMP7', 'CHMP5', 'CHMP3', 'CHMP4C', 'MITD1']
37	GO:BP	GO:0031468	nuclear membrane reassembly	1.7180503669641716e-23	True	"""The reformation of the nuclear membranes following their breakdown in the context of a normal process."" [GOC:mah]"	26	98	14	21110	0.1428571428571428	0.5384615384615384	query_1	['GO:0071709', 'GO:0071763']	['CHMP2A', 'CHMP2B', 'CHMP1A', 'VPS4A', 'CHMP1B', 'CHMP4B', 'VPS4B', 'CHMP4A', 'CHMP6', 'CHMP7', 'CHMP5', 'CHMP3', 'CHMP4C', 'SPAST']
38	REAC	REAC:R-HSA-162588	Budding and maturation of HIV virion	2.5707296058629175e-23	True	Budding and maturation of HIV virion	28	78	15	10790	0.1923076923076923	0.5357142857142857	query_1	['REAC:R-HSA-162599']	['CHMP2A', 'CHMP2B', 'VPS4A', 'CHMP4B', 'VTA1', 'VPS4B', 'TSG101', 'CHMP4A', 'CHMP6', 'CHMP7', 'CHMP5', 'VPS37C', 'CHMP3', 'VPS28', 'CHMP4C']
39	GO:BP	GO:0010256	endomembrane system organization	2.7322408522180485e-23	True	"""A process that is carried out at the cellular level which results in the assembly, arrangement of constituent parts, or disassembly of the endomembrane system."" [GOC:mah, GOC:sm]"	605	98	33	21110	0.336734693877551	0.0545454545454545	query_1	['GO:0016043']	['CHMP2A', 'CHMP2B', 'HGS', 'CHMP1A', 'VPS4A', 'ATP6V0A1', 'CHMP1B', 'CHMP4B', 'STAM2', 'VTA1', 'VPS4B', 'FLOT1', 'TSG101', 'ATP6AP2', 'CHMP4A', 'LEMD2', 'DMPK', 'CHMP6', 'CHMP7', 'IST1', 'STAM', 'CHMP5', 'VPS37C', 'CHMP3', 'VPS28', 'PLN', 'ATP6V1A', 'CHMP4C', 'ATP6AP1', 'ATL1', 'ATP6V0C', 'RTN3', 'SPAST']
40	GO:BP	GO:0061763	multivesicular body-lysosome fusion	2.746985165333719e-23	True	"""The organelle membrane fusion process in which the membrane of a multivesicular body fuses with a lysosome to create a hybrid organelle."" [GOC:dph, GOC:pad, GOC:PARL, PMID:21118109]"	11	98	11	21110	0.1122448979591836	1.0	query_1	['GO:0006906', 'GO:0032510', 'GO:0097212']	['CHMP2A', 'CHMP2B', 'CHMP1A', 'CHMP1B', 'CHMP4B', 'CHMP4A', 'CHMP6', 'CHMP7', 'CHMP5', 'CHMP3', 'CHMP4C']
41	GO:BP	GO:0051469	vesicle fusion with vacuole	2.746985165333719e-23	True	"""The joining of the lipid bilayer membrane around a vesicle with the lipid bilayer membrane around the vacuole."" [GOC:ai]"	11	98	11	21110	0.1122448979591836	1.0	query_1	['GO:0006906', 'GO:0097576']	['CHMP2A', 'CHMP2B', 'CHMP1A', 'CHMP1B', 'CHMP4B', 'CHMP4A', 'CHMP6', 'CHMP7', 'CHMP5', 'CHMP3', 'CHMP4C']
42	GO:CC	GO:1904930	amphisome membrane	2.0906875258104056e-22	True	"""Any membrane that is part of an amphisome."" [GO_REF:0000064, GOC:bhm, GOC:TermGenie, PMID:17984323]"	13	100	11	22122	0.11	0.8461538461538461	query_1	['GO:0000421', 'GO:0044753']	['CHMP2A', 'CHMP2B', 'CHMP1A', 'CHMP1B', 'CHMP4B', 'CHMP4A', 'CHMP6', 'CHMP7', 'CHMP5', 'CHMP3', 'CHMP4C']
