374	GO:BP	GO:0002449	lymphocyte mediated immunity	1.0073188668227978e-05	True	"""Any process involved in the carrying out of an immune response by a lymphocyte."" [GO_REF:0000022, GOC:add, ISBN:0781735149]"	286	102	11	17376	0.1078431372549019	0.0384615384615384	query_1	['GO:0002443']	['NBN', 'MSH2', 'TP53BP1', 'PAXIP1', 'LIG4', 'APLF', 'MLH1', 'ERCC1', 'EXO1', 'RNF8', 'MSH6']
375	GO:BP	GO:0006979	response to oxidative stress	1.0212746281870183e-05	True	"""Any process that results in a change in state or activity of a cell or an organism (in terms of movement, secretion, enzyme production, gene expression, etc.) as a result of oxidative stress, a state often resulting from exposure to high levels of reactive oxygen species, e.g. superoxide anions, hydrogen peroxide (H2O2), and hydroxyl radicals."" [GOC:jl, PMID:12115731]"	416	102	13	17376	0.1274509803921568	0.03125	query_1	['GO:0006950']	['RAD52', 'OGG1', 'PCNA', 'PARP1', 'ERCC1', 'FANCD2', 'APEX1', 'XRCC1', 'WRN', 'TP53', 'PNKP', 'NEIL1', 'BANF1']
376	GO:BP	GO:0019438	aromatic compound biosynthetic process	1.0473003999933515e-05	True	"""The chemical reactions and pathways resulting in the formation of aromatic compounds, any substance containing an aromatic carbon ring."" [GOC:ai]"	3774	102	44	17376	0.4313725490196078	0.0116587175410704	query_1	['GO:0006725', 'GO:0044249']	['RBBP8', 'BRIP1', 'USP1', 'TP53BP1', 'POLD3', 'RAD50', 'LIG3', 'XRCC6', 'HLTF', 'PAXIP1', 'LIG4', 'POLD4', 'OGG1', 'LIG1', 'POLE4', 'BRCA2', 'POLA1', 'PRIM1', 'PCNA', 'PARP1', 'XRCC5', 'ERCC1', 'RPA1', 'FANCD2', 'BLM', 'ATM', 'POLE3', 'MRE11', 'APEX1', 'PRIM2', 'BRCA1', 'CDK2', 'PRKDC', 'POLA2', 'POLD1', 'POLB', 'WRN', 'POLE2', 'TP53', 'CHCHD10', 'PNKP', 'POLE', 'POLD2', 'RNF8']
377	GO:CC	GO:0099086	synaptonemal structure	1.0753422909067316e-05	True	"""A proteinaceous scaffold found between homologous chromosomes during meiosis."" [GOC:elh, GOC:vw]"	39	102	5	17376	0.0490196078431372	0.1282051282051282	query_1	['GO:0000794', 'GO:0110165']	['MLH1', 'BRCA2', 'BLM', 'RAD51', 'BRCA1']
378	GO:CC	GO:0000795	synaptonemal complex	1.0753422909067316e-05	True	"""A proteinaceous scaffold found between homologous chromosomes during meiosis. It consists of 2 lateral elements and a central element, all running parallel to each other. Transverse filaments connect the lateral elements to the central element."" [DOI:10.5772/29752, GOC:elh]"	39	102	5	17376	0.0490196078431372	0.1282051282051282	query_1	['GO:0099086']	['MLH1', 'BRCA2', 'BLM', 'RAD51', 'BRCA1']
379	GO:CC	GO:0005739	mitochondrion	1.1009518024943756e-05	True	"""A semiautonomous, self replicating organelle that occurs in varying numbers, shapes, and sizes in the cytoplasm of virtually all eukaryotic cells. It is notably the site of tissue respiration."" [GOC:giardia, ISBN:0198506732]"	1577	102	25	17376	0.2450980392156862	0.0158528852251109	query_1	['GO:0005737', 'GO:0043231']	['MICOS10', 'MTX3', 'MTX2', 'MICOS13', 'LIG3', 'MTX1', 'CHCHD3', 'FEN1', 'OGG1', 'LIG1', 'PARP1', 'APOOL', 'VDAC1', 'RAD51', 'TOP3A', 'APEX1', 'CARD19', 'APOO', 'CHCHD6', 'DNAJC11', 'TP53', 'CHCHD10', 'SAMM50', 'PNKP', 'IMMT']
380	GO:CC	GO:0005743	mitochondrial inner membrane	1.10355435152367e-05	True	"""The inner, i.e. lumen-facing, lipid bilayer of the mitochondrial envelope. It is highly folded to form cristae."" [GOC:ai]"	465	102	13	17376	0.1274509803921568	0.0279569892473118	query_1	['GO:0019866', 'GO:0031966']	['MICOS10', 'MTX3', 'MTX2', 'MICOS13', 'MTX1', 'CHCHD3', 'APOOL', 'APOO', 'CHCHD6', 'DNAJC11', 'CHCHD10', 'SAMM50', 'IMMT']
381	GO:BP	GO:1902969	mitotic DNA replication	1.1337608362290593e-05	True	"""Any nuclear DNA replication that is involved in a mitotic cell cycle."" [GO_REF:0000060, GOC:TermGenie]"	14	102	4	17376	0.0392156862745098	0.2857142857142857	query_1	['GO:0033260', 'GO:1903047']	['LIG1', 'BRCA2', 'POLA1', 'RAD51']
382	GO:BP	GO:0044819	mitotic G1/S transition checkpoint signaling	1.1694274869358618e-05	True	"""A cell cycle checkpoint that detects and negatively regulates progression from G1 to S phase as part of a mitotic cell cycle."" [GOC:mtg_cell_cycle]"	32	102	5	17376	0.0490196078431372	0.15625	query_1	['GO:0007093', 'GO:2000134']	['RPA2', 'ATM', 'CDK2', 'PRKDC', 'TP53']
383	GO:BP	GO:0031571	mitotic G1 DNA damage checkpoint signaling	1.1694274869358618e-05	True	"""A signal transduction process that contributes to a mitotic cell cycle G1/S transition DNA damage checkpoint."" [GOC:mtg_cell_cycle]"	32	102	5	17376	0.0490196078431372	0.15625	query_1	['GO:0044773', 'GO:0044819']	['RPA2', 'ATM', 'CDK2', 'PRKDC', 'TP53']
384	GO:BP	GO:0043247	telomere maintenance in response to DNA damage	1.1694274869358618e-05	True	"""Any process that occur in response to the presence of critically short or damaged telomeres."" [GOC:BHF, GOC:BHF_telomere, GOC:jbu, PMID:15279784]"	32	102	5	17376	0.0490196078431372	0.15625	query_1	['GO:0000723', 'GO:0006974']	['DCLRE1C', 'ERCC1', 'ERCC4', 'APEX1', 'XRCC1']
385	GO:BP	GO:0002460	adaptive immune response based on somatic recombination of immune receptors built from immunoglobulin superfamily domains	1.19198120754206e-05	True	"""An immune response mediated by lymphocytes expressing specific receptors for antigen produced through a somatic diversification process that includes somatic recombination of germline gene segments encoding immunoglobulin superfamily domains. Recombined receptors for antigen encoded by immunoglobulin superfamily domains include T cell receptors and immunoglobulins (antibodies) produced by B cells. The first encounter with antigen elicits a primary immune response that is slow and not of great magnitude. T and B cells selected by antigen become activated and undergo clonal expansion. A fraction of antigen-reactive T and B cells become memory cells, whereas others differentiate into effector cells. The memory cells generated during the primary response enable a much faster and stronger secondary immune response upon subsequent exposures to the same antigen (immunological memory). An example of this is the adaptive immune response found in Mus musculus."" [GOC:add, GOC:mtg_sensu, ISBN:0781735149, ISBN:1405196831]"	292	102	11	17376	0.1078431372549019	0.0376712328767123	query_1	['GO:0002250']	['NBN', 'MSH2', 'TP53BP1', 'PAXIP1', 'LIG4', 'APLF', 'MLH1', 'ERCC1', 'EXO1', 'RNF8', 'MSH6']
386	GO:BP	GO:0000280	nuclear division	1.2855928515664915e-05	True	"""The division of a cell nucleus into two nuclei, with DNA and other nuclear contents distributed between the daughter nuclei."" [GOC:mah]"	426	102	13	17376	0.1274509803921568	0.0305164319248826	query_1	['GO:0048285']	['BRIP1', 'RAD50', 'RAD51AP1', 'MLH1', 'BRCA2', 'RAD1', 'ERCC4', 'FANCD2', 'ATM', 'MRE11', 'RAD51', 'RMI1', 'BANF1']
387	REAC	REAC:R-HSA-110320	Translesion Synthesis by POLH	1.357440480219354e-05	True	Translesion Synthesis by POLH	19	102	4	17376	0.0392156862745098	0.2105263157894736	query_1	['REAC:R-HSA-110313']	['RPA2', 'PCNA', 'RPA3', 'RPA1']
388	GO:BP	GO:2001251	negative regulation of chromosome organization	1.55832456559774e-05	True	"""Any process that stops, prevents or reduces the frequency, rate or extent of chromosome organization."" [GOC:obol]"	96	102	7	17376	0.0686274509803921	0.0729166666666666	query_1	['GO:0010639', 'GO:0033044', 'GO:0051276']	['NBN', 'RAD50', 'PARP1', 'ERCC1', 'ERCC4', 'ATM', 'XRCC1']
389	GO:BP	GO:0010638	positive regulation of organelle organization	1.6054139627613287e-05	True	"""Any process that increases the frequency, rate or extent of a process involved in the formation, arrangement of constituent parts, or disassembly of an organelle."" [GOC:dph, GOC:tb]"	508	102	14	17376	0.1372549019607843	0.0275590551181102	query_1	['GO:0006996', 'GO:0033043', 'GO:0051130']	['NBN', 'RAD50', 'RAD51AP1', 'LIG4', 'FEN1', 'XRCC5', 'ERCC1', 'ATM', 'MRE11', 'VDAC1', 'CDK2', 'TP53', 'CHCHD10', 'PNKP']
390	GO:BP	GO:0090398	cellular senescence	1.6553603852271736e-05	True	"""A cell aging process stimulated in response to cellular stress, whereby normal cells lose the ability to divide through irreversible cell cycle arrest."" [GOC:BHF, PMID:28682291]"	97	102	7	17376	0.0686274509803921	0.0721649484536082	query_1	['GO:0033554', 'GO:0044237']	['LMNA', 'H2AX', 'BRCA2', 'ATM', 'CDK2', 'WRN', 'TP53']
391	GO:CC	GO:0031975	envelope	1.6893078047654188e-05	True	"""A multilayered structure surrounding all or part of a cell; encompasses one or more lipid bilayers, and may include a cell wall layer; also includes the space between layers."" [GOC:mah, GOC:pz]"	1199	102	21	17376	0.2058823529411764	0.0175145954962468	query_1	['GO:0110165']	['MICOS10', 'MTX3', 'MTX2', 'LMNA', 'BRIP1', 'MICOS13', 'MTX1', 'CHCHD3', 'POLA1', 'PARP1', 'APOOL', 'VDAC1', 'CARD19', 'APOO', 'CHCHD6', 'EMD', 'DNAJC11', 'CHCHD10', 'SAMM50', 'IMMT', 'BANF1']
392	GO:CC	GO:0031967	organelle envelope	1.6893078047654188e-05	True	"""A double membrane structure enclosing an organelle, including two lipid bilayers and the region between them. In some cases, an organelle envelope may have more than two membranes."" [GOC:mah, GOC:pz]"	1199	102	21	17376	0.2058823529411764	0.0175145954962468	query_1	['GO:0031975', 'GO:0043227', 'GO:0043229']	['MICOS10', 'MTX3', 'MTX2', 'LMNA', 'BRIP1', 'MICOS13', 'MTX1', 'CHCHD3', 'POLA1', 'PARP1', 'APOOL', 'VDAC1', 'CARD19', 'APOO', 'CHCHD6', 'EMD', 'DNAJC11', 'CHCHD10', 'SAMM50', 'IMMT', 'BANF1']
393	GO:BP	GO:0045132	meiotic chromosome segregation	1.7656565101381357e-05	True	"""The process in which genetic material, in the form of chromosomes, is organized into specific structures and then physically separated and apportioned to two or more sets during M phase of the meiotic cell cycle."" [GOC:ai, GOC:mah]"	98	102	7	17376	0.0686274509803921	0.0714285714285714	query_1	['GO:0098813', 'GO:0140013', 'GO:1903046']	['BRIP1', 'MLH1', 'ERCC4', 'FANCD2', 'ATM', 'MRE11', 'RMI1']
394	GO:BP	GO:0007095	mitotic G2 DNA damage checkpoint signaling	1.7968002877303682e-05	True	"""A mitotic cell cycle checkpoint that detects and negatively regulates progression through the G2/M transition of the cell cycle in response to DNA damage."" [GOC:mtg_cell_cycle, PMID:16299494]"	35	102	5	17376	0.0490196078431372	0.1428571428571428	query_1	['GO:0044773', 'GO:0044818']	['NBN', 'BLM', 'ATM', 'MRE11', 'BRCA1']
395	GO:BP	GO:0090399	replicative senescence	1.9358406005505247e-05	True	"""A cell aging process associated with the dismantling of a cell as a response to telomere shortening and/or cellular aging."" [GOC:BHF]"	16	102	4	17376	0.0392156862745098	0.25	query_1	['GO:0044237']	['ERCC1', 'ATM', 'WRN', 'TP53']
396	GO:BP	GO:0051106	positive regulation of DNA ligation	1.9445066850624687e-05	True	"""Any process that activates or increases the frequency, rate or extent of DNA ligation, the re-formation of a broken phosphodiester bond in the DNA backbone, carried out by DNA ligase."" [GOC:ai]"	5	102	3	17376	0.0294117647058823	0.6	query_1	['GO:0006266', 'GO:0051054', 'GO:0051105']	['APLF', 'RAD51', 'XRCC1']
397	GO:BP	GO:0045191	regulation of isotype switching	2.3564716955297668e-05	True	"""Any process that modulates the frequency, rate or extent of isotype switching."" [GOC:ai]"	37	102	5	17376	0.0490196078431372	0.1351351351351351	query_1	['GO:0000018', 'GO:0002637', 'GO:0002889', 'GO:0045190', 'GO:0050864']	['MSH2', 'TP53BP1', 'PAXIP1', 'APLF', 'MLH1']
398	GO:BP	GO:0000076	DNA replication checkpoint signaling	2.484584682266761e-05	True	"""A signal transduction process that contributes to a DNA replication checkpoint, that prevents the initiation of nuclear division until DNA replication is complete, thereby ensuring that progeny inherit a full complement of the genome."" [GOC:curators, GOC:rn, PMID:11728327, PMID:12537518]"	17	102	4	17376	0.0392156862745098	0.2352941176470588	query_1	['GO:0031570']	['HUS1', 'RAD9B', 'RAD9A', 'HUS1B']
399	REAC	REAC:R-HSA-113510	E2F mediated regulation of DNA replication	2.5044099537536853e-05	True	E2F mediated regulation of DNA replication	22	102	4	17376	0.0392156862745098	0.1818181818181818	query_1	['REAC:R-HSA-69206']	['POLA1', 'PRIM1', 'PRIM2', 'POLA2']
400	GO:BP	GO:1901362	organic cyclic compound biosynthetic process	2.6909065761253105e-05	True	"""The chemical reactions and pathways resulting in the formation of organic cyclic compound."" [GOC:TermGenie]"	3912	102	44	17376	0.4313725490196078	0.0112474437627811	query_1	['GO:1901360', 'GO:1901576']	['RBBP8', 'BRIP1', 'USP1', 'TP53BP1', 'POLD3', 'RAD50', 'LIG3', 'XRCC6', 'HLTF', 'PAXIP1', 'LIG4', 'POLD4', 'OGG1', 'LIG1', 'POLE4', 'BRCA2', 'POLA1', 'PRIM1', 'PCNA', 'PARP1', 'XRCC5', 'ERCC1', 'RPA1', 'FANCD2', 'BLM', 'ATM', 'POLE3', 'MRE11', 'APEX1', 'PRIM2', 'BRCA1', 'CDK2', 'PRKDC', 'POLA2', 'POLD1', 'POLB', 'WRN', 'POLE2', 'TP53', 'CHCHD10', 'PNKP', 'POLE', 'POLD2', 'RNF8']
401	GO:BP	GO:0033043	regulation of organelle organization	2.730612461202856e-05	True	"""Any process that modulates the frequency, rate or extent of a process involved in the formation, arrangement of constituent parts, or disassembly of an organelle."" [GOC:mah]"	1153	102	21	17376	0.2058823529411764	0.018213356461405	query_1	['GO:0006996', 'GO:0051128']	['LMNA', 'NBN', 'RAD50', 'RAD51AP1', 'LIG4', 'FEN1', 'RAD1', 'PARP1', 'XRCC5', 'ERCC1', 'ERCC4', 'ATM', 'MRE11', 'VDAC1', 'BRCA1', 'CDK2', 'XRCC1', 'RMI2', 'TP53', 'CHCHD10', 'PNKP']
402	GO:BP	GO:0007004	telomere maintenance via telomerase	2.8055045026027786e-05	True	"""The maintenance of proper telomeric length by the addition of telomeric repeats by telomerase."" [GOC:elh]"	68	102	6	17376	0.0588235294117647	0.088235294117647	query_1	['GO:0006278', 'GO:0010833']	['RAD50', 'XRCC5', 'RPA1', 'ATM', 'MRE11', 'PNKP']
403	GO:BP	GO:0051173	positive regulation of nitrogen compound metabolic process	2.973443475836698e-05	True	"""Any process that activates or increases the frequency, rate or extent of the chemical reactions and pathways involving nitrogen or nitrogenous compounds."" [GOC:ai, GOC:tb]"	2994	102	37	17376	0.3627450980392157	0.0123580494321977	query_1	['GO:0006807', 'GO:0009893', 'GO:0051171']	['RBBP8', 'LMNA', 'NBN', 'MSH2', 'USP1', 'TP53BP1', 'RAD50', 'FANCI', 'RAD51AP1', 'XRCC6', 'HLTF', 'WDR48', 'PAXIP1', 'APLF', 'MLH1', 'H2AX', 'BRCA2', 'PCNA', 'PARP1', 'XRCC5', 'ERCC1', 'BLM', 'ATM', 'MRE11', 'RAD51', 'APEX1', 'PRIM2', 'BRCA1', 'CDK2', 'PRKDC', 'XRCC1', 'BARD1', 'WRN', 'TP53', 'CHCHD10', 'PNKP', 'RNF8']
404	GO:BP	GO:0006278	RNA-templated DNA biosynthetic process	3.030129710049688e-05	True	"""A DNA biosynthetic process that uses RNA as a template for RNA-dependent DNA polymerases (e.g. reverse transcriptase) that synthesize the new strand."" [GOC:mah, ISBN:0198506732]"	69	102	6	17376	0.0588235294117647	0.0869565217391304	query_1	['GO:0071897']	['RAD50', 'XRCC5', 'RPA1', 'ATM', 'MRE11', 'PNKP']
405	GO:CC	GO:0016363	nuclear matrix	3.178801617122239e-05	True	"""The dense fibrillar network lying on the inner side of the nuclear membrane."" [ISBN:0582227089]"	127	102	7	17376	0.0686274509803921	0.0551181102362204	query_1	['GO:0034399', 'GO:0110165']	['LMNA', 'HLTF', 'PAXIP1', 'OGG1', 'POLA1', 'BLM', 'TP53']
406	GO:BP	GO:0043504	mitochondrial DNA repair	3.664019928708339e-05	True	"""The process of restoring mitochondrial DNA after damage."" [PMID:12565799, PMID:15189144, PMID:16050976]"	6	102	3	17376	0.0294117647058823	0.5	query_1	['GO:0006281', 'GO:0032042']	['LIG3', 'PARP1', 'TP53']
407	GO:BP	GO:0000019	regulation of mitotic recombination	3.664019928708339e-05	True	"""Any process that modulates the frequency, rate or extent of DNA recombination during mitosis."" [GOC:go_curators]"	6	102	3	17376	0.0294117647058823	0.5	query_1	['GO:0000018', 'GO:0006312']	['RAD50', 'MLH1', 'MRE11']
408	GO:BP	GO:0043570	maintenance of DNA repeat elements	3.664019928708339e-05	True	"""Any process involved in sustaining the fidelity and copy number of DNA repeat elements."" [GOC:jl]"	6	102	3	17376	0.0294117647058823	0.5	query_1	['GO:0006259', 'GO:0051276']	['MSH2', 'MSH3', 'RMI2']
409	GO:BP	GO:0051105	regulation of DNA ligation	3.664019928708339e-05	True	"""Any process that modulates the frequency, rate or extent of DNA ligation, the re-formation of a broken phosphodiester bond in the DNA backbone, carried out by DNA ligase."" [GOC:ai]"	6	102	3	17376	0.0294117647058823	0.5	query_1	['GO:0006266', 'GO:0051052']	['APLF', 'RAD51', 'XRCC1']
410	GO:BP	GO:0048285	organelle fission	3.664019928708339e-05	True	"""The creation of two or more organelles by division of one organelle."" [GOC:jid]"	472	102	13	17376	0.1274509803921568	0.0275423728813559	query_1	['GO:0006996']	['BRIP1', 'RAD50', 'RAD51AP1', 'MLH1', 'BRCA2', 'RAD1', 'ERCC4', 'FANCD2', 'ATM', 'MRE11', 'RAD51', 'RMI1', 'BANF1']
411	GO:BP	GO:0035518	histone H2A monoubiquitination	3.8130363626298616e-05	True	"""The modification of histone H2A by addition of a single ubiquitin group."" [PMID:18206970]"	19	102	4	17376	0.0392156862745098	0.2105263157894736	query_1	['GO:0010390', 'GO:0033522']	['BRCA2', 'RAD51', 'BRCA1', 'BARD1']
412	GO:BP	GO:0008340	determination of adult lifespan	4.723742975825405e-05	True	"""The pathways that regulate the duration of the adult phase of the life-cycle of an animal."" [PMID:25561524, PMID:273723695, PMID:3424805]"	20	102	4	17376	0.0392156862745098	0.2	query_1	['GO:0032501']	['MSH2', 'ATM', 'TP53', 'MSH6']
413	GO:CC	GO:0031966	mitochondrial membrane	5.223419514577404e-05	True	"""Either of the lipid bilayers that surround the mitochondrion and form the mitochondrial envelope."" [GOC:mah, NIF_Subcellular:sao1045389829]"	710	102	15	17376	0.1470588235294117	0.0211267605633802	query_1	['GO:0005740', 'GO:0031090']	['MICOS10', 'MTX3', 'MTX2', 'MICOS13', 'MTX1', 'CHCHD3', 'APOOL', 'VDAC1', 'CARD19', 'APOO', 'CHCHD6', 'DNAJC11', 'CHCHD10', 'SAMM50', 'IMMT']
414	GO:BP	GO:0034502	protein localization to chromosome	5.319445804226042e-05	True	"""Any process in which a protein is transported to, or maintained at, a specific location on a chromosome."" [GOC:mah]"	117	102	7	17376	0.0686274509803921	0.0598290598290598	query_1	['GO:0033365']	['MSH2', 'RPA2', 'BRCA2', 'XRCC4', 'XRCC5', 'RPA1', 'VRK1']
415	GO:BP	GO:0031324	negative regulation of cellular metabolic process	5.638418355050989e-05	True	"""Any process that stops, prevents, or reduces the frequency, rate or extent of the chemical reactions and pathways by which individual cells transform chemical substances."" [GOC:mah]"	2089	102	29	17376	0.284313725490196	0.0138822403063666	query_1	['GO:0009892', 'GO:0031323', 'GO:0044237', 'GO:0048523']	['RBBP8', 'NBN', 'MSH2', 'TP53BP1', 'RAD50', 'LIG3', 'XRCC6', 'MLH1', 'MSH3', 'OGG1', 'PCNA', 'PARP1', 'XRCC5', 'ERCC1', 'ERCC4', 'BLM', 'ATM', 'VDAC1', 'APEX1', 'BRCA1', 'CDK2', 'PRKDC', 'XRCC1', 'BARD1', 'RMI2', 'TP53', 'NEIL1', 'RNF8', 'MSH6']
416	GO:BP	GO:0032042	mitochondrial DNA metabolic process	5.732504269415937e-05	True	"""The chemical reactions and pathways involving mitochondrial DNA."" [GOC:mah]"	21	102	4	17376	0.0392156862745098	0.1904761904761904	query_1	['GO:0000002', 'GO:0006259']	['LIG3', 'PARP1', 'TOP3A', 'TP53']
417	GO:BP	GO:0033365	protein localization to organelle	5.907682001315147e-05	True	"""A process in which a protein is transported to, or maintained in, a location within an organelle."" [GOC:mah]"	924	102	18	17376	0.1764705882352941	0.0194805194805194	query_1	['GO:0008104']	['MTX2', 'LMNA', 'XPA', 'MSH2', 'MTX1', 'RPA2', 'BRCA2', 'PARP1', 'XRCC4', 'XRCC5', 'RPA1', 'VRK1', 'POLA2', 'BARD1', 'WRN', 'TP53', 'CHCHD10', 'SAMM50']
418	GO:BP	GO:0045321	leukocyte activation	5.907682001315147e-05	True	"""A change in morphology and behavior of a leukocyte resulting from exposure to a specific antigen, mitogen, cytokine, cellular ligand, or soluble factor."" [GOC:add]"	924	102	18	17376	0.1764705882352941	0.0194805194805194	query_1	['GO:0001775', 'GO:0002376']	['NBN', 'MSH2', 'TP53BP1', 'DCLRE1C', 'XRCC6', 'PAXIP1', 'LIG4', 'APLF', 'MLH1', 'ERCC1', 'NHEJ1', 'FANCD2', 'ATM', 'EXO1', 'PRKDC', 'TP53', 'RNF8', 'MSH6']
419	GO:BP	GO:0010639	negative regulation of organelle organization	5.993737650102962e-05	True	"""Any process that decreases the frequency, rate or extent of a process involved in the formation, arrangement of constituent parts, or disassembly of an organelle."" [GOC:dph, GOC:tb]"	350	102	11	17376	0.1078431372549019	0.0314285714285714	query_1	['GO:0006996', 'GO:0033043', 'GO:0051129']	['LMNA', 'NBN', 'RAD50', 'RAD1', 'PARP1', 'ERCC1', 'ERCC4', 'ATM', 'BRCA1', 'XRCC1', 'TP53']
420	GO:BP	GO:0051096	positive regulation of helicase activity	6.110631091310278e-05	True	"""Any process that activates or increases the activity of a helicase."" [GOC:ai]"	7	102	3	17376	0.0294117647058823	0.4285714285714285	query_1	['GO:0032781', 'GO:0043085', 'GO:0051095']	['MSH2', 'MSH3', 'MSH6']
421	GO:BP	GO:0045002	double-strand break repair via single-strand annealing	6.110631091310278e-05	True	"""Repair of a DSB made between two repeated sequences oriented in the same direction occurs primarily by the single strand annealing pathway. The ends of the break are processed by a 5' to 3' exonuclease, exposing complementary single-strand regions of the direct repeats that can anneal, resulting in a deletion of the unique DNA between the direct repeats."" [PMID:11606529]"	7	102	3	17376	0.0294117647058823	0.4285714285714285	query_1	['GO:0006302']	['RBBP8', 'RAD52', 'OGG1']
422	GO:BP	GO:0031325	positive regulation of cellular metabolic process	6.213560942336994e-05	True	"""Any process that activates or increases the frequency, rate or extent of the chemical reactions and pathways by which individual cells transform chemical substances."" [GOC:mah]"	2839	102	35	17376	0.3431372549019608	0.012328284607256	query_1	['GO:0009893', 'GO:0031323', 'GO:0044237', 'GO:0048522']	['RBBP8', 'NBN', 'MSH2', 'USP1', 'TP53BP1', 'RAD50', 'RAD51AP1', 'XRCC6', 'HLTF', 'WDR48', 'PAXIP1', 'APLF', 'MLH1', 'H2AX', 'BRCA2', 'PCNA', 'PARP1', 'XRCC5', 'ERCC1', 'BLM', 'ATM', 'MRE11', 'VDAC1', 'RAD51', 'APEX1', 'PRIM2', 'BRCA1', 'CDK2', 'PRKDC', 'XRCC1', 'WRN', 'TP53', 'CHCHD10', 'PNKP', 'RNF8']
423	GO:BP	GO:0006268	DNA unwinding involved in DNA replication	6.738415312067467e-05	True	"""The process in which interchain hydrogen bonds between two strands of DNA are broken or 'melted', generating unpaired template strands for DNA replication."" [ISBN:071673706X, ISBN:0815316194]"	22	102	4	17376	0.0392156862745098	0.1818181818181818	query_1	['GO:0006261', 'GO:0032508']	['RPA1', 'BLM', 'RAD51', 'WRN']
424	GO:BP	GO:0031323	regulation of cellular metabolic process	6.738415312067467e-05	True	"""Any process that modulates the frequency, rate or extent of the chemical reactions and pathways by which individual cells transform chemical substances."" [GOC:mah]"	5073	102	51	17376	0.5	0.0100532229450029	query_1	['GO:0019222', 'GO:0044237', 'GO:0050794']	['RBBP8', 'HUS1', 'LMNA', 'BRIP1', 'NBN', 'MSH2', 'USP1', 'TP53BP1', 'RAD50', 'RAD52', 'RAD51AP1', 'LIG3', 'XRCC6', 'HLTF', 'WDR48', 'PAXIP1', 'APLF', 'MLH1', 'H2AX', 'RPA2', 'MSH3', 'OGG1', 'BRCA2', 'PCNA', 'PARP1', 'XRCC5', 'ERCC1', 'ERCC4', 'FANCD2', 'BLM', 'ATM', 'POLE3', 'MRE11', 'VDAC1', 'RAD51', 'APEX1', 'PRIM2', 'BRCA1', 'CDK2', 'PRKDC', 'XRCC1', 'BARD1', 'POLB', 'WRN', 'RMI2', 'TP53', 'CHCHD10', 'PNKP', 'NEIL1', 'RNF8', 'MSH6']
425	GO:BP	GO:0016574	histone ubiquitination	7.08079578900551e-05	True	"""The modification of histones by addition of ubiquitin groups."" [GOC:ai]"	47	102	5	17376	0.0490196078431372	0.1063829787234042	query_1	['GO:0016567', 'GO:0016570']	['BRCA2', 'RAD51', 'BRCA1', 'BARD1', 'RNF8']
426	GO:BP	GO:0048523	negative regulation of cellular process	7.153460842118656e-05	True	"""Any process that stops, prevents, or reduces the frequency, rate or extent of a cellular process, any of those that are carried out at the cellular level, but are not necessarily restricted to a single cell. For example, cell communication occurs among more than one cell, but occurs at the cellular level."" [GOC:jid]"	4496	102	47	17376	0.4607843137254901	0.0104537366548042	query_1	['GO:0009987', 'GO:0048519', 'GO:0050794']	['RBBP8', 'HUS1', 'RPA4', 'LMNA', 'BRIP1', 'RAD9B', 'NBN', 'MSH2', 'TP53BP1', 'RAD50', 'LIG3', 'XRCC6', 'LIG4', 'MLH1', 'H2AX', 'RPA2', 'MSH3', 'MDC1', 'OGG1', 'BRCA2', 'RAD1', 'PCNA', 'PARP1', 'XRCC5', 'ERCC1', 'ERCC4', 'FANCD2', 'BLM', 'ATM', 'RAD9A', 'MRE11', 'VDAC1', 'RAD51', 'APEX1', 'HUS1B', 'CARD19', 'BRCA1', 'CDK2', 'PRKDC', 'XRCC1', 'BARD1', 'EMD', 'RMI2', 'TP53', 'NEIL1', 'RNF8', 'MSH6']
427	GO:BP	GO:0097190	apoptotic signaling pathway	7.476859042074178e-05	True	"""The series of molecular signals which triggers the apoptotic death of a cell. The pathway starts with reception of a signal, and ends when the execution phase of apoptosis is triggered."" [GOC:mtg_apoptosis]"	588	102	14	17376	0.1372549019607843	0.0238095238095238	query_1	['GO:0006915', 'GO:0007165']	['LMNA', 'NBN', 'MSH2', 'MLH1', 'BRCA2', 'PARP1', 'ATM', 'RAD9A', 'BRCA1', 'PRKDC', 'POLB', 'TP53', 'CHCHD10', 'MSH6']
428	REAC	REAC:R-HSA-162587	HIV Life Cycle	7.638587709899354e-05	True	HIV Life Cycle	145	102	7	17376	0.0686274509803921	0.0482758620689655	query_1	['REAC:R-HSA-162906']	['XRCC6', 'LIG4', 'FEN1', 'LIG1', 'XRCC4', 'XRCC5', 'BANF1']
429	GO:BP	GO:1901976	regulation of cell cycle checkpoint	7.769154807166132e-05	True	"""Any process that modulates the frequency, rate or extent of cell cycle checkpoint."" [GOC:mtg_cell_cycle, GOC:TermGenie, PMID:23028116]"	48	102	5	17376	0.0490196078431372	0.1041666666666666	query_1	['GO:0000075', 'GO:1901987', 'GO:1902531']	['RPA2', 'BRCA2', 'RAD51', 'BRCA1', 'BARD1']
430	GO:BP	GO:0006275	regulation of DNA replication	8.134643119530282e-05	True	"""Any process that modulates the frequency, rate or extent of DNA replication."" [GOC:go_curators]"	126	102	7	17376	0.0686274509803921	0.0555555555555555	query_1	['GO:0006260', 'GO:0051052']	['NBN', 'LIG3', 'PCNA', 'BLM', 'POLE3', 'CDK2', 'TP53']
