Mandibuloacral dysplasia with type A lipodystrophy	source	native	name	p_value	significant	description	term_size	query_size	intersection_size	effective_domain_size	precision	recall	query	parents	intersections
0	REAC	REAC:R-HSA-73894	DNA Repair	5.0598790145806754e-98	True	DNA Repair	329	102	71	17376	0.696078431372549	0.21580547112462	query_1	['REAC:0000000']	['RBBP8', 'HUS1', 'BRIP1', 'RAD9B', 'XPA', 'NBN', 'MSH2', 'USP1', 'TP53BP1', 'POLD3', 'RAD50', 'FANCI', 'RAD52', 'DCLRE1C', 'RAD51AP1', 'LIG3', 'XRCC6', 'WDR48', 'PAXIP1', 'LIG4', 'MLH1', 'FEN1', 'TDP1', 'POLD4', 'H2AX', 'RPA2', 'MSH3', 'MDC1', 'OGG1', 'LIG1', 'POLE4', 'BRCA2', 'RAD1', 'PCNA', 'RPA3', 'PMS2', 'PARP1', 'XRCC4', 'XRCC5', 'ERCC1', 'NHEJ1', 'RPA1', 'ERCC4', 'FANCD2', 'BLM', 'ATM', 'RAD9A', 'POLE3', 'MRE11', 'RAD51', 'TOP3A', 'APEX1', 'EXO1', 'BRCA1', 'CDK2', 'PRKDC', 'XRCC1', 'POLD1', 'BARD1', 'POLB', 'WRN', 'RMI2', 'POLE2', 'RMI1', 'TP53', 'PNKP', 'NEIL1', 'POLE', 'POLD2', 'RNF8', 'MSH6']
1	GO:BP	GO:0006281	DNA repair	1.865656883267269e-86	True	"""The process of restoring DNA after damage. Genomes are subject to damage by chemical and physical agents in the environment (e.g. UV and ionizing radiations, chemical mutagens, fungal and bacterial toxins, etc.) and by free radicals or alkylating agents endogenously generated in metabolism. DNA is also damaged because of errors during its replication. A variety of different DNA repair pathways have been reported that include direct reversal, base excision repair, nucleotide excision repair, photoreactivation, bypass, double-strand break repair pathway, and mismatch repair pathway."" [PMID:11563486]"	573	102	75	17376	0.7352941176470589	0.1308900523560209	query_1	['GO:0006259', 'GO:0006974']	['RBBP8', 'HUS1', 'RPA4', 'BRIP1', 'RAD9B', 'XPA', 'NBN', 'MSH2', 'USP1', 'TP53BP1', 'POLD3', 'RAD50', 'FANCI', 'RAD52', 'DCLRE1C', 'RAD51AP1', 'LIG3', 'XRCC6', 'HLTF', 'WDR48', 'PAXIP1', 'LIG4', 'APLF', 'MLH1', 'FEN1', 'TDP1', 'POLD4', 'H2AX', 'RPA2', 'MSH3', 'MDC1', 'OGG1', 'LIG1', 'BRCA2', 'POLA1', 'RAD1', 'PCNA', 'RPA3', 'PMS2', 'PARP1', 'XRCC4', 'XRCC5', 'ERCC1', 'NHEJ1', 'RPA1', 'APTX', 'ERCC4', 'FANCD2', 'BLM', 'ATM', 'RAD9A', 'MRE11', 'RAD51', 'TOP3A', 'APEX1', 'EXO1', 'HUS1B', 'BRCA1', 'CDK2', 'PRKDC', 'XRCC1', 'POLD1', 'BARD1', 'POLB', 'WRN', 'RMI2', 'POLE2', 'RMI1', 'TP53', 'PNKP', 'NEIL1', 'POLE', 'POLD2', 'RNF8', 'MSH6']
2	REAC	REAC:R-HSA-5693532	DNA Double-Strand Break Repair	3.0923714851700496e-84	True	DNA Double-Strand Break Repair	168	102	55	17376	0.5392156862745098	0.3273809523809524	query_1	['REAC:R-HSA-73894']	['RBBP8', 'HUS1', 'BRIP1', 'RAD9B', 'NBN', 'TP53BP1', 'POLD3', 'RAD50', 'RAD52', 'DCLRE1C', 'RAD51AP1', 'LIG3', 'XRCC6', 'PAXIP1', 'LIG4', 'FEN1', 'TDP1', 'POLD4', 'H2AX', 'RPA2', 'MDC1', 'POLE4', 'BRCA2', 'RAD1', 'PCNA', 'RPA3', 'PARP1', 'XRCC4', 'XRCC5', 'ERCC1', 'NHEJ1', 'RPA1', 'ERCC4', 'BLM', 'ATM', 'RAD9A', 'POLE3', 'MRE11', 'RAD51', 'TOP3A', 'EXO1', 'BRCA1', 'CDK2', 'PRKDC', 'XRCC1', 'POLD1', 'BARD1', 'WRN', 'RMI2', 'POLE2', 'RMI1', 'TP53', 'POLE', 'POLD2', 'RNF8']
3	GO:BP	GO:0006259	DNA metabolic process	4.143648410424417e-80	True	"""Any cellular metabolic process involving deoxyribonucleic acid. This is one of the two main types of nucleic acid, consisting of a long, unbranched macromolecule formed from one, or more commonly, two, strands of linked deoxyribonucleotides."" [ISBN:0198506732]"	1006	102	82	17376	0.803921568627451	0.0815109343936381	query_1	['GO:0090304']	['RBBP8', 'HUS1', 'RPA4', 'LMNA', 'BRIP1', 'RAD9B', 'XPA', 'NBN', 'MSH2', 'USP1', 'TP53BP1', 'POLD3', 'RAD50', 'FANCI', 'RAD52', 'DCLRE1C', 'RAD51AP1', 'LIG3', 'XRCC6', 'HLTF', 'WDR48', 'PAXIP1', 'LIG4', 'APLF', 'MLH1', 'FEN1', 'TDP1', 'POLD4', 'H2AX', 'RPA2', 'MSH3', 'MDC1', 'OGG1', 'LIG1', 'POLE4', 'BRCA2', 'POLA1', 'PRIM1', 'RAD1', 'PCNA', 'RPA3', 'PMS2', 'PARP1', 'XRCC4', 'XRCC5', 'ERCC1', 'NHEJ1', 'RPA1', 'APTX', 'ERCC4', 'FANCD2', 'BLM', 'ATM', 'RAD9A', 'POLE3', 'MRE11', 'RAD51', 'TOP3A', 'APEX1', 'PRIM2', 'EXO1', 'HUS1B', 'BRCA1', 'CDK2', 'PRKDC', 'POLA2', 'XRCC1', 'POLD1', 'BARD1', 'POLB', 'WRN', 'RMI2', 'POLE2', 'RMI1', 'TP53', 'PNKP', 'NEIL1', 'BANF1', 'POLE', 'POLD2', 'RNF8', 'MSH6']
4	GO:BP	GO:0006974	DNA damage response	9.737084686312906e-79	True	"""Any process that results in a change in state or activity of a cell (in terms of movement, secretion, enzyme production, gene expression, etc.) as a result of a stimulus indicating damage to its DNA from environmental insults or errors during metabolism."" [GOC:go_curators]"	855	102	78	17376	0.7647058823529411	0.0912280701754386	query_1	['GO:0033554']	['RBBP8', 'HUS1', 'RPA4', 'BRIP1', 'RAD9B', 'XPA', 'NBN', 'MSH2', 'USP1', 'TP53BP1', 'POLD3', 'RAD50', 'FANCI', 'RAD52', 'DCLRE1C', 'RAD51AP1', 'LIG3', 'XRCC6', 'HLTF', 'WDR48', 'PAXIP1', 'LIG4', 'APLF', 'MLH1', 'FEN1', 'TDP1', 'POLD4', 'H2AX', 'RPA2', 'MSH3', 'MDC1', 'OGG1', 'LIG1', 'BRCA2', 'POLA1', 'RAD1', 'PCNA', 'RPA3', 'PMS2', 'PARP1', 'XRCC4', 'XRCC5', 'ERCC1', 'NHEJ1', 'RPA1', 'APTX', 'ERCC4', 'FANCD2', 'BLM', 'ATM', 'RAD9A', 'POLE3', 'MRE11', 'RAD51', 'TOP3A', 'APEX1', 'VRK1', 'EXO1', 'HUS1B', 'BRCA1', 'CDK2', 'PRKDC', 'XRCC1', 'CHCHD6', 'POLD1', 'BARD1', 'POLB', 'WRN', 'RMI2', 'POLE2', 'RMI1', 'TP53', 'PNKP', 'NEIL1', 'POLE', 'POLD2', 'RNF8', 'MSH6']
5	REAC	REAC:R-HSA-5693538	Homology Directed Repair	1.802167780505765e-67	True	Homology Directed Repair	138	102	45	17376	0.4411764705882353	0.3260869565217391	query_1	['REAC:R-HSA-5693532']	['RBBP8', 'HUS1', 'BRIP1', 'RAD9B', 'NBN', 'TP53BP1', 'POLD3', 'RAD50', 'RAD52', 'RAD51AP1', 'LIG3', 'FEN1', 'POLD4', 'H2AX', 'RPA2', 'MDC1', 'POLE4', 'BRCA2', 'RAD1', 'PCNA', 'RPA3', 'PARP1', 'ERCC1', 'RPA1', 'ERCC4', 'BLM', 'ATM', 'RAD9A', 'POLE3', 'MRE11', 'RAD51', 'TOP3A', 'EXO1', 'BRCA1', 'CDK2', 'XRCC1', 'POLD1', 'BARD1', 'WRN', 'RMI2', 'POLE2', 'RMI1', 'POLE', 'POLD2', 'RNF8']
6	REAC	REAC:R-HSA-5693567	HDR through Homologous Recombination (HRR) or Single Strand Annealing (SSA)	4.753660233123419e-60	True	HDR through Homologous Recombination (HRR) or Single Strand Annealing (SSA)	132	102	41	17376	0.4019607843137255	0.3106060606060606	query_1	['REAC:R-HSA-5693538']	['RBBP8', 'HUS1', 'BRIP1', 'RAD9B', 'NBN', 'TP53BP1', 'POLD3', 'RAD50', 'RAD52', 'RAD51AP1', 'POLD4', 'H2AX', 'RPA2', 'MDC1', 'POLE4', 'BRCA2', 'RAD1', 'PCNA', 'RPA3', 'ERCC1', 'RPA1', 'ERCC4', 'BLM', 'ATM', 'RAD9A', 'POLE3', 'MRE11', 'RAD51', 'TOP3A', 'EXO1', 'BRCA1', 'CDK2', 'POLD1', 'BARD1', 'WRN', 'RMI2', 'POLE2', 'RMI1', 'POLE', 'POLD2', 'RNF8']
7	GO:BP	GO:0006302	double-strand break repair	3.906697615940313e-59	True	"""The repair of double-strand breaks in DNA via homologous and nonhomologous mechanisms to reform a continuous DNA helix."" [GOC:elh]"	296	102	50	17376	0.4901960784313725	0.1689189189189189	query_1	['GO:0006281']	['RBBP8', 'HUS1', 'RPA4', 'BRIP1', 'NBN', 'MSH2', 'TP53BP1', 'RAD50', 'RAD52', 'DCLRE1C', 'RAD51AP1', 'LIG3', 'XRCC6', 'WDR48', 'LIG4', 'APLF', 'MLH1', 'FEN1', 'TDP1', 'H2AX', 'RPA2', 'OGG1', 'BRCA2', 'POLA1', 'RPA3', 'PARP1', 'XRCC4', 'XRCC5', 'ERCC1', 'NHEJ1', 'RPA1', 'APTX', 'ERCC4', 'FANCD2', 'BLM', 'ATM', 'MRE11', 'RAD51', 'TOP3A', 'HUS1B', 'BRCA1', 'PRKDC', 'XRCC1', 'POLB', 'WRN', 'RMI2', 'RMI1', 'TP53', 'PNKP', 'RNF8']
8	GO:BP	GO:0006310	DNA recombination	3.906697615940313e-59	True	"""Any process in which a new genotype is formed by reassortment of genes resulting in gene combinations different from those that were present in the parents. In eukaryotes genetic recombination can occur by chromosome assortment, intrachromosomal recombination, or nonreciprocal interchromosomal recombination. Interchromosomal recombination occurs by crossing over. In bacteria it may occur by genetic transformation, conjugation, transduction, or F-duction."" [ISBN:0198506732]"	319	102	51	17376	0.5	0.1598746081504702	query_1	['GO:0006259']	['RBBP8', 'HUS1', 'RPA4', 'BRIP1', 'NBN', 'MSH2', 'TP53BP1', 'RAD50', 'RAD52', 'DCLRE1C', 'RAD51AP1', 'LIG3', 'XRCC6', 'WDR48', 'PAXIP1', 'LIG4', 'APLF', 'MLH1', 'FEN1', 'H2AX', 'RPA2', 'MSH3', 'LIG1', 'BRCA2', 'RPA3', 'PARP1', 'XRCC4', 'XRCC5', 'ERCC1', 'NHEJ1', 'RPA1', 'ERCC4', 'FANCD2', 'BLM', 'ATM', 'MRE11', 'RAD51', 'TOP3A', 'APEX1', 'EXO1', 'HUS1B', 'BRCA1', 'PRKDC', 'XRCC1', 'BARD1', 'POLB', 'WRN', 'RMI2', 'RMI1', 'RNF8', 'MSH6']
9	REAC	REAC:R-HSA-9675135	Diseases of DNA repair	8.708154492584879e-57	True	Diseases of DNA repair	50	102	31	17376	0.3039215686274509	0.62	query_1	['REAC:R-HSA-1643685']	['RBBP8', 'HUS1', 'BRIP1', 'RAD9B', 'NBN', 'MSH2', 'RAD50', 'RAD51AP1', 'MLH1', 'RPA2', 'MSH3', 'OGG1', 'BRCA2', 'RAD1', 'RPA3', 'PMS2', 'RPA1', 'BLM', 'ATM', 'RAD9A', 'MRE11', 'RAD51', 'TOP3A', 'EXO1', 'BRCA1', 'BARD1', 'WRN', 'RMI2', 'RMI1', 'NEIL1', 'MSH6']
10	REAC	REAC:R-HSA-5685942	HDR through Homologous Recombination (HRR)	1.026355553630663e-55	True	HDR through Homologous Recombination (HRR)	68	102	33	17376	0.3235294117647059	0.4852941176470588	query_1	['REAC:R-HSA-5693567']	['RBBP8', 'HUS1', 'BRIP1', 'RAD9B', 'NBN', 'POLD3', 'RAD50', 'RAD51AP1', 'POLD4', 'RPA2', 'POLE4', 'BRCA2', 'RAD1', 'PCNA', 'RPA3', 'RPA1', 'BLM', 'ATM', 'RAD9A', 'POLE3', 'MRE11', 'RAD51', 'TOP3A', 'EXO1', 'BRCA1', 'POLD1', 'BARD1', 'WRN', 'RMI2', 'POLE2', 'RMI1', 'POLE', 'POLD2']
11	GO:BP	GO:0033554	cellular response to stress	7.909124149076948e-55	True	"""Any process that results in a change in state or activity of a cell (in terms of movement, secretion, enzyme production, gene expression, etc.) as a result of a stimulus indicating the organism is under stress. The stress is usually, but not necessarily, exogenous (e.g. temperature, humidity, ionizing radiation)."" [GOC:mah]"	1893	102	80	17376	0.7843137254901961	0.0422609614368726	query_1	['GO:0006950', 'GO:0051716']	['RBBP8', 'HUS1', 'RPA4', 'LMNA', 'BRIP1', 'RAD9B', 'XPA', 'NBN', 'MSH2', 'USP1', 'TP53BP1', 'POLD3', 'RAD50', 'FANCI', 'RAD52', 'DCLRE1C', 'RAD51AP1', 'LIG3', 'XRCC6', 'HLTF', 'WDR48', 'PAXIP1', 'LIG4', 'APLF', 'MLH1', 'FEN1', 'TDP1', 'POLD4', 'H2AX', 'RPA2', 'MSH3', 'MDC1', 'OGG1', 'LIG1', 'BRCA2', 'POLA1', 'RAD1', 'PCNA', 'RPA3', 'PMS2', 'PARP1', 'XRCC4', 'XRCC5', 'ERCC1', 'NHEJ1', 'RPA1', 'APTX', 'ERCC4', 'FANCD2', 'BLM', 'ATM', 'RAD9A', 'POLE3', 'MRE11', 'VDAC1', 'RAD51', 'TOP3A', 'APEX1', 'VRK1', 'EXO1', 'HUS1B', 'BRCA1', 'CDK2', 'PRKDC', 'XRCC1', 'CHCHD6', 'POLD1', 'BARD1', 'POLB', 'WRN', 'RMI2', 'POLE2', 'RMI1', 'TP53', 'PNKP', 'NEIL1', 'POLE', 'POLD2', 'RNF8', 'MSH6']
12	REAC	REAC:R-HSA-5685938	HDR through Single Strand Annealing (SSA)	6.200446475120024e-47	True	HDR through Single Strand Annealing (SSA)	37	102	25	17376	0.2450980392156862	0.6756756756756757	query_1	['REAC:R-HSA-5693567']	['RBBP8', 'HUS1', 'BRIP1', 'RAD9B', 'NBN', 'RAD50', 'RAD52', 'RPA2', 'RAD1', 'RPA3', 'ERCC1', 'RPA1', 'ERCC4', 'BLM', 'ATM', 'RAD9A', 'MRE11', 'RAD51', 'TOP3A', 'EXO1', 'BRCA1', 'BARD1', 'WRN', 'RMI2', 'RMI1']
13	REAC	REAC:R-HSA-9701190	Defective homologous recombination repair (HRR) due to BRCA2 loss of function	8.585865299705088e-43	True	Defective homologous recombination repair (HRR) due to BRCA2 loss of function	41	102	24	17376	0.2352941176470588	0.5853658536585366	query_1	['REAC:R-HSA-9675136']	['RBBP8', 'HUS1', 'BRIP1', 'RAD9B', 'NBN', 'RAD50', 'RAD51AP1', 'RPA2', 'BRCA2', 'RAD1', 'RPA3', 'RPA1', 'BLM', 'ATM', 'RAD9A', 'MRE11', 'RAD51', 'TOP3A', 'EXO1', 'BRCA1', 'BARD1', 'WRN', 'RMI2', 'RMI1']
14	REAC	REAC:R-HSA-9675136	Diseases of DNA Double-Strand Break Repair	8.585865299705088e-43	True	Diseases of DNA Double-Strand Break Repair	41	102	24	17376	0.2352941176470588	0.5853658536585366	query_1	['REAC:R-HSA-9675135']	['RBBP8', 'HUS1', 'BRIP1', 'RAD9B', 'NBN', 'RAD50', 'RAD51AP1', 'RPA2', 'BRCA2', 'RAD1', 'RPA3', 'RPA1', 'BLM', 'ATM', 'RAD9A', 'MRE11', 'RAD51', 'TOP3A', 'EXO1', 'BRCA1', 'BARD1', 'WRN', 'RMI2', 'RMI1']
15	REAC	REAC:R-HSA-9709570	Impaired BRCA2 binding to RAD51	9.542658537394704e-43	True	Impaired BRCA2 binding to RAD51	35	102	23	17376	0.2254901960784313	0.6571428571428571	query_1	['REAC:R-HSA-9701190']	['RBBP8', 'HUS1', 'BRIP1', 'RAD9B', 'NBN', 'RAD50', 'RPA2', 'BRCA2', 'RAD1', 'RPA3', 'RPA1', 'BLM', 'ATM', 'RAD9A', 'MRE11', 'RAD51', 'TOP3A', 'EXO1', 'BRCA1', 'BARD1', 'WRN', 'RMI2', 'RMI1']
16	REAC	REAC:R-HSA-5693579	Homologous DNA Pairing and Strand Exchange	3.677612465001093e-42	True	Homologous DNA Pairing and Strand Exchange	43	102	24	17376	0.2352941176470588	0.5581395348837209	query_1	['REAC:R-HSA-5685942']	['RBBP8', 'HUS1', 'BRIP1', 'RAD9B', 'NBN', 'RAD50', 'RAD51AP1', 'RPA2', 'BRCA2', 'RAD1', 'RPA3', 'RPA1', 'BLM', 'ATM', 'RAD9A', 'MRE11', 'RAD51', 'TOP3A', 'EXO1', 'BRCA1', 'BARD1', 'WRN', 'RMI2', 'RMI1']
17	REAC	REAC:R-HSA-5693616	Presynaptic phase of homologous DNA pairing and strand exchange	8.273097495184574e-41	True	Presynaptic phase of homologous DNA pairing and strand exchange	40	102	23	17376	0.2254901960784313	0.575	query_1	['REAC:R-HSA-5693579']	['RBBP8', 'HUS1', 'BRIP1', 'RAD9B', 'NBN', 'RAD50', 'RPA2', 'BRCA2', 'RAD1', 'RPA3', 'RPA1', 'BLM', 'ATM', 'RAD9A', 'MRE11', 'RAD51', 'TOP3A', 'EXO1', 'BRCA1', 'BARD1', 'WRN', 'RMI2', 'RMI1']
18	REAC	REAC:R-HSA-1640170	Cell Cycle	1.7993305839086843e-40	True	Cell Cycle	673	102	49	17376	0.4803921568627451	0.0728083209509658	query_1	['REAC:0000000']	['RBBP8', 'HUS1', 'RPA4', 'BRIP1', 'RAD9B', 'NBN', 'TP53BP1', 'POLD3', 'RAD50', 'MLH1', 'FEN1', 'POLD4', 'H2AX', 'RPA2', 'MDC1', 'LIG1', 'POLE4', 'BRCA2', 'POLA1', 'PRIM1', 'RAD1', 'PCNA', 'RPA3', 'RPA1', 'BLM', 'ATM', 'RAD9A', 'POLE3', 'MRE11', 'RAD51', 'TOP3A', 'PRIM2', 'VRK1', 'EXO1', 'BRCA1', 'CDK2', 'POLA2', 'POLD1', 'BARD1', 'WRN', 'EMD', 'RMI2', 'POLE2', 'RMI1', 'TP53', 'BANF1', 'POLE', 'POLD2', 'RNF8']
19	GO:BP	GO:0006260	DNA replication	3.208134000740052e-40	True	"""The cellular metabolic process in which a cell duplicates one or more molecules of DNA. DNA replication begins when specific sequences, known as origins of replication, are recognized and bound by the origin recognition complex, and ends when the original DNA molecule has been completely duplicated and the copies topologically separated. The unit of replication usually corresponds to the genome of the cell, an organelle, or a virus. The template for replication can either be an existing DNA molecule or RNA."" [GOC:mah]"	272	102	38	17376	0.3725490196078431	0.1397058823529411	query_1	['GO:0006259']	['RBBP8', 'RPA4', 'NBN', 'POLD3', 'RAD50', 'LIG3', 'LIG4', 'FEN1', 'POLD4', 'RPA2', 'LIG1', 'POLE4', 'BRCA2', 'POLA1', 'PRIM1', 'PCNA', 'RPA3', 'PARP1', 'RPA1', 'BLM', 'POLE3', 'MRE11', 'RAD51', 'PRIM2', 'BRCA1', 'CDK2', 'POLA2', 'POLD1', 'BARD1', 'POLB', 'WRN', 'RMI2', 'POLE2', 'RMI1', 'TP53', 'PNKP', 'POLE', 'POLD2']
20	REAC	REAC:R-HSA-73933	Resolution of Abasic Sites (AP sites)	6.663849643275086e-40	True	Resolution of Abasic Sites (AP sites)	36	102	22	17376	0.2156862745098039	0.6111111111111112	query_1	['REAC:R-HSA-73884']	['POLD3', 'LIG3', 'FEN1', 'POLD4', 'RPA2', 'OGG1', 'LIG1', 'POLE4', 'PCNA', 'RPA3', 'PARP1', 'RPA1', 'POLE3', 'APEX1', 'XRCC1', 'POLD1', 'POLB', 'POLE2', 'PNKP', 'NEIL1', 'POLE', 'POLD2']
21	GO:BP	GO:0006261	DNA-templated DNA replication	6.60491769006422e-39	True	"""A DNA replication process that uses parental DNA as a template for the DNA-dependent DNA polymerases that synthesize the new strands."" [GOC:mah, ISBN:0198506732]"	157	102	32	17376	0.3137254901960784	0.2038216560509554	query_1	['GO:0006260']	['RBBP8', 'RPA4', 'NBN', 'POLD3', 'RAD50', 'LIG3', 'FEN1', 'POLD4', 'LIG1', 'POLE4', 'BRCA2', 'POLA1', 'PRIM1', 'PCNA', 'PARP1', 'RPA1', 'BLM', 'POLE3', 'MRE11', 'RAD51', 'PRIM2', 'BRCA1', 'CDK2', 'POLA2', 'POLD1', 'BARD1', 'POLB', 'WRN', 'POLE2', 'PNKP', 'POLE', 'POLD2']
22	GO:CC	GO:0005694	chromosome	1.1358400698969979e-38	True	"""A structure composed of a very long molecule of DNA and associated proteins (e.g. histones) that carries hereditary information."" [ISBN:0198547684]"	1834	102	67	17376	0.6568627450980392	0.0365321701199563	query_1	['GO:0043232']	['RBBP8', 'HUS1', 'RPA4', 'LMNA', 'RAD9B', 'XPA', 'NBN', 'MSH2', 'TP53BP1', 'POLD3', 'RAD50', 'FANCI', 'RAD51AP1', 'XRCC6', 'PAXIP1', 'LIG4', 'APLF', 'MLH1', 'FEN1', 'POLD4', 'H2AX', 'RPA2', 'MDC1', 'POLE4', 'BRCA2', 'POLA1', 'PRIM1', 'RAD1', 'PCNA', 'RPA3', 'PARP1', 'XRCC4', 'XRCC5', 'ERCC1', 'NHEJ1', 'RPA1', 'APTX', 'ERCC4', 'FANCD2', 'BLM', 'ATM', 'RAD9A', 'POLE3', 'MRE11', 'RAD51', 'TOP3A', 'APEX1', 'PRIM2', 'HUS1B', 'BRCA1', 'CDK2', 'PRKDC', 'POLA2', 'XRCC1', 'POLD1', 'WRN', 'RMI2', 'POLE2', 'RMI1', 'TP53', 'PNKP', 'NEIL1', 'BANF1', 'POLE', 'POLD2', 'RNF8', 'MSH6']
23	GO:CC	GO:0005654	nucleoplasm	1.1358400698969979e-38	True	"""That part of the nuclear content other than the chromosomes or the nucleolus."" [GOC:ma, ISBN:0124325653]"	3986	102	87	17376	0.8529411764705882	0.0218263923733065	query_1	['GO:0031981', 'GO:0110165']	['RBBP8', 'HUS1', 'RPA4', 'LMNA', 'BRIP1', 'RAD9B', 'XPA', 'NBN', 'MICOS13', 'MSH2', 'USP1', 'TP53BP1', 'POLD3', 'RAD50', 'FANCI', 'RAD52', 'DCLRE1C', 'RAD51AP1', 'LIG3', 'XRCC6', 'HLTF', 'WDR48', 'PAXIP1', 'LIG4', 'APLF', 'MLH1', 'FEN1', 'TDP1', 'POLD4', 'H2AX', 'WDR20', 'RPA2', 'MSH3', 'MDC1', 'OGG1', 'LIG1', 'POLE4', 'BRCA2', 'POLA1', 'PRIM1', 'RAD1', 'PCNA', 'USP12', 'RPA3', 'PMS2', 'PARP1', 'XRCC4', 'XRCC5', 'ERCC1', 'NHEJ1', 'RPA1', 'APTX', 'ERCC4', 'FANCD2', 'BLM', 'ATM', 'RAD9A', 'POLE3', 'MRE11', 'RAD51', 'TOP3A', 'APEX1', 'PRIM2', 'VRK1', 'EXO1', 'BRCA1', 'CDK2', 'PRKDC', 'POLA2', 'XRCC1', 'POLD1', 'BARD1', 'POLB', 'WRN', 'EMD', 'RMI2', 'POLE2', 'DNAJC11', 'RMI1', 'TP53', 'PNKP', 'NEIL1', 'BANF1', 'POLE', 'POLD2', 'RNF8', 'MSH6']
24	GO:CC	GO:0031981	nuclear lumen	2.365663566854525e-38	True	"""The volume enclosed by the nuclear inner membrane."" [GOC:mah, GOC:pz]"	4336	102	89	17376	0.8725490196078431	0.0205258302583025	query_1	['GO:0005634', 'GO:0070013']	['RBBP8', 'HUS1', 'RPA4', 'MTX2', 'LMNA', 'BRIP1', 'RAD9B', 'XPA', 'NBN', 'MICOS13', 'MSH2', 'USP1', 'TP53BP1', 'POLD3', 'RAD50', 'FANCI', 'RAD52', 'DCLRE1C', 'RAD51AP1', 'LIG3', 'XRCC6', 'HLTF', 'WDR48', 'PAXIP1', 'LIG4', 'APLF', 'MLH1', 'FEN1', 'TDP1', 'POLD4', 'H2AX', 'WDR20', 'RPA2', 'MSH3', 'MDC1', 'OGG1', 'LIG1', 'POLE4', 'BRCA2', 'POLA1', 'PRIM1', 'RAD1', 'PCNA', 'USP12', 'RPA3', 'PMS2', 'PARP1', 'XRCC4', 'XRCC5', 'ERCC1', 'NHEJ1', 'RPA1', 'APTX', 'ERCC4', 'FANCD2', 'BLM', 'ATM', 'RAD9A', 'POLE3', 'MRE11', 'RAD51', 'TOP3A', 'APEX1', 'PRIM2', 'VRK1', 'EXO1', 'HUS1B', 'BRCA1', 'CDK2', 'PRKDC', 'POLA2', 'XRCC1', 'POLD1', 'BARD1', 'POLB', 'WRN', 'EMD', 'RMI2', 'POLE2', 'DNAJC11', 'RMI1', 'TP53', 'PNKP', 'NEIL1', 'BANF1', 'POLE', 'POLD2', 'RNF8', 'MSH6']
25	REAC	REAC:R-HSA-69473	G2/M DNA damage checkpoint	5.9482491257835616e-36	True	G2/M DNA damage checkpoint	94	102	26	17376	0.2549019607843137	0.2765957446808511	query_1	['REAC:R-HSA-69481']	['RBBP8', 'HUS1', 'BRIP1', 'RAD9B', 'NBN', 'TP53BP1', 'RAD50', 'H2AX', 'RPA2', 'MDC1', 'RAD1', 'RPA3', 'RPA1', 'BLM', 'ATM', 'RAD9A', 'MRE11', 'TOP3A', 'EXO1', 'BRCA1', 'BARD1', 'WRN', 'RMI2', 'RMI1', 'TP53', 'RNF8']
26	REAC	REAC:R-HSA-5693607	Processing of DNA double-strand break ends	1.4203492124411826e-35	True	Processing of DNA double-strand break ends	97	102	26	17376	0.2549019607843137	0.268041237113402	query_1	['REAC:R-HSA-5693567']	['RBBP8', 'HUS1', 'BRIP1', 'RAD9B', 'NBN', 'TP53BP1', 'RAD50', 'H2AX', 'RPA2', 'MDC1', 'RAD1', 'RPA3', 'RPA1', 'BLM', 'ATM', 'RAD9A', 'MRE11', 'TOP3A', 'EXO1', 'BRCA1', 'CDK2', 'BARD1', 'WRN', 'RMI2', 'RMI1', 'RNF8']
27	GO:CC	GO:0043233	organelle lumen	1.4829572179516752e-35	True	"""The internal volume enclosed by the membranes of a particular organelle; includes the volume enclosed by a single organelle membrane, e.g. endoplasmic reticulum lumen, or the volume enclosed by the innermost of the two lipid bilayers of an organelle envelope, e.g. nuclear lumen."" [GOC:jl, GOC:mah]"	5406	102	93	17376	0.9117647058823528	0.0172031076581576	query_1	['GO:0031974', 'GO:0043226']	['RBBP8', 'HUS1', 'RPA4', 'MTX2', 'LMNA', 'BRIP1', 'RAD9B', 'XPA', 'NBN', 'MICOS13', 'MSH2', 'USP1', 'TP53BP1', 'POLD3', 'RAD50', 'FANCI', 'RAD52', 'DCLRE1C', 'RAD51AP1', 'LIG3', 'XRCC6', 'HLTF', 'WDR48', 'PAXIP1', 'LIG4', 'APLF', 'MLH1', 'FEN1', 'TDP1', 'POLD4', 'H2AX', 'WDR20', 'RPA2', 'MSH3', 'MDC1', 'OGG1', 'LIG1', 'POLE4', 'BRCA2', 'POLA1', 'PRIM1', 'RAD1', 'PCNA', 'USP12', 'RPA3', 'PMS2', 'PARP1', 'APOOL', 'XRCC4', 'XRCC5', 'ERCC1', 'NHEJ1', 'RPA1', 'APTX', 'ERCC4', 'FANCD2', 'BLM', 'ATM', 'RAD9A', 'POLE3', 'MRE11', 'VDAC1', 'RAD51', 'TOP3A', 'APEX1', 'PRIM2', 'VRK1', 'EXO1', 'HUS1B', 'BRCA1', 'CDK2', 'PRKDC', 'POLA2', 'XRCC1', 'POLD1', 'BARD1', 'POLB', 'WRN', 'EMD', 'RMI2', 'POLE2', 'DNAJC11', 'RMI1', 'TP53', 'CHCHD10', 'PNKP', 'NEIL1', 'IMMT', 'BANF1', 'POLE', 'POLD2', 'RNF8', 'MSH6']
28	GO:CC	GO:0070013	intracellular organelle lumen	1.4829572179516752e-35	True	"""An organelle lumen that is part of an intracellular organelle."" [GOC:mah]"	5406	102	93	17376	0.9117647058823528	0.0172031076581576	query_1	['GO:0043229', 'GO:0043233']	['RBBP8', 'HUS1', 'RPA4', 'MTX2', 'LMNA', 'BRIP1', 'RAD9B', 'XPA', 'NBN', 'MICOS13', 'MSH2', 'USP1', 'TP53BP1', 'POLD3', 'RAD50', 'FANCI', 'RAD52', 'DCLRE1C', 'RAD51AP1', 'LIG3', 'XRCC6', 'HLTF', 'WDR48', 'PAXIP1', 'LIG4', 'APLF', 'MLH1', 'FEN1', 'TDP1', 'POLD4', 'H2AX', 'WDR20', 'RPA2', 'MSH3', 'MDC1', 'OGG1', 'LIG1', 'POLE4', 'BRCA2', 'POLA1', 'PRIM1', 'RAD1', 'PCNA', 'USP12', 'RPA3', 'PMS2', 'PARP1', 'APOOL', 'XRCC4', 'XRCC5', 'ERCC1', 'NHEJ1', 'RPA1', 'APTX', 'ERCC4', 'FANCD2', 'BLM', 'ATM', 'RAD9A', 'POLE3', 'MRE11', 'VDAC1', 'RAD51', 'TOP3A', 'APEX1', 'PRIM2', 'VRK1', 'EXO1', 'HUS1B', 'BRCA1', 'CDK2', 'PRKDC', 'POLA2', 'XRCC1', 'POLD1', 'BARD1', 'POLB', 'WRN', 'EMD', 'RMI2', 'POLE2', 'DNAJC11', 'RMI1', 'TP53', 'CHCHD10', 'PNKP', 'NEIL1', 'IMMT', 'BANF1', 'POLE', 'POLD2', 'RNF8', 'MSH6']
29	GO:CC	GO:0031974	membrane-enclosed lumen	1.4829572179516752e-35	True	"""The enclosed volume within a sealed membrane or between two sealed membranes. Encompasses the volume enclosed by the membranes of a particular organelle, e.g. endoplasmic reticulum lumen, or the space between the two lipid bilayers of a double membrane surrounding an organelle, e.g. nuclear envelope lumen."" [GOC:add, GOC:mah]"	5406	102	93	17376	0.9117647058823528	0.0172031076581576	query_1	['GO:0110165']	['RBBP8', 'HUS1', 'RPA4', 'MTX2', 'LMNA', 'BRIP1', 'RAD9B', 'XPA', 'NBN', 'MICOS13', 'MSH2', 'USP1', 'TP53BP1', 'POLD3', 'RAD50', 'FANCI', 'RAD52', 'DCLRE1C', 'RAD51AP1', 'LIG3', 'XRCC6', 'HLTF', 'WDR48', 'PAXIP1', 'LIG4', 'APLF', 'MLH1', 'FEN1', 'TDP1', 'POLD4', 'H2AX', 'WDR20', 'RPA2', 'MSH3', 'MDC1', 'OGG1', 'LIG1', 'POLE4', 'BRCA2', 'POLA1', 'PRIM1', 'RAD1', 'PCNA', 'USP12', 'RPA3', 'PMS2', 'PARP1', 'APOOL', 'XRCC4', 'XRCC5', 'ERCC1', 'NHEJ1', 'RPA1', 'APTX', 'ERCC4', 'FANCD2', 'BLM', 'ATM', 'RAD9A', 'POLE3', 'MRE11', 'VDAC1', 'RAD51', 'TOP3A', 'APEX1', 'PRIM2', 'VRK1', 'EXO1', 'HUS1B', 'BRCA1', 'CDK2', 'PRKDC', 'POLA2', 'XRCC1', 'POLD1', 'BARD1', 'POLB', 'WRN', 'EMD', 'RMI2', 'POLE2', 'DNAJC11', 'RMI1', 'TP53', 'CHCHD10', 'PNKP', 'NEIL1', 'IMMT', 'BANF1', 'POLE', 'POLD2', 'RNF8', 'MSH6']
30	GO:BP	GO:0010212	response to ionizing radiation	6.098314670802638e-35	True	"""Any process that results in a change in state or activity of a cell or an organism (in terms of movement, secretion, enzyme production, gene expression, etc.) as a result of a ionizing radiation stimulus. Ionizing radiation is radiation with sufficient energy to remove electrons from atoms and may arise from spontaneous decay of unstable isotopes, resulting in alpha and beta particles and gamma rays. Ionizing radiation also includes X-rays."" [PMID:12509526]"	143	102	29	17376	0.284313725490196	0.2027972027972027	query_1	['GO:0009314']	['HUS1', 'RAD9B', 'MSH2', 'TP53BP1', 'DCLRE1C', 'RAD51AP1', 'XRCC6', 'PAXIP1', 'LIG4', 'H2AX', 'BRCA2', 'RAD1', 'PARP1', 'XRCC4', 'XRCC5', 'ERCC1', 'NHEJ1', 'FANCD2', 'BLM', 'ATM', 'RAD9A', 'RAD51', 'BRCA1', 'PRKDC', 'BARD1', 'POLB', 'WRN', 'TP53', 'RNF8']
31	GO:BP	GO:0000725	recombinational repair	2.9950071430663143e-34	True	"""A DNA repair process that involves the exchange, reciprocal or nonreciprocal, of genetic material between the broken DNA molecule and a homologous DNA region."" [GOC:elh]"	171	102	30	17376	0.2941176470588235	0.175438596491228	query_1	['GO:0006281', 'GO:0006310']	['RBBP8', 'HUS1', 'RPA4', 'NBN', 'TP53BP1', 'RAD52', 'RAD51AP1', 'LIG3', 'XRCC6', 'WDR48', 'FEN1', 'H2AX', 'RPA2', 'BRCA2', 'RPA3', 'PARP1', 'XRCC5', 'RPA1', 'ERCC4', 'BLM', 'ATM', 'MRE11', 'RAD51', 'TOP3A', 'HUS1B', 'BRCA1', 'XRCC1', 'WRN', 'RMI2', 'RMI1']
32	GO:BP	GO:0009314	response to radiation	5.777587217534581e-34	True	"""Any process that results in a change in state or activity of a cell or an organism (in terms of movement, secretion, enzyme production, gene expression, etc.) as a result of an electromagnetic radiation stimulus. Electromagnetic radiation is a propagating wave in space with electric and magnetic components. These components oscillate at right angles to each other and to the direction of propagation."" [GOC:jl, Wikipedia:Electromagnetic_radiation]"	433	102	39	17376	0.3823529411764705	0.0900692840646651	query_1	['GO:0009628']	['HUS1', 'RAD9B', 'XPA', 'MSH2', 'USP1', 'TP53BP1', 'POLD3', 'DCLRE1C', 'RAD51AP1', 'XRCC6', 'PAXIP1', 'LIG4', 'FEN1', 'H2AX', 'OGG1', 'BRCA2', 'RAD1', 'PCNA', 'PARP1', 'XRCC4', 'XRCC5', 'ERCC1', 'NHEJ1', 'ERCC4', 'FANCD2', 'BLM', 'ATM', 'RAD9A', 'RAD51', 'BRCA1', 'PRKDC', 'POLD1', 'BARD1', 'POLB', 'WRN', 'TP53', 'PNKP', 'RNF8', 'MSH6']
