348	GO:CC	GO:0030136	clathrin-coated vesicle	0.0017273902889999	True	"""A vesicle with a coat formed of clathrin connected to the membrane via one of the clathrin adaptor complexes."" [GOC:mah, PMID:11252894]"	214	100	8	22122	0.08	0.0373831775700934	query_1	['GO:0030135']	['AP1G2', 'ATP6V0A1', 'ATP6AP2', 'ATP6V0D1', 'ATP6V1E1', 'ATP6V1A', 'ATP6AP1', 'ATP6V0C']
349	KEGG	KEGG:05165	Human papillomavirus infection	0.0017706961210849	True	Human papillomavirus infection	331	70	12	8161	0.1714285714285714	0.0362537764350453	query_1	['KEGG:00000']	['ATP6V0A2', 'ATP6V0A1', 'TCIRG1', 'ATP6V0A4', 'CASP3', 'ATP6V0D1', 'ATP6V1E1', 'ATP6V1A', 'ATP6AP1', 'ATP6V0C', 'TP53', 'ATP6V0D2']
350	GO:MF	GO:0019899	enzyme binding	0.0018552725023111	True	"""Binding to an enzyme, a protein with catalytic activity."" [GOC:jl]"	2093	101	27	20195	0.2673267326732673	0.0129001433349259	query_1	['GO:0005515']	['ATP6V0A2', 'TRPC4AP', 'HGS', 'ATP6V0A1', 'SPATA2', 'FLOT1', 'TSG101', 'HSPA2', 'SMYD2', 'CHMP4A', 'STAM', 'SLN', 'TCIRG1', 'TIMP3', 'ATP6V0A4', 'CASP3', 'CHMP3', 'ATP6V1E1', 'PLN', 'ATP6AP1', 'ATP6V0C', 'ACE', 'VPS9D1', 'TP53', 'CYLD', 'ELOF1', 'CBL']
351	REAC	REAC:R-HSA-1632852	Macroautophagy	0.0020730081603578	True	Macroautophagy	134	78	8	10790	0.1025641025641025	0.0597014925373134	query_1	['REAC:R-HSA-9612973']	['CHMP2A', 'CHMP2B', 'CHMP4B', 'CHMP4A', 'CHMP6', 'CHMP7', 'CHMP3', 'CHMP4C']
352	TF	TF:M09904_1	Factor: Elk-1; motif: RCCGGAAGTGN; match class: 1	0.0021355243512751	True	Factor: Elk-1; motif: RCCGGAAGTGN; match class: 1	2812	103	34	20011	0.3300970873786408	0.0120910384068278	query_1	['TF:M09904']	['ZNF460', 'KIF7', 'CSNK1G1', 'CHMP2A', 'MOCOS', 'TMEM199', 'MIB2', 'CHMP1A', 'STAM2', 'SPATA2', 'AIDA', 'VTA1', 'CCDC115', 'TMEM185A', 'VPS4B', 'TSG101', 'SMYD2', 'SH3BP1', 'CHMP4A', 'LEMD2', 'PDIA6', 'FLOT2', 'CHMP5', 'CD68', 'BTF3L4', 'CASP3', 'ATP6V0D1', 'CHMP3', 'LITAF', 'TMEM79', 'MPZL3', 'TP53', 'VMA21', 'ELOF1']
353	GO:BP	GO:0003072	renal control of peripheral vascular resistance involved in regulation of systemic arterial blood pressure	0.0021901640475521	True	"""The renal process that modulates the force with which blood travels through the circulatory system, by impeding blood flow through the peripheral vasculature."" [GOC:mtg_cardio]"	5	98	3	21110	0.0306122448979591	0.6	query_1	['GO:0003071']	['AGTR1', 'AGTR2', 'AGT']
354	GO:BP	GO:0002034	maintenance of blood vessel diameter homeostasis by renin-angiotensin	0.0021901640475521	True	"""The process in which the diameter of a blood vessel is changed due to activity of the renin-angiotensin system."" [GOC:dph, GOC:pr, GOC:tb]"	5	98	3	21110	0.0306122448979591	0.6	query_1	['GO:0003072', 'GO:0003081', 'GO:0097746']	['AGTR1', 'AGTR2', 'AGT']
355	GO:BP	GO:0071453	cellular response to oxygen levels	0.0022099248008794	True	"""Any process that results in a change in state or activity of a cell (in terms of movement, secretion, enzyme production, gene expression, etc.) as a result of a stimulus reflecting the presence, absence, or concentration of oxygen."" [GOC:mah]"	164	98	8	21110	0.0816326530612244	0.048780487804878	query_1	['GO:0070482', 'GO:0070887']	['ATP6V0A2', 'TMEM199', 'CCDC115', 'ATP6V0D1', 'ATP6V1A', 'ATP6AP1', 'TP53', 'CBL']
356	GO:BP	GO:0070071	proton-transporting two-sector ATPase complex assembly	0.0022550124528628	True	"""The aggregation, arrangement and bonding together of a proton-transporting two-sector ATPase complex, a large protein complex that catalyzes the synthesis or hydrolysis of ATP by a rotational mechanism, coupled to the transport of protons across a membrane."" [GOC:mah]"	17	98	4	21110	0.0408163265306122	0.2352941176470588	query_1	['GO:0065003']	['PIP4P1', 'TMEM199', 'CCDC115', 'VMA21']
357	GO:BP	GO:0001991	regulation of systemic arterial blood pressure by circulatory renin-angiotensin	0.0022550124528628	True	"""The process in which angiotensinogen metabolites in the bloodstream modulate the force with which blood passes through the circulatory system. The process begins when renin is released and cleaves angiotensinogen."" [ISBN:0721643949]"	17	98	4	21110	0.0408163265306122	0.2352941176470588	query_1	['GO:0003081']	['AGTR2', 'ATP6AP2', 'REN', 'ACE']
358	GO:CC	GO:0101003	ficolin-1-rich granule membrane	0.0022639866774665	True	"""The lipid bilayer surrounding a ficolin-1-rich granule."" [GOC:mec, PMID:23650620]"	60	100	5	22122	0.05	0.0833333333333333	query_1	['GO:0030667', 'GO:0070820', 'GO:0101002']	['ATP6V0A1', 'ARL8A', 'ATP6AP2', 'TCIRG1', 'ATP6V0C']
359	GO:BP	GO:0043462	regulation of ATP-dependent activity	0.0023776517986793	True	"""Any process that modulates the rate of an ATP-dependent activity."" [GOC:jl]"	72	98	6	21110	0.0612244897959183	0.0833333333333333	query_1	['GO:0065009']	['HSPA2', 'SLN', 'PLN', 'ATP2A1', 'TP53', 'VMA21']
360	GO:BP	GO:0071705	nitrogen compound transport	0.0024192736832256	True	"""The directed movement of nitrogen-containing compounds into, out of or within a cell, or between cells, by means of some agent such as a transporter or pore."" [GOC:mah]"	2290	98	28	21110	0.2857142857142857	0.0122270742358078	query_1	['GO:0006810']	['AP1G2', 'CHMP2A', 'CHMP2B', 'HGS', 'CHMP1A', 'VPS4A', 'CHMP1B', 'CHMP4B', 'STAM2', 'VTA1', 'VPS4B', 'FLOT1', 'TSG101', 'ARL8A', 'CHMP4A', 'CHMP6', 'CHMP7', 'IST1', 'AGT', 'STAM', 'CHMP5', 'TCIRG1', 'VPS37C', 'CHMP3', 'VPS28', 'CHMP4C', 'ATP6AP1', 'TP53']
361	REAC	REAC:R-HSA-68886	M Phase	0.0025125981609767	True	M Phase	408	78	13	10790	0.1666666666666666	0.0318627450980392	query_1	['REAC:R-HSA-69278']	['CHMP2A', 'CHMP2B', 'VPS4A', 'CHMP4B', 'CHMP4A', 'LEMD2', 'CHMP6', 'CHMP7', 'IST1', 'CHMP3', 'CHMP4C', 'CC2D1B', 'SPAST']
362	GO:BP	GO:0098771	inorganic ion homeostasis	0.0025229797964224	True	"""Any process involved in the maintenance of an internal steady state of inorganic ions within an organism or cell."" [GOC:dos]"	533	98	13	21110	0.1326530612244898	0.024390243902439	query_1	['GO:0048878']	['ATP6V0A2', 'AGTR1', 'TMEM199', 'CCDC115', 'DMPK', 'AGT', 'TCIRG1', 'ATP6V0D1', 'PLN', 'ATP6V1A', 'ATP6AP1', 'ATP2A1', 'ACE']
363	GO:BP	GO:0022607	cellular component assembly	0.0027324407890593	True	"""The aggregation, arrangement and bonding together of a cellular component."" [GOC:isa_complete]"	4661	98	43	21110	0.4387755102040816	0.0092254880926839	query_1	['GO:0016043', 'GO:0044085']	['CGNL1', 'PIP4P1', 'LRFN3', 'CHMP2A', 'CHMP2B', 'TMEM199', 'HGS', 'CHMP1A', 'VPS4A', 'CHMP1B', 'CHMP4B', 'STAM2', 'AIDA', 'VTA1', 'CCDC115', 'VPS4B', 'FLOT1', 'TSG101', 'HSPA2', 'SH3BP1', 'CHMP4A', 'CHMP6', 'CHMP7', 'IST1', 'AGT', 'TFG', 'STAM', 'CHMP5', 'TCIRG1', 'VPS37C', 'ATP6V0D1', 'CHMP3', 'VPS28', 'PLN', 'CHMP4C', 'ATL1', 'SORBS1', 'RTN3', 'ACE', 'TP53', 'CYLD', 'SPAST', 'VMA21']
364	GO:BP	GO:0098662	inorganic cation transmembrane transport	0.0028865019534408	True	"""A process in which an inorganic cation is transported from one side of a membrane to the other by means of some agent such as a transporter or pore."" [GOC:mah]"	828	98	16	21110	0.1632653061224489	0.0193236714975845	query_1	['GO:0098660']	['ATP6V0A2', 'TRPC4AP', 'ATP6V0A1', 'HSPA2', 'ATP6AP2', 'SLN', 'TCIRG1', 'ATP6V0A4', 'ATP6V0D1', 'ATP6V1E1', 'PLN', 'ATP6V1A', 'ATP6AP1', 'ATP2A1', 'ATP6V0C', 'ATP6V0D2']
365	HP	HP:0002009	Potter facies	0.0030279055534921	True	A facial appearance characteristic of a fetus or neonate due to oligohydramnios experienced in the womb, comprising ocular hypertelorism, low-set ears, receding chin, and flattening of the nose.	13	39	4	4851	0.1025641025641025	0.3076923076923077	query_1	['HP:0011334']	['AGTR1', 'AGT', 'REN', 'ACE']
366	GO:CC	GO:0070382	exocytic vesicle	0.0032148470824634	True	"""A transport vesicle that mediates transport from an intracellular compartment to the plasma membrane, and fuses with the plasma membrane to release various cargo molecules, such as proteins or hormones, by exocytosis."" [GOC:kad, GOC:mah]"	233	100	8	22122	0.08	0.0343347639484978	query_1	['GO:0030133', 'GO:0099503']	['ATP6V0A1', 'ATP6AP2', 'ATP6V0A4', 'ATP6V0D1', 'ATP6V1E1', 'ATP6V1A', 'ATP6AP1', 'ATP6V0C']
367	GO:BP	GO:0022402	cell cycle process	0.0032656498326038	True	"""The cellular process that ensures successive accurate and complete genome replication and chromosome segregation."" [GOC:isa_complete, GOC:mtg_cell_cycle]"	1281	98	20	21110	0.2040816326530612	0.0156128024980484	query_1	['GO:0007049', 'GO:0009987']	['CHMP2A', 'CHMP2B', 'CHMP1A', 'VPS4A', 'CHMP1B', 'CHMP4B', 'VPS4B', 'HSPA2', 'ARL8A', 'CHMP4A', 'CHMP6', 'CHMP7', 'IST1', 'CHMP5', 'CHMP3', 'CHMP4C', 'TP53', 'SPAST', 'MITD1', 'ZFYVE19']
368	HP	HP:0011037	Decreased urine output	0.0033235106991948	True	A decreased rate of urine production.	29	39	5	4851	0.1282051282051282	0.1724137931034483	query_1	['HP:0012590']	['C3', 'AGTR1', 'AGT', 'REN', 'ACE']
369	GO:CC	GO:0030141	secretory granule	0.0033336680642625	True	"""A small subcellular vesicle, surrounded by a membrane, that is formed from the Golgi apparatus and contains a highly concentrated protein destined for secretion. Secretory granules move towards the periphery of the cell and upon stimulation, their membranes fuse with the cell membrane, and their protein load is exteriorized. Processing of the contained protein may take place in secretory granules."" [GOC:mah, ISBN:0198506732]"	893	100	15	22122	0.15	0.0167973124300112	query_1	['GO:0012505', 'GO:0099503']	['C3', 'ANPEP', 'ATP6V0A2', 'PRG2', 'ATP6V0A1', 'FGL2', 'ARL8A', 'ATP6AP2', 'IST1', 'FLOT2', 'CD68', 'TCIRG1', 'TIMP3', 'ATP6V1A', 'ATP6V0C']
370	TF	TF:M11424	Factor: Erm; motif: NNSCGGAWGYN	0.0033379473548821	True	Factor: Erm; motif: NNSCGGAWGYN	8323	103	67	20011	0.6504854368932039	0.0080499819776522	query_1	['TF:M00000']	['AP1G2', 'PIP4P1', 'ZNF460', 'KIF7', 'CSNK1G1', 'PRG2', 'IFRD2', 'CHMP2A', 'PAPPA', 'TRPC4AP', 'TMEM199', 'HGS', 'MIB2', 'CHMP1A', 'VPS4A', 'CHMP4B', 'STAM2', 'SPATA2', 'AIDA', 'VTA1', 'CCDC115', 'TMEM185B', 'TMEM185A', 'VPS4B', 'FLOT1', 'TM9SF1', 'TSG101', 'SMYD2', 'ARL8A', 'SH3BP1', 'ATP6AP2', 'CHMP4A', 'LEMD2', 'CHMP6', 'CHMP7', 'IST1', 'AGT', 'TFG', 'REN', 'TBC1D24', 'PDIA6', 'FLOT2', 'ZNF282', 'CHMP5', 'CD68', 'VPS37C', 'PRPF38A', 'BTF3L4', 'ATP6V0A4', 'CASP3', 'ATP6V0D1', 'CHMP3', 'LITAF', 'TMEM79', 'MPZL3', 'LGALS1', 'ATP6V0C', 'ACE', 'VPS9D1', 'TP53', 'ATP6V0D2', 'VMA21', 'ELOF1', 'CBL', 'MITD1', 'ZFYVE19', 'SARAF']
371	GO:BP	GO:0007017	microtubule-based process	0.0033392184544057	True	"""Any cellular process that depends upon or alters the microtubule cytoskeleton, that part of the cytoskeleton comprising microtubules and their associated proteins."" [GOC:mah]"	943	98	17	21110	0.173469387755102	0.0180275715800636	query_1	['GO:0009987']	['KIF7', 'CHMP2A', 'CHMP2B', 'CHMP1A', 'CHMP1B', 'CHMP4B', 'VPS4B', 'ARL8A', 'CHMP4A', 'CHMP6', 'CHMP7', 'FLOT2', 'CHMP5', 'CHMP3', 'CHMP4C', 'CYLD', 'SPAST']
372	REAC	REAC:R-HSA-8876384	Listeria monocytogenes entry into host cells	0.0036078214474399	True	Listeria monocytogenes entry into host cells	19	78	4	10790	0.0512820512820512	0.2105263157894736	query_1	['REAC:R-HSA-5663205']	['HGS', 'STAM2', 'STAM', 'CBL']
373	TF	TF:M12603	Factor: ERM; motif: NNCACTTCCGGNN	0.0037497872053356	True	Factor: ERM; motif: NNCACTTCCGGNN	7222	103	61	20011	0.5922330097087378	0.0084464137358072	query_1	['TF:M00000']	['PIP4P1', 'ZNF460', 'KIF7', 'CSNK1G1', 'PRG2', 'IFRD2', 'CHMP2A', 'TRPC4AP', 'MOCOS', 'TMEM199', 'MIB2', 'CHMP1A', 'VPS4A', 'CHMP1B', 'CHMP4B', 'STAM2', 'SPATA2', 'AIDA', 'CCDC115', 'TMEM185B', 'TMEM185A', 'VPS4B', 'FLOT1', 'TSG101', 'SMYD2', 'ARL8A', 'SH3BP1', 'CHMP4A', 'LEMD2', 'CHMP6', 'IST1', 'TFG', 'REN', 'TBC1D24', 'PDIA6', 'FLOT2', 'ZNF282', 'CHMP5', 'CD68', 'VPS37C', 'ATP6V0A4', 'CASP3', 'ATP6V0D1', 'CHMP3', 'VPS28', 'LITAF', 'TMEM79', 'CC2D1B', 'MPZL3', 'ATP2A1', 'SORBS1', 'LGALS1', 'ATP6V0C', 'VPS9D1', 'TP53', 'SPAST', 'VMA21', 'ELOF1', 'MITD1', 'ZFYVE19', 'SARAF']
374	WP	WP:WP4917	Proximal tubule transport	0.0039596123230815	True	Proximal tubule transport	57	52	5	8133	0.0961538461538461	0.087719298245614	query_1	['WP:000000']	['ATP6V0A4', 'ATP6V1E1', 'ATP6V1A', 'ATP6V0C', 'ATP6V0D2']
375	GO:CC	GO:0000813	ESCRT I complex	0.00426162818438	True	"""An endosomal sorting complex required for transport. It consists of the class E vacuolar protein sorting (Vps) proteins and interacts with ubiquitinated cargoes."" [GOC:rb, PMID:12892785, PMID:12900393]"	11	100	3	22122	0.03	0.2727272727272727	query_1	['GO:0010008', 'GO:0036452', 'GO:0098796']	['TSG101', 'VPS37C', 'VPS28']
376	GO:BP	GO:0000226	microtubule cytoskeleton organization	0.0043167034381243	True	"""A process that is carried out at the cellular level which results in the assembly, arrangement of constituent parts, or disassembly of cytoskeletal structures comprising microtubules and their associated proteins."" [GOC:mah]"	653	98	14	21110	0.1428571428571428	0.0214395099540581	query_1	['GO:0007010', 'GO:0007017']	['CHMP2A', 'CHMP2B', 'CHMP1A', 'CHMP1B', 'CHMP4B', 'VPS4B', 'CHMP4A', 'CHMP6', 'CHMP7', 'CHMP5', 'CHMP3', 'CHMP4C', 'CYLD', 'SPAST']
377	GO:BP	GO:2000855	regulation of mineralocorticoid secretion	0.0043655471694983	True	"""Any process that modulates the frequency, rate or extent of mineralocorticoid secretion."" [GOC:sl]"	6	98	3	21110	0.0306122448979591	0.5	query_1	['GO:0035931', 'GO:2000846']	['AGTR1', 'AGT', 'REN']
378	GO:BP	GO:2000858	regulation of aldosterone secretion	0.0043655471694983	True	"""Any process that modulates the frequency, rate or extent of aldosterone secretion."" [GOC:sl]"	6	98	3	21110	0.0306122448979591	0.5	query_1	['GO:0035932', 'GO:2000855']	['AGTR1', 'AGT', 'REN']
379	GO:BP	GO:0023051	regulation of signaling	0.0044056415649169	True	"""Any process that modulates the frequency, rate or extent of a signaling process."" [GOC:mtg_signal]"	3413	98	35	21110	0.3571428571428571	0.0102549077058306	query_1	['GO:0023052', 'GO:0050789']	['CGNL1', 'PIP4P1', 'C3', 'KIF7', 'CSNK1G1', 'AGTR1', 'HGS', 'MIB2', 'AGTR2', 'SPATA2', 'AIDA', 'FLOT1', 'TSG101', 'SMYD2', 'SH3BP1', 'ATP6AP2', 'LEMD2', 'DMPK', 'CHMP6', 'AGT', 'TFG', 'REN', 'TBC1D24', 'CHMP5', 'TCIRG1', 'TIMP3', 'LITAF', 'SORBS1', 'LGALS1', 'ATP6V0C', 'ACE', 'GCNT2', 'TP53', 'CYLD', 'CBL']
380	REAC	REAC:R-HSA-6807004	Negative regulation of MET activity	0.0044850821107401	True	Negative regulation of MET activity	20	78	4	10790	0.0512820512820512	0.2	query_1	['REAC:R-HSA-6806834']	['HGS', 'STAM2', 'STAM', 'CBL']
381	GO:CC	GO:0099513	polymeric cytoskeletal fiber	0.0046457304281173	True	"""A component of the cytoskeleton consisting of a homo or heteropolymeric fiber constructed from an indeterminate number of protein subunits."" [GOC:dos]"	806	100	14	22122	0.14	0.0173697270471464	query_1	['GO:0005856', 'GO:0099512']	['KIF7', 'CHMP2A', 'CHMP2B', 'CHMP1A', 'CHMP1B', 'CHMP4B', 'CHMP4A', 'CHMP6', 'CHMP7', 'CHMP5', 'CHMP3', 'CHMP4C', 'CYLD', 'SPAST']
382	GO:BP	GO:0098655	monoatomic cation transmembrane transport	0.0046506251363783	True	"""The process in which a monoatomic cation is transported across a membrane. Monatomic cations (also called simple cations) are positively charged ions consisting of exactly one atom."" [GOC:dos, GOC:vw]"	859	98	16	21110	0.1632653061224489	0.0186263096623981	query_1	['GO:0006812', 'GO:0034220']	['ATP6V0A2', 'TRPC4AP', 'ATP6V0A1', 'HSPA2', 'ATP6AP2', 'SLN', 'TCIRG1', 'ATP6V0A4', 'ATP6V0D1', 'ATP6V1E1', 'PLN', 'ATP6V1A', 'ATP6AP1', 'ATP2A1', 'ATP6V0C', 'ATP6V0D2']
383	GO:BP	GO:0033043	regulation of organelle organization	0.0046841689340071	True	"""Any process that modulates the frequency, rate or extent of a process involved in the formation, arrangement of constituent parts, or disassembly of an organelle."" [GOC:mah]"	1193	98	19	21110	0.1938775510204081	0.0159262363788767	query_1	['GO:0006996', 'GO:0051128']	['CGNL1', 'CHMP2A', 'CHMP2B', 'CHMP1A', 'CHMP1B', 'CHMP4B', 'VPS4B', 'TSG101', 'SH3BP1', 'CHMP4A', 'CHMP6', 'CHMP7', 'STAM', 'CHMP5', 'CHMP3', 'CHMP4C', 'TP53', 'CYLD', 'SPAST']
384	REAC	REAC:R-HSA-9006934	Signaling by Receptor Tyrosine Kinases	0.004884782850273	True	Signaling by Receptor Tyrosine Kinases	502	78	14	10790	0.1794871794871795	0.0278884462151394	query_1	['REAC:R-HSA-162582']	['ATP6V0A2', 'HGS', 'ATP6V0A1', 'STAM2', 'STAM', 'TCIRG1', 'ATP6V0A4', 'ATP6V0D1', 'ATP6V1E1', 'ATP6V1A', 'ATP6AP1', 'ATP6V0C', 'ATP6V0D2', 'CBL']
385	TF	TF:M02062	Factor: Erg; motif: ACCGGAAGTN	0.0050042961510593	True	Factor: Erg; motif: ACCGGAAGTN	8211	103	66	20011	0.6407766990291263	0.0080379978078187	query_1	['TF:M00000']	['PIP4P1', 'ZNF460', 'ATP6V0A2', 'KIF7', 'CSNK1G1', 'PRG2', 'IFRD2', 'CHMP2A', 'TRPC4AP', 'MOCOS', 'TMEM199', 'HGS', 'MIB2', 'CHMP1A', 'VPS4A', 'ATP6V0A1', 'CHMP4B', 'STAM2', 'SPATA2', 'AIDA', 'VTA1', 'CCDC115', 'TMEM185B', 'TMEM185A', 'VPS4B', 'FLOT1', 'TSG101', 'SMYD2', 'ARL8A', 'SH3BP1', 'ATP6AP2', 'CHMP4A', 'LEMD2', 'CHMP6', 'CHMP7', 'IST1', 'AGT', 'TFG', 'REN', 'TBC1D24', 'PDIA6', 'FLOT2', 'ZNF282', 'CHMP5', 'VPS37C', 'PRPF38A', 'BTF3L4', 'ATP6V0A4', 'CASP3', 'ATP6V0D1', 'CHMP3', 'ATP6V1E1', 'LITAF', 'TMEM79', 'CHMP4C', 'CC2D1B', 'MPZL3', 'LGALS1', 'ATP6V0C', 'VPS9D1', 'TP53', 'VMA21', 'ELOF1', 'MITD1', 'ZFYVE19', 'SARAF']
386	TF	TF:M03975_1	Factor: ERG; motif: ACCGGAARTN; match class: 1	0.0050640110298415	True	Factor: ERG; motif: ACCGGAARTN; match class: 1	4089	103	42	20011	0.4077669902912621	0.0102714600146735	query_1	['TF:M03975']	['ZNF460', 'KIF7', 'CSNK1G1', 'CHMP2A', 'TMEM199', 'MIB2', 'CHMP1A', 'VPS4A', 'ATP6V0A1', 'STAM2', 'SPATA2', 'AIDA', 'VTA1', 'CCDC115', 'TMEM185A', 'VPS4B', 'FLOT1', 'TSG101', 'SMYD2', 'ARL8A', 'SH3BP1', 'ATP6AP2', 'LEMD2', 'IST1', 'TFG', 'REN', 'PDIA6', 'FLOT2', 'CHMP5', 'VPS37C', 'PRPF38A', 'BTF3L4', 'CASP3', 'ATP6V0D1', 'CHMP3', 'TMEM79', 'MPZL3', 'ATP6V0C', 'TP53', 'VMA21', 'ELOF1', 'SARAF']
387	REAC	REAC:R-HSA-5663205	Infectious disease	0.0051647767989017	True	Infectious disease	1059	78	21	10790	0.2692307692307692	0.0198300283286118	query_1	['REAC:R-HSA-1643685']	['C3', 'CHMP2A', 'CHMP2B', 'HGS', 'CHMP1A', 'VPS4A', 'CHMP4B', 'STAM2', 'VTA1', 'VPS4B', 'TSG101', 'CHMP4A', 'CHMP6', 'CHMP7', 'STAM', 'CHMP5', 'VPS37C', 'CHMP3', 'VPS28', 'CHMP4C', 'CBL']
388	TF	TF:M03966	Factor: ELF1; motif: AACCCGGAAGTR	0.0052343278642039	True	Factor: ELF1; motif: AACCCGGAAGTR	6744	103	58	20011	0.5631067961165048	0.008600237247924	query_1	['TF:M00000']	['PIP4P1', 'ZNF460', 'ATP6V0A2', 'KIF7', 'CSNK1G1', 'PRG2', 'CHMP2A', 'TRPC4AP', 'TMEM199', 'HGS', 'MIB2', 'CHMP1A', 'VPS4A', 'CHMP1B', 'CHMP4B', 'STAM2', 'SPATA2', 'AIDA', 'VTA1', 'CCDC115', 'FGL2', 'TMEM185A', 'VPS4B', 'TM9SF1', 'TSG101', 'SMYD2', 'SH3BP1', 'CHMP4A', 'LEMD2', 'IST1', 'TFG', 'REN', 'SLN', 'TBC1D24', 'PDIA6', 'FLOT2', 'CHMP5', 'TCIRG1', 'VPS37C', 'PRPF38A', 'BTF3L4', 'ATP6V0A4', 'ATP6V0D1', 'CHMP3', 'ATP6V1E1', 'VPS28', 'LITAF', 'TMEM79', 'MPZL3', 'ATP6V0C', 'ACE', 'VPS9D1', 'TP53', 'ATP6V0D2', 'VMA21', 'ELOF1', 'CBL', 'MITD1']
389	REAC	REAC:R-HSA-8849932	Synaptic adhesion-like molecules	0.00551006218116	True	Synaptic adhesion-like molecules	21	78	4	10790	0.0512820512820512	0.1904761904761904	query_1	['REAC:R-HSA-6794362']	['LRFN3', 'FLOT1', 'FLOT2', 'RTN3']
390	TF	TF:M11396_1	Factor: Erg; motif: NACCGGAARTN; match class: 1	0.0055541495174655	True	Factor: Erg; motif: NACCGGAARTN; match class: 1	5051	103	48	20011	0.4660194174757281	0.0095030686992674	query_1	['TF:M11396']	['ZNF460', 'KIF7', 'CSNK1G1', 'CHMP2A', 'TMEM199', 'MIB2', 'CHMP1A', 'VPS4A', 'ATP6V0A1', 'STAM2', 'SPATA2', 'CCDC115', 'TMEM185A', 'VPS4B', 'FLOT1', 'TM9SF1', 'TSG101', 'SMYD2', 'ARL8A', 'SH3BP1', 'ATP6AP2', 'CHMP4A', 'LEMD2', 'IST1', 'AGT', 'TFG', 'REN', 'TBC1D24', 'PDIA6', 'FLOT2', 'ZNF282', 'CHMP5', 'VPS37C', 'PRPF38A', 'BTF3L4', 'CASP3', 'ATP6V0D1', 'CHMP3', 'ATP6V1E1', 'TMEM79', 'MPZL3', 'ATP6V0C', 'TP53', 'VMA21', 'ELOF1', 'CBL', 'ZFYVE19', 'SARAF']
391	HP	HP:0011334	Facial shape deformation	0.0057139997254954	True	Facial shape deformation	15	39	4	4851	0.1025641025641025	0.2666666666666666	query_1	['HP:0001999']	['AGTR1', 'AGT', 'REN', 'ACE']
392	TF	TF:M01752	Factor: ERG; motif: ACCGGAART	0.0059043230985638	True	Factor: ERG; motif: ACCGGAART	9627	103	73	20011	0.7087378640776699	0.0075828399293653	query_1	['TF:M00000']	['PIP4P1', 'ZNF460', 'C3', 'ATP6V0A2', 'KIF7', 'CSNK1G1', 'PRG2', 'IFRD2', 'CHMP2A', 'TRPC4AP', 'MOCOS', 'TMEM199', 'HGS', 'MIB2', 'CHMP1A', 'VPS4A', 'ATP6V0A1', 'CHMP1B', 'CHMP4B', 'STAM2', 'SPATA2', 'AIDA', 'VTA1', 'CCDC115', 'TMEM185B', 'TMEM185A', 'VPS4B', 'FLOT1', 'TM9SF1', 'TSG101', 'SMYD2', 'ARL8A', 'SH3BP1', 'ATP6AP2', 'CHMP4A', 'LEMD2', 'CHMP6', 'CHMP7', 'IST1', 'AGT', 'TFG', 'REN', 'TBC1D24', 'PDIA6', 'FLOT2', 'ZNF282', 'CHMP5', 'CD68', 'VPS37C', 'PRPF38A', 'BTF3L4', 'ATP6V0A4', 'CASP3', 'ATP6V0D1', 'CHMP3', 'ATP6V1E1', 'LITAF', 'TMEM79', 'CHMP4C', 'CC2D1B', 'MPZL3', 'LGALS1', 'ATP6V0C', 'VPS9D1', 'TP53', 'SPAST', 'ATP6V0D2', 'VMA21', 'ELOF1', 'CBL', 'MITD1', 'ZFYVE19', 'SARAF']
393	GO:BP	GO:0045921	positive regulation of exocytosis	0.0059148636669313	True	"""Any process that activates or increases the frequency, rate or extent of exocytosis."" [GOC:go_curators]"	84	98	6	21110	0.0612244897959183	0.0714285714285714	query_1	['GO:0006887', 'GO:0017157', 'GO:1903532']	['CHMP2A', 'HGS', 'VPS4A', 'VPS4B', 'TSG101', 'STAM']
394	HP	HP:0007457	Prominent veins on trunk	0.005941338431742	True	Prominent thoracic and abdominal veins.	5	39	3	4851	0.0769230769230769	0.6	query_1	['HP:0001015']	['ATP6V0A2', 'ATP6V1E1', 'ATP6V1A']
395	GO:CC	GO:0033181	plasma membrane proton-transporting V-type ATPase complex	0.0059853472331323	True	"""A proton-transporting two-sector ATPase complex found in the plasma membrane."" [GOC:mah]"	2	100	2	22122	0.02	1.0	query_1	['GO:0033176', 'GO:0098797']	['ATP6V0D1', 'ATP6V0D2']
396	GO:BP	GO:0050896	response to stimulus	0.0060214126432838	True	"""Any process that results in a change in state or activity of a cell or an organism (in terms of movement, secretion, enzyme production, gene expression, etc.) as a result of a stimulus. The process begins with detection of the stimulus and ends with a change in state or activity or the cell or organism."" [GOC:ai, GOC:bf]"	9081	98	65	21110	0.6632653061224489	0.0071578020041845	query_1	['GO:0008150']	['CGNL1', 'PIP4P1', 'C3', 'ANPEP', 'ATP6V0A2', 'KIF7', 'CSNK1G1', 'PRG2', 'AGTR1', 'CHMP2A', 'PAPPA', 'CHMP2B', 'TMEM199', 'HGS', 'MIB2', 'AGTR2', 'CHMP1A', 'VPS4A', 'CHMP1B', 'CHMP4B', 'STAM2', 'SPATA2', 'AIDA', 'CCDC115', 'FGL2', 'VPS4B', 'FLOT1', 'TSG101', 'HSPA2', 'SMYD2', 'SH3BP1', 'ATP6AP2', 'CHMP4A', 'LEMD2', 'DMPK', 'CHMP6', 'CHMP7', 'AGT', 'TFG', 'STAM', 'REN', 'TBC1D24', 'PDIA6', 'CHMP5', 'CD68', 'TCIRG1', 'TIMP3', 'CASP3', 'ATP6V0D1', 'CHMP3', 'PLN', 'ATP6V1A', 'LITAF', 'CHMP4C', 'ATP6AP1', 'ATP2A1', 'SORBS1', 'LGALS1', 'ATP6V0C', 'ACE', 'GCNT2', 'TP53', 'CYLD', 'CBL', 'ZFYVE19']
397	GO:CC	GO:0101002	ficolin-1-rich granule	0.00606416088771	True	"""Highly exocytosable gelatinase-poor granules found in neutrophils and rich in ficolin-1. Ficolin-1 is released from neutrophil granules by stimulation with fMLP or PMA, and the majority becomes associated with the surface membrane of the cells and can be detected by flow cytometry."" [GOC:mec, PMID:19741154]"	184	100	7	22122	0.07	0.0380434782608695	query_1	['GO:0030141']	['PRG2', 'ATP6V0A1', 'FGL2', 'ARL8A', 'ATP6AP2', 'TCIRG1', 'ATP6V0C']
398	GO:BP	GO:0070482	response to oxygen levels	0.0066110769698444	True	"""Any process that results in a change in state or activity of a cell or an organism (in terms of movement, secretion, enzyme production, gene expression, etc.) as a result of a stimulus reflecting the presence, absence, or concentration of oxygen."" [GOC:BHF, GOC:mah]"	327	98	10	21110	0.1020408163265306	0.0305810397553516	query_1	['GO:0009628']	['ATP6V0A2', 'TMEM199', 'CCDC115', 'CASP3', 'ATP6V0D1', 'ATP6V1A', 'ATP6AP1', 'ACE', 'TP53', 'CBL']
399	WP	WP:WP5038	Mitochondrial immune response to SARS-CoV-2	0.0073434802093258	True	Mitochondrial immune response to SARS-CoV-2	33	52	4	8133	0.0769230769230769	0.1212121212121212	query_1	['WP:000000']	['AGTR1', 'AGTR2', 'REN', 'ACE']
400	WP	WP:WP4950	16p11.2 distal deletion syndrome	0.0073434802093258	True	16p11.2 distal deletion syndrome	33	52	4	8133	0.0769230769230769	0.1212121212121212	query_1	['WP:000000']	['C3', 'SLN', 'PLN', 'ATP2A1']
401	GO:BP	GO:0032466	negative regulation of cytokinesis	0.0076139330685436	True	"""Any process that stops, prevents, or reduces the frequency, rate or extent of the division of the cytoplasm of a cell, and its separation into two daughter cells."" [GOC:mah]"	7	98	3	21110	0.0306122448979591	0.4285714285714285	query_1	['GO:0000910', 'GO:0010948', 'GO:0032465', 'GO:0051782']	['VPS4A', 'CHMP4C', 'ZFYVE19']
402	GO:BP	GO:0035931	mineralocorticoid secretion	0.0076139330685436	True	"""The regulated release of any mineralocorticoid into the circulatory system. Mineralocorticoids are a class of steroid hormones that regulate water and electrolyte metabolism."" [GOC:sl]"	7	98	3	21110	0.0306122448979591	0.4285714285714285	query_1	['GO:0035930']	['AGTR1', 'AGT', 'REN']
403	GO:BP	GO:0070072	vacuolar proton-transporting V-type ATPase complex assembly	0.0076139330685436	True	"""The aggregation, arrangement and bonding together of a vacuolar proton-transporting V-type ATPase complex, proton-transporting two-sector ATPase complex that couples ATP hydrolysis to the transport of protons across the vacuolar membrane."" [GOC:BHF, GOC:mah]"	7	98	3	21110	0.0306122448979591	0.4285714285714285	query_1	['GO:0070070']	['TMEM199', 'CCDC115', 'VMA21']
