89	GO:CC	GO:0098796	membrane protein complex	1.776693334006349e-15	True	"""Any protein complex that is part of a membrane."" [GOC:dos]"	1361	100	35	22122	0.35	0.0257163850110213	query_1	['GO:0016020', 'GO:0032991']	['AP1G2', 'ATP6V0A2', 'CHMP2A', 'CHMP2B', 'TMEM199', 'CHMP1A', 'ATP6V0A1', 'CHMP1B', 'CHMP4B', 'CCDC115', 'FLOT1', 'TSG101', 'HSPA2', 'ATP6AP2', 'CHMP4A', 'CHMP6', 'CHMP7', 'FLOT2', 'TCIRG1', 'VPS37C', 'ATP6V0A4', 'CASP3', 'ATP6V0D1', 'CHMP3', 'ATP6V1E1', 'VPS28', 'PLN', 'ATP6V1A', 'CHMP4C', 'ATP6AP1', 'ATP2A1', 'SORBS1', 'ATP6V0C', 'ATP6V0D2', 'CBL']
90	GO:BP	GO:0019058	viral life cycle	2.507730706030138e-15	True	"""A set of processes which all viruses follow to ensure survival; includes attachment and entry of the virus particle, decoding of genome information, translation of viral mRNA by host ribosomes, genome replication, and assembly and release of viral particles containing the genome."" [ISBN:1555811272]"	316	98	21	21110	0.2142857142857142	0.0664556962025316	query_1	['GO:0016032']	['ANPEP', 'AGTR1', 'CHMP2A', 'CHMP2B', 'CHMP1A', 'VPS4A', 'CHMP1B', 'CHMP4B', 'VTA1', 'VPS4B', 'TSG101', 'CHMP4A', 'CHMP6', 'CHMP7', 'IST1', 'CHMP5', 'VPS37C', 'CHMP3', 'VPS28', 'CHMP4C', 'LGALS1']
91	GO:BP	GO:0060236	regulation of mitotic spindle organization	2.8764529706838027e-15	True	"""Any process that modulates the rate, frequency or extent of the assembly, arrangement of constituent parts, or disassembly of the microtubule spindle during a mitotic cell cycle."" [GOC:ascb_2009, GOC:dph, GOC:tb]"	45	98	12	21110	0.1224489795918367	0.2666666666666666	query_1	['GO:0007052', 'GO:0090224']	['CHMP2A', 'CHMP2B', 'CHMP1A', 'CHMP1B', 'CHMP4B', 'VPS4B', 'CHMP4A', 'CHMP6', 'CHMP7', 'CHMP5', 'CHMP3', 'CHMP4C']
92	GO:BP	GO:0090224	regulation of spindle organization	9.089615961184166e-15	True	"""Any process that modulates the rate, frequency or extent of the assembly, arrangement of constituent parts, or disassembly of the microtubule spindle."" [GOC:ascb_2009, GOC:dph, GOC:tb]"	49	98	12	21110	0.1224489795918367	0.2448979591836734	query_1	['GO:0007051', 'GO:0010564', 'GO:0070507']	['CHMP2A', 'CHMP2B', 'CHMP1A', 'CHMP1B', 'CHMP4B', 'VPS4B', 'CHMP4A', 'CHMP6', 'CHMP7', 'CHMP5', 'CHMP3', 'CHMP4C']
93	GO:BP	GO:0032984	protein-containing complex disassembly	1.0703070351806112e-14	True	"""The disaggregation of a protein-containing macromolecular complex into its constituent components."" [GOC:mah]"	250	98	19	21110	0.1938775510204081	0.076	query_1	['GO:0022411', 'GO:0043933']	['CHMP2A', 'CHMP2B', 'CHMP1A', 'VPS4A', 'CHMP1B', 'CHMP4B', 'VTA1', 'VPS4B', 'TSG101', 'SH3BP1', 'CHMP4A', 'CHMP6', 'CHMP7', 'IST1', 'SLN', 'CHMP5', 'CHMP3', 'CHMP4C', 'SPAST']
94	GO:CC	GO:0033179	proton-transporting V-type ATPase, V0 domain	1.889930526412481e-14	True	"""A protein complex that forms part of a proton-transporting V-type ATPase and mediates proton transport across a membrane. The V0 complex consists of at least four different subunits (a,c,d and e); six or more c subunits form a proton-binding rotor ring."" [GOC:mah, ISBN:0716743663, PMID:16449553]"	12	100	8	22122	0.08	0.6666666666666666	query_1	['GO:0033176', 'GO:0033177']	['ATP6V0A2', 'ATP6V0A1', 'ATP6AP2', 'TCIRG1', 'ATP6V0A4', 'ATP6V0D1', 'ATP6V0C', 'ATP6V0D2']
95	GO:BP	GO:0006997	nucleus organization	1.960828569556509e-14	True	"""A process that is carried out at the cellular level which results in the assembly, arrangement of constituent parts, or disassembly of the nucleus."" [GOC:dph, GOC:ems, GOC:jl, GOC:mah]"	148	98	16	21110	0.1632653061224489	0.1081081081081081	query_1	['GO:0006996']	['CHMP2A', 'CHMP2B', 'CHMP1A', 'VPS4A', 'CHMP1B', 'CHMP4B', 'VPS4B', 'CHMP4A', 'LEMD2', 'DMPK', 'CHMP6', 'CHMP7', 'CHMP5', 'CHMP3', 'CHMP4C', 'SPAST']
96	GO:BP	GO:0051310	metaphase plate congression	3.1804788687052155e-14	True	"""The alignment of chromosomes at the metaphase plate (spindle equator), a plane halfway between the poles of the spindle."" [GOC:ai]"	73	98	13	21110	0.1326530612244898	0.1780821917808219	query_1	['GO:0051303', 'GO:0098813']	['CHMP2A', 'CHMP2B', 'CHMP1A', 'VPS4A', 'CHMP1B', 'CHMP4B', 'VPS4B', 'CHMP4A', 'CHMP6', 'CHMP7', 'CHMP5', 'CHMP3', 'CHMP4C']
97	GO:BP	GO:0051452	intracellular pH reduction	3.3160770511859954e-14	True	"""Any process that reduces the internal pH of a cell, measured by the concentration of the hydrogen ion."" [GOC:ai]"	54	98	12	21110	0.1224489795918367	0.2222222222222222	query_1	['GO:0051453']	['ATP6V0A2', 'TMEM199', 'ATP6V0A1', 'CCDC115', 'ATP6AP2', 'TCIRG1', 'ATP6V0A4', 'ATP6V0D1', 'ATP6V1A', 'ATP6AP1', 'ATP6V0C', 'ATP6V0D2']
98	GO:BP	GO:0000910	cytokinesis	5.314580631736881e-14	True	"""The division of the cytoplasm and the plasma membrane of a cell and its partitioning into two daughter cells."" [GOC:mtg_cell_cycle]"	192	98	17	21110	0.173469387755102	0.0885416666666666	query_1	['GO:0022402', 'GO:0051301']	['CHMP2A', 'CHMP2B', 'CHMP1A', 'VPS4A', 'CHMP1B', 'CHMP4B', 'VPS4B', 'CHMP4A', 'CHMP6', 'CHMP7', 'IST1', 'CHMP5', 'CHMP3', 'CHMP4C', 'SPAST', 'MITD1', 'ZFYVE19']
99	GO:BP	GO:0016032	viral process	6.351202189057888e-14	True	"""A multi-organism process in which a virus is a participant. The other participant is the host. Includes infection of a host cell, replication of the viral genome, and assembly of progeny virus particles. In some cases the viral genetic material may integrate into the host genome and only subsequently, under particular circumstances, 'complete' its life cycle."" [GOC:bf, GOC:jl, GOC:mah]"	423	98	22	21110	0.2244897959183673	0.0520094562647754	query_1	['GO:0008150']	['ANPEP', 'AGTR1', 'CHMP2A', 'CHMP2B', 'CHMP1A', 'VPS4A', 'CHMP1B', 'CHMP4B', 'VTA1', 'VPS4B', 'TSG101', 'CHMP4A', 'CHMP6', 'CHMP7', 'IST1', 'CHMP5', 'VPS37C', 'CHMP3', 'VPS28', 'CHMP4C', 'LGALS1', 'TP53']
100	GO:BP	GO:0007041	lysosomal transport	7.264150844798652e-14	True	"""The directed movement of substances into, out of or within a lysosome."" [GOC:ai]"	129	98	15	21110	0.1530612244897959	0.1162790697674418	query_1	['GO:0007034']	['CHMP2A', 'CHMP2B', 'HGS', 'CHMP1A', 'VPS4A', 'CHMP1B', 'CHMP4B', 'VPS4B', 'TSG101', 'CHMP4A', 'CHMP6', 'CHMP7', 'CHMP5', 'CHMP3', 'CHMP4C']
101	GO:BP	GO:0061024	membrane organization	9.217052193775205e-14	True	"""A process which results in the assembly, arrangement of constituent parts, or disassembly of a membrane. A membrane is a double layer of lipid molecules that encloses all cells, and, in eukaryotes, many organelles; may be a single or double lipid bilayer; also includes associated proteins."" [GOC:dph, GOC:tb]"	897	98	29	21110	0.2959183673469387	0.0323299888517279	query_1	['GO:0016043']	['C3', 'CHMP2A', 'CHMP2B', 'HGS', 'CHMP1A', 'VPS4A', 'CHMP1B', 'CHMP4B', 'STAM2', 'VPS4B', 'FLOT1', 'TSG101', 'SH3BP1', 'CHMP4A', 'LEMD2', 'DMPK', 'CHMP6', 'CHMP7', 'TFG', 'STAM', 'CHMP5', 'VPS37C', 'CHMP3', 'VPS28', 'CHMP4C', 'ATL1', 'TP53', 'SPAST', 'MITD1']
102	REAC	REAC:R-HSA-9615710	Late endosomal microautophagy	1.3567795272841434e-13	True	Late endosomal microautophagy	34	78	11	10790	0.141025641025641	0.3235294117647059	query_1	['REAC:R-HSA-9612973']	['CHMP2A', 'CHMP2B', 'CHMP4B', 'TSG101', 'CHMP4A', 'CHMP6', 'CHMP7', 'VPS37C', 'CHMP3', 'VPS28', 'CHMP4C']
103	GO:CC	GO:0070062	extracellular exosome	1.3702048640835457e-13	True	"""A vesicle that is released into the extracellular region by fusion of the limiting endosomal membrane of a multivesicular body with the plasma membrane. Extracellular exosomes, also simply called exosomes, have a diameter of about 40-100 nm."" [GOC:BHF, GOC:mah, GOC:vesicles, PMID:15908444, PMID:17641064, PMID:19442504, PMID:19498381, PMID:22418571, PMID:24009894]"	2109	100	40	22122	0.4	0.0189663347558084	query_1	['GO:0005615', 'GO:1903561']	['C3', 'ANPEP', 'PRG2', 'CHMP2A', 'CHMP2B', 'HGS', 'CHMP1A', 'VPS4A', 'ATP6V0A1', 'CHMP1B', 'CHMP4B', 'VTA1', 'FGL2', 'VPS4B', 'FLOT1', 'TSG101', 'HSPA2', 'ARL8A', 'ATP6AP2', 'CHMP6', 'IST1', 'AGT', 'CAPN7', 'PDIA6', 'FLOT2', 'CHMP5', 'VPS37C', 'ATP6V0A4', 'ATP6V0D1', 'CHMP3', 'ATP6V1E1', 'VPS28', 'ATP6V1A', 'ATP6AP1', 'LGALS1', 'ATP6V0C', 'ACE', 'SPAST', 'ATP6V0D2', 'MITD1']
104	GO:CC	GO:1904949	ATPase complex	1.451278398752995e-13	True	"""A protein complex which is capable of ATPase activity."" [GO_REF:0000088, GOC:bhm, GOC:TermGenie, PMID:9606181]"	158	100	15	22122	0.15	0.0949367088607595	query_1	['GO:1902494']	['ATP6V0A2', 'TMEM199', 'VPS4A', 'ATP6V0A1', 'CCDC115', 'VPS4B', 'ATP6AP2', 'TCIRG1', 'ATP6V0A4', 'ATP6V0D1', 'ATP6V1E1', 'ATP6V1A', 'ATP6AP1', 'ATP6V0C', 'ATP6V0D2']
105	GO:BP	GO:0022411	cellular component disassembly	1.4690769348443972e-13	True	"""A cellular process that results in the breakdown of a cellular component."" [GOC:isa_complete]"	498	98	23	21110	0.2346938775510204	0.0461847389558232	query_1	['GO:0016043']	['C3', 'CHMP2A', 'CHMP2B', 'CHMP1A', 'VPS4A', 'CHMP1B', 'CHMP4B', 'VTA1', 'VPS4B', 'FLOT1', 'TSG101', 'HSPA2', 'SH3BP1', 'CHMP4A', 'CHMP6', 'CHMP7', 'IST1', 'SLN', 'CHMP5', 'CHMP3', 'CHMP4C', 'TP53', 'SPAST']
106	GO:CC	GO:0005643	nuclear pore	1.9527413166567605e-13	True	"""A protein complex providing a discrete opening in the nuclear envelope of a eukaryotic cell, where the inner and outer nuclear membranes are joined."" [ISBN:0198547684]"	99	100	13	22122	0.13	0.1313131313131313	query_1	['GO:0005635', 'GO:0140513']	['CHMP2A', 'CHMP2B', 'CHMP1A', 'VPS4A', 'CHMP1B', 'CHMP4B', 'VPS4B', 'CHMP4A', 'CHMP6', 'CHMP7', 'CHMP5', 'CHMP3', 'CHMP4C']
107	GO:CC	GO:1903561	extracellular vesicle	2.01768407528974e-13	True	"""Any vesicle that is part of the extracellular region."" [GO_REF:0000064, GOC:pm, GOC:TermGenie, PMID:24769233]"	2133	100	40	22122	0.4	0.0187529301453352	query_1	['GO:0031982', 'GO:0065010']	['C3', 'ANPEP', 'PRG2', 'CHMP2A', 'CHMP2B', 'HGS', 'CHMP1A', 'VPS4A', 'ATP6V0A1', 'CHMP1B', 'CHMP4B', 'VTA1', 'FGL2', 'VPS4B', 'FLOT1', 'TSG101', 'HSPA2', 'ARL8A', 'ATP6AP2', 'CHMP6', 'IST1', 'AGT', 'CAPN7', 'PDIA6', 'FLOT2', 'CHMP5', 'VPS37C', 'ATP6V0A4', 'ATP6V0D1', 'CHMP3', 'ATP6V1E1', 'VPS28', 'ATP6V1A', 'ATP6AP1', 'LGALS1', 'ATP6V0C', 'ACE', 'SPAST', 'ATP6V0D2', 'MITD1']
108	GO:CC	GO:0043230	extracellular organelle	2.050247494984113e-13	True	"""Organized structure of distinctive morphology and function, occurring outside the cell. Includes, for example, extracellular membrane vesicles (EMVs) and the cellulosomes of anaerobic bacteria and fungi."" [GOC:jl, PMID:9914479]"	2134	100	40	22122	0.4	0.0187441424554826	query_1	['GO:0005576', 'GO:0043226']	['C3', 'ANPEP', 'PRG2', 'CHMP2A', 'CHMP2B', 'HGS', 'CHMP1A', 'VPS4A', 'ATP6V0A1', 'CHMP1B', 'CHMP4B', 'VTA1', 'FGL2', 'VPS4B', 'FLOT1', 'TSG101', 'HSPA2', 'ARL8A', 'ATP6AP2', 'CHMP6', 'IST1', 'AGT', 'CAPN7', 'PDIA6', 'FLOT2', 'CHMP5', 'VPS37C', 'ATP6V0A4', 'ATP6V0D1', 'CHMP3', 'ATP6V1E1', 'VPS28', 'ATP6V1A', 'ATP6AP1', 'LGALS1', 'ATP6V0C', 'ACE', 'SPAST', 'ATP6V0D2', 'MITD1']
109	GO:CC	GO:0065010	extracellular membrane-bounded organelle	2.050247494984113e-13	True	"""Organized structure of distinctive morphology and function, bounded by a lipid bilayer membrane and occurring outside the cell."" [GOC:isa_complete]"	2134	100	40	22122	0.4	0.0187441424554826	query_1	['GO:0043227', 'GO:0043230']	['C3', 'ANPEP', 'PRG2', 'CHMP2A', 'CHMP2B', 'HGS', 'CHMP1A', 'VPS4A', 'ATP6V0A1', 'CHMP1B', 'CHMP4B', 'VTA1', 'FGL2', 'VPS4B', 'FLOT1', 'TSG101', 'HSPA2', 'ARL8A', 'ATP6AP2', 'CHMP6', 'IST1', 'AGT', 'CAPN7', 'PDIA6', 'FLOT2', 'CHMP5', 'VPS37C', 'ATP6V0A4', 'ATP6V0D1', 'CHMP3', 'ATP6V1E1', 'VPS28', 'ATP6V1A', 'ATP6AP1', 'LGALS1', 'ATP6V0C', 'ACE', 'SPAST', 'ATP6V0D2', 'MITD1']
110	GO:BP	GO:0051303	establishment of chromosome localization	2.6036940372108924e-13	True	"""The directed movement of a chromosome to a specific location."" [GOC:ai]"	85	98	13	21110	0.1326530612244898	0.1529411764705882	query_1	['GO:0050000', 'GO:0051649', 'GO:0051656']	['CHMP2A', 'CHMP2B', 'CHMP1A', 'VPS4A', 'CHMP1B', 'CHMP4B', 'VPS4B', 'CHMP4A', 'CHMP6', 'CHMP7', 'CHMP5', 'CHMP3', 'CHMP4C']
111	REAC	REAC:R-HSA-77387	Insulin receptor recycling	4.154063814440085e-13	True	Insulin receptor recycling	26	78	10	10790	0.1282051282051282	0.3846153846153846	query_1	['REAC:R-HSA-74752']	['ATP6V0A2', 'ATP6V0A1', 'TCIRG1', 'ATP6V0A4', 'ATP6V0D1', 'ATP6V1E1', 'ATP6V1A', 'ATP6AP1', 'ATP6V0C', 'ATP6V0D2']
112	REAC	REAC:R-HSA-5620971	Pyroptosis	6.559774341821789e-13	True	Pyroptosis	27	78	10	10790	0.1282051282051282	0.3703703703703703	query_1	['REAC:R-HSA-5218859']	['CHMP2A', 'CHMP2B', 'CHMP4B', 'CHMP4A', 'CHMP6', 'CHMP7', 'CASP3', 'CHMP3', 'CHMP4C', 'TP53']
113	REAC	REAC:R-HSA-2995410	Nuclear Envelope (NE) Reassembly	7.091357369199955e-13	True	Nuclear Envelope (NE) Reassembly	70	78	13	10790	0.1666666666666666	0.1857142857142857	query_1	['REAC:R-HSA-68882']	['CHMP2A', 'CHMP2B', 'VPS4A', 'CHMP4B', 'CHMP4A', 'LEMD2', 'CHMP6', 'CHMP7', 'IST1', 'CHMP3', 'CHMP4C', 'CC2D1B', 'SPAST']
114	GO:BP	GO:0050000	chromosome localization	7.664683903602722e-13	True	"""Any process in which a chromosome is transported to, or maintained in, a specific location."" [GOC:ai]"	92	98	13	21110	0.1326530612244898	0.1413043478260869	query_1	['GO:0051640']	['CHMP2A', 'CHMP2B', 'CHMP1A', 'VPS4A', 'CHMP1B', 'CHMP4B', 'VPS4B', 'CHMP4A', 'CHMP6', 'CHMP7', 'CHMP5', 'CHMP3', 'CHMP4C']
115	GO:BP	GO:0044403	biological process involved in symbiotic interaction	8.907601287989489e-13	True	"""A process carried out by gene products in an organism that enable the organism to engage in a symbiotic relationship, a more or less intimate association, with another organism. The various forms of symbiosis include parasitism, in which the association is disadvantageous or destructive to one of the organisms; mutualism, in which the association is advantageous, or often necessary to one or both and not harmful to either; and commensalism, in which one member of the association benefits while the other is not affected. However, mutualism, parasitism, and commensalism are often not discrete categories of interactions and should rather be perceived as a continuum of interaction ranging from parasitism to mutualism. In fact, the direction of a symbiotic interaction can change during the lifetime of the symbionts due to developmental changes as well as changes in the biotic/abiotic environment in which the interaction occurs. Microscopic symbionts are often referred to as endosymbionts."" [GOC:cc, PMID:31257129]"	317	98	19	21110	0.1938775510204081	0.0599369085173501	query_1	['GO:0044419']	['ANPEP', 'AGTR1', 'CHMP2A', 'CHMP2B', 'CHMP1A', 'VPS4A', 'CHMP1B', 'CHMP4B', 'VPS4B', 'TSG101', 'CHMP4A', 'CHMP6', 'CHMP7', 'IST1', 'CHMP5', 'CHMP3', 'CHMP4C', 'LGALS1', 'CBL']
116	GO:CC	GO:0000220	vacuolar proton-transporting V-type ATPase, V0 domain	1.093601137220973e-12	True	"""The V0 domain of a proton-transporting V-type ATPase found in the vacuolar membrane."" [GOC:mah, PMID:16449553]"	10	100	7	22122	0.07	0.7	query_1	['GO:0016471', 'GO:0033179']	['ATP6V0A2', 'ATP6V0A1', 'ATP6AP2', 'TCIRG1', 'ATP6V0A4', 'ATP6V0D1', 'ATP6V0C']
117	REAC	REAC:R-HSA-5218859	Regulated Necrosis	1.1556307235938774e-12	True	Regulated Necrosis	55	78	12	10790	0.1538461538461538	0.2181818181818181	query_1	['REAC:R-HSA-5357801']	['CHMP2A', 'CHMP2B', 'CHMP4B', 'FLOT1', 'CHMP4A', 'CHMP6', 'CHMP7', 'FLOT2', 'CASP3', 'CHMP3', 'CHMP4C', 'TP53']
118	GO:MF	GO:0044769	ATPase activity, coupled to transmembrane movement of ions, rotational mechanism	1.7328041299823728e-12	True	"""Enables the transfer of ions from one side of a membrane to the other according to the reaction: ATP + H2O + ion(in) = ADP + phosphate + ion(out), by a rotational mechanism."" [GOC:jl]"	25	101	9	20195	0.0891089108910891	0.36	query_1	['GO:0042625']	['ATP6V0A2', 'ATP6V0A1', 'TCIRG1', 'ATP6V0A4', 'ATP6V0D1', 'ATP6V1E1', 'ATP6V1A', 'ATP6V0C', 'ATP6V0D2']
119	GO:MF	GO:0042625	ATPase-coupled ion transmembrane transporter activity	1.7328041299823728e-12	True	"""Enables the transfer of an ion from one side of a membrane to the other, driven by the reaction: ATP + H2O = ADP + phosphate."" [GOC:jl, GOC:mtg_transport, ISBN:0815340729]"	25	101	9	20195	0.0891089108910891	0.36	query_1	['GO:0042626']	['ATP6V0A2', 'ATP6V0A1', 'TCIRG1', 'ATP6V0A4', 'ATP6V0D1', 'ATP6V1E1', 'ATP6V1A', 'ATP6V0C', 'ATP6V0D2']
120	GO:MF	GO:0046961	proton-transporting ATPase activity, rotational mechanism	1.7328041299823728e-12	True	"""Enables the transfer of protons from one side of a membrane to the other according to the reaction: ATP + H2O + H+(in) = ADP + phosphate + H+(out), by a rotational mechanism."" [RHEA:57721]"	25	101	9	20195	0.0891089108910891	0.36	query_1	['GO:0009678', 'GO:0019829', 'GO:0044769']	['ATP6V0A2', 'ATP6V0A1', 'TCIRG1', 'ATP6V0A4', 'ATP6V0D1', 'ATP6V1E1', 'ATP6V1A', 'ATP6V0C', 'ATP6V0D2']
121	GO:CC	GO:0005776	autophagosome	1.8291592506229504e-12	True	"""A double-membrane-bounded compartment that engulfs endogenous cellular material as well as invading microorganisms to target them to the lytic vacuole/lysosome for degradation as part of macroautophagy."" [GOC:autophagy, ISBN:0198547684, PMID:11099404]"	117	100	13	22122	0.13	0.1111111111111111	query_1	['GO:0005773']	['CHMP2A', 'CHMP2B', 'CHMP1A', 'CHMP1B', 'CHMP4B', 'TM9SF1', 'ATP6AP2', 'CHMP4A', 'CHMP6', 'CHMP7', 'CHMP5', 'CHMP3', 'CHMP4C']
122	GO:BP	GO:0051179	localization	2.2532661439787015e-12	True	"""Any process in which a cell, a substance, or a cellular entity, such as a protein complex or organelle, is transported, tethered to or otherwise maintained in a specific location. In the case of substances, localization may also be achieved via selective degradation."" [GOC:ai, GOC:dos]"	5604	98	64	21110	0.6530612244897959	0.0114204139900071	query_1	['GO:0008150']	['AP1G2', 'CGNL1', 'PIP4P1', 'C3', 'ATP6V0A2', 'CSNK1G1', 'AGTR1', 'CHMP2A', 'CHMP2B', 'TRPC4AP', 'HGS', 'CHMP1A', 'VPS4A', 'ATP6V0A1', 'CHMP1B', 'CHMP4B', 'STAM2', 'VTA1', 'VPS4B', 'FLOT1', 'TM9SF1', 'TSG101', 'HSPA2', 'ARL8A', 'SH3BP1', 'ATP6AP2', 'CHMP4A', 'LEMD2', 'DMPK', 'CHMP6', 'CHMP7', 'IST1', 'AGT', 'TFG', 'STAM', 'REN', 'SLN', 'TBC1D24', 'FLOT2', 'CHMP5', 'CD68', 'TCIRG1', 'VPS37C', 'ATP6V0A4', 'ATP6V0D1', 'CHMP3', 'ATP6V1E1', 'VPS28', 'PLN', 'ATP6V1A', 'TMEM79', 'CHMP4C', 'ATP6AP1', 'ATP2A1', 'SORBS1', 'ATP6V0C', 'RTN3', 'ACE', 'VPS9D1', 'TP53', 'SPAST', 'ATP6V0D2', 'CBL', 'SARAF']
123	REAC	REAC:R-HSA-9679504	Translation of Replicase and Assembly of the Replication Transcription Complex	2.580072120368617e-12	True	Translation of Replicase and Assembly of the Replication Transcription Complex	13	78	8	10790	0.1025641025641025	0.6153846153846154	query_1	['REAC:R-HSA-9678108']	['CHMP2A', 'CHMP2B', 'CHMP4B', 'CHMP4A', 'CHMP6', 'CHMP7', 'CHMP3', 'CHMP4C']
124	GO:BP	GO:0090307	mitotic spindle assembly	2.760164703001421e-12	True	"""Mitotic bipolar spindle assembly begins with spindle microtubule nucleation from the separated spindle pole body, includes spindle elongation during prometaphase, and is complete when all kinetochores are stably attached the spindle, and the spindle assembly checkpoint is satisfied."" [GOC:tb, GOC:vw]"	76	98	12	21110	0.1224489795918367	0.1578947368421052	query_1	['GO:0000070', 'GO:0007052', 'GO:0051225']	['CHMP2A', 'CHMP2B', 'CHMP1A', 'CHMP1B', 'CHMP4B', 'VPS4B', 'CHMP4A', 'CHMP6', 'CHMP7', 'CHMP5', 'CHMP3', 'CHMP4C']
125	REAC	REAC:R-HSA-917977	Transferrin endocytosis and recycling	3.3701959218325065e-12	True	Transferrin endocytosis and recycling	31	78	10	10790	0.1282051282051282	0.3225806451612903	query_1	['REAC:R-HSA-917937']	['ATP6V0A2', 'ATP6V0A1', 'TCIRG1', 'ATP6V0A4', 'ATP6V0D1', 'ATP6V1E1', 'ATP6V1A', 'ATP6AP1', 'ATP6V0C', 'ATP6V0D2']
126	GO:BP	GO:0051234	establishment of localization	3.652829646954355e-12	True	"""Any process that localizes a substance or cellular component. This may occur via movement, tethering or selective degradation."" [GOC:ai, GOC:dos]"	4964	98	60	21110	0.6122448979591837	0.0120870265914585	query_1	['GO:0051179']	['AP1G2', 'C3', 'ATP6V0A2', 'CSNK1G1', 'AGTR1', 'CHMP2A', 'CHMP2B', 'TRPC4AP', 'HGS', 'CHMP1A', 'VPS4A', 'ATP6V0A1', 'CHMP1B', 'CHMP4B', 'STAM2', 'VTA1', 'VPS4B', 'FLOT1', 'TSG101', 'HSPA2', 'ARL8A', 'SH3BP1', 'ATP6AP2', 'CHMP4A', 'DMPK', 'CHMP6', 'CHMP7', 'IST1', 'AGT', 'TFG', 'STAM', 'REN', 'SLN', 'TBC1D24', 'FLOT2', 'CHMP5', 'CD68', 'TCIRG1', 'VPS37C', 'ATP6V0A4', 'ATP6V0D1', 'CHMP3', 'ATP6V1E1', 'VPS28', 'PLN', 'ATP6V1A', 'TMEM79', 'CHMP4C', 'ATP6AP1', 'ATP2A1', 'SORBS1', 'ATP6V0C', 'RTN3', 'ACE', 'VPS9D1', 'TP53', 'SPAST', 'ATP6V0D2', 'CBL', 'SARAF']
127	GO:BP	GO:0006810	transport	3.802601670419404e-12	True	"""The directed movement of substances (such as macromolecules, small molecules, ions) or cellular components (such as complexes and organelles) into, out of or within a cell, or between cells, or within a multicellular organism by means of some agent such as a transporter or a transporter complex, a pore or a motor protein."" [GOC:dos, GOC:dph, GOC:jl, GOC:mah]"	4802	98	59	21110	0.6020408163265306	0.01228654727197	query_1	['GO:0051234']	['AP1G2', 'C3', 'ATP6V0A2', 'CSNK1G1', 'AGTR1', 'CHMP2A', 'CHMP2B', 'TRPC4AP', 'HGS', 'CHMP1A', 'VPS4A', 'ATP6V0A1', 'CHMP1B', 'CHMP4B', 'STAM2', 'VTA1', 'VPS4B', 'FLOT1', 'TSG101', 'HSPA2', 'ARL8A', 'SH3BP1', 'ATP6AP2', 'CHMP4A', 'DMPK', 'CHMP6', 'CHMP7', 'IST1', 'AGT', 'TFG', 'STAM', 'REN', 'SLN', 'TBC1D24', 'FLOT2', 'CHMP5', 'TCIRG1', 'VPS37C', 'ATP6V0A4', 'ATP6V0D1', 'CHMP3', 'ATP6V1E1', 'VPS28', 'PLN', 'ATP6V1A', 'TMEM79', 'CHMP4C', 'ATP6AP1', 'ATP2A1', 'SORBS1', 'ATP6V0C', 'RTN3', 'ACE', 'VPS9D1', 'TP53', 'SPAST', 'ATP6V0D2', 'CBL', 'SARAF']
128	GO:BP	GO:0044248	cellular catabolic process	5.3377973924487815e-12	True	"""The chemical reactions and pathways resulting in the breakdown of substances, carried out by individual cells."" [GOC:jl]"	1513	98	34	21110	0.3469387755102041	0.0224719101123595	query_1	['GO:0009056', 'GO:0044237']	['ANPEP', 'ATP6V0A2', 'CHMP2A', 'CHMP2B', 'HGS', 'CHMP1A', 'VPS4A', 'ATP6V0A1', 'CHMP1B', 'CHMP4B', 'STAM2', 'VTA1', 'VPS4B', 'TM9SF1', 'TSG101', 'CHMP4A', 'CHMP6', 'CHMP7', 'STAM', 'CHMP5', 'TCIRG1', 'VPS37C', 'TIMP3', 'CASP3', 'ATP6V0D1', 'CHMP3', 'ATP6V1E1', 'VPS28', 'ATP6V1A', 'CHMP4C', 'ATP6V0C', 'ACE', 'TP53', 'ATP6V0D2']
129	GO:MF	GO:0009678	pyrophosphate hydrolysis-driven proton transmembrane transporter activity	5.786474924608897e-12	True	"""Enables the transmembrane transport of one proton (H+), driven by the hydrolysis of pyrophosphate, and generating a proton motive force."" [GOC:mtg_transport, ISBN:0815340729, Wikipedia:Proton-pumping_pyrophosphatase]"	28	101	9	20195	0.0891089108910891	0.3214285714285714	query_1	['GO:0015078', 'GO:0015399', 'GO:0022853']	['ATP6V0A2', 'ATP6V0A1', 'TCIRG1', 'ATP6V0A4', 'ATP6V0D1', 'ATP6V1E1', 'ATP6V1A', 'ATP6V0C', 'ATP6V0D2']
130	REAC	REAC:R-HSA-9694676	Translation of Replicase and Assembly of the Replication Transcription Complex	5.985424423151172e-12	True	Translation of Replicase and Assembly of the Replication Transcription Complex	14	78	8	10790	0.1025641025641025	0.5714285714285714	query_1	['REAC:R-HSA-9772572']	['CHMP2A', 'CHMP2B', 'CHMP4B', 'CHMP4A', 'CHMP6', 'CHMP7', 'CHMP3', 'CHMP4C']
131	REAC	REAC:R-HSA-162599	Late Phase of HIV Life Cycle	8.329936137100413e-12	True	Late Phase of HIV Life Cycle	132	78	15	10790	0.1923076923076923	0.1136363636363636	query_1	['REAC:R-HSA-162587']	['CHMP2A', 'CHMP2B', 'VPS4A', 'CHMP4B', 'VTA1', 'VPS4B', 'TSG101', 'CHMP4A', 'CHMP6', 'CHMP7', 'CHMP5', 'VPS37C', 'CHMP3', 'VPS28', 'CHMP4C']
132	GO:BP	GO:0051453	regulation of intracellular pH	1.7463426421312584e-11	True	"""Any process that modulates the internal pH of a cell, measured by the concentration of the hydrogen ion."" [GOC:ai, GOC:dph, GOC:tb]"	88	98	12	21110	0.1224489795918367	0.1363636363636363	query_1	['GO:0030641', 'GO:0065008']	['ATP6V0A2', 'TMEM199', 'ATP6V0A1', 'CCDC115', 'ATP6AP2', 'TCIRG1', 'ATP6V0A4', 'ATP6V0D1', 'ATP6V1A', 'ATP6AP1', 'ATP6V0C', 'ATP6V0D2']
133	REAC	REAC:R-HSA-162587	HIV Life Cycle	3.4244898364086706e-11	True	HIV Life Cycle	145	78	15	10790	0.1923076923076923	0.1034482758620689	query_1	['REAC:R-HSA-162906']	['CHMP2A', 'CHMP2B', 'VPS4A', 'CHMP4B', 'VTA1', 'VPS4B', 'TSG101', 'CHMP4A', 'CHMP6', 'CHMP7', 'CHMP5', 'VPS37C', 'CHMP3', 'VPS28', 'CHMP4C']
134	GO:BP	GO:0030641	regulation of cellular pH	3.4760605427911257e-11	True	"""Any process involved in the maintenance of an internal equilibrium of hydrogen ions (protons) within a cell or between a cell and its external environment."" [GOC:dph, GOC:mah, GOC:tb]"	93	98	12	21110	0.1224489795918367	0.1290322580645161	query_1	['GO:0006885', 'GO:0030003']	['ATP6V0A2', 'TMEM199', 'ATP6V0A1', 'CCDC115', 'ATP6AP2', 'TCIRG1', 'ATP6V0A4', 'ATP6V0D1', 'ATP6V1A', 'ATP6AP1', 'ATP6V0C', 'ATP6V0D2']
135	GO:BP	GO:0051656	establishment of organelle localization	3.666077562343824e-11	True	"""The directed movement of an organelle to a specific location."" [GOC:ai]"	447	98	20	21110	0.2040816326530612	0.0447427293064877	query_1	['GO:0051234', 'GO:0051640']	['CHMP2A', 'CHMP2B', 'HGS', 'CHMP1A', 'VPS4A', 'CHMP1B', 'CHMP4B', 'VPS4B', 'TSG101', 'CHMP4A', 'CHMP6', 'CHMP7', 'TFG', 'STAM', 'CHMP5', 'TCIRG1', 'CHMP3', 'CHMP4C', 'SPAST', 'CBL']
136	GO:BP	GO:0030163	protein catabolic process	3.7730278097006405e-11	True	"""The chemical reactions and pathways resulting in the breakdown of a protein by the destruction of the native, active configuration, with or without the hydrolysis of peptide bonds."" [GOC:mah]"	1041	98	28	21110	0.2857142857142857	0.0268972142170989	query_1	['GO:0009057', 'GO:0019538', 'GO:1901565']	['CHMP2A', 'PAPPA', 'CHMP2B', 'TRPC4AP', 'TMEM199', 'HGS', 'CHMP1A', 'VPS4A', 'CHMP1B', 'CHMP4B', 'STAM2', 'CCDC115', 'VPS4B', 'TSG101', 'CHMP4A', 'CHMP6', 'CHMP7', 'STAM', 'CHMP5', 'TCIRG1', 'VPS37C', 'TIMP3', 'CASP3', 'CHMP3', 'VPS28', 'CHMP4C', 'CYLD', 'CBL']
