329	GO:BP	GO:0071478	cellular response to radiation	0.0074723325913583	True	"""Any process that results in a change in state or activity of a cell (in terms of movement, secretion, enzyme production, gene expression, etc.) as a result of an electromagnetic radiation stimulus. Electromagnetic radiation is a propagating wave in space with electric and magnetic components. These components oscillate at right angles to each other and to the direction of propagation."" [GOC:mah]"	191	99	8	21110	0.0808080808080808	0.0418848167539267	query_1	['GO:0009314', 'GO:0071214']	['CUL4B', 'DDB2', 'CREBBP', 'ZMPSTE24', 'DDB1', 'RBX1', 'EP300', 'CUL4A']
330	REAC	REAC:R-HSA-5696395	Formation of Incision Complex in GG-NER	0.0074792916927312	True	Formation of Incision Complex in GG-NER	43	83	5	10790	0.0602409638554216	0.1162790697674418	query_1	['REAC:R-HSA-5696399']	['CUL4B', 'DDB2', 'DDB1', 'RBX1', 'CUL4A']
331	GO:BP	GO:0007165	signal transduction	0.0076276958312464	True	"""The cellular process in which a signal is conveyed to trigger a change in the activity or state of a cell. Signal transduction begins with reception of a signal (e.g. a ligand binding to a receptor or receptor activation by a stimulus such as light), or for signal transduction in the absence of ligand, signal-withdrawal or the activity of a constitutively active receptor. Signal transduction ends with regulation of a downstream cellular process, e.g. regulation of transcription or regulation of a metabolic process. Signal transduction covers signaling from receptors located on the surface of the cell and signaling via molecules located within the cell. For signaling between cells, signal transduction is restricted to events at and within the receiving cell."" [GOC:go_curators, GOC:mtg_signaling_feb11]"	6034	99	50	21110	0.5050505050505051	0.0082863771958899	query_1	['GO:0007154', 'GO:0009987', 'GO:0023052', 'GO:0050794', 'GO:0051716']	['CUL3', 'RXRA', 'PTCH1', 'MROH2B', 'IHH', 'SELENOS', 'SYVN1', 'CREBBP', 'PPARD', 'BOC', 'DHH', 'CYTH4', 'CDON', 'DERL2', 'DNAJC10', 'HSP90AB1', 'VCP', 'CYTH3', 'CYTH1', 'ZMPSTE24', 'TAMALIN', 'CYTH2', 'OS9', 'DDB1', 'DERL1', 'RBX1', 'ARFRP1', 'VHL', 'ARFIP2', 'HIF1A', 'SEL1L', 'GBF1', 'EPAS1', 'SHH', 'EP300', 'ARNT', 'AHR', 'ERLEC1', 'SELENOK', 'CUL5', 'COPS5', 'PKHD1', 'RARA', 'HHIP', 'FAM3D', 'CUL1', 'CUL2', 'FABP5', 'PKD2', 'CUL4A']
332	GO:BP	GO:0001701	in utero embryonic development	0.0076684053542395	True	"""The process whose specific outcome is the progression of the embryo in the uterus over time, from formation of the zygote in the oviduct, to birth. An example of this process is found in Mus musculus."" [GOC:go_curators, GOC:mtg_sensu]"	408	99	11	21110	0.1111111111111111	0.0269607843137254	query_1	['GO:0043009']	['CUL3', 'PTCH1', 'IHH', 'DAD1', 'EGLN1', 'HIF1A', 'EPAS1', 'ARNT', 'ZFP14', 'PKD2', 'CUL4A']
333	GO:BP	GO:0043066	negative regulation of apoptotic process	0.0077155061483399	True	"""Any process that stops, prevents, or reduces the frequency, rate or extent of cell death by apoptotic process."" [GOC:jl, GOC:mtg_apoptosis]"	884	99	16	21110	0.1616161616161616	0.0180995475113122	query_1	['GO:0006915', 'GO:0042981', 'GO:0043069']	['IHH', 'NAA38', 'SELENOS', 'SYVN1', 'PPARD', 'DAD1', 'HSP90AB1', 'DDB1', 'HSP90B1', 'VHL', 'HIF1A', 'SHH', 'COPS5', 'PKHD1', 'HHIP', 'NAA35']
334	GO:BP	GO:0043619	regulation of transcription from RNA polymerase II promoter in response to oxidative stress	0.0078507494496443	True	"""Modulation of the frequency, rate or extent of transcription from an RNA polymerase II promoter as a result of a stimulus indicating the organism is under oxidative stress, a state often resulting from exposure to high levels of reactive oxygen species, e.g. superoxide anions, hydrogen peroxide (H2O2), and hydroxyl radicals."" [GOC:jl]"	7	99	3	21110	0.0303030303030303	0.4285714285714285	query_1	['GO:0034599', 'GO:0043618']	['HIF1A', 'EPAS1', 'ARNT']
335	HPA	HPA:0350472	pancreas; exocrine glandular cells[Medium]	0.0079028707842199	True	pancreas; exocrine glandular cells[Medium]	5297	69	50	11006	0.7246376811594203	0.0094393052671323	query_1	['HPA:0350471']	['CUL3', 'RXRA', 'LRIG3', 'PNPLA2', 'CUL4B', 'SELENOS', 'SYVN1', 'CREBBP', 'STT3B', 'PPARD', 'GNL2', 'CYTH4', 'DERL2', 'DNAJC10', 'HSP90AB1', 'COX10', 'ARL1', 'ZMPSTE24', 'PLEKHA3', 'TAMALIN', 'SCOC', 'ELOB', 'OS9', 'DDB1', 'UBE2J1', 'DERL1', 'DDOST', 'CYTIP', 'ARFRP1', 'RPN1', 'HSP90B1', 'EGLN1', 'VHL', 'ARFIP2', 'PRCC', 'SKP1', 'SEL1L', 'RPLP2', 'EP300', 'STT3A', 'FAF2', 'ERLEC1', 'RNF7', 'CUL5', 'MAGT1', 'COPS5', 'PKHD1', 'DDX42', 'RPN2', 'CUL1']
336	GO:BP	GO:0006886	intracellular protein transport	0.0080085667900878	True	"""The directed movement of proteins in a cell, including the movement of proteins between specific compartments or structures within a cell, such as organelles of a eukaryotic cell."" [GOC:mah]"	1108	99	18	21110	0.1818181818181818	0.0162454873646209	query_1	['GO:0008104', 'GO:0015031', 'GO:0046907']	['SELENOS', 'SYVN1', 'ARF1', 'DERL2', 'VCP', 'ARL1', 'TAMALIN', 'OS9', 'UBE2J1', 'DERL1', 'ARFRP1', 'HSP90B1', 'ARFIP2', 'SEL1L', 'SHH', 'FAF2', 'ERLEC1', 'HSPA8']
337	GO:MF	GO:0051787	misfolded protein binding	0.0081562447440628	True	"""Binding to a misfolded protein."" [GOC:ai]"	29	99	4	20195	0.0404040404040404	0.1379310344827586	query_1	['GO:0005515']	['DERL2', 'DNAJC10', 'DERL1', 'HSPA8']
338	CORUM	CORUM:2189	Ubiquitin E3 ligase (SMAD3, BTRC, CUL1, SKP1A, RBX1)	0.0081964425313155	True	Ubiquitin E3 ligase (SMAD3, BTRC, CUL1, SKP1A, RBX1)	5	59	3	3383	0.0508474576271186	0.6	query_1	['CORUM:0000000']	['RBX1', 'SKP1', 'CUL1']
339	CORUM	CORUM:1214	Ubiquitin E3 ligase (DET1, DDB1, CUL4A, RBX1, COP1)	0.0081964425313155	True	Ubiquitin E3 ligase (DET1, DDB1, CUL4A, RBX1, COP1)	5	59	3	3383	0.0508474576271186	0.6	query_1	['CORUM:0000000']	['DDB1', 'RBX1', 'CUL4A']
340	CORUM	CORUM:3036	Ubiquitin E3 ligase (SKP1A, SKP2, CUL1, CKS1B, RBX1)	0.0081964425313155	True	Ubiquitin E3 ligase (SKP1A, SKP2, CUL1, CKS1B, RBX1)	5	59	3	3383	0.0508474576271186	0.6	query_1	['CORUM:0000000']	['RBX1', 'SKP1', 'CUL1']
341	REAC	REAC:R-HSA-6811438	Intra-Golgi traffic	0.0083875104739137	True	Intra-Golgi traffic	44	83	5	10790	0.0602409638554216	0.1136363636363636	query_1	['REAC:R-HSA-6811442']	['ARF1', 'CYTH4', 'CYTH3', 'CYTH1', 'CYTH2']
342	GO:MF	GO:0008289	lipid binding	0.0086100070669817	True	"""Binding to a lipid."" [GOC:ai]"	831	99	15	20195	0.1515151515151515	0.0180505415162454	query_1	['GO:0005488']	['RXRA', 'PTCH1', 'PPARD', 'CYTH4', 'VCP', 'CYTH3', 'CYTH1', 'PLEKHA3', 'CYTH2', 'ARFIP2', 'GBF1', 'RARA', 'HSPA8', 'FABP5', 'PLEKHA8']
343	HPA	HPA:0020052	adrenal gland; glandular cells[Medium]	0.0086177751960601	True	adrenal gland; glandular cells[Medium]	6009	69	54	11006	0.782608695652174	0.0089865202196704	query_1	['HPA:0020051']	['CUL3', 'RXRA', 'LRIG3', 'PNPLA2', 'CUL4B', 'SELENOS', 'DDB2', 'SYVN1', 'CREBBP', 'STT3B', 'PPARD', 'CYTH4', 'DERL2', 'DNAJC10', 'HSP90AB1', 'VCP', 'COX10', 'ARL1', 'TAMALIN', 'SCOC', 'ELOB', 'OS9', 'DDB1', 'DERL1', 'DDOST', 'CYTIP', 'ARFRP1', 'CSDE1', 'RPN1', 'HSP90B1', 'EGLN1', 'VHL', 'ARFIP2', 'PRCC', 'SKP1', 'SEL1L', 'RPLP2', 'EP300', 'ARNT', 'AHR', 'STT3A', 'FAF2', 'CAND1', 'RNF7', 'CUL5', 'MAGT1', 'COPS5', 'DDX42', 'RPN2', 'CUL2', 'PKD2', 'SYS1', 'TUSC3', 'NAA35']
344	GO:BP	GO:0042221	response to chemical	0.0087434623800551	True	"""Any process that results in a change in state or activity of a cell or an organism (in terms of movement, secretion, enzyme production, gene expression, etc.) as a result of a chemical stimulus."" [GOC:jl]"	4124	99	39	21110	0.3939393939393939	0.0094568380213385	query_1	['GO:0050896']	['CUL3', 'EGLN3', 'RXRA', 'PTCH1', 'IHH', 'SELENOS', 'SYVN1', 'STT3B', 'PPARD', 'DAD1', 'BOC', 'DHH', 'DERL2', 'DNAJC10', 'HSP90AB1', 'VCP', 'OS9', 'UBE2J1', 'DERL1', 'RBX1', 'DDOST', 'HSP90B1', 'EGLN1', 'VHL', 'HIF1A', 'SEL1L', 'GBF1', 'EPAS1', 'SHH', 'EP300', 'ARNT', 'AHR', 'FAF2', 'ERLEC1', 'COPS5', 'RARA', 'RPN2', 'HSPA8', 'PKD2']
345	GO:BP	GO:0071702	organic substance transport	0.0092967594889634	True	"""The directed movement of organic substances into, out of or within a cell, or between cells, or within a multicellular organism by means of some agent such as a transporter or pore. An organic substance is a molecular entity that contains carbon."" [GOC:mah]"	3017	99	32	21110	0.3232323232323232	0.0106065628107391	query_1	['GO:0006810']	['RXRA', 'PTCH1', 'SELENOS', 'SYVN1', 'PPARD', 'ARF1', 'DERL2', 'VCP', 'ARL1', 'ZMPSTE24', 'PLEKHA3', 'TAMALIN', 'OS9', 'UBE2J1', 'DERL1', 'ARFRP1', 'HSP90B1', 'ARFIP2', 'HIF1A', 'SEL1L', 'GBF1', 'SHH', 'FAF2', 'ERLEC1', 'SELENOK', 'CUL5', 'HSPA8', 'FAM3D', 'FABP5', 'PLEKHA8', 'PKD2', 'SYS1']
346	GO:MF	GO:0030674	protein-macromolecule adaptor activity	0.0093831773674889	True	"""The binding activity of a protein that brings together two or more macromolecules in contact, permitting those molecules to function in a coordinated way. The adaptor can bring together two proteins, or a protein and another macromolecule such as a lipid or a nucleic acid."" [GOC:bf, GOC:mah, GOC:vw]"	369	99	10	20195	0.101010101010101	0.02710027100271	query_1	['GO:0060090']	['CUL4B', 'DDB1', 'VHL', 'SKP1', 'ELOC', 'CUL5', 'HSPA8', 'CUL1', 'CUL2', 'CUL4A']
347	REAC	REAC:R-HSA-5362798	Release of Hh-Np from the secreting cell	0.0097977616973517	True	Release of Hh-Np from the secreting cell	8	83	3	10790	0.036144578313253	0.375	query_1	['REAC:R-HSA-5358346']	['IHH', 'DHH', 'SHH']
348	GO:BP	GO:0009059	macromolecule biosynthetic process	0.0098403295546459	True	"""The chemical reactions and pathways resulting in the formation of a macromolecule, any molecule of high relative molecular mass, the structure of which essentially comprises the multiple repetition of units derived, actually or conceptually, from molecules of low relative molecular mass."" [GOC:mah]"	4824	99	43	21110	0.4343434343434343	0.0089137645107794	query_1	['GO:0043170', 'GO:1901576']	['CUL3', 'RXRA', 'PTCH1', 'IHH', 'SELENOS', 'CREBBP', 'STT3B', 'PPARD', 'DAD1', 'LMO7', 'CDON', 'HSP90AB1', 'VCP', 'ZMPSTE24', 'ELOB', 'UBE2J1', 'DDOST', 'CSDE1', 'RPN1', 'EGLN1', 'VHL', 'HIF1A', 'EPAS1', 'ELOC', 'RPLP2', 'NEDD8', 'SHH', 'EP300', 'ARNT', 'AHR', 'STT3A', 'CAND1', 'SELENOK', 'MAGT1', 'COPS5', 'PKHD1', 'ZFP14', 'RARA', 'RPN2', 'HSPA8', 'PKD2', 'TUSC3', 'CDX1']
349	GO:BP	GO:0051604	protein maturation	0.0099814537437754	True	"""Any process leading to the attainment of the full functional capacity of a protein."" [GOC:ai]"	339	99	10	21110	0.101010101010101	0.0294985250737463	query_1	['GO:0010467', 'GO:0019538']	['PTCH1', 'IHH', 'NAA38', 'CREBBP', 'DHH', 'ZMPSTE24', 'NAA30', 'SHH', 'EP300', 'NAA35']
350	GO:MF	GO:0060090	molecular adaptor activity	0.0100482661029265	True	"""The binding activity of a molecule that brings together two or more molecules through a selective, non-covalent, often stoichiometric interaction, permitting those molecules to function in a coordinated way."" [GOC:mtg_MIT_16mar07, GOC:vw]"	545	99	12	20195	0.1212121212121212	0.0220183486238532	query_1	['GO:0003674']	['CUL4B', 'DDB1', 'RBX1', 'VHL', 'SKP1', 'ELOC', 'AHR', 'CUL5', 'HSPA8', 'CUL1', 'CUL2', 'CUL4A']
351	GO:BP	GO:0050896	response to stimulus	0.0101849483609011	True	"""Any process that results in a change in state or activity of a cell or an organism (in terms of movement, secretion, enzyme production, gene expression, etc.) as a result of a stimulus. The process begins with detection of the stimulus and ends with a change in state or activity or the cell or organism."" [GOC:ai, GOC:bf]"	9081	99	65	21110	0.6565656565656566	0.0071578020041845	query_1	['GO:0008150']	['CUL3', 'EGLN3', 'RXRA', 'PTCH1', 'MROH2B', 'IHH', 'CUL4B', 'SELENOS', 'DDB2', 'SYVN1', 'CREBBP', 'STT3B', 'PPARD', 'ARF1', 'DAD1', 'BOC', 'DHH', 'CYTH4', 'CDON', 'DERL2', 'DNAJC10', 'HSP90AB1', 'VCP', 'CYTH3', 'CYTH1', 'ZMPSTE24', 'TAMALIN', 'CYTH2', 'OS9', 'DDB1', 'UBE2J1', 'DERL1', 'RBX1', 'DDOST', 'ARFRP1', 'HSP90B1', 'EGLN1', 'VHL', 'ARFIP2', 'HIF1A', 'SEL1L', 'GBF1', 'EPAS1', 'SHH', 'EP300', 'ARNT', 'AHR', 'FAF2', 'ERLEC1', 'SELENOK', 'RNF7', 'CUL5', 'ERCC8', 'COPS5', 'PKHD1', 'RARA', 'RPN2', 'HHIP', 'HSPA8', 'FAM3D', 'CUL1', 'CUL2', 'FABP5', 'PKD2', 'CUL4A']
352	GO:BP	GO:0097190	apoptotic signaling pathway	0.0102158639132408	True	"""The series of molecular signals which triggers the apoptotic death of a cell. The pathway starts with reception of a signal, and ends when the execution phase of apoptosis is triggered."" [GOC:mtg_apoptosis]"	599	99	13	21110	0.1313131313131313	0.021702838063439	query_1	['GO:0006915', 'GO:0007165']	['CUL3', 'SELENOS', 'SYVN1', 'PPARD', 'DNAJC10', 'HIF1A', 'SHH', 'EP300', 'SELENOK', 'CUL5', 'CUL1', 'CUL2', 'CUL4A']
353	GO:BP	GO:0048745	smooth muscle tissue development	0.0102256767215977	True	"""The process whose specific outcome is the progression of smooth muscle over time, from its formation to the mature structure."" [GOC:dph, GOC:jid, GOC:lm]"	24	99	4	21110	0.0404040404040404	0.1666666666666666	query_1	['GO:0060537']	['PTCH1', 'IHH', 'SHH', 'PKD2']
354	GO:BP	GO:0043069	negative regulation of programmed cell death	0.010403474443746	True	"""Any process that stops, prevents, or reduces the frequency, rate or extent of programmed cell death, cell death resulting from activation of endogenous cellular processes."" [GOC:jl]"	905	99	16	21110	0.1616161616161616	0.0176795580110497	query_1	['GO:0012501', 'GO:0043067', 'GO:0060548']	['IHH', 'NAA38', 'SELENOS', 'SYVN1', 'PPARD', 'DAD1', 'HSP90AB1', 'DDB1', 'HSP90B1', 'VHL', 'HIF1A', 'SHH', 'COPS5', 'PKHD1', 'HHIP', 'NAA35']
355	HPA	HPA:0220052	gallbladder; glandular cells[Medium]	0.0109452873907748	True	gallbladder; glandular cells[Medium]	6606	69	57	11006	0.8260869565217391	0.008628519527702	query_1	['HPA:0220051']	['CUL3', 'RXRA', 'LRIG3', 'CUL4B', 'SELENOS', 'DDB2', 'SYVN1', 'CREBBP', 'STT3B', 'PPARD', 'LMO7', 'GNL2', 'CYTH4', 'DERL2', 'DNAJC10', 'HSP90AB1', 'VCP', 'COX10', 'ARL1', 'PLEKHA3', 'TAMALIN', 'SCOC', 'ELOB', 'OS9', 'DDB1', 'DERL1', 'DDOST', 'CYTIP', 'ARFRP1', 'CSDE1', 'RPN1', 'HSP90B1', 'EGLN1', 'VHL', 'ARFIP2', 'PRCC', 'HIF1A', 'SKP1', 'SEL1L', 'RPLP2', 'EP300', 'ARNT', 'STT3A', 'FAF2', 'ERLEC1', 'UBE2D2', 'RNF7', 'CUL5', 'MAGT1', 'COPS5', 'DDX42', 'RPN2', 'FAM3D', 'CUL2', 'PKD2', 'TUSC3', 'NAA35']
356	GO:BP	GO:0050794	regulation of cellular process	0.0110917778289749	True	"""Any process that modulates the frequency, rate or extent of a cellular process, any of those that are carried out at the cellular level, but are not necessarily restricted to a single cell. For example, cell communication occurs among more than one cell, but occurs at the cellular level."" [GOC:go_curators]"	11108	99	74	21110	0.7474747474747475	0.0066618653222902	query_1	['GO:0009987', 'GO:0050789']	['CUL3', 'EGLN3', 'RXRA', 'PTCH1', 'PNPLA2', 'MROH2B', 'IHH', 'NAA38', 'LIMCH1', 'CUL4B', 'SELENOS', 'SYVN1', 'CREBBP', 'PPARD', 'ARF1', 'DAD1', 'BOC', 'LMO7', 'DHH', 'CYTH4', 'CDON', 'DERL2', 'DNAJC10', 'HSP90AB1', 'VCP', 'CYTH3', 'CYTH1', 'ZMPSTE24', 'TAMALIN', 'SCOC', 'CYTH2', 'OS9', 'DDB1', 'UBE2J1', 'DERL1', 'RBX1', 'CYTIP', 'ARFRP1', 'CSDE1', 'HSP90B1', 'EGLN1', 'VHL', 'ARFIP2', 'PRCC', 'HIF1A', 'SEL1L', 'GBF1', 'EPAS1', 'ELOC', 'NEDD8', 'SHH', 'EP300', 'ARNT', 'AHR', 'ERLEC1', 'CAND1', 'SELENOK', 'CUL5', 'ERCC8', 'COPS5', 'PKHD1', 'ZFP14', 'RARA', 'DDX42', 'HHIP', 'HSPA8', 'FAM3D', 'CUL1', 'CUL2', 'FABP5', 'PKD2', 'CUL4A', 'CDX1', 'NAA35']
357	HPA	HPA:0460651	skin 1; fibroblasts[Low]	0.0113728826602029	True	skin 1; fibroblasts[Low]	4078	69	42	11006	0.6086956521739131	0.0102991662579695	query_1	['HPA:0460000']	['CUL3', 'RXRA', 'PNPLA2', 'CUL4B', 'SELENOS', 'SYVN1', 'CREBBP', 'STT3B', 'PPARD', 'CYTH4', 'DNAJC10', 'VCP', 'COX10', 'ARL1', 'TAMALIN', 'SCOC', 'ELOB', 'DDB1', 'UBE2J1', 'DERL1', 'CYTIP', 'ARFRP1', 'EGLN1', 'VHL', 'ARFIP2', 'PRCC', 'HIF1A', 'SKP1', 'SEL1L', 'RPLP2', 'EP300', 'STT3A', 'UBE2D2', 'CUL5', 'MAGT1', 'COPS5', 'DDX42', 'CUL1', 'CUL2', 'PKD2', 'TUSC3', 'NAA35']
358	GO:BP	GO:0023052	signaling	0.0116655754703511	True	"""The entirety of a process in which information is transmitted within a biological system. This process begins with an active signal and ends when a cellular response has been triggered."" [GOC:mtg_signal, GOC:mtg_signaling_feb11, GOC:signaling]"	6493	99	52	21110	0.5252525252525253	0.0080086246727244	query_1	['GO:0050789']	['CUL3', 'RXRA', 'PTCH1', 'MROH2B', 'IHH', 'SELENOS', 'SYVN1', 'CREBBP', 'PPARD', 'ARF1', 'BOC', 'LMO7', 'DHH', 'CYTH4', 'CDON', 'DERL2', 'DNAJC10', 'HSP90AB1', 'VCP', 'CYTH3', 'CYTH1', 'ZMPSTE24', 'TAMALIN', 'CYTH2', 'OS9', 'DDB1', 'DERL1', 'RBX1', 'ARFRP1', 'VHL', 'ARFIP2', 'HIF1A', 'SEL1L', 'GBF1', 'EPAS1', 'SHH', 'EP300', 'ARNT', 'AHR', 'ERLEC1', 'SELENOK', 'CUL5', 'COPS5', 'PKHD1', 'RARA', 'HHIP', 'FAM3D', 'CUL1', 'CUL2', 'FABP5', 'PKD2', 'CUL4A']
359	REAC	REAC:R-HSA-5619084	ABC transporter disorders	0.0116774726479507	True	ABC transporter disorders	78	83	6	10790	0.072289156626506	0.0769230769230769	query_1	['REAC:R-HSA-5619115']	['DERL2', 'VCP', 'OS9', 'DERL1', 'SEL1L', 'ERLEC1']
360	HPA	HPA:0060000	bronchus	0.0116866920408572	True	bronchus	7421	69	61	11006	0.8840579710144928	0.0082199164533081	query_1	['HPA:0000000']	['CUL3', 'RXRA', 'LRIG3', 'PNPLA2', 'CUL4B', 'SELENOS', 'DDB2', 'SYVN1', 'CREBBP', 'STT3B', 'PPARD', 'LMO7', 'CYTH4', 'DERL2', 'DNAJC10', 'HSP90AB1', 'VCP', 'COX10', 'ARL1', 'ZMPSTE24', 'PLEKHA3', 'TAMALIN', 'SCOC', 'ELOB', 'OS9', 'DDB1', 'UBE2J1', 'DERL1', 'DDOST', 'CYTIP', 'ARFRP1', 'CSDE1', 'RPN1', 'HSP90B1', 'EGLN1', 'VHL', 'ARFIP2', 'PRCC', 'HIF1A', 'SKP1', 'SEL1L', 'RPLP2', 'EP300', 'ARNT', 'AHR', 'STT3A', 'FAF2', 'ERLEC1', 'CAND1', 'CUL5', 'MAGT1', 'COPS5', 'DDX42', 'RPN2', 'FAM3D', 'CUL1', 'CUL2', 'PKD2', 'SYS1', 'TUSC3', 'NAA35']
361	GO:BP	GO:0070861	regulation of protein exit from endoplasmic reticulum	0.0121296883572479	True	"""Any process that modulates the frequency, rate or extent of the directed movement of proteins from the endoplasmic reticulum."" [GOC:mah]"	25	99	4	21110	0.0404040404040404	0.16	query_1	['GO:0032527', 'GO:0033157']	['DERL2', 'OS9', 'UBE2J1', 'ERLEC1']
362	GO:BP	GO:0017196	N-terminal peptidyl-methionine acetylation	0.0125183831515863	True	"""The acetylation of the N-terminal methionine of proteins to form the derivative N-acetyl-L-methionine."" [RESID:AA0049]"	8	99	3	21110	0.0303030303030303	0.375	query_1	['GO:0006474', 'GO:0018206']	['NAA38', 'NAA30', 'NAA35']
363	REAC	REAC:R-HSA-3371571	HSF1-dependent transactivation	0.0126078649813289	True	HSF1-dependent transactivation	24	83	4	10790	0.0481927710843373	0.1666666666666666	query_1	['REAC:R-HSA-3371556']	['CREBBP', 'HSP90AB1', 'EP300', 'HSPA8']
364	REAC	REAC:R-HSA-73893	DNA Damage Bypass	0.0129098684841553	True	DNA Damage Bypass	48	83	5	10790	0.0602409638554216	0.1041666666666666	query_1	['REAC:R-HSA-73894']	['CUL4B', 'VCP', 'DDB1', 'RBX1', 'CUL4A']
365	HPA	HPA:0380523	placenta; trophoblastic cells[High]	0.0132561545047224	True	placenta; trophoblastic cells[High]	1933	69	26	11006	0.3768115942028985	0.0134505949301603	query_1	['HPA:0380522']	['CUL3', 'PNPLA2', 'SELENOS', 'SYVN1', 'STT3B', 'PPARD', 'HSP90AB1', 'VCP', 'TAMALIN', 'ELOB', 'OS9', 'DERL1', 'CYTIP', 'ARFRP1', 'RPN1', 'HSP90B1', 'EGLN1', 'VHL', 'PRCC', 'SKP1', 'EP300', 'ARNT', 'ERLEC1', 'MAGT1', 'COPS5', 'DDX42']
366	HPA	HPA:0600221	tonsil; squamous epithelial cells[Low]	0.0138583523391023	True	tonsil; squamous epithelial cells[Low]	6645	69	57	11006	0.8260869565217391	0.0085778781038374	query_1	['HPA:0600000']	['CUL3', 'RXRA', 'LRIG3', 'PNPLA2', 'CUL4B', 'SELENOS', 'DDB2', 'SYVN1', 'CREBBP', 'STT3B', 'PPARD', 'LMO7', 'CYTH4', 'DERL2', 'DNAJC10', 'HSP90AB1', 'VCP', 'COX10', 'ARL1', 'TAMALIN', 'SCOC', 'ELOB', 'OS9', 'DDB1', 'UBE2J1', 'DERL1', 'DDOST', 'CYTIP', 'ARFRP1', 'CSDE1', 'RPN1', 'HSP90B1', 'EGLN1', 'VHL', 'PRCC', 'HIF1A', 'SKP1', 'SEL1L', 'RPLP2', 'EP300', 'ARNT', 'AHR', 'STT3A', 'FAF2', 'ERLEC1', 'RNF7', 'CUL5', 'MAGT1', 'COPS5', 'DDX42', 'RPN2', 'CUL2', 'FABP5', 'PKD2', 'SYS1', 'TUSC3', 'NAA35']
367	GO:BP	GO:0045935	positive regulation of nucleobase-containing compound metabolic process	0.013892114144075	True	"""Any cellular process that activates or increases the frequency, rate or extent of the chemical reactions and pathways involving nucleobases, nucleosides, nucleotides and nucleic acids."" [GOC:go_curators]"	2050	99	25	21110	0.2525252525252525	0.0121951219512195	query_1	['GO:0006139', 'GO:0019219', 'GO:0031325', 'GO:0051173']	['RXRA', 'PTCH1', 'IHH', 'CREBBP', 'PPARD', 'LMO7', 'CDON', 'HSP90AB1', 'VCP', 'CSDE1', 'EGLN1', 'VHL', 'HIF1A', 'EPAS1', 'SHH', 'EP300', 'ARNT', 'AHR', 'CAND1', 'ERCC8', 'COPS5', 'RARA', 'HSPA8', 'PKD2', 'CDX1']
368	WP	WP:WP236	Adipogenesis	0.01396560559868	True	Adipogenesis	130	68	7	8133	0.1029411764705882	0.0538461538461538	query_1	['WP:000000']	['RXRA', 'PPARD', 'ZMPSTE24', 'HIF1A', 'EPAS1', 'AHR', 'RARA']
369	HPA	HPA:0291161	liver; cholangiocytes[Low]	0.0139802660535308	True	liver; cholangiocytes[Low]	3959	69	41	11006	0.5942028985507246	0.0103561505430664	query_1	['HPA:0290000']	['CUL3', 'RXRA', 'LRIG3', 'SELENOS', 'DDB2', 'SYVN1', 'CREBBP', 'STT3B', 'LMO7', 'DERL2', 'DNAJC10', 'HSP90AB1', 'VCP', 'COX10', 'ARL1', 'ZMPSTE24', 'SCOC', 'ELOB', 'OS9', 'DDB1', 'DERL1', 'CYTIP', 'ARFRP1', 'CSDE1', 'RPN1', 'HSP90B1', 'EGLN1', 'SEL1L', 'EP300', 'ARNT', 'STT3A', 'FAF2', 'ERLEC1', 'UBE2D2', 'CUL5', 'MAGT1', 'COPS5', 'DDX42', 'RPN2', 'CUL1', 'PKD2']
370	GO:BP	GO:0009058	biosynthetic process	0.0141502025494852	True	"""The chemical reactions and pathways resulting in the formation of substances; typically the energy-requiring part of metabolism in which simpler substances are transformed into more complex ones."" [GOC:curators, ISBN:0198547684]"	5969	99	49	21110	0.494949494949495	0.0082090802479477	query_1	['GO:0008152']	['CUL3', 'RXRA', 'PTCH1', 'PNPLA2', 'IHH', 'SELENOS', 'CREBBP', 'STT3B', 'PPARD', 'DAD1', 'LMO7', 'DHH', 'CDON', 'HSP90AB1', 'VCP', 'COX10', 'ZMPSTE24', 'ELOB', 'DDB1', 'UBE2J1', 'DDOST', 'CSDE1', 'RPN1', 'EGLN1', 'VHL', 'HIF1A', 'GBF1', 'EPAS1', 'ELOC', 'RPLP2', 'NEDD8', 'SHH', 'EP300', 'ARNT', 'AHR', 'STT3A', 'CAND1', 'SELENOK', 'MAGT1', 'COPS5', 'PKHD1', 'ZFP14', 'RARA', 'RPN2', 'HSPA8', 'FABP5', 'PKD2', 'TUSC3', 'CDX1']
371	HPA	HPA:0210000	fallopian tube	0.0145688868243341	True	fallopian tube	7457	69	61	11006	0.8840579710144928	0.0081802333378034	query_1	['HPA:0000000']	['CUL3', 'RXRA', 'LRIG3', 'PNPLA2', 'CUL4B', 'SELENOS', 'DDB2', 'SYVN1', 'CREBBP', 'STT3B', 'PPARD', 'LMO7', 'CYTH4', 'DERL2', 'DNAJC10', 'HSP90AB1', 'VCP', 'COX10', 'ARL1', 'ZMPSTE24', 'PLEKHA3', 'TAMALIN', 'SCOC', 'ELOB', 'OS9', 'DDB1', 'UBE2J1', 'DERL1', 'DDOST', 'CYTIP', 'ARFRP1', 'CSDE1', 'RPN1', 'HSP90B1', 'EGLN1', 'VHL', 'ARFIP2', 'PRCC', 'SKP1', 'SEL1L', 'RPLP2', 'EP300', 'ARNT', 'AHR', 'STT3A', 'FAF2', 'ERLEC1', 'CAND1', 'UBE2D2', 'RNF7', 'CUL5', 'MAGT1', 'COPS5', 'DDX42', 'RPN2', 'CUL1', 'CUL2', 'PKD2', 'SYS1', 'TUSC3', 'NAA35']
372	HPA	HPA:0150052	duodenum; glandular cells[Medium]	0.0148195602618925	True	duodenum; glandular cells[Medium]	6098	69	54	11006	0.782608695652174	0.0088553624139062	query_1	['HPA:0150051']	['CUL3', 'RXRA', 'LRIG3', 'PNPLA2', 'CUL4B', 'SELENOS', 'SYVN1', 'CREBBP', 'STT3B', 'PPARD', 'LMO7', 'CYTH4', 'DERL2', 'DNAJC10', 'VCP', 'COX10', 'ARL1', 'PLEKHA3', 'TAMALIN', 'SCOC', 'ELOB', 'OS9', 'DDB1', 'DERL1', 'CYTIP', 'ARFRP1', 'CSDE1', 'HSP90B1', 'EGLN1', 'VHL', 'PRCC', 'HIF1A', 'SKP1', 'SEL1L', 'RPLP2', 'EP300', 'ARNT', 'AHR', 'STT3A', 'FAF2', 'ERLEC1', 'CAND1', 'RNF7', 'CUL5', 'MAGT1', 'COPS5', 'DDX42', 'RPN2', 'FAM3D', 'CUL2', 'PKD2', 'SYS1', 'TUSC3', 'NAA35']
373	GO:BP	GO:0009896	positive regulation of catabolic process	0.0148382681233359	True	"""Any process that activates or increases the frequency, rate or extent of the chemical reactions and pathways resulting in the breakdown of substances."" [GOC:go_curators]"	526	99	12	21110	0.1212121212121212	0.0228136882129277	query_1	['GO:0009056', 'GO:0009893', 'GO:0009894']	['PNPLA2', 'CUL4B', 'VCP', 'SCOC', 'ELOB', 'ZYG11B', 'DDB1', 'RBX1', 'CSDE1', 'VHL', 'HIF1A', 'ARNT']
374	HPA	HPA:0290401	liver; hepatocytes[Low]	0.0148719000863703	True	liver; hepatocytes[Low]	5743	69	52	11006	0.7536231884057971	0.0090545011318126	query_1	['HPA:0290000']	['CUL3', 'RXRA', 'LRIG3', 'PNPLA2', 'CUL4B', 'DDB2', 'SYVN1', 'CREBBP', 'STT3B', 'CYTH4', 'DERL2', 'DNAJC10', 'HSP90AB1', 'VCP', 'COX10', 'ARL1', 'ZMPSTE24', 'PLEKHA3', 'TAMALIN', 'SCOC', 'ELOB', 'OS9', 'DDB1', 'UBE2J1', 'DERL1', 'DDOST', 'CYTIP', 'ARFRP1', 'CSDE1', 'RPN1', 'HSP90B1', 'EGLN1', 'SKP1', 'SEL1L', 'RPLP2', 'EP300', 'ARNT', 'AHR', 'STT3A', 'FAF2', 'ERLEC1', 'CAND1', 'RNF7', 'MAGT1', 'COPS5', 'DDX42', 'RPN2', 'FAM3D', 'CUL2', 'PKD2', 'SYS1', 'NAA35']
375	HP	HP:0000446	Narrow nasal bridge	0.0148820524507165	True	Decreased width of the bony bridge of the nose.	49	31	5	4851	0.1612903225806451	0.1020408163265306	query_1	['HP:0000422']	['PTCH1', 'CREBBP', 'CDON', 'SHH', 'EP300']
376	HPA	HPA:0340461	ovary; ovarian stroma cells[Low]	0.016167862754743	True	ovary; ovarian stroma cells[Low]	3981	69	41	11006	0.5942028985507246	0.0102989198693795	query_1	['HPA:0340000']	['CUL3', 'RXRA', 'LRIG3', 'PNPLA2', 'SELENOS', 'DDB2', 'SYVN1', 'CREBBP', 'STT3B', 'PPARD', 'DNAJC10', 'HSP90AB1', 'VCP', 'COX10', 'ARL1', 'ZMPSTE24', 'ELOB', 'OS9', 'UBE2J1', 'DERL1', 'DDOST', 'CYTIP', 'CSDE1', 'RPN1', 'HSP90B1', 'EGLN1', 'PRCC', 'SKP1', 'SEL1L', 'EP300', 'ARNT', 'FAF2', 'ERLEC1', 'CAND1', 'CUL5', 'COPS5', 'DDX42', 'RPN2', 'CUL1', 'CUL2', 'PKD2']
377	CORUM	CORUM:3015	p27-cyclinE-Cdk2 - Ubiquitin E3 ligase (SKP1A, SKP2, CUL1, CKS1B, RBX1) complex	0.0161894328307769	True	p27-cyclinE-Cdk2 - Ubiquitin E3 ligase (SKP1A, SKP2, CUL1, CKS1B, RBX1) complex	6	59	3	3383	0.0508474576271186	0.5	query_1	['CORUM:0000000']	['RBX1', 'SKP1', 'CUL1']
