COG7-CDG	source	native	name	Corrected p_value	significant	description	term_size	query_size	intersection_size	effective_domain_size	precision	recall	query	parents	intersections
228	GO:BP	GO:0006914	autophagy	5.671252807544132e-10	True	"""The cellular catabolic process in which cells digest parts of their own cytoplasm; allows for both recycling of macromolecular constituents under conditions of cellular stress and remodeling the intracellular structure for cell differentiation."" [GOC:autophagy, ISBN:0198547684, PMID:11099404, PMID:9412464]"	552	101	21	15719	0.2079207920792079	0.0380434782608695	query_1	['GO:0044248', 'GO:0061919']	['BCL2L11', 'GSK3B', 'AKT1', 'BCL2', 'TAB2', 'FOXO3', 'MCL1', 'TBK1', 'RNF31', 'HSP90AA1', 'TAX1BP1', 'IKBKG', 'MAP3K7', 'MEFV', 'PYCARD', 'BCL2L1', 'TAB3', 'FBXW7', 'TP53', 'BAD', 'CDC37']
227	GO:BP	GO:0061919	process utilizing autophagic mechanism	5.671252807544132e-10	True	"""A cellular process involving delivery of a portion of the cytoplasm to lysosomes or to the plant or fungal vacuole that does not involve direct transport through the endocytic or vacuolar protein sorting (Vps) pathways. This process typically leads to degradation of the cargo; however, it can also be used to deliver resident proteins, such as in the cytoplasm-to-vacuole targeting (Cvt) pathway."" [PMID:21997368, PMID:22966490, PMID:28596378]"	552	101	21	15719	0.2079207920792079	0.0380434782608695	query_1	['GO:0009987']	['BCL2L11', 'GSK3B', 'AKT1', 'BCL2', 'TAB2', 'FOXO3', 'MCL1', 'TBK1', 'RNF31', 'HSP90AA1', 'TAX1BP1', 'IKBKG', 'MAP3K7', 'MEFV', 'PYCARD', 'BCL2L1', 'TAB3', 'FBXW7', 'TP53', 'BAD', 'CDC37']
226	GO:BP	GO:0036211	protein modification process	5.671252807544132e-10	True	"""The covalent alteration of one or more amino acids occurring in proteins, peptides and nascent polypeptides (co-translational, post-translational modifications). Includes the modification of charged tRNAs that are destined to occur in a protein (pre-translation modification)."" [GOC:bf, GOC:jl]"	3399	101	52	15719	0.5148514851485149	0.0152986172403648	query_1	['GO:0019538', 'GO:0043412']	['SHARPIN', 'BAX', 'MAP3K8', 'TANK', 'HSPA1A', 'GSK3B', 'AKT1', 'CREBBP', 'UBE2V1', 'MAP3K14', 'TRAF3', 'BCL2', 'HSP90AB1', 'CHUK', 'TNFRSF1A', 'TAB2', 'RELA', 'IKBKB', 'FKBP5', 'IKBKE', 'RBX1', 'RBCK1', 'BTRC', 'TBK1', 'TNF', 'FAS', 'RNF31', 'RIPK1', 'SKP1', 'MALT1', 'TNIP1', 'HSP90AA1', 'FBXW11', 'TAB1', 'BIRC3', 'TRAF2', 'MAP3K7', 'TNFAIP3', 'MEFV', 'PYCARD', 'COG7', 'TRAF6', 'BIRC2', 'SFN', 'BAK1', 'APP', 'CUL1', 'FBXW7', 'TP53', 'BCL10', 'UBE2N', 'CDC37']
229	GO:BP	GO:0060547	negative regulation of necrotic cell death	6.049530491937442e-10	True	"""Any process that decreases the rate, frequency or extent of necrotic cell death. Necrotic cell death is a cell death process that is morphologically characterized by a gain in cell volume (oncosis), swelling of organelles, plasma membrane rupture and subsequent loss of intracellular contents."" [GOC:BHF, GOC:dph, GOC:tb]"	21	101	7	15719	0.0693069306930693	0.3333333333333333	query_1	['GO:0010939', 'GO:0060548', 'GO:0070265']	['RBCK1', 'RNF31', 'FADD', 'RIPK1', 'BIRC3', 'BIRC2', 'CASP8']
9	GO:CC	GO:0140535	intracellular protein-containing complex	7.490204688306674e-10	True	"""A protein-containing complex located intracellularly."" [GOC:pg]"	904	101	26	16420	0.2574257425742574	0.0287610619469026	query_1	['GO:0032991']	['SHARPIN', 'CARD11', 'STIP1', 'GSK3B', 'CREBBP', 'UBE2V1', 'TRAF3', 'HSP90AB1', 'RBX1', 'RBCK1', 'BTRC', 'RNF31', 'NFKB1', 'SKP1', 'MALT1', 'NFKB2', 'FBXW11', 'IKBKG', 'TRAF2', 'MAP3K7', 'NFKBIA', 'CUL1', 'FBXW7', 'BCL10', 'UBE2N', 'CDC37']
77	REAC	REAC:R-HSA-1280218	Adaptive Immune System	7.624767780144625e-10	True	Adaptive Immune System	750	94	28	10022	0.2978723404255319	0.0373333333333333	query_1	['REAC:R-HSA-168256']	['CARD11', 'MAP3K8', 'AKT1', 'NFKBIE', 'NFKBIB', 'UBE2V1', 'MAP3K14', 'CHUK', 'TAB2', 'RELA', 'IKBKB', 'RBX1', 'FYB1', 'RBCK1', 'BTRC', 'NFKB1', 'SKP1', 'MALT1', 'FBXW11', 'IKBKG', 'MAP3K7', 'REL', 'TRAF6', 'NFKBIA', 'CUL1', 'FBXW7', 'BCL10', 'UBE2N']
230	GO:BP	GO:0044092	negative regulation of molecular function	7.66506798383608e-10	True	"""Any process that stops or reduces the rate or extent of a molecular function, an elemental biological activity occurring at the molecular level, such as catalysis or binding."" [GO:jl]"	971	101	27	15719	0.2673267326732673	0.0278063851699279	query_1	['GO:0065009']	['BAX', 'GSK3B', 'AKT1', 'NFKBIE', 'NFKBIB', 'TRAF3', 'PYDC2', 'CHUK', 'CARD8', 'IKBKB', 'RBCK1', 'BTRC', 'TNF', 'NFKB1', 'TNFSF14', 'TAX1BP1', 'BIRC3', 'TNFAIP3', 'AIM2', 'PYCARD', 'BIRC2', 'SFN', 'NFKBIA', 'APP', 'FBXW7', 'TP53', 'NLRP2']
78	REAC	REAC:R-HSA-5663205	Infectious disease	8.038594605133976e-10	True	Infectious disease	983	94	32	10022	0.3404255319148936	0.0325534079348931	query_1	['REAC:R-HSA-1643685']	['HSPA1A', 'GSK3B', 'AKT1', 'CREBBP', 'UBE2V1', 'TRAF3', 'HSP90AB1', 'CHUK', 'TAB2', 'RELA', 'IKBKB', 'IKBKE', 'RBX1', 'BTRC', 'TBK1', 'NFKB1', 'PSTPIP1', 'RIPK1', 'SKP1', 'NFKB2', 'HSP90AA1', 'IKBKG', 'TAB1', 'MAP3K7', 'MEFV', 'PYCARD', 'TRAF6', 'SFN', 'CASP1', 'APP', 'TAB3', 'UBE2N']
231	GO:BP	GO:2001242	regulation of intrinsic apoptotic signaling pathway	8.154030390109235e-10	True	"""Any process that modulates the frequency, rate or extent of intrinsic apoptotic signaling pathway."" [GOC:mtg_apoptosis]"	168	101	13	15719	0.1287128712871287	0.0773809523809523	query_1	['GO:0097193', 'GO:1902531', 'GO:2001233']	['BCL2L11', 'BAX', 'HSPA1A', 'AKT1', 'BCL2', 'MCL1', 'BID', 'BBC3', 'PYCARD', 'BCL2L1', 'FBXW7', 'TP53', 'BAD']
232	GO:BP	GO:0043525	positive regulation of neuron apoptotic process	8.205969206712682e-10	True	"""Any process that activates or increases the frequency, rate or extent of cell death of neurons by apoptotic process."" [GOC:go_curators, GOC:mtg_apoptosis]"	54	101	9	15719	0.0891089108910891	0.1666666666666666	query_1	['GO:0043065', 'GO:0043523', 'GO:0051402', 'GO:1901216']	['BCL2L11', 'BAX', 'FOXO3', 'FASLG', 'MCL1', 'TNF', 'BBC3', 'FBXW7', 'TP53']
233	GO:BP	GO:0051252	regulation of RNA metabolic process	9.71968248841414e-10	True	"""Any process that modulates the frequency, rate or extent of the chemical reactions and pathways involving RNA."" [GOC:ai]"	3448	101	52	15719	0.5148514851485149	0.0150812064965197	query_1	['GO:0016070', 'GO:0019219', 'GO:0060255']	['CARD11', 'HSPA1A', 'AKT1', 'TNFRSF1B', 'NFKBIE', 'CREBBP', 'NFKBIB', 'UBE2V1', 'TRAF3', 'PYDC2', 'CHUK', 'CARD8', 'TNFRSF1A', 'FOXO3', 'RELA', 'IKBKB', 'NLRC4', 'FASLG', 'IKBKE', 'RBCK1', 'BTRC', 'TBK1', 'TNF', 'RNF31', 'FADD', 'NFKB1', 'TNIP2', 'NLRP3', 'RIPK1', 'CFLAR', 'TRADD', 'MALT1', 'TNIP1', 'NFKB2', 'TAX1BP1', 'FBXW11', 'IKBKG', 'TRAF2', 'MAP3K7', 'TNFAIP3', 'AIM2', 'RELB', 'PYCARD', 'REL', 'TRAF6', 'BIRC2', 'NFKBIA', 'APP', 'TP53', 'BCL10', 'UBE2N', 'NLRP2']
234	GO:BP	GO:0009896	positive regulation of catabolic process	1.0809550176168276e-09	True	"""Any process that activates or increases the frequency, rate or extent of the chemical reactions and pathways resulting in the breakdown of substances."" [GOC:go_curators]"	512	101	20	15719	0.198019801980198	0.0390625	query_1	['GO:0009056', 'GO:0009893', 'GO:0009894']	['BCL2L11', 'BAX', 'HSPA1A', 'GSK3B', 'AKT1', 'TNFRSF1B', 'FOXO3', 'RBX1', 'TBK1', 'TNF', 'RNF31', 'HSP90AA1', 'SNX33', 'IKBKG', 'MAP3K7', 'TNFAIP3', 'MEFV', 'APP', 'FBXW7', 'BAD']
235	GO:BP	GO:0034654	nucleobase-containing compound biosynthetic process	1.1827245864218634e-09	True	"""The chemical reactions and pathways resulting in the formation of nucleobases, nucleosides, nucleotides and nucleic acids."" [GOC:mah]"	3709	101	54	15719	0.5346534653465347	0.0145591803720679	query_1	['GO:0006139', 'GO:0018130', 'GO:0019438', 'GO:0044271', 'GO:1901362']	['CARD11', 'HSPA1A', 'AKT1', 'TNFRSF1B', 'NFKBIE', 'CREBBP', 'NFKBIB', 'UBE2V1', 'TRAF3', 'PYDC2', 'HSP90AB1', 'CHUK', 'CARD8', 'TNFRSF1A', 'FOXO3', 'RELA', 'IKBKB', 'NLRC4', 'FASLG', 'IKBKE', 'RBCK1', 'BTRC', 'TBK1', 'TNF', 'RNF31', 'FADD', 'NFKB1', 'TNIP2', 'NLRP3', 'RIPK1', 'CFLAR', 'TRADD', 'MALT1', 'TNIP1', 'NFKB2', 'HSP90AA1', 'TAX1BP1', 'FBXW11', 'IKBKG', 'TRAF2', 'MAP3K7', 'TNFAIP3', 'AIM2', 'RELB', 'PYCARD', 'REL', 'TRAF6', 'BIRC2', 'NFKBIA', 'APP', 'TP53', 'BCL10', 'UBE2N', 'NLRP2']
10	GO:CC	GO:0031265	CD95 death-inducing signaling complex	1.1893855024893874e-09	True	"""A protein complex formed upon binding of Fas/CD95/APO-1 to its ligand. The complex includes FADD/Mort1, procaspase-8/10 and c-FLIP in addition to the ligand-bound receptor."" [PMID:12628743, PMID:12655293]"	6	101	5	16420	0.0495049504950495	0.8333333333333334	query_1	['GO:0031264']	['CASP10', 'FAS', 'FADD', 'CFLAR', 'CASP8']
11	GO:CC	GO:0071159	NF-kappaB complex	1.1893855024893874e-09	True	"""A protein complex that consists of a homo- or heterodimer of members of a family of structurally related proteins that contain a conserved N-terminal region called the Rel homology domain (RHD). In the nucleus, NF-kappaB complexes act as transcription factors. In unstimulated cells, NF-kappaB dimers are sequestered in the cytoplasm by IkappaB monomers; signals that induce NF-kappaB activity cause degradation of IkappaB, allowing NF-kappaB dimers to translocate to the nucleus and induce gene expression."" [ISBN:0849327946]"	6	101	5	16420	0.0495049504950495	0.8333333333333334	query_1	['GO:0140513']	['RELA', 'NFKB1', 'NFKB2', 'RELB', 'REL']
12	GO:CC	GO:0097342	ripoptosome	1.1893855024893874e-09	True	"""A protein complex whose core components are the receptor-interacting serine/threonine-protein kinases RIPK1 and RIPK3 (also called RIP1 and RIP3). Formation of the ripoptosome can induce an extrinsic apoptotic signaling pathway or a necroptotic signaling pathway. The composition of this protein complex may depend on several factors including nature of the signal, cell type and more."" [GOC:bhm, GOC:mtg_apoptosis, PMID:22265414, PMID:22274400]"	6	101	5	16420	0.0495049504950495	0.8333333333333334	query_1	['GO:0005829', 'GO:1902494']	['CASP10', 'FADD', 'RIPK1', 'CFLAR', 'CASP8']
236	GO:BP	GO:0070423	nucleotide-binding oligomerization domain containing signaling pathway	1.2248513606400831e-09	True	"""The series of molecular signals initiated by the binding of a ligand (such as a bacterial peptidoglycan) to a cytoplasmic nucleotide-binding oligomerization domain containing (NOD) protein receptor, and ending with regulation of a downstream cellular process."" [GOC:add, PMID:17944960, PMID:18585455]"	23	101	7	15719	0.0693069306930693	0.3043478260869565	query_1	['GO:0002753', 'GO:0035872']	['HSPA1A', 'RELA', 'BIRC3', 'MAP3K7', 'TNFAIP3', 'BIRC2', 'NFKBIA']
237	GO:BP	GO:0045321	leukocyte activation	1.2988539347310763e-09	True	"""A change in morphology and behavior of a leukocyte resulting from exposure to a specific antigen, mitogen, cytokine, cellular ligand, or soluble factor."" [GOC:add]"	920	101	26	15719	0.2574257425742574	0.0282608695652173	query_1	['GO:0001775', 'GO:0002376']	['CARD11', 'BAX', 'MAP3K8', 'AKT1', 'TNFRSF1B', 'BCL2', 'FOXO3', 'AZI2', 'TNF', 'FADD', 'TNIP2', 'BID', 'NLRP3', 'TNFSF14', 'MALT1', 'TNFAIP3', 'LTBR', 'RELB', 'PYCARD', 'TRAF6', 'BAK1', 'CASP8', 'APP', 'TP53', 'BCL10', 'BAD']
79	REAC	REAC:R-HSA-5633008	TP53 Regulates Transcription of Cell Death Genes	1.4821063841633268e-09	True	TP53 Regulates Transcription of Cell Death Genes	44	94	9	10022	0.0957446808510638	0.2045454545454545	query_1	['REAC:R-HSA-3700989']	['BAX', 'CREBBP', 'CASP10', 'NLRC4', 'FAS', 'BID', 'BBC3', 'CASP1', 'TP53']
80	REAC	REAC:R-HSA-114452	Activation of BH3-only proteins	1.55507969810241e-09	True	Activation of BH3-only proteins	30	94	8	10022	0.0851063829787234	0.2666666666666666	query_1	['REAC:R-HSA-109606']	['BCL2L11', 'AKT1', 'BCL2', 'BID', 'BBC3', 'SFN', 'TP53', 'BAD']
238	GO:BP	GO:0042110	T cell activation	1.6590753805058786e-09	True	"""The change in morphology and behavior of a mature or immature T cell resulting from exposure to a mitogen, cytokine, chemokine, cellular ligand, or an antigen for which it is specific."" [GOC:mgi_curators, ISBN:0781735149]"	525	101	20	15719	0.198019801980198	0.0380952380952381	query_1	['GO:0046649']	['CARD11', 'BAX', 'MAP3K8', 'AKT1', 'TNFRSF1B', 'BCL2', 'FOXO3', 'AZI2', 'FADD', 'BID', 'NLRP3', 'TNFSF14', 'MALT1', 'RELB', 'PYCARD', 'TRAF6', 'CASP8', 'TP53', 'BCL10', 'BAD']
239	GO:BP	GO:0070269	pyroptosis	1.6916035463440934e-09	True	"""A caspase-1-dependent cell death subroutine that is associated with the generation of pyrogenic mediators such as IL-1beta and IL-18."" [GOC:mtg_apoptosis, PMID:18846107, PMID:21760595]"	24	101	7	15719	0.0693069306930693	0.2916666666666667	query_1	['GO:0012501']	['NLRC4', 'AIM2', 'MEFV', 'PYCARD', 'NLRP1', 'CASP1', 'CASP8']
240	GO:BP	GO:0035872	nucleotide-binding domain, leucine rich repeat containing receptor signaling pathway	1.6916035463440934e-09	True	"""The series of molecular signals initiated by a ligand binding to a nucleotide-binding domain, leucine rich repeat containing receptor (NLR), and ending with the regulation of a downstream cellular process. NLRs are cytoplasmic receptors defined by their tripartite domain architecture that contains: a variable C-terminus, a middle nucleotide-binding domain, and a LRR domain that is variable in the repeats composition and number."" [GOC:sj, PMID:18280719]"	24	101	7	15719	0.0693069306930693	0.2916666666666667	query_1	['GO:0030522']	['HSPA1A', 'RELA', 'BIRC3', 'MAP3K7', 'TNFAIP3', 'BIRC2', 'NFKBIA']
81	REAC	REAC:R-HSA-5602358	Diseases associated with the TLR signaling cascade	2.0298596095689715e-09	True	Diseases associated with the TLR signaling cascade	31	94	8	10022	0.0851063829787234	0.2580645161290322	query_1	['REAC:R-HSA-5260271']	['TRAF3', 'CHUK', 'RELA', 'IKBKB', 'NFKB1', 'NFKB2', 'IKBKG', 'NFKBIA']
82	REAC	REAC:R-HSA-5260271	Diseases of Immune System	2.0298596095689715e-09	True	Diseases of Immune System	31	94	8	10022	0.0851063829787234	0.2580645161290322	query_1	['REAC:R-HSA-1643685']	['TRAF3', 'CHUK', 'RELA', 'IKBKB', 'NFKB1', 'NFKB2', 'IKBKG', 'NFKBIA']
241	GO:BP	GO:1902110	positive regulation of mitochondrial membrane permeability involved in apoptotic process	2.068132889483657e-09	True	"""Any positive regulation of mitochondrial membrane permeability that is involved in apoptotic process."" [GOC:mtg_apoptosis, GOC:pm, GOC:TermGenie, PMID:19168129]"	40	101	8	15719	0.0792079207920792	0.2	query_1	['GO:1902108', 'GO:1902686']	['BCL2L11', 'BAX', 'HSPA1A', 'GSK3B', 'BID', 'BBC3', 'BCL2L1', 'BAK1']
242	GO:BP	GO:0018130	heterocycle biosynthetic process	2.331417536018968e-09	True	"""The chemical reactions and pathways resulting in the formation of heterocyclic compounds, those with a cyclic molecular structure and at least two different atoms in the ring (or rings)."" [ISBN:0198547684]"	3775	101	54	15719	0.5346534653465347	0.0143046357615894	query_1	['GO:0044249', 'GO:0046483']	['CARD11', 'HSPA1A', 'AKT1', 'TNFRSF1B', 'NFKBIE', 'CREBBP', 'NFKBIB', 'UBE2V1', 'TRAF3', 'PYDC2', 'HSP90AB1', 'CHUK', 'CARD8', 'TNFRSF1A', 'FOXO3', 'RELA', 'IKBKB', 'NLRC4', 'FASLG', 'IKBKE', 'RBCK1', 'BTRC', 'TBK1', 'TNF', 'RNF31', 'FADD', 'NFKB1', 'TNIP2', 'NLRP3', 'RIPK1', 'CFLAR', 'TRADD', 'MALT1', 'TNIP1', 'NFKB2', 'HSP90AA1', 'TAX1BP1', 'FBXW11', 'IKBKG', 'TRAF2', 'MAP3K7', 'TNFAIP3', 'AIM2', 'RELB', 'PYCARD', 'REL', 'TRAF6', 'BIRC2', 'NFKBIA', 'APP', 'TP53', 'BCL10', 'UBE2N', 'NLRP2']
243	GO:BP	GO:0070059	intrinsic apoptotic signaling pathway in response to endoplasmic reticulum stress	2.462513616060862e-09	True	"""The series of molecular signals in which an intracellular signal is conveyed to trigger the apoptotic death of a cell. The pathway is induced in response to a stimulus indicating endoplasmic reticulum (ER) stress, and ends when the execution phase of apoptosis is triggered. ER stress usually results from the accumulation of unfolded or misfolded proteins in the ER lumen."" [GOC:mah, GOC:mtg_apoptosis, PMID:18701708]"	61	101	9	15719	0.0891089108910891	0.1475409836065573	query_1	['GO:0034976', 'GO:0097193']	['BCL2L11', 'BAX', 'HSPA1A', 'BCL2', 'BBC3', 'TRAF2', 'BCL2L1', 'BAK1', 'TP53']
244	GO:BP	GO:0019438	aromatic compound biosynthetic process	2.5701068742583347e-09	True	"""The chemical reactions and pathways resulting in the formation of aromatic compounds, any substance containing an aromatic carbon ring."" [GOC:ai]"	3785	101	54	15719	0.5346534653465347	0.0142668428005284	query_1	['GO:0006725', 'GO:0044249']	['CARD11', 'HSPA1A', 'AKT1', 'TNFRSF1B', 'NFKBIE', 'CREBBP', 'NFKBIB', 'UBE2V1', 'TRAF3', 'PYDC2', 'HSP90AB1', 'CHUK', 'CARD8', 'TNFRSF1A', 'FOXO3', 'RELA', 'IKBKB', 'NLRC4', 'FASLG', 'IKBKE', 'RBCK1', 'BTRC', 'TBK1', 'TNF', 'RNF31', 'FADD', 'NFKB1', 'TNIP2', 'NLRP3', 'RIPK1', 'CFLAR', 'TRADD', 'MALT1', 'TNIP1', 'NFKB2', 'HSP90AA1', 'TAX1BP1', 'FBXW11', 'IKBKG', 'TRAF2', 'MAP3K7', 'TNFAIP3', 'AIM2', 'RELB', 'PYCARD', 'REL', 'TRAF6', 'BIRC2', 'NFKBIA', 'APP', 'TP53', 'BCL10', 'UBE2N', 'NLRP2']
245	GO:BP	GO:0010467	gene expression	2.603425277857072e-09	True	"""The process in which a gene's sequence is converted into a mature gene product (protein or RNA). This includes the production of an RNA transcript and its processing, translation and maturation for protein-coding genes."" [GOC:txnOH-2018, PMID:25934543, PMID:31580950]"	5541	101	67	15719	0.6633663366336634	0.0120916802021295	query_1	['GO:0043170']	['CARD11', 'HSPA1A', 'GSK3B', 'AKT1', 'TNFRSF1B', 'NFKBIE', 'CREBBP', 'NFKBIB', 'UBE2V1', 'TRAF3', 'PYDC2', 'BCL2', 'HSP90AB1', 'CHUK', 'CARD8', 'TNFRSF1A', 'FOXO3', 'RELA', 'IKBKB', 'NLRC4', 'FASLG', 'IKBKE', 'RBCK1', 'BTRC', 'TBK1', 'TNF', 'RNF31', 'FADD', 'NFKB1', 'TNIP2', 'NLRP3', 'LTA', 'RIPK1', 'CFLAR', 'TRADD', 'MALT1', 'LTB', 'TNIP1', 'NFKB2', 'XPNPEP3', 'HSP90AA1', 'TAX1BP1', 'FBXW11', 'IKBKG', 'TRAF2', 'MAP3K7', 'TNFAIP3', 'AIM2', 'MEFV', 'RELB', 'PYCARD', 'REL', 'NLRP1', 'TRAF6', 'BIRC2', 'NFKBIA', 'BAK1', 'CASP1', 'CASP8', 'APP', 'FBXW7', 'TP53', 'BCL10', 'UBE2N', 'BAD', 'NLRP2', 'CDC37']
83	REAC	REAC:R-HSA-162582	Signal Transduction	2.631911242190185e-09	True	Signal Transduction	2438	94	51	10022	0.5425531914893617	0.0209187858900738	query_1	['REAC:0000000']	['SHARPIN', 'BCL2L11', 'BAX', 'STIP1', 'GSK3B', 'AKT1', 'CREBBP', 'BCL2', 'CASP10', 'HSP90AB1', 'CHUK', 'TNFRSF1A', 'TAB2', 'FOXO3', 'RELA', 'IKBKB', 'FKBP5', 'FASLG', 'RBX1', 'RBCK1', 'BTRC', 'TNF', 'FAS', 'RNF31', 'FADD', 'NFKB1', 'RIPK1', 'SKP1', 'CFLAR', 'TRADD', 'HSP90AA1', 'TAX1BP1', 'IKBKG', 'TAB1', 'BIRC3', 'TRAF2', 'MAP3K7', 'TNFAIP3', 'TRAF6', 'BIRC2', 'BCL2L1', 'SFN', 'NFKBIA', 'CASP8', 'APP', 'TAB3', 'CUL1', 'RHPN2', 'TP53', 'BAD', 'CDC37']
84	REAC	REAC:R-HSA-5660668	CLEC7A/inflammasome pathway	2.631911242190185e-09	True	CLEC7A/inflammasome pathway	6	94	5	10022	0.0531914893617021	0.8333333333333334	query_1	['REAC:R-HSA-5607764']	['RELA', 'NFKB1', 'MALT1', 'PYCARD', 'CASP8']
246	GO:BP	GO:0006807	nitrogen compound metabolic process	2.91510868770403e-09	True	"""The chemical reactions and pathways involving organic or inorganic compounds that contain nitrogen."" [GOC:jl, ISBN:0198506732]"	8936	101	87	15719	0.8613861386138614	0.0097358997314234	query_1	['GO:0008152']	['SHARPIN', 'BCL2L11', 'CARD11', 'BAX', 'MAP3K8', 'TANK', 'HSPA1A', 'GSK3B', 'AKT1', 'TNFRSF1B', 'NFKBIE', 'CREBBP', 'NFKBIB', 'UBE2V1', 'MAP3K14', 'TRAF3', 'PYDC2', 'BCL2', 'CASP10', 'HSP90AB1', 'CHUK', 'CARD8', 'TNFRSF1A', 'TAB2', 'FOXO3', 'RELA', 'IKBKB', 'NLRC4', 'FKBP5', 'FASLG', 'CASP5', 'IKBKE', 'RBX1', 'RBCK1', 'BTRC', 'TBK1', 'TNF', 'FAS', 'RNF31', 'FADD', 'NFKB1', 'TNIP2', 'BID', 'NLRP3', 'BBC3', 'RIPK1', 'SKP1', 'CFLAR', 'TNFSF14', 'TRADD', 'MALT1', 'TNIP1', 'NFKB2', 'XPNPEP3', 'HSP90AA1', 'TAX1BP1', 'FBXW11', 'SNX33', 'IKBKG', 'TAB1', 'BIRC3', 'TRAF2', 'MAP3K7', 'TNFAIP3', 'AIM2', 'MEFV', 'RELB', 'PYCARD', 'REL', 'COG7', 'NLRP1', 'TRAF6', 'BIRC2', 'SFN', 'NFKBIA', 'BAK1', 'CASP1', 'CASP8', 'APP', 'CUL1', 'FBXW7', 'TP53', 'BCL10', 'UBE2N', 'BAD', 'NLRP2', 'CDC37']
247	GO:BP	GO:2001234	negative regulation of apoptotic signaling pathway	2.918351749106274e-09	True	"""Any process that stops, prevents or reduces the frequency, rate or extent of apoptotic signaling pathway."" [GOC:mtg_apoptosis]"	228	101	14	15719	0.1386138613861386	0.0614035087719298	query_1	['GO:0009968', 'GO:0043066', 'GO:0097190', 'GO:2001233']	['BAX', 'HSPA1A', 'GSK3B', 'AKT1', 'BCL2', 'RELA', 'MCL1', 'TNF', 'BID', 'RIPK1', 'CFLAR', 'TNFAIP3', 'BCL2L1', 'BAK1']
248	GO:BP	GO:1902686	mitochondrial outer membrane permeabilization involved in programmed cell death	3.052487644538919e-09	True	"""The process by which the mitochondrial outer membrane becomes permeable to the passing of proteins and other molecules from the intermembrane space to the cytosol as part of a programmed cell death process."" [GO_REF:0000060, GOC:mtg_apoptosis, GOC:pg, GOC:TermGenie, PMID:20151314]"	42	101	8	15719	0.0792079207920792	0.1904761904761904	query_1	['GO:0012501', 'GO:0035794']	['BCL2L11', 'BAX', 'HSPA1A', 'GSK3B', 'BID', 'BBC3', 'BCL2L1', 'BAK1']
249	GO:BP	GO:0071496	cellular response to external stimulus	3.096632702771113e-09	True	"""Any process that results in a change in state or activity of a cell (in terms of movement, secretion, enzyme production, gene expression, etc.) as a result of an external stimulus."" [GOC:mah]"	322	101	16	15719	0.1584158415841584	0.0496894409937888	query_1	['GO:0009605']	['MAP3K14', 'BCL2', 'TNFRSF1A', 'FOXO3', 'CASP5', 'FAS', 'FADD', 'NFKB1', 'TNFSF14', 'LTBR', 'BAK1', 'CASP1', 'CASP8', 'TP53', 'BCL10', 'BAD']
250	GO:BP	GO:0031398	positive regulation of protein ubiquitination	3.677465786956215e-09	True	"""Any process that activates or increases the frequency, rate or extent of the addition of ubiquitin groups to a protein."" [GOC:mah]"	119	101	11	15719	0.1089108910891089	0.0924369747899159	query_1	['GO:0016567', 'GO:0031396', 'GO:1903322']	['UBE2V1', 'RBX1', 'BTRC', 'SKP1', 'MALT1', 'BIRC3', 'TRAF6', 'BIRC2', 'FBXW7', 'BCL10', 'UBE2N']
251	GO:BP	GO:0002753	cytosolic pattern recognition receptor signaling pathway	3.973158220977922e-09	True	"""The series of molecular signals initiated by the binding of a ligand from another organism to a cytosolic pattern recognition receptor (PRR). PRRs bind pathogen-associated molecular pattern (PAMPs), structures conserved among microbial species."" [GOC:add, GOC:ar, ISBN:0781735149, PMID:15199967, PMID:17328678, PMID:18272355, PMID:19531363, PMID:21187438]"	90	101	10	15719	0.099009900990099	0.1111111111111111	query_1	['GO:0002221', 'GO:0030522']	['HSPA1A', 'RELA', 'TNF', 'TNIP2', 'BIRC3', 'MAP3K7', 'TNFAIP3', 'TRAF6', 'BIRC2', 'NFKBIA']
252	GO:BP	GO:0043412	macromolecule modification	4.762192460017028e-09	True	"""The covalent alteration of one or more monomeric units in a polypeptide, polynucleotide, polysaccharide, or other biological macromolecule, resulting in a change in its properties."" [GOC:go_curators]"	3600	101	52	15719	0.5148514851485149	0.0144444444444444	query_1	['GO:0043170']	['SHARPIN', 'BAX', 'MAP3K8', 'TANK', 'HSPA1A', 'GSK3B', 'AKT1', 'CREBBP', 'UBE2V1', 'MAP3K14', 'TRAF3', 'BCL2', 'HSP90AB1', 'CHUK', 'TNFRSF1A', 'TAB2', 'RELA', 'IKBKB', 'FKBP5', 'IKBKE', 'RBX1', 'RBCK1', 'BTRC', 'TBK1', 'TNF', 'FAS', 'RNF31', 'RIPK1', 'SKP1', 'MALT1', 'TNIP1', 'HSP90AA1', 'FBXW11', 'TAB1', 'BIRC3', 'TRAF2', 'MAP3K7', 'TNFAIP3', 'MEFV', 'PYCARD', 'COG7', 'TRAF6', 'BIRC2', 'SFN', 'BAK1', 'APP', 'CUL1', 'FBXW7', 'TP53', 'BCL10', 'UBE2N', 'CDC37']
253	GO:BP	GO:0001775	cell activation	4.895335637053506e-09	True	"""A multicellular organismal process by which exposure to an activating factor such as a cellular or soluble ligand results in a change in the morphology or behavior of a cell."" [GOC:mgi_curators]"	1059	101	27	15719	0.2673267326732673	0.0254957507082152	query_1	['GO:0009987', 'GO:0032501']	['CARD11', 'BAX', 'MAP3K8', 'AKT1', 'TNFRSF1B', 'BCL2', 'FOXO3', 'AZI2', 'TNF', 'FADD', 'TNIP2', 'BID', 'NLRP3', 'TNFSF14', 'MALT1', 'NFKB2', 'TNFAIP3', 'LTBR', 'RELB', 'PYCARD', 'TRAF6', 'BAK1', 'CASP8', 'APP', 'TP53', 'BCL10', 'BAD']
254	GO:BP	GO:0046649	lymphocyte activation	5.175507826463032e-09	True	"""A change in morphology and behavior of a lymphocyte resulting from exposure to a specific antigen, mitogen, cytokine, chemokine, cellular ligand, or soluble factor."" [GOC:mgi_curators, ISBN:0781735149]"	762	101	23	15719	0.2277227722772277	0.0301837270341207	query_1	['GO:0045321']	['CARD11', 'BAX', 'MAP3K8', 'AKT1', 'TNFRSF1B', 'BCL2', 'FOXO3', 'AZI2', 'FADD', 'TNIP2', 'BID', 'NLRP3', 'TNFSF14', 'MALT1', 'TNFAIP3', 'RELB', 'PYCARD', 'TRAF6', 'BAK1', 'CASP8', 'TP53', 'BCL10', 'BAD']
13	GO:CC	GO:1990234	transferase complex	5.9330565607198595e-09	True	"""A protein complex capable of catalyzing the transfer of a group, e.g. a methyl group, glycosyl group, acyl group, phosphorus-containing, or other groups, from one compound (generally regarded as the donor) to another compound (generally regarded as the acceptor)."" [GOC:bhm, PMID:16540464]"	854	101	24	16420	0.2376237623762376	0.0281030444964871	query_1	['GO:1902494']	['SHARPIN', 'TANK', 'CREBBP', 'UBE2V1', 'TRAF3', 'CHUK', 'IKBKB', 'TBKBP1', 'IKBKE', 'RBX1', 'RBCK1', 'AZI2', 'BTRC', 'TBK1', 'RNF31', 'SKP1', 'FBXW11', 'IKBKG', 'TRAF2', 'MAP3K7', 'PYCARD', 'CUL1', 'FBXW7', 'UBE2N']
255	GO:BP	GO:0001776	leukocyte homeostasis	7.471100361206353e-09	True	"""The process of regulating the proliferation and elimination of cells of the immune system such that the total number of cells of a particular cell type within a whole or part of an organism is stable over time in the absence of an outside stimulus."" [GOC:add, ISBN:0781735149]"	96	101	10	15719	0.099009900990099	0.1041666666666666	query_1	['GO:0002376', 'GO:0048872']	['BCL2L11', 'BAX', 'AKT1', 'BCL2', 'FAS', 'FADD', 'TNFSF14', 'TNFAIP3', 'BAK1', 'BCL10']
