Williams syndrome	source	native	name	Corrected p_value	significant	description	term_size	query_size	intersection_size	effective_domain_size	precision	recall	query	parents	intersections
247	GO:BP	GO:0045321	leukocyte activation	2.2653297548648278e-07	True	"""A change in morphology and behavior of a leukocyte resulting from exposure to a specific antigen, mitogen, cytokine, cellular ligand, or soluble factor."" [GOC:add]"	920	118	25	15719	0.211864406779661	0.0271739130434782	query_1	['GO:0001775', 'GO:0002376']	['ITGB1', 'FN1', 'SRC', 'PIK3R1', 'ITK', 'PLCG2', 'SOS1', 'FYN', 'ITGA4', 'LAT', 'ZAP70', 'LYN', 'LCP2', 'VAV1', 'SYK', 'ERBB2', 'PTK2B', 'SH3KBP1', 'GAB2', 'VCAM1', 'ITGB6', 'LCK', 'THBS1', 'CBL', 'PTPN11']
249	GO:BP	GO:0071675	regulation of mononuclear cell migration	2.340506878513473e-07	True	"""Any process that modulates the rate, frequency or extent of mononuclear cell migration. Mononuclear cell migration is the movement of a mononuclear cell within or between different tissues and organs of the body."" [GOC:mah]"	116	118	10	15719	0.0847457627118644	0.0862068965517241	query_1	['GO:0002685', 'GO:0071674']	['ITGB3', 'CRK', 'ITGA4', 'MADCAM1', 'LYN', 'PTK2B', 'CRKL', 'PTK2', 'THBS1', 'JAM2']
250	GO:BP	GO:0001935	endothelial cell proliferation	2.549270317834155e-07	True	"""The multiplication or reproduction of endothelial cells, resulting in the expansion of a cell population. Endothelial cells are thin flattened cells which line the inside surfaces of body cavities, blood vessels, and lymph vessels, making up the endothelium."" [GOC:add, ISBN:0781735149]"	151	118	11	15719	0.0932203389830508	0.0728476821192053	query_1	['GO:0050673']	['VEGFB', 'ITGB3', 'ITGA4', 'NRP2', 'KDR', 'PLCG1', 'VEGFA', 'NRP1', 'THBS1', 'FLT1', 'PGF']
76	REAC	REAC:R-HSA-8876384	Listeria monocytogenes entry into host cells	2.70605177511778e-07	True	Listeria monocytogenes entry into host cells	19	108	6	10022	0.0555555555555555	0.3157894736842105	query_1	['REAC:R-HSA-5663205']	['MET', 'SRC', 'CDH1', 'SH3KBP1', 'SH3GL2', 'CBL']
75	REAC	REAC:R-HSA-2730905	Role of LAT2/NTAL/LAB on calcium mobilization	2.70605177511778e-07	True	Role of LAT2/NTAL/LAB on calcium mobilization	19	108	6	10022	0.0555555555555555	0.3157894736842105	query_1	['REAC:R-HSA-2454202']	['PIK3R1', 'SOS1', 'FYN', 'LYN', 'SYK', 'GAB2']
251	GO:BP	GO:0038095	Fc-epsilon receptor signaling pathway	2.7268113674555165e-07	True	"""The series of molecular signals initiated by the binding of the Fc portion of immunoglobulin E (IgE) to an Fc-epsilon receptor on the surface of a target cell, and ending with the regulation of a downstream cellular process, e.g. transcription. The Fc portion of an immunoglobulin is its C-terminal constant region."" [GOC:phg, PMID:12413516, PMID:15048725]"	24	118	6	15719	0.0508474576271186	0.25	query_1	['GO:0038093']	['PLCG2', 'SOS1', 'LYN', 'VAV1', 'SYK', 'PLCG1']
252	GO:BP	GO:0051893	regulation of focal adhesion assembly	2.728060398186e-07	True	"""Any process that modulates the frequency, rate or extent of focal adhesion formation, the establishment and maturation of focal adhesions."" [GOC:ai]"	62	118	8	15719	0.0677966101694915	0.1290322580645161	query_1	['GO:0001952', 'GO:0048041', 'GO:0090109']	['SRC', 'KDR', 'VCL', 'VEGFA', 'TLN1', 'PTK2', 'NRP1', 'THBS1']
253	GO:BP	GO:0090109	regulation of cell-substrate junction assembly	2.728060398186e-07	True	"""Any process that modulates the rate, frequency, or extent of cell-substrate junction assembly. Cell-substrate junction assembly is the aggregation, arrangement and bonding together of a set of components to form a junction between a cell and its substrate."" [GOC:dph, GOC:tb]"	62	118	8	15719	0.0677966101694915	0.1290322580645161	query_1	['GO:0007044', 'GO:0150116', 'GO:1901888']	['SRC', 'KDR', 'VCL', 'VEGFA', 'TLN1', 'PTK2', 'NRP1', 'THBS1']
77	REAC	REAC:R-HSA-373760	L1CAM interactions	2.807803848980771e-07	True	L1CAM interactions	114	108	11	10022	0.1018518518518518	0.0964912280701754	query_1	['REAC:R-HSA-422475']	['ITGB1', 'ITGA9', 'ITGAV', 'ITGB3', 'ITGA2B', 'ITGA5', 'NRP2', 'EGFR', 'SH3GL2', 'L1CAM', 'NRP1']
254	GO:BP	GO:0007411	axon guidance	2.831720280198603e-07	True	"""The chemotaxis process that directs the migration of an axon growth cone to a specific target site in response to a combination of attractive and repulsive cues."" [ISBN:0878932437]"	232	118	13	15719	0.1101694915254237	0.0560344827586206	query_1	['GO:0007409', 'GO:0097485']	['PLXNB1', 'RET', 'SOS1', 'FYN', 'NRP2', 'ERBB2', 'MUSK', 'VEGFA', 'L1CAM', 'PTK2', 'NRP1', 'SEMA4D', 'PLXNA1']
255	GO:BP	GO:0097485	neuron projection guidance	2.968691344486483e-07	True	"""The process in which the migration of a neuron projection is directed to a specific target site in response to a combination of attractive and repulsive cues."" [GOC:BHF, GOC:rl, PMID:22790009]"	233	118	13	15719	0.1101694915254237	0.055793991416309	query_1	['GO:0006935', 'GO:0031175', 'GO:0048812']	['PLXNB1', 'RET', 'SOS1', 'FYN', 'NRP2', 'ERBB2', 'MUSK', 'VEGFA', 'L1CAM', 'PTK2', 'NRP1', 'SEMA4D', 'PLXNA1']
256	GO:BP	GO:0001704	formation of primary germ layer	3.159303873959906e-07	True	"""The formation of the ectoderm, mesoderm and endoderm during gastrulation."" [GOC:go_curators]"	120	118	10	15719	0.0847457627118644	0.0833333333333333	query_1	['GO:0007369', 'GO:0048646']	['ITGB1', 'ITGB5', 'FN1', 'ITGAV', 'ITGB3', 'ITGA5', 'ITGA4', 'GRB2', 'VTN', 'ITGA3']
257	GO:BP	GO:0009790	embryo development	3.182493614941339e-07	True	"""The process whose specific outcome is the progression of an embryo from its formation until the end of its embryonic life stage. The end of the embryonic stage is organism-specific. For example, for mammals, the process would begin with zygote formation and end with birth. For insects, the process would begin at zygote formation and end with larval hatching. For plant zygotic embryos, this would be from zygote formation to the end of seed dormancy. For plant vegetative embryos, this would be from the initial determination of the cell or group of cells to form an embryo until the point when the embryo becomes independent of the parent plant."" [GOC:go_curators, GOC:isa_complete, GOC:mtg_sensu]"	1083	118	27	15719	0.2288135593220339	0.0249307479224376	query_1	['GO:0007275']	['ITGB1', 'ITGB5', 'FN1', 'ITGAV', 'ITGB3', 'TGFB3', 'RET', 'LRP4', 'SOS1', 'ITGA5', 'ITGA4', 'SH3PXD2A', 'GRB2', 'NRP2', 'EGFR', 'FBN1', 'KDR', 'FBN2', 'PLCG1', 'VEGFA', 'MFAP2', 'MFAP5', 'VTN', 'NRP1', 'ITGA3', 'PDGFRA', 'FLT1']
258	GO:BP	GO:0044409	entry into host	3.243935733835675e-07	True	"""Entry of a symbiont into the body, tissues, or cells of a host organism as part of the symbiont life cycle. The host is defined as the larger of the organisms involved in a symbiotic interaction."" [GOC:vw]"	155	118	11	15719	0.0932203389830508	0.0709677419354838	query_1	['GO:0044000']	['ITGB1', 'ITGB5', 'ITGAV', 'SRC', 'ITGB3', 'ITGA5', 'EGFR', 'ITGB6', 'NRP1', 'ITGB7', 'CBL']
259	GO:BP	GO:0043491	protein kinase B signaling	3.370343719331524e-07	True	"""A series of reactions, mediated by the intracellular serine/threonine kinase protein kinase B (also called AKT), which occurs as a result of a single trigger reaction or compound."" [GOC:bf, PMID:20517722]"	194	118	12	15719	0.1016949152542373	0.0618556701030927	query_1	['GO:0035556']	['MET', 'RAPGEF1', 'ITGB1', 'VEGFB', 'SRC', 'RET', 'LOX', 'EGFR', 'KDR', 'VEGFA', 'PTK2', 'THBS1']
260	GO:BP	GO:0060284	regulation of cell development	3.430407139106709e-07	True	"""Any process that modulates the rate, frequency or extent of the progression of the cell over time, from its formation to the mature structure. Cell development does not include the steps involved in committing a cell to a specific fate."" [GOC:dph, GOC:tb]"	803	118	23	15719	0.1949152542372881	0.0286425902864259	query_1	['GO:0045595', 'GO:0048468']	['LIMK1', 'ITGB1', 'PLXNB1', 'FN1', 'SPP1', 'PIK3R1', 'RET', 'LRP4', 'SOS1', 'LOX', 'ZAP70', 'LYN', 'FBN1', 'VCL', 'SYK', 'ERBB2', 'CDH1', 'PTK2B', 'VEGFA', 'L1CAM', 'NRP1', 'SEMA4D', 'PLXNA1']
261	GO:BP	GO:0010243	response to organonitrogen compound	3.430407139106709e-07	True	"""Any process that results in a change in state or activity of a cell or an organism (in terms of movement, secretion, enzyme production, gene expression, etc.) as a result of an organonitrogen stimulus. An organonitrogen compound is formally a compound containing at least one carbon-nitrogen bond."" [PMID:9869419]"	1014	118	26	15719	0.2203389830508474	0.0256410256410256	query_1	['GO:0010033', 'GO:1901698']	['RAPGEF1', 'ITGB1', 'BCAR1', 'SRC', 'ITGB3', 'PIK3R1', 'CRK', 'SHC1', 'SOS1', 'GAB1', 'PXN', 'FYN', 'ITGA4', 'LYN', 'GRB2', 'EGFR', 'FBN1', 'SYK', 'CDH1', 'PTK2B', 'AGRN', 'CRKL', 'VCAM1', 'PTK2', 'PTPN11', 'PDGFRA']
262	GO:BP	GO:0031032	actomyosin structure organization	3.9521998785557874e-07	True	"""A process that is carried out at the cellular level which results in the assembly, arrangement of constituent parts, or disassembly of cytoskeletal structures containing both actin and myosin or paramyosin. The myosin may be organized into filaments."" [GOC:dph, GOC:jl, GOC:mah]"	197	118	12	15719	0.1016949152542373	0.0609137055837563	query_1	['GO:0030036']	['LIMK1', 'MET', 'ITGB1', 'ITGB5', 'SRC', 'TGFB3', 'PIK3R1', 'PXN', 'PTK2B', 'NRP1', 'ELN', 'PDGFRA']
263	GO:BP	GO:0048675	axon extension	4.216708305011713e-07	True	"""Long distance growth of a single axon process involved in cellular development."" [GOC:BHF, GOC:dgh, GOC:dph, GOC:jid, GOC:lm, GOC:rl]"	124	118	10	15719	0.0847457627118644	0.0806451612903225	query_1	['GO:0007409', 'GO:1990138']	['LIMK1', 'ITGB1', 'FN1', 'NRP2', 'VCL', 'CDH1', 'VEGFA', 'L1CAM', 'NRP1', 'SEMA4D']
264	GO:BP	GO:0071526	semaphorin-plexin signaling pathway	4.671804840252251e-07	True	"""The series of molecular signals generated as a consequence of a semaphorin receptor (composed of a plexin and a neurophilin) binding to a semaphorin ligand."" [GOC:BHF, GOC:mah, GOC:vk, PMID:15239959]"	44	118	7	15719	0.059322033898305	0.1590909090909091	query_1	['GO:0007166']	['MET', 'PLXNB1', 'NRP2', 'KDR', 'NRP1', 'SEMA4D', 'PLXNA1']
265	GO:BP	GO:0001938	positive regulation of endothelial cell proliferation	4.719620520850821e-07	True	"""Any process that activates or increases the rate or extent of endothelial cell proliferation."" [GOC:add]"	94	118	9	15719	0.0762711864406779	0.0957446808510638	query_1	['GO:0001935', 'GO:0001936', 'GO:0050679']	['VEGFB', 'ITGB3', 'ITGA4', 'NRP2', 'KDR', 'PLCG1', 'VEGFA', 'NRP1', 'PGF']
78	REAC	REAC:R-HSA-8851907	MET activates PI3K/AKT signaling	5.060381174884877e-07	True	MET activates PI3K/AKT signaling	5	108	4	10022	0.037037037037037	0.8	query_1	['REAC:R-HSA-6806834']	['MET', 'PIK3R1', 'HGF', 'GAB1']
79	REAC	REAC:R-HSA-9006115	Signaling by NTRK2 (TRKB)	5.118726294701171e-07	True	Signaling by NTRK2 (TRKB)	21	108	6	10022	0.0555555555555555	0.2857142857142857	query_1	['REAC:R-HSA-166520']	['SRC', 'PIK3R1', 'SOS1', 'GAB1', 'PLCG1', 'PTPN11']
80	REAC	REAC:R-HSA-1280218	Adaptive Immune System	5.129829984715234e-07	True	Adaptive Immune System	750	108	26	10022	0.2407407407407407	0.0346666666666666	query_1	['REAC:R-HSA-168256']	['ITGB1', 'ITGB5', 'ITGAV', 'PIK3R1', 'ITK', 'PLCG2', 'SOS1', 'FYN', 'ITGA4', 'NCF1', 'LAT', 'ZAP70', 'LYN', 'LCP2', 'VAV1', 'SYK', 'PLCG1', 'FCGR1A', 'CDH1', 'SH3KBP1', 'SH3GL2', 'VCAM1', 'LCK', 'ITGB7', 'PTPN11', 'GRAP2']
266	GO:BP	GO:0010594	regulation of endothelial cell migration	5.30139996703526e-07	True	"""Any process that modulates the rate, frequency, or extent of the orderly movement of an endothelial cell into the extracellular matrix to form an endothelium."" [GOC:BHF, GOC:dph, GOC:tb]"	163	118	11	15719	0.0932203389830508	0.0674846625766871	query_1	['GO:0010632', 'GO:0043542']	['MET', 'BCAR1', 'ITGB3', 'NRP2', 'KDR', 'PLCG1', 'PTK2B', 'VEGFA', 'PTK2', 'NRP1', 'THBS1']
267	GO:BP	GO:0043551	regulation of phosphatidylinositol 3-kinase activity	5.436710214240277e-07	True	"""Any process that modulates the frequency, rate or extent of phosphatidylinositol 3-kinase activity, the catalysis of the transfer of a phosphate group, usually from ATP, to an inositol lipid at the 3' position of the inositol ring."" [GOC:bf]"	45	118	7	15719	0.059322033898305	0.1555555555555555	query_1	['GO:0043550']	['SRC', 'PIK3R1', 'LYN', 'PTK2B', 'PTK2', 'PDGFRA', 'FLT1']
268	GO:BP	GO:0030036	actin cytoskeleton organization	6.008838429169483e-07	True	"""A process that is carried out at the cellular level which results in the assembly, arrangement of constituent parts, or disassembly of cytoskeletal structures comprising actin filaments and their associated proteins."" [GOC:dph, GOC:jl, GOC:mah]"	695	118	21	15719	0.1779661016949152	0.0302158273381294	query_1	['GO:0007010', 'GO:0030029']	['LIMK1', 'MET', 'ITGB1', 'ITGB5', 'BCAR1', 'SRC', 'ITGB3', 'TGFB3', 'PIK3R1', 'CRK', 'SHC1', 'GAB1', 'PXN', 'GRB2', 'JAM3', 'PTK2B', 'SH3KBP1', 'TLN1', 'NRP1', 'ELN', 'PDGFRA']
81	REAC	REAC:R-HSA-1280215	Cytokine Signaling in Immune system	6.215252719170898e-07	True	Cytokine Signaling in Immune system	705	108	25	10022	0.2314814814814814	0.0354609929078014	query_1	['REAC:R-HSA-168256']	['RAPGEF1', 'ITGB1', 'FN1', 'PIK3R1', 'CRK', 'HGF', 'SHC1', 'SOS1', 'STX1A', 'FYN', 'LYN', 'GRB2', 'VAV1', 'SYK', 'PLCG1', 'FCGR1A', 'PTK2B', 'VEGFA', 'CRKL', 'GAB2', 'VCAM1', 'LCK', 'CBL', 'PTPN11', 'GRAP2']
269	GO:BP	GO:0071375	cellular response to peptide hormone stimulus	6.822524371355282e-07	True	"""Any process that results in a change in state or activity of a cell (in terms of movement, secretion, enzyme production, gene expression, etc.) as a result of a peptide hormone stimulus. A peptide hormone is any of a class of peptides that are secreted into the blood stream and have endocrine functions in living animals."" [GOC:mah]"	298	118	14	15719	0.1186440677966101	0.046979865771812	query_1	['GO:0032870', 'GO:0043434', 'GO:1901653']	['BCAR1', 'SRC', 'ITGB3', 'PIK3R1', 'CRK', 'SHC1', 'SOS1', 'GAB1', 'PXN', 'LYN', 'GRB2', 'FBN1', 'PTK2', 'PTPN11']
270	GO:BP	GO:0072657	protein localization to membrane	7.055450749134904e-07	True	"""A process in which a protein is transported to, or maintained in, a specific location in a membrane."" [GOC:mah]"	575	118	19	15719	0.1610169491525423	0.0330434782608695	query_1	['GO:0008104', 'GO:0051668']	['ITGB1', 'PIK3R1', 'VPS37D', 'CRK', 'LRP4', 'STX1A', 'FYN', 'ITGA4', 'NCF1', 'MADCAM1', 'EGFR', 'ERBB2', 'MUSK', 'CDH1', 'AGRN', 'GTF2IRD2', 'CRKL', 'ITGB7', 'ITGA3']
271	GO:BP	GO:0007399	nervous system development	7.254773744886507e-07	True	"""The process whose specific outcome is the progression of nervous tissue over time, from its formation to its mature state."" [GOC:dgh]"	2331	118	41	15719	0.3474576271186441	0.0175890175890175	query_1	['GO:0048731']	['LIMK1', 'MET', 'RAPGEF1', 'ITGB1', 'PLXNB1', 'DNAJC30', 'FN1', 'SRC', 'SPP1', 'CRK', 'HGF', 'RET', 'LRP4', 'SOS1', 'FYN', 'ITGA4', 'LYN', 'TNC', 'NRP2', 'JAM3', 'EGFR', 'VCL', 'ERBB2', 'MUSK', 'CDH1', 'PTK2B', 'VEGFA', 'AGRN', 'SH3GL2', 'CRKL', 'VTN', 'SHC3', 'VCAM1', 'L1CAM', 'PTK2', 'NRP1', 'ITGA3', 'JAM2', 'PTPN11', 'SEMA4D', 'PLXNA1']
272	GO:BP	GO:0035987	endodermal cell differentiation	7.30571618518718e-07	True	"""The process in which a relatively unspecialized cell acquires the specialized features of an endoderm cell, a cell of the inner of the three germ layers of the embryo."" [CL:0000223, GOC:yaf, PMID:17624332]"	47	118	7	15719	0.059322033898305	0.1489361702127659	query_1	['GO:0001706', 'GO:0030154']	['ITGB5', 'FN1', 'ITGAV', 'ITGA5', 'ITGA4', 'GRB2', 'VTN']
273	GO:BP	GO:0070527	platelet aggregation	7.496100235828057e-07	True	"""The adhesion of one platelet to one or more other platelets via adhesion molecules."" [GOC:BHF, GOC:vk]"	71	118	8	15719	0.0677966101694915	0.1126760563380281	query_1	['GO:0030168', 'GO:0034109']	['FN1', 'ITGB3', 'LYN', 'VCL', 'SYK', 'TLN1', 'EMILIN1', 'PDGFRA']
274	GO:BP	GO:0050853	B cell receptor signaling pathway	7.496100235828057e-07	True	"""The series of molecular signals initiated by the cross-linking of an antigen receptor on a B cell."" [GOC:add]"	71	118	8	15719	0.0677966101694915	0.1126760563380281	query_1	['GO:0050851']	['BCAR1', 'ITK', 'PLCG2', 'SOS1', 'LYN', 'GRB2', 'SYK', 'LCK']
275	GO:BP	GO:0030947	regulation of vascular endothelial growth factor receptor signaling pathway	8.521942287826596e-07	True	"""Any process that modulates the frequency, rate or extent of vascular endothelial growth factor receptor signaling pathway activity."" [GOC:dgh]"	29	118	6	15719	0.0508474576271186	0.2068965517241379	query_1	['GO:0009966', 'GO:0048010', 'GO:0090287']	['VEGFB', 'ITGB3', 'ITGA5', 'VTN', 'NRP1', 'EMILIN1']
276	GO:BP	GO:0050878	regulation of body fluid levels	9.005584145500645e-07	True	"""Any process that modulates the levels of body fluids."" [GOC:ai, GOC:dph, GOC:tb]"	356	118	15	15719	0.1271186440677966	0.0421348314606741	query_1	['GO:0065008']	['FN1', 'SRC', 'ITGB3', 'PLCG2', 'LYN', 'VCL', 'VAV1', 'SYK', 'VEGFA', 'VTN', 'TLN1', 'LCK', 'EMILIN1', 'THBS1', 'PDGFRA']
24	GO:CC	GO:0001726	ruffle	9.079559153599992e-07	True	"""Projection at the leading edge of a crawling cell; the protrusions are supported by a microfilament meshwork."" [ISBN:0124325653]"	177	118	11	16420	0.0932203389830508	0.0621468926553672	query_1	['GO:0031252', 'GO:0120025']	['ITGB1', 'ITGAV', 'BCAR1', 'SRC', 'ITGB3', 'PLCG2', 'ITGA5', 'EGFR', 'PLCG1', 'ERBB2', 'TLN1']
277	GO:BP	GO:0010941	regulation of cell death	1.0335878628323532e-06	True	"""Any process that modulates the rate or frequency of cell death. Cell death is the specific activation or halting of processes within a cell so that its vital functions markedly cease, rather than simply deteriorating gradually over time, which culminates in cell death."" [GOC:dph, GOC:tb]"	1554	118	32	15719	0.2711864406779661	0.0205920205920205	query_1	['GO:0008219', 'GO:0050794']	['MET', 'ITGB1', 'VEGFB', 'ITGAV', 'BCAR1', 'SRC', 'ITGB3', 'TGFB3', 'PIK3R1', 'HGF', 'RET', 'SHC1', 'PLCG2', 'LOX', 'ITGA5', 'FYN', 'ITGA4', 'LYN', 'EGFR', 'KDR', 'SYK', 'PLCG1', 'ERBB2', 'PTK2B', 'VEGFA', 'PTK2', 'NRP1', 'LCK', 'EMILIN1', 'THBS1', 'CBL', 'SEMA4D']
278	GO:BP	GO:0097435	supramolecular fiber organization	1.043828863394997e-06	True	"""A process that is carried out at the cellular level which results in the assembly, arrangement of constituent parts, or disassembly of a supramolecular fiber, a polymer consisting of an indefinite number of protein or protein complex subunits that have polymerised to form a fiber-shaped structure."" [GOC:pr]"	787	118	22	15719	0.1864406779661017	0.0279542566709021	query_1	['GO:0016043']	['LIMK1', 'MET', 'ITGB1', 'ITGB5', 'BCAR1', 'SRC', 'TGFB3', 'PIK3R1', 'LOX', 'PXN', 'FBLN5', 'GRB2', 'LOXL1', 'PTK2B', 'SH3KBP1', 'MFAP5', 'CLIP2', 'NRP1', 'EMILIN1', 'ELN', 'PDGFRA', 'MFAP4']
279	GO:BP	GO:0045859	regulation of protein kinase activity	1.1080822380491412e-06	True	"""Any process that modulates the frequency, rate or extent of protein kinase activity."" [GOC:go_curators]"	593	118	19	15719	0.1610169491525423	0.0320404721753794	query_1	['GO:0001932', 'GO:0043549']	['SRC', 'ITGB3', 'HGF', 'SHC1', 'SOS1', 'NCF1', 'LAT', 'LYN', 'LCP2', 'EGFR', 'SYK', 'FCGR1A', 'ERBB2', 'PTK2B', 'VEGFA', 'PTK2', 'THBS1', 'CBL', 'FLT1']
280	GO:BP	GO:1901698	response to nitrogen compound	1.175838064942751e-06	True	"""Any process that results in a change in state or activity of a cell or an organism (in terms of movement, secretion, enzyme production, gene expression, etc.) as a result of a nitrogen compound stimulus."" [GOC:pr, GOC:TermGenie]"	1082	118	26	15719	0.2203389830508474	0.0240295748613678	query_1	['GO:0042221']	['RAPGEF1', 'ITGB1', 'BCAR1', 'SRC', 'ITGB3', 'PIK3R1', 'CRK', 'SHC1', 'SOS1', 'GAB1', 'PXN', 'FYN', 'ITGA4', 'LYN', 'GRB2', 'EGFR', 'FBN1', 'SYK', 'CDH1', 'PTK2B', 'AGRN', 'CRKL', 'VCAM1', 'PTK2', 'PTPN11', 'PDGFRA']
82	REAC	REAC:R-HSA-1433559	Regulation of KIT signaling	1.2115262842261851e-06	True	Regulation of KIT signaling	13	108	5	10022	0.0462962962962962	0.3846153846153846	query_1	['REAC:R-HSA-1433557']	['SOS1', 'FYN', 'LYN', 'LCK', 'CBL']
282	GO:BP	GO:0043412	macromolecule modification	1.2534693916266544e-06	True	"""The covalent alteration of one or more monomeric units in a polypeptide, polynucleotide, polysaccharide, or other biological macromolecule, resulting in a change in its properties."" [GOC:go_curators]"	3600	118	53	15719	0.4491525423728814	0.0147222222222222	query_1	['GO:0043170']	['LIMK1', 'MET', 'FKBP6', 'MLXIPL', 'VEGFB', 'FN1', 'SRC', 'ITGB3', 'TGFB3', 'PIK3R1', 'HGF', 'RET', 'SHC1', 'ITK', 'PLCG2', 'LRP4', 'SOS1', 'LOX', 'STX1A', 'ITGA5', 'FYN', 'BUD23', 'NCF1', 'LAT', 'ZAP70', 'SMARCA5', 'LYN', 'LCP2', 'LOXL1', 'EGFR', 'KDR', 'SYK', 'FCGR1A', 'ERBB2', 'MUSK', 'TRMT112', 'PTK2B', 'VEGFA', 'SH3GL2', 'CRKL', 'VTN', 'BAZ1B', 'PTK2', 'NRP1', 'LCK', 'EMILIN1', 'THBS1', 'CBL', 'PTPN11', 'PDGFRA', 'SEMA4D', 'FLT1', 'PGF']
281	GO:BP	GO:0051668	localization within membrane	1.2534693916266544e-06	True	"""Any process in which a substance or cellular entity, such as a protein complex or organelle, is transported to, and/or maintained in, a specific location within a membrane."" [GOC:ai]"	662	118	20	15719	0.1694915254237288	0.0302114803625377	query_1	['GO:0051641']	['ITGB1', 'ITGB3', 'PIK3R1', 'VPS37D', 'CRK', 'LRP4', 'STX1A', 'FYN', 'ITGA4', 'NCF1', 'MADCAM1', 'EGFR', 'ERBB2', 'MUSK', 'CDH1', 'AGRN', 'GTF2IRD2', 'CRKL', 'ITGB7', 'ITGA3']
283	GO:BP	GO:0010033	response to organic substance	1.2628896613420458e-06	True	"""Any process that results in a change in state or activity of a cell or an organism (in terms of movement, secretion, enzyme production, gene expression, etc.) as a result of an organic substance stimulus."" [GOC:sm, PMID:23356676]"	2672	118	44	15719	0.3728813559322034	0.0164670658682634	query_1	['GO:0042221']	['MET', 'RAPGEF1', 'ITGB1', 'MLXIPL', 'BCAR1', 'SRC', 'SPP1', 'ITGB3', 'TGFB3', 'PIK3R1', 'CRK', 'HGF', 'RET', 'SHC1', 'PLCG2', 'SOS1', 'GAB1', 'LOX', 'PXN', 'FYN', 'ITGA4', 'NCF1', 'SMARCA5', 'LYN', 'GRB2', 'NRP2', 'LOXL1', 'EGFR', 'FBN1', 'SYK', 'CDH1', 'PTK2B', 'AGRN', 'CRKL', 'VCAM1', 'PTK2', 'THBS1', 'ADAM15', 'ITGA3', 'CBL', 'PTPN11', 'PDGFRA', 'PGF', 'TBL2']
25	GO:CC	GO:0009897	external side of plasma membrane	1.2739005996520866e-06	True	"""The leaflet of the plasma membrane that faces away from the cytoplasm and any proteins embedded or anchored in it or attached to its surface."" [GOC:dos, GOC:tb]"	378	118	15	16420	0.1271186440677966	0.0396825396825396	query_1	['GO:0005886', 'GO:0009986', 'GO:0098552']	['ITGB1', 'ITGA9', 'ITGAV', 'ITGB3', 'ITGA2B', 'ITGA5', 'ITGA4', 'ITGAE', 'KDR', 'FCGR1A', 'VCAM1', 'ITGB6', 'THBS1', 'ITGA3', 'PDGFRA']
284	GO:BP	GO:0043067	regulation of programmed cell death	1.312138702111727e-06	True	"""Any process that modulates the frequency, rate or extent of programmed cell death, cell death resulting from activation of endogenous cellular processes."" [GOC:jl]"	1405	118	30	15719	0.2542372881355932	0.0213523131672597	query_1	['GO:0010941', 'GO:0012501']	['MET', 'ITGB1', 'VEGFB', 'ITGAV', 'BCAR1', 'SRC', 'TGFB3', 'PIK3R1', 'HGF', 'RET', 'SHC1', 'PLCG2', 'LOX', 'ITGA5', 'ITGA4', 'LYN', 'EGFR', 'KDR', 'SYK', 'PLCG1', 'ERBB2', 'PTK2B', 'VEGFA', 'PTK2', 'NRP1', 'LCK', 'EMILIN1', 'THBS1', 'CBL', 'SEMA4D']
285	GO:BP	GO:0044000	movement in host	1.3660905827010249e-06	True	"""The process in which an organism or its progeny spreads from one location to another within its host organism. The host is defined as the larger of the organisms involved in a symbiotic interaction."" [GOC:cc]"	180	118	11	15719	0.0932203389830508	0.0611111111111111	query_1	['GO:0051701']	['ITGB1', 'ITGB5', 'ITGAV', 'SRC', 'ITGB3', 'ITGA5', 'EGFR', 'ITGB6', 'NRP1', 'ITGB7', 'CBL']
286	GO:BP	GO:0032103	positive regulation of response to external stimulus	1.3660905827010249e-06	True	"""Any process that activates, maintains or increases the rate of a response to an external stimulus."" [GOC:mah]"	540	118	18	15719	0.1525423728813559	0.0333333333333333	query_1	['GO:0009605', 'GO:0032101', 'GO:0048584']	['MET', 'VEGFB', 'SRC', 'PLCG2', 'FYN', 'LYN', 'KDR', 'VAV1', 'SYK', 'FCGR1A', 'PTK2B', 'VEGFA', 'VTN', 'PTK2', 'NRP1', 'EMILIN1', 'THBS1', 'PGF']
287	GO:BP	GO:0036211	protein modification process	1.3899586599743946e-06	True	"""The covalent alteration of one or more amino acids occurring in proteins, peptides and nascent polypeptides (co-translational, post-translational modifications). Includes the modification of charged tRNAs that are destined to occur in a protein (pre-translation modification)."" [GOC:bf, GOC:jl]"	3399	118	51	15719	0.4322033898305085	0.0150044130626654	query_1	['GO:0019538', 'GO:0043412']	['LIMK1', 'MET', 'MLXIPL', 'VEGFB', 'FN1', 'SRC', 'ITGB3', 'TGFB3', 'PIK3R1', 'HGF', 'RET', 'SHC1', 'ITK', 'PLCG2', 'LRP4', 'SOS1', 'LOX', 'STX1A', 'ITGA5', 'FYN', 'NCF1', 'LAT', 'ZAP70', 'SMARCA5', 'LYN', 'LCP2', 'LOXL1', 'EGFR', 'KDR', 'SYK', 'FCGR1A', 'ERBB2', 'MUSK', 'TRMT112', 'PTK2B', 'VEGFA', 'SH3GL2', 'CRKL', 'VTN', 'BAZ1B', 'PTK2', 'NRP1', 'LCK', 'EMILIN1', 'THBS1', 'CBL', 'PTPN11', 'PDGFRA', 'SEMA4D', 'FLT1', 'PGF']
83	REAC	REAC:R-HSA-1643685	Disease	1.4658805464558149e-06	True	Disease	1723	108	41	10022	0.3796296296296296	0.0237957051654091	query_1	['REAC:0000000']	['MET', 'ITGB1', 'FN1', 'SRC', 'ITGB3', 'PIK3R1', 'VPS37D', 'CRK', 'HGF', 'SHC1', 'PLCG2', 'SOS1', 'GAB1', 'STX1A', 'ITGA2B', 'FYN', 'ITGA4', 'LYN', 'GRB2', 'EGFR', 'RFC2', 'KDR', 'VCL', 'VAV1', 'SYK', 'PLCG1', 'FCGR1A', 'ERBB2', 'CDH1', 'SH3KBP1', 'AGRN', 'SH3GL2', 'GAB2', 'TLN1', 'PTK2', 'NRP1', 'LCK', 'THBS1', 'CBL', 'PTPN11', 'PDGFRA']
288	GO:BP	GO:0051960	regulation of nervous system development	1.4864348421562262e-06	True	"""Any process that modulates the frequency, rate or extent of nervous system development, the origin and formation of nervous tissue."" [GOC:ai]"	426	118	16	15719	0.135593220338983	0.0375586854460093	query_1	['GO:0007399', 'GO:2000026']	['LIMK1', 'ITGB1', 'PLXNB1', 'FN1', 'SPP1', 'HGF', 'LRP4', 'LYN', 'CDH1', 'VEGFA', 'AGRN', 'L1CAM', 'NRP1', 'JAM2', 'SEMA4D', 'PLXNA1']
