KID syndrome	source	native	name	Corrected p_value	significant	description	term_size	query_size	intersection_size	effective_domain_size	precision	recall	query	parents	intersections
0	GO:BP	GO:0007166	cell surface receptor signaling pathway	4.829231360737629e-36	True	"""The series of molecular signals initiated by activation of a receptor on the surface of a cell. The pathway begins with binding of an extracellular ligand to a cell surface receptor, or for receptors that signal in the absence of a ligand, by ligand-withdrawal or the activity of a constitutively active receptor. The pathway ends with regulation of a downstream cellular process, e.g. transcription."" [GOC:bf, GOC:mah, GOC:pr, GOC:signaling]"	2638	101	77	15719	0.7623762376237624	0.0291887793783169	query_1	['GO:0007165']	['MET', 'RAPGEF1', 'C3', 'ITGB1', 'ITGA9', 'PIK3CB', 'ITGB5', 'VEGFB', 'PLXNB1', 'FN1', 'ITGAV', 'PIK3R2', 'BCAR1', 'SRC', 'FGA', 'ITGB3', 'TGFB3', 'PIK3R1', 'CRK', 'HGF', 'SHC1', 'ITK', 'PLCG2', 'CTNNB1', 'SOS1', 'PIK3CD', 'ITGA2B', 'ITGA5', 'HFE', 'PXN', 'FYN', 'ITGA4', 'LAT', 'ZAP70', 'CXCL12', 'MS4A1', 'LYN', 'GRB2', 'NRP2', 'LCP2', 'CXCR4', 'EGFR', 'APOA1', 'TF', 'PIK3CA', 'KDR', 'FGB', 'VAV1', 'SYK', 'PLCG1', 'FCGR1A', 'FGG', 'ERBB2', 'PTK2B', 'IGHM', 'VEGFA', 'PIK3R3', 'CRKL', 'VTN', 'CD81', 'TLN1', 'PTK2', 'ITGB6', 'NRP1', 'LCK', 'CD19', 'BLNK', 'CBL', 'PTPN11', 'ACKR3', 'PDGFRA', 'HPX', 'SEMA4D', 'FLT1', 'CR2', 'PGF', 'PLXNA1']
1	GO:BP	GO:0007169	transmembrane receptor protein tyrosine kinase signaling pathway	1.824278053037685e-32	True	"""The series of molecular signals initiated by an extracellular ligand binding to a receptor on the surface of the target cell where the receptor possesses tyrosine kinase activity, and ending with the regulation of a downstream cellular process, e.g. transcription."" [GOC:ceb, GOC:signaling]"	605	101	44	15719	0.4356435643564356	0.0727272727272727	query_1	['GO:0007167']	['MET', 'RAPGEF1', 'PIK3CB', 'VEGFB', 'PIK3R2', 'BCAR1', 'SRC', 'ITGB3', 'PIK3R1', 'CRK', 'HGF', 'SHC1', 'CTNNB1', 'SOS1', 'PIK3CD', 'ITGA5', 'PXN', 'FYN', 'ZAP70', 'LYN', 'GRB2', 'NRP2', 'LCP2', 'EGFR', 'PIK3CA', 'KDR', 'VAV1', 'SYK', 'PLCG1', 'ERBB2', 'PTK2B', 'VEGFA', 'PIK3R3', 'CRKL', 'VTN', 'PTK2', 'NRP1', 'LCK', 'BLNK', 'CBL', 'PTPN11', 'PDGFRA', 'FLT1', 'PGF']
2	GO:BP	GO:0016477	cell migration	1.824278053037685e-32	True	"""The controlled self-propelled movement of a cell from one site to a destination guided by molecular cues."" [GOC:cjm, GOC:dph, GOC:ems, GOC:pf, Wikipedia:Cell_migration]"	1427	101	59	15719	0.5841584158415841	0.0413454800280308	query_1	['GO:0048870']	['MET', 'ITGB1', 'ITGA9', 'PIK3CB', 'ITGB5', 'VEGFB', 'PLXNB1', 'FN1', 'ITGAV', 'BCAR1', 'SRC', 'ITGB3', 'PIK3R1', 'CRK', 'HGF', 'PLCG2', 'CTNNB1', 'SOS1', 'PIK3CD', 'ITGA5', 'PXN', 'FYN', 'ITGA4', 'ZAP70', 'CXCL12', 'LYN', 'TNC', 'NRP2', 'CXCR4', 'EGFR', 'APOA1', 'PIK3CA', 'KDR', 'VCL', 'VAV1', 'SYK', 'PLCG1', 'CERS2', 'SH3KBP1', 'PTK2B', 'VEGFA', 'PIK3R3', 'CRKL', 'ABCC1', 'VTN', 'CD81', 'VCAM1', 'L1CAM', 'PTK2', 'ITGB6', 'NRP1', 'LCK', 'PTPN11', 'ACKR3', 'PDGFRA', 'SEMA4D', 'FLT1', 'PGF', 'PLXNA1']
3	GO:BP	GO:0007155	cell adhesion	8.54155133909205e-32	True	"""The attachment of a cell, either to another cell or to an underlying substrate such as the extracellular matrix, via cell adhesion molecules."" [GOC:hb, GOC:pf]"	1409	101	58	15719	0.5742574257425742	0.0411639460610362	query_1	['GO:0009987']	['RAPGEF1', 'ITGB1', 'ITGA9', 'PIK3CB', 'ITGB5', 'PLXNB1', 'FN1', 'ITGAV', 'PIK3R2', 'BCAR1', 'SRC', 'SPP1', 'FGA', 'ITGB3', 'PIK3R1', 'CRK', 'SHC1', 'TFRC', 'CTNNB1', 'ITGA2B', 'ITGA5', 'HFE', 'PXN', 'FYN', 'ITGA4', 'ZAP70', 'CXCL12', 'LYN', 'TNC', 'NRP2', 'CXCR4', 'EGFR', 'APOA1', 'PIK3CA', 'KDR', 'FGB', 'VCL', 'VAV1', 'SYK', 'FGG', 'ERBB2', 'PTK2B', 'VEGFA', 'CRKL', 'VTN', 'CD81', 'TLN1', 'VCAM1', 'L1CAM', 'PTK2', 'ITGB6', 'NRP1', 'LCK', 'PTPN11', 'ACKR3', 'PDGFRA', 'SEMA4D', 'PLXNA1']
4	GO:BP	GO:0048584	positive regulation of response to stimulus	1.0241109439843536e-31	True	"""Any process that activates, maintains or increases the rate of a response to a stimulus. Response to stimulus is a change in state or activity of a cell or an organism (in terms of movement, secretion, enzyme production, gene expression, etc.) as a result of a stimulus."" [GOC:jid]"	2113	101	67	15719	0.6633663366336634	0.0317084713677236	query_1	['GO:0048518', 'GO:0048583', 'GO:0050896']	['MET', 'RAPGEF1', 'C3', 'ITGB1', 'PIK3CB', 'ADRA1A', 'VEGFB', 'PLXNB1', 'FN1', 'ITGAV', 'BCAR1', 'SRC', 'FGA', 'ITGB3', 'TGFB3', 'PIK3R1', 'CRK', 'HGF', 'SHC1', 'ITK', 'PLCG2', 'TFRC', 'CTNNB1', 'SOS1', 'PIK3CD', 'ITGA5', 'HFE', 'FYN', 'ZAP70', 'CXCL12', 'MS4A1', 'LYN', 'GRB2', 'LCP2', 'CXCR4', 'EGFR', 'APOA1', 'PIK3CA', 'KDR', 'FGB', 'VAV1', 'SYK', 'PLCG1', 'FCGR1A', 'FGG', 'ERBB2', 'PTK2B', 'IGHM', 'VEGFA', 'CRKL', 'ABCC1', 'VTN', 'CD81', 'PTK2', 'NRP1', 'LCK', 'CD19', 'BLNK', 'CBL', 'PTPN11', 'ACKR3', 'PDGFRA', 'HPX', 'SEMA4D', 'FLT1', 'CR2', 'PGF']
5	GO:BP	GO:0048870	cell motility	4.955645566062922e-31	True	"""Any process involved in the controlled self-propelled movement of a cell that results in translocation of the cell from one place to another."" [GOC:dgh, GOC:dph, GOC:isa_complete, GOC:mlg]"	1609	101	60	15719	0.594059405940594	0.0372902423865755	query_1	['GO:0009987']	['MET', 'ITGB1', 'ITGA9', 'PIK3CB', 'ITGB5', 'VEGFB', 'PLXNB1', 'FN1', 'ITGAV', 'BCAR1', 'SRC', 'ITGB3', 'PIK3R1', 'CRK', 'HGF', 'PLCG2', 'CTNNB1', 'SOS1', 'PIK3CD', 'ITGA5', 'PXN', 'FYN', 'ITGA4', 'ZAP70', 'CXCL12', 'LYN', 'TNC', 'NRP2', 'CXCR4', 'EGFR', 'APOA1', 'TF', 'PIK3CA', 'KDR', 'VCL', 'VAV1', 'SYK', 'PLCG1', 'CERS2', 'SH3KBP1', 'PTK2B', 'VEGFA', 'PIK3R3', 'CRKL', 'ABCC1', 'VTN', 'CD81', 'VCAM1', 'L1CAM', 'PTK2', 'ITGB6', 'NRP1', 'LCK', 'PTPN11', 'ACKR3', 'PDGFRA', 'SEMA4D', 'FLT1', 'PGF', 'PLXNA1']
6	GO:BP	GO:0007167	enzyme-linked receptor protein signaling pathway	9.771948085987962e-31	True	"""The series of molecular signals initiated by an extracellular ligand binding to a receptor on the surface of the target cell, where the receptor possesses catalytic activity or is closely associated with an enzyme such as a protein kinase, and ending with the regulation of a downstream cellular process, e.g. transcription."" [GOC:mah, GOC:signaling, ISBN:0815316194]"	927	101	49	15719	0.4851485148514851	0.052858683926645	query_1	['GO:0007166']	['MET', 'RAPGEF1', 'PIK3CB', 'ITGB5', 'VEGFB', 'PIK3R2', 'BCAR1', 'SRC', 'ITGB3', 'TGFB3', 'PIK3R1', 'CRK', 'HGF', 'SHC1', 'CTNNB1', 'SOS1', 'PIK3CD', 'ITGA5', 'HFE', 'PXN', 'FYN', 'ZAP70', 'LYN', 'GRB2', 'NRP2', 'LCP2', 'EGFR', 'TF', 'PIK3CA', 'KDR', 'VAV1', 'SYK', 'PLCG1', 'ERBB2', 'PTK2B', 'VEGFA', 'PIK3R3', 'CRKL', 'VTN', 'PTK2', 'ITGB6', 'NRP1', 'LCK', 'BLNK', 'CBL', 'PTPN11', 'PDGFRA', 'FLT1', 'PGF']
0	REAC	REAC:R-HSA-76002	Platelet activation, signaling and aggregation	6.1451499174774736e-30	True	Platelet activation, signaling and aggregation	252	100	36	10022	0.36	0.1428571428571428	query_1	['REAC:R-HSA-109582']	['PIK3CB', 'VEGFB', 'FN1', 'PIK3R2', 'BCAR1', 'SRC', 'FGA', 'ITGB3', 'TGFB3', 'PIK3R1', 'CRK', 'HGF', 'SHC1', 'PLCG2', 'SOS1', 'ITGA2B', 'FYN', 'LAT', 'LYN', 'LCP2', 'APOA1', 'TF', 'PIK3CA', 'FGB', 'VCL', 'VAV1', 'SYK', 'FGG', 'VEGFA', 'PIK3R3', 'SERPINA1', 'TLN1', 'PTK2', 'LCK', 'ALB', 'PTPN11']
7	GO:BP	GO:0009605	response to external stimulus	6.569456169656952e-29	True	"""Any process that results in a change in state or activity of a cell or an organism (in terms of movement, secretion, enzyme production, gene expression, etc.) as a result of an external stimulus."" [GOC:hb]"	2649	101	70	15719	0.693069306930693	0.0264250660626651	query_1	['GO:0050896']	['MET', 'GJB6', 'C3', 'ITGA9', 'PIK3CB', 'ADRA1A', 'VEGFB', 'PLXNB1', 'ITGAV', 'BCAR1', 'SRC', 'SPP1', 'FGA', 'ITGB3', 'CRK', 'HGF', 'SHC1', 'PLCG2', 'TFRC', 'CTNNB1', 'SOS1', 'PIK3CD', 'HFE', 'FYN', 'ITGA4', 'ZAP70', 'CXCL12', 'MS4A1', 'LYN', 'GJB2', 'TNC', 'NRP2', 'CXCR4', 'VKORC1', 'APOA1', 'TF', 'PIK3CA', 'KDR', 'FGB', 'VAV1', 'SYK', 'PLCG1', 'FCGR1A', 'FGG', 'ERBB2', 'CERS2', 'PTK2B', 'IGHM', 'VEGFA', 'CRKL', 'ABCC1', 'VTN', 'CD81', 'VCAM1', 'L1CAM', 'PTK2', 'ITGB6', 'NRP1', 'LCK', 'ALB', 'CBL', 'PTPN11', 'ACKR3', 'PDGFRA', 'HPX', 'SEMA4D', 'FLT1', 'CR2', 'PGF', 'PLXNA1']
1	REAC	REAC:R-HSA-9006934	Signaling by Receptor Tyrosine Kinases	9.764251860453004e-28	True	Signaling by Receptor Tyrosine Kinases	495	100	43	10022	0.43	0.0868686868686868	query_1	['REAC:R-HSA-162582']	['MET', 'RAPGEF1', 'ITGB1', 'PIK3CB', 'VEGFB', 'FN1', 'ITGAV', 'PIK3R2', 'BCAR1', 'SRC', 'SPP1', 'ITGB3', 'PIK3R1', 'CRK', 'HGF', 'SHC1', 'CTNNB1', 'SOS1', 'PXN', 'FYN', 'CXCL12', 'LYN', 'NRP2', 'EGFR', 'PIK3CA', 'KDR', 'VAV1', 'PLCG1', 'ERBB2', 'SH3KBP1', 'PTK2B', 'VEGFA', 'PIK3R3', 'SH3GL2', 'CRKL', 'PTK2', 'NRP1', 'LCK', 'CBL', 'PTPN11', 'PDGFRA', 'FLT1', 'PGF']
8	GO:BP	GO:0040011	locomotion	1.7521958856455446e-27	True	"""Self-propelled movement of a cell or organism from one location to another."" [GOC:dgh]"	1285	101	52	15719	0.5148514851485149	0.0404669260700389	query_1	['GO:0008150']	['MET', 'ITGB1', 'ITGA9', 'PIK3CB', 'VEGFB', 'PLXNB1', 'FN1', 'ITGAV', 'BCAR1', 'SRC', 'ITGB3', 'PIK3R1', 'CRK', 'HGF', 'PLCG2', 'SOS1', 'PIK3CD', 'ITGA5', 'FYN', 'ITGA4', 'CXCL12', 'LYN', 'TNC', 'NRP2', 'CXCR4', 'EGFR', 'APOA1', 'TF', 'KDR', 'VCL', 'VAV1', 'SYK', 'PLCG1', 'ERBB2', 'CERS2', 'PTK2B', 'VEGFA', 'PIK3R3', 'CRKL', 'ABCC1', 'VTN', 'CD81', 'VCAM1', 'L1CAM', 'PTK2', 'NRP1', 'ACKR3', 'PDGFRA', 'SEMA4D', 'FLT1', 'PGF', 'PLXNA1']
9	GO:BP	GO:0030155	regulation of cell adhesion	1.622460047438299e-26	True	"""Any process that modulates the frequency, rate or extent of attachment of a cell to another cell or to the extracellular matrix."" [GOC:mah]"	753	101	42	15719	0.4158415841584158	0.0557768924302788	query_1	['GO:0007155', 'GO:0050794']	['PIK3CB', 'PLXNB1', 'FN1', 'ITGAV', 'PIK3R2', 'SRC', 'FGA', 'ITGB3', 'PIK3R1', 'CRK', 'TFRC', 'ITGA5', 'HFE', 'FYN', 'ITGA4', 'ZAP70', 'CXCL12', 'LYN', 'TNC', 'CXCR4', 'APOA1', 'PIK3CA', 'KDR', 'FGB', 'VCL', 'VAV1', 'SYK', 'FGG', 'ERBB2', 'PTK2B', 'VEGFA', 'CRKL', 'VTN', 'CD81', 'TLN1', 'VCAM1', 'PTK2', 'NRP1', 'LCK', 'PTPN11', 'SEMA4D', 'PLXNA1']
10	GO:BP	GO:0007160	cell-matrix adhesion	2.1598923529872686e-26	True	"""The binding of a cell to the extracellular matrix via adhesion molecules."" [GOC:hb]"	220	101	28	15719	0.2772277227722772	0.1272727272727272	query_1	['GO:0031589']	['ITGB1', 'ITGA9', 'PIK3CB', 'ITGB5', 'FN1', 'ITGAV', 'SRC', 'FGA', 'ITGB3', 'PIK3R1', 'CTNNB1', 'ITGA2B', 'ITGA5', 'PXN', 'ITGA4', 'KDR', 'FGB', 'VCL', 'FGG', 'PTK2B', 'VEGFA', 'VTN', 'TLN1', 'VCAM1', 'L1CAM', 'PTK2', 'ITGB6', 'NRP1']
11	GO:BP	GO:1902533	positive regulation of intracellular signal transduction	1.2657385680480538e-25	True	"""Any process that activates or increases the frequency, rate or extent of intracellular signal transduction."" [GOC:BHF, GOC:dph, GOC:signaling, GOC:tb, GOC:TermGenie]"	962	101	45	15719	0.4455445544554455	0.0467775467775467	query_1	['GO:0009967', 'GO:0035556', 'GO:1902531']	['MET', 'RAPGEF1', 'ITGB1', 'PIK3CB', 'ADRA1A', 'VEGFB', 'PLXNB1', 'FN1', 'ITGAV', 'SRC', 'FGA', 'ITGB3', 'TGFB3', 'CRK', 'HGF', 'SHC1', 'PLCG2', 'TFRC', 'CTNNB1', 'SOS1', 'PIK3CD', 'FYN', 'ZAP70', 'LYN', 'EGFR', 'APOA1', 'PIK3CA', 'KDR', 'FGB', 'SYK', 'FGG', 'ERBB2', 'PTK2B', 'VEGFA', 'CRKL', 'CD81', 'PTK2', 'NRP1', 'LCK', 'CBL', 'PTPN11', 'ACKR3', 'PDGFRA', 'SEMA4D', 'FLT1']
0	GO:CC	GO:0071944	cell periphery	4.180149337508047e-25	True	"""The broad region around and including the plasma membrane of a cell,  encompassing the cell cortex (inside the cell), the plasma membrane, and any external encapsulating structures."" [GOC:pdt]"	5277	102	86	16420	0.8431372549019608	0.0162971385256774	query_1	['GO:0110165']	['MET', 'GJB6', 'RAPGEF1', 'C3', 'ITGB1', 'ITGA9', 'PIK3CB', 'ITGB5', 'ADRA1A', 'PLXNB1', 'FN1', 'ITGAV', 'BCAR1', 'SRC', 'FGA', 'ITGB3', 'TGFB3', 'PIK3R1', 'CRK', 'SHC1', 'ITK', 'PLCG2', 'TFRC', 'CTNNB1', 'SOS1', 'PIK3CD', 'ITGA2B', 'KCNK1', 'ITGA5', 'HFE', 'PXN', 'FYN', 'GJB1', 'ITGA4', 'LAT', 'ZAP70', 'CXCL12', 'MS4A1', 'LYN', 'GJB2', 'GRB2', 'TNC', 'NRP2', 'LCP2', 'CXCR4', 'EGFR', 'APOA1', 'TF', 'TFR2', 'PIK3CA', 'KDR', 'FGB', 'VCL', 'VAV1', 'SYK', 'PLCG1', 'FCGR1A', 'FGG', 'ERBB2', 'SH3KBP1', 'PTK2B', 'IGHM', 'VEGFA', 'SH3GL2', 'SERPINA1', 'CRKL', 'ABCC1', 'VTN', 'CD81', 'TLN1', 'VCAM1', 'L1CAM', 'PTK2', 'ITGB6', 'NRP1', 'LCK', 'CD19', 'BLNK', 'CBL', 'ACKR3', 'PDGFRA', 'HPX', 'SEMA4D', 'FLT1', 'CR2', 'PLXNA1']
13	GO:BP	GO:0006950	response to stress	4.4588622195764935e-25	True	"""Any process that results in a change in state or activity of a cell or an organism (in terms of movement, secretion, enzyme production, gene expression, etc.) as a result of a disturbance in organismal or cellular homeostasis, usually, but not necessarily, exogenous (e.g. temperature, humidity, ionizing radiation)."" [GOC:mah]"	3764	101	76	15719	0.7524752475247525	0.0201912858660998	query_1	['GO:0050896']	['MET', 'RAPGEF1', 'C3', 'ITGB1', 'PIK3CB', 'VEGFB', 'FN1', 'PIK3R2', 'SRC', 'SPP1', 'FGA', 'ITGB3', 'TGFB3', 'PIK3R1', 'CRK', 'HGF', 'SHC1', 'ITK', 'PLCG2', 'TFRC', 'CTNNB1', 'SOS1', 'PIK3CD', 'ITGA5', 'HFE', 'PXN', 'FYN', 'LAT', 'ZAP70', 'CXCL12', 'CERS6', 'LYN', 'GJB2', 'GRB2', 'TNC', 'CXCR4', 'VKORC1', 'EGFR', 'APOA1', 'TF', 'TFR2', 'PIK3CA', 'KDR', 'FGB', 'VCL', 'VAV1', 'SYK', 'PLCG1', 'FCGR1A', 'FGG', 'ERBB2', 'CERS2', 'PTK2B', 'IGHM', 'VEGFA', 'SERPINA1', 'CRKL', 'ABCC1', 'VTN', 'CD81', 'TLN1', 'VCAM1', 'PTK2', 'ITGB6', 'NRP1', 'LCK', 'BLNK', 'ALB', 'CBL', 'PTPN11', 'ACKR3', 'PDGFRA', 'HPX', 'CR2', 'PGF', 'HPR']
12	GO:BP	GO:2000147	positive regulation of cell motility	4.4588622195764935e-25	True	"""Any process that activates or increases the frequency, rate or extent of cell motility."" [GOC:mah]"	533	101	36	15719	0.3564356435643564	0.0675422138836773	query_1	['GO:0040017', 'GO:0048522', 'GO:0048870', 'GO:2000145']	['MET', 'ITGB1', 'PIK3CB', 'VEGFB', 'FN1', 'ITGAV', 'BCAR1', 'SRC', 'ITGB3', 'PIK3R1', 'CRK', 'HGF', 'PLCG2', 'PIK3CD', 'ITGA5', 'ITGA4', 'CXCL12', 'LYN', 'NRP2', 'CXCR4', 'EGFR', 'TF', 'KDR', 'PLCG1', 'PTK2B', 'VEGFA', 'PIK3R3', 'CRKL', 'VTN', 'PTK2', 'NRP1', 'ACKR3', 'PDGFRA', 'SEMA4D', 'FLT1', 'PGF']
15	GO:BP	GO:0031589	cell-substrate adhesion	6.19322780845588e-25	True	"""The attachment of a cell to the underlying substrate via adhesion molecules."" [GOC:mah, GOC:pf]"	345	101	31	15719	0.3069306930693069	0.0898550724637681	query_1	['GO:0007155']	['ITGB1', 'ITGA9', 'PIK3CB', 'ITGB5', 'FN1', 'ITGAV', 'SRC', 'FGA', 'ITGB3', 'PIK3R1', 'CRK', 'CTNNB1', 'ITGA2B', 'ITGA5', 'PXN', 'ITGA4', 'APOA1', 'KDR', 'FGB', 'VCL', 'FGG', 'PTK2B', 'VEGFA', 'CRKL', 'VTN', 'TLN1', 'VCAM1', 'L1CAM', 'PTK2', 'ITGB6', 'NRP1']
14	GO:BP	GO:0009967	positive regulation of signal transduction	6.19322780845588e-25	True	"""Any process that activates or increases the frequency, rate or extent of signal transduction."" [GOC:sm]"	1468	101	52	15719	0.5148514851485149	0.0354223433242506	query_1	['GO:0007165', 'GO:0009966', 'GO:0010647', 'GO:0023056', 'GO:0048584']	['MET', 'RAPGEF1', 'C3', 'ITGB1', 'PIK3CB', 'ADRA1A', 'VEGFB', 'PLXNB1', 'FN1', 'ITGAV', 'SRC', 'FGA', 'ITGB3', 'TGFB3', 'PIK3R1', 'CRK', 'HGF', 'SHC1', 'PLCG2', 'TFRC', 'CTNNB1', 'SOS1', 'PIK3CD', 'ITGA5', 'HFE', 'FYN', 'ZAP70', 'LYN', 'CXCR4', 'EGFR', 'APOA1', 'PIK3CA', 'KDR', 'FGB', 'SYK', 'FGG', 'ERBB2', 'PTK2B', 'VEGFA', 'CRKL', 'VTN', 'CD81', 'PTK2', 'NRP1', 'LCK', 'CBL', 'PTPN11', 'ACKR3', 'PDGFRA', 'HPX', 'SEMA4D', 'FLT1']
16	GO:BP	GO:0009719	response to endogenous stimulus	7.055337663359736e-25	True	"""Any process that results in a change in state or activity of a cell or an organism (in terms of movement, secretion, enzyme production, gene expression, etc.) as a result of a stimulus arising within the organism."" [GOC:sm]"	1624	101	54	15719	0.5346534653465347	0.0332512315270936	query_1	['GO:0050896']	['RAPGEF1', 'ITGB1', 'PIK3CB', 'ITGB5', 'ADRA1A', 'VEGFB', 'PIK3R2', 'BCAR1', 'SRC', 'SPP1', 'ITGB3', 'TGFB3', 'PIK3R1', 'CRK', 'HGF', 'SHC1', 'CTNNB1', 'SOS1', 'PIK3CD', 'ITGA5', 'HFE', 'PXN', 'FYN', 'ITGA4', 'CXCL12', 'LYN', 'GJB2', 'GRB2', 'NRP2', 'CXCR4', 'EGFR', 'PIK3CA', 'KDR', 'FGB', 'SYK', 'PLCG1', 'ERBB2', 'PTK2B', 'VEGFA', 'PIK3R3', 'SH3GL2', 'CRKL', 'ABCC1', 'VTN', 'CD81', 'VCAM1', 'PTK2', 'ITGB6', 'NRP1', 'CBL', 'PTPN11', 'PDGFRA', 'FLT1', 'PGF']
17	GO:BP	GO:0042325	regulation of phosphorylation	7.055337663359736e-25	True	"""Any process that modulates the frequency, rate or extent of addition of phosphate groups into a molecule."" [GOC:jl]"	1135	101	47	15719	0.4653465346534653	0.0414096916299559	query_1	['GO:0016310', 'GO:0019220']	['MET', 'C3', 'PIK3CB', 'ADRA1A', 'VEGFB', 'FN1', 'PIK3R2', 'SRC', 'ITGB3', 'TGFB3', 'PIK3R1', 'HGF', 'SHC1', 'PLCG2', 'TFRC', 'SOS1', 'ITGA5', 'HFE', 'FYN', 'LAT', 'LYN', 'LCP2', 'EGFR', 'APOA1', 'TF', 'PIK3CA', 'KDR', 'SYK', 'FCGR1A', 'ERBB2', 'PTK2B', 'VEGFA', 'PIK3R3', 'SH3GL2', 'CRKL', 'VTN', 'CD81', 'PTK2', 'NRP1', 'CD19', 'CBL', 'PTPN11', 'PDGFRA', 'HPX', 'SEMA4D', 'FLT1', 'PGF']
18	GO:BP	GO:0071363	cellular response to growth factor stimulus	7.2691807417459905e-25	True	"""Any process that results in a change in state or activity of a cell (in terms of movement, secretion, enzyme production, gene expression, etc.) as a result of a growth factor stimulus."" [GOC:mah]"	638	101	38	15719	0.3762376237623762	0.0595611285266457	query_1	['GO:0070848', 'GO:0071495']	['RAPGEF1', 'PIK3CB', 'ITGB5', 'VEGFB', 'BCAR1', 'SRC', 'ITGB3', 'TGFB3', 'CRK', 'HGF', 'SHC1', 'CTNNB1', 'SOS1', 'PIK3CD', 'ITGA5', 'HFE', 'PXN', 'FYN', 'GRB2', 'NRP2', 'EGFR', 'PIK3CA', 'KDR', 'PLCG1', 'ERBB2', 'VEGFA', 'SH3GL2', 'CRKL', 'VTN', 'VCAM1', 'PTK2', 'ITGB6', 'NRP1', 'CBL', 'PTPN11', 'PDGFRA', 'FLT1', 'PGF']
19	GO:BP	GO:0002376	immune system process	7.2691807417459905e-25	True	"""Any process involved in the development or functioning of the immune system, an organismal system for calibrated responses to potential internal or invasive threats."" [GO_REF:0000022, GOC:add]"	2394	101	63	15719	0.6237623762376238	0.0263157894736842	query_1	['GO:0008150']	['RAPGEF1', 'C3', 'ITGB1', 'ITGA9', 'PIK3CB', 'VEGFB', 'FN1', 'PIK3R2', 'BCAR1', 'SRC', 'FGA', 'ITGB3', 'TGFB3', 'PIK3R1', 'CRK', 'ITK', 'PLCG2', 'TFRC', 'CTNNB1', 'SOS1', 'PIK3CD', 'HFE', 'FYN', 'ITGA4', 'LAT', 'ZAP70', 'CXCL12', 'MS4A1', 'LYN', 'GRB2', 'LCP2', 'CXCR4', 'APOA1', 'TF', 'PIK3CA', 'FGB', 'VAV1', 'SYK', 'PLCG1', 'FCGR1A', 'ERBB2', 'SH3KBP1', 'PTK2B', 'IGHM', 'VEGFA', 'PIK3R3', 'CRKL', 'VTN', 'CD81', 'VCAM1', 'PTK2', 'ITGB6', 'LCK', 'CD19', 'BLNK', 'CBL', 'PTPN11', 'ACKR3', 'HPX', 'SEMA4D', 'FLT1', 'CR2', 'PGF']
20	GO:BP	GO:0040017	positive regulation of locomotion	8.067530788493778e-25	True	"""Any process that activates or increases the frequency, rate or extent of locomotion of a cell or organism."" [GOC:go_curators]"	549	101	36	15719	0.3564356435643564	0.0655737704918032	query_1	['GO:0040011', 'GO:0040012', 'GO:0048518']	['MET', 'ITGB1', 'PIK3CB', 'VEGFB', 'FN1', 'ITGAV', 'BCAR1', 'SRC', 'ITGB3', 'PIK3R1', 'CRK', 'HGF', 'PLCG2', 'PIK3CD', 'ITGA5', 'ITGA4', 'CXCL12', 'LYN', 'NRP2', 'CXCR4', 'EGFR', 'TF', 'KDR', 'PLCG1', 'PTK2B', 'VEGFA', 'PIK3R3', 'CRKL', 'VTN', 'PTK2', 'NRP1', 'ACKR3', 'PDGFRA', 'SEMA4D', 'FLT1', 'PGF']
21	GO:BP	GO:0023056	positive regulation of signaling	9.466025053446542e-25	True	"""Any process that activates, maintains or increases the frequency, rate or extent of a signaling process."" [GOC:mtg_signal]"	1641	101	54	15719	0.5346534653465347	0.0329067641681901	query_1	['GO:0023051', 'GO:0023052', 'GO:0048518']	['MET', 'RAPGEF1', 'C3', 'ITGB1', 'PIK3CB', 'ADRA1A', 'VEGFB', 'PLXNB1', 'FN1', 'ITGAV', 'SRC', 'SPP1', 'FGA', 'ITGB3', 'TGFB3', 'PIK3R1', 'CRK', 'HGF', 'SHC1', 'PLCG2', 'TFRC', 'CTNNB1', 'SOS1', 'PIK3CD', 'ITGA5', 'HFE', 'FYN', 'ZAP70', 'LYN', 'CXCR4', 'EGFR', 'APOA1', 'TFR2', 'PIK3CA', 'KDR', 'FGB', 'SYK', 'FGG', 'ERBB2', 'PTK2B', 'VEGFA', 'CRKL', 'VTN', 'CD81', 'PTK2', 'NRP1', 'LCK', 'CBL', 'PTPN11', 'ACKR3', 'PDGFRA', 'HPX', 'SEMA4D', 'FLT1']
22	GO:BP	GO:0010647	positive regulation of cell communication	9.61742124910987e-25	True	"""Any process that increases the frequency, rate or extent of cell communication. Cell communication is the process that mediates interactions between a cell and its surroundings. Encompasses interactions such as signaling or attachment between one cell and another cell, between a cell and an extracellular matrix, or between a cell and any other aspect of its environment."" [GOC:dph, GOC:tb]"	1643	101	54	15719	0.5346534653465347	0.0328667072428484	query_1	['GO:0007154', 'GO:0010646', 'GO:0048522']	['MET', 'RAPGEF1', 'C3', 'ITGB1', 'PIK3CB', 'ADRA1A', 'VEGFB', 'PLXNB1', 'FN1', 'ITGAV', 'SRC', 'SPP1', 'FGA', 'ITGB3', 'TGFB3', 'PIK3R1', 'CRK', 'HGF', 'SHC1', 'PLCG2', 'TFRC', 'CTNNB1', 'SOS1', 'PIK3CD', 'ITGA5', 'HFE', 'FYN', 'ZAP70', 'LYN', 'CXCR4', 'EGFR', 'APOA1', 'TFR2', 'PIK3CA', 'KDR', 'FGB', 'SYK', 'FGG', 'ERBB2', 'PTK2B', 'VEGFA', 'CRKL', 'VTN', 'CD81', 'PTK2', 'NRP1', 'LCK', 'CBL', 'PTPN11', 'ACKR3', 'PDGFRA', 'HPX', 'SEMA4D', 'FLT1']
23	GO:BP	GO:0007154	cell communication	1.0762641300571555e-24	True	"""Any process that mediates interactions between a cell and its surroundings. Encompasses interactions such as signaling or attachment between one cell and another cell, between a cell and an extracellular matrix, or between a cell and any other aspect of its environment."" [GOC:mah]"	5768	101	89	15719	0.8811881188118812	0.0154299583911234	query_1	['GO:0009987']	['MET', 'GJB6', 'RAPGEF1', 'C3', 'ITGB1', 'ITGA9', 'PIK3CB', 'ITGB5', 'ADRA1A', 'VEGFB', 'PLXNB1', 'FN1', 'ITGAV', 'PIK3R2', 'BCAR1', 'SRC', 'SPP1', 'FGA', 'ITGB3', 'TGFB3', 'PIK3R1', 'CRK', 'HGF', 'SHC1', 'ITK', 'PLCG2', 'TFRC', 'CTNNB1', 'SOS1', 'PIK3CD', 'ITGA2B', 'ITGA5', 'HFE', 'PXN', 'FYN', 'GJB1', 'ITGA4', 'LAT', 'ZAP70', 'CXCL12', 'MS4A1', 'LYN', 'GJB2', 'GRB2', 'TNC', 'NRP2', 'LCP2', 'CXCR4', 'EGFR', 'APOA1', 'TF', 'TFR2', 'PIK3CA', 'KDR', 'FGB', 'VAV1', 'SYK', 'PLCG1', 'FCGR1A', 'FGG', 'ERBB2', 'SH3KBP1', 'PTK2B', 'IGHM', 'VEGFA', 'PIK3R3', 'SH3GL2', 'CRKL', 'VTN', 'CD81', 'TLN1', 'VCAM1', 'PTK2', 'ITGB6', 'NRP1', 'LCK', 'CD19', 'BLNK', 'ALB', 'CBL', 'PTPN11', 'ACKR3', 'PDGFRA', 'HPX', 'SEMA4D', 'FLT1', 'CR2', 'PGF', 'PLXNA1']
24	GO:BP	GO:0030335	positive regulation of cell migration	1.165572763876509e-24	True	"""Any process that activates or increases the frequency, rate or extent of cell migration."" [GOC:go_curators]"	514	101	35	15719	0.3465346534653465	0.0680933852140077	query_1	['GO:0016477', 'GO:0030334', 'GO:2000147']	['MET', 'ITGB1', 'PIK3CB', 'VEGFB', 'FN1', 'ITGAV', 'BCAR1', 'SRC', 'ITGB3', 'PIK3R1', 'CRK', 'HGF', 'PLCG2', 'PIK3CD', 'ITGA5', 'ITGA4', 'CXCL12', 'LYN', 'NRP2', 'CXCR4', 'EGFR', 'KDR', 'PLCG1', 'PTK2B', 'VEGFA', 'PIK3R3', 'CRKL', 'VTN', 'PTK2', 'NRP1', 'ACKR3', 'PDGFRA', 'SEMA4D', 'FLT1', 'PGF']
25	GO:BP	GO:0018108	peptidyl-tyrosine phosphorylation	1.5886636663912323e-24	True	"""The phosphorylation of peptidyl-tyrosine to form peptidyl-O4'-phospho-L-tyrosine."" [RESID:AA0039]"	362	101	31	15719	0.3069306930693069	0.0856353591160221	query_1	['GO:0006468', 'GO:0018212']	['MET', 'ADRA1A', 'VEGFB', 'SRC', 'ITGB3', 'HGF', 'SHC1', 'ITK', 'PLCG2', 'ITGA5', 'FYN', 'ZAP70', 'LYN', 'EGFR', 'KDR', 'SYK', 'FCGR1A', 'ERBB2', 'PTK2B', 'VEGFA', 'VTN', 'CD81', 'PTK2', 'NRP1', 'LCK', 'CBL', 'PTPN11', 'PDGFRA', 'HPX', 'SEMA4D', 'FLT1']
26	GO:BP	GO:0018212	peptidyl-tyrosine modification	1.8123061509817017e-24	True	"""The modification of peptidyl-tyrosine."" [GOC:go_curators]"	364	101	31	15719	0.3069306930693069	0.0851648351648351	query_1	['GO:0018193']	['MET', 'ADRA1A', 'VEGFB', 'SRC', 'ITGB3', 'HGF', 'SHC1', 'ITK', 'PLCG2', 'ITGA5', 'FYN', 'ZAP70', 'LYN', 'EGFR', 'KDR', 'SYK', 'FCGR1A', 'ERBB2', 'PTK2B', 'VEGFA', 'VTN', 'CD81', 'PTK2', 'NRP1', 'LCK', 'CBL', 'PTPN11', 'PDGFRA', 'HPX', 'SEMA4D', 'FLT1']
27	GO:BP	GO:0023052	signaling	2.4973310943793764e-24	True	"""The entirety of a process in which information is transmitted within a biological system. This process begins with an active signal and ends when a cellular response has been triggered."" [GOC:mtg_signal, GOC:mtg_signaling_feb11, GOC:signaling]"	5663	101	88	15719	0.8712871287128713	0.0155394667137559	query_1	['GO:0050789']	['MET', 'GJB6', 'RAPGEF1', 'C3', 'ITGB1', 'ITGA9', 'PIK3CB', 'ITGB5', 'ADRA1A', 'VEGFB', 'PLXNB1', 'FN1', 'ITGAV', 'PIK3R2', 'BCAR1', 'SRC', 'SPP1', 'FGA', 'ITGB3', 'TGFB3', 'PIK3R1', 'CRK', 'HGF', 'SHC1', 'ITK', 'PLCG2', 'TFRC', 'CTNNB1', 'SOS1', 'PIK3CD', 'ITGA2B', 'ITGA5', 'HFE', 'PXN', 'FYN', 'GJB1', 'ITGA4', 'LAT', 'ZAP70', 'CXCL12', 'MS4A1', 'LYN', 'GJB2', 'GRB2', 'TNC', 'NRP2', 'LCP2', 'CXCR4', 'EGFR', 'APOA1', 'TF', 'TFR2', 'PIK3CA', 'KDR', 'FGB', 'VAV1', 'SYK', 'PLCG1', 'FCGR1A', 'FGG', 'ERBB2', 'SH3KBP1', 'PTK2B', 'IGHM', 'VEGFA', 'PIK3R3', 'SH3GL2', 'CRKL', 'VTN', 'CD81', 'TLN1', 'VCAM1', 'PTK2', 'ITGB6', 'NRP1', 'LCK', 'CD19', 'BLNK', 'CBL', 'PTPN11', 'ACKR3', 'PDGFRA', 'HPX', 'SEMA4D', 'FLT1', 'CR2', 'PGF', 'PLXNA1']
28	GO:BP	GO:0070848	response to growth factor	2.5356128165534903e-24	True	"""Any process that results in a change in state or activity of a cell or an organism (in terms of movement, secretion, enzyme production, gene expression, etc.) as a result of a growth factor stimulus."" [GOC:BHF, GOC:mah]"	667	101	38	15719	0.3762376237623762	0.0569715142428785	query_1	['GO:0009719']	['RAPGEF1', 'PIK3CB', 'ITGB5', 'VEGFB', 'BCAR1', 'SRC', 'ITGB3', 'TGFB3', 'CRK', 'HGF', 'SHC1', 'CTNNB1', 'SOS1', 'PIK3CD', 'ITGA5', 'HFE', 'PXN', 'FYN', 'GRB2', 'NRP2', 'EGFR', 'PIK3CA', 'KDR', 'PLCG1', 'ERBB2', 'VEGFA', 'SH3GL2', 'CRKL', 'VTN', 'VCAM1', 'PTK2', 'ITGB6', 'NRP1', 'CBL', 'PTPN11', 'PDGFRA', 'FLT1', 'PGF']
2	REAC	REAC:R-HSA-912631	Regulation of signaling by CBL	2.53819501952877e-24	True	Regulation of signaling by CBL	21	100	15	10022	0.15	0.7142857142857143	query_1	['REAC:R-HSA-512988']	['RAPGEF1', 'PIK3CB', 'PIK3R2', 'PIK3R1', 'CRK', 'PIK3CD', 'FYN', 'LYN', 'PIK3CA', 'VAV1', 'SYK', 'PIK3R3', 'CRKL', 'BLNK', 'CBL']
