COG7-CDG	source	native	name	Corrected p_value	significant	description	term_size	query_size	intersection_size	effective_domain_size	precision	recall	query	parents	intersections
551	GO:BP	GO:0010243	response to organonitrogen compound	0.0001350949444374	True	"""Any process that results in a change in state or activity of a cell or an organism (in terms of movement, secretion, enzyme production, gene expression, etc.) as a result of an organonitrogen stimulus. An organonitrogen compound is formally a compound containing at least one carbon-nitrogen bond."" [PMID:9869419]"	1014	101	19	15719	0.1881188118811881	0.0187376725838264	query_1	['GO:0010033', 'GO:1901698']	['BCL2L11', 'GSK3B', 'AKT1', 'BCL2', 'RELA', 'TNF', 'FADD', 'NFKB1', 'NLRP3', 'CFLAR', 'HSP90AA1', 'TNFAIP3', 'NLRP1', 'BIRC2', 'BCL2L1', 'NFKBIA', 'APP', 'TP53', 'BAD']
552	GO:BP	GO:0002697	regulation of immune effector process	0.0001350949444374	True	"""Any process that modulates the frequency, rate, or extent of an immune effector process."" [GOC:add]"	363	101	11	15719	0.1089108910891089	0.0303030303030303	query_1	['GO:0002252', 'GO:0002682']	['TNFRSF1B', 'TNF', 'FADD', 'NLRP3', 'LTA', 'MALT1', 'TRAF2', 'MAP3K7', 'PYCARD', 'TRAF6', 'BCL10']
553	GO:BP	GO:0002702	positive regulation of production of molecular mediator of immune response	0.0001352432622758	True	"""Any process that activates or increases the frequency, rate, or extent of the production of molecular mediator of immune response."" [GOC:add]"	131	101	7	15719	0.0693069306930693	0.0534351145038167	query_1	['GO:0002440', 'GO:0002699', 'GO:0002700', 'GO:0010628']	['NLRP3', 'MALT1', 'TRAF2', 'MAP3K7', 'PYCARD', 'TRAF6', 'BCL10']
554	GO:BP	GO:0022607	cellular component assembly	0.0001352432622758	True	"""The aggregation, arrangement and bonding together of a cellular component."" [GOC:isa_complete]"	2852	101	36	15719	0.3564356435643564	0.0126227208976157	query_1	['GO:0016043', 'GO:0044085']	['BCL2L11', 'CARD11', 'BAX', 'HSPA1A', 'GSK3B', 'CREBBP', 'PYDC2', 'BCL2', 'HSP90AB1', 'CARD8', 'IKBKB', 'NLRC4', 'IKBKE', 'TNF', 'FAS', 'FADD', 'PSTPIP1', 'BID', 'NLRP3', 'BBC3', 'RIPK1', 'CFLAR', 'HSP90AA1', 'IKBKG', 'TRAF2', 'AIM2', 'MEFV', 'PYCARD', 'NLRP1', 'BIRC2', 'BAK1', 'APP', 'RHPN2', 'TP53', 'BCL10', 'BAD']
555	GO:BP	GO:0010498	proteasomal protein catabolic process	0.0001442085037468	True	"""The chemical reactions and pathways resulting in the breakdown of a protein or peptide by hydrolysis of its peptide bonds that is mediated by the proteasome."" [GOC:tb]"	510	101	13	15719	0.1287128712871287	0.0254901960784313	query_1	['GO:0030163', 'GO:0051603']	['SHARPIN', 'HSPA1A', 'GSK3B', 'AKT1', 'HSP90AB1', 'RBX1', 'RBCK1', 'BTRC', 'SKP1', 'FBXW11', 'BIRC2', 'CUL1', 'FBXW7']
37	GO:CC	GO:0005654	nucleoplasm	0.0001460960135586	True	"""That part of the nuclear content other than the chromosomes or the nucleolus."" [GOC:ma, ISBN:0124325653]"	3998	101	44	16420	0.4356435643564356	0.0110055027513756	query_1	['GO:0031981', 'GO:0110165']	['HSPA1A', 'GSK3B', 'AKT1', 'NFKBIE', 'CREBBP', 'UBE2V1', 'MAP3K14', 'BCL2', 'HSP90AB1', 'CHUK', 'CARD8', 'TAB2', 'FOXO3', 'RELA', 'FKBP5', 'MCL1', 'IKBKE', 'RBX1', 'BTRC', 'TBK1', 'FAS', 'NFKB1', 'TNIP2', 'SKP1', 'TNIP1', 'NFKB2', 'HSP90AA1', 'COG5', 'IKBKG', 'TAB1', 'BIRC3', 'TRAF2', 'AIM2', 'MEFV', 'RELB', 'PYCARD', 'REL', 'NLRP1', 'NFKBIA', 'CASP8', 'CUL1', 'FBXW7', 'TP53', 'UBE2N']
556	GO:BP	GO:0030155	regulation of cell adhesion	0.0001462510705692	True	"""Any process that modulates the frequency, rate or extent of attachment of a cell to another cell or to the extracellular matrix."" [GOC:mah]"	753	101	16	15719	0.1584158415841584	0.0212483399734395	query_1	['GO:0007155', 'GO:0050794']	['CARD11', 'MAP3K8', 'GSK3B', 'AKT1', 'BCL2', 'FOXO3', 'RELA', 'TNF', 'FADD', 'NLRP3', 'TNFSF14', 'MALT1', 'PYCARD', 'TRAF6', 'BCL10', 'BAD']
557	GO:BP	GO:0019941	modification-dependent protein catabolic process	0.000148058824829	True	"""The chemical reactions and pathways resulting in the breakdown of a protein or peptide by hydrolysis of its peptide bonds, initiated by the covalent modification of the target protein."" [GOC:go_curators]"	670	101	15	15719	0.1485148514851485	0.0223880597014925	query_1	['GO:0043632', 'GO:0051603']	['SHARPIN', 'HSPA1A', 'GSK3B', 'AKT1', 'HSP90AB1', 'RBX1', 'RBCK1', 'BTRC', 'SKP1', 'FBXW11', 'TNFAIP3', 'BIRC2', 'CUL1', 'FBXW7', 'UBE2N']
558	GO:BP	GO:0006986	response to unfolded protein	0.0001554651358226	True	"""Any process that results in a change in state or activity of a cell or an organism (in terms of movement, secretion, enzyme production, gene expression, etc.) as a result of an unfolded protein stimulus."" [GOC:jl]"	134	101	7	15719	0.0693069306930693	0.0522388059701492	query_1	['GO:0035966']	['BCL2L11', 'BAX', 'HSPA1A', 'HSP90AB1', 'BBC3', 'HSP90AA1', 'BAK1']
559	GO:BP	GO:0045861	negative regulation of proteolysis	0.0001566965280782	True	"""Any process that stops, prevents, or reduces the frequency, rate or extent of the hydrolysis of a peptide bond or bonds within a protein."" [GOC:go_curators]"	303	101	10	15719	0.099009900990099	0.033003300330033	query_1	['GO:0006508', 'GO:0030162', 'GO:0051248']	['AKT1', 'HSP90AB1', 'CARD8', 'TNF', 'TNFSF14', 'BIRC3', 'BIRC2', 'SFN', 'APP', 'TP53']
560	GO:BP	GO:0001783	B cell apoptotic process	0.0001577238782628	True	"""Any apoptotic process in a B cell, a lymphocyte of B lineage with the phenotype CD19-positive and capable of B cell mediated immunity."" [CL:0000236, GOC:add, GOC:mtg_apoptosis, ISBN:0781735149]"	27	101	4	15719	0.0396039603960396	0.1481481481481481	query_1	['GO:0070227']	['BAX', 'BCL2', 'BAK1', 'BCL10']
134	REAC	REAC:R-HSA-8863678	Neurodegenerative Diseases	0.0001628062871306	True	Neurodegenerative Diseases	21	94	4	10022	0.0425531914893617	0.1904761904761904	query_1	['REAC:R-HSA-9734009']	['BCL2L11', 'FOXO3', 'FASLG', 'APP']
135	REAC	REAC:R-HSA-8862803	Deregulated CDK5 triggers multiple neurodegenerative pathways in Alzheimer's disease models	0.0001628062871306	True	Deregulated CDK5 triggers multiple neurodegenerative pathways in Alzheimer's disease models	21	94	4	10022	0.0425531914893617	0.1904761904761904	query_1	['REAC:R-HSA-8863678']	['BCL2L11', 'FOXO3', 'FASLG', 'APP']
561	GO:BP	GO:0010605	negative regulation of macromolecule metabolic process	0.0001667345437033	True	"""Any process that decreases the frequency, rate or extent of the chemical reactions and pathways involving macromolecules, any molecule of high relative molecular mass, the structure of which essentially comprises the multiple repetition of units derived, actually or conceptually, from molecules of low relative molecular mass."" [GOC:dph, GOC:tb]"	2640	101	34	15719	0.3366336633663366	0.0128787878787878	query_1	['GO:0009892', 'GO:0043170', 'GO:0060255']	['BAX', 'HSPA1A', 'GSK3B', 'AKT1', 'CREBBP', 'PYDC2', 'HSP90AB1', 'CARD8', 'FOXO3', 'RELA', 'IKBKB', 'FASLG', 'IKBKE', 'BTRC', 'TBK1', 'TNF', 'NFKB1', 'TNFSF14', 'NFKB2', 'FBXW11', 'BIRC3', 'TRAF2', 'TNFAIP3', 'MEFV', 'RELB', 'PYCARD', 'REL', 'TRAF6', 'BIRC2', 'SFN', 'BAK1', 'APP', 'FBXW7', 'TP53']
136	REAC	REAC:R-HSA-9755511	KEAP1-NFE2L2 pathway	0.0001799233972558	True	KEAP1-NFE2L2 pathway	101	94	7	10022	0.0744680851063829	0.0693069306930693	query_1	['REAC:R-HSA-9711123']	['GSK3B', 'AKT1', 'CREBBP', 'RBX1', 'BTRC', 'SKP1', 'CUL1']
562	GO:BP	GO:0043632	modification-dependent macromolecule catabolic process	0.0001802912664062	True	"""The chemical reactions and pathways resulting in the breakdown of a macromolecule, initiated by covalent modification of the target molecule."" [GOC:jl]"	682	101	15	15719	0.1485148514851485	0.0219941348973607	query_1	['GO:0009057']	['SHARPIN', 'HSPA1A', 'GSK3B', 'AKT1', 'HSP90AB1', 'RBX1', 'RBCK1', 'BTRC', 'SKP1', 'FBXW11', 'TNFAIP3', 'BIRC2', 'CUL1', 'FBXW7', 'UBE2N']
563	GO:BP	GO:1902042	negative regulation of extrinsic apoptotic signaling pathway via death domain receptors	0.0001814882860696	True	"""Any process that stops, prevents or reduces the frequency, rate or extent of extrinsic apoptotic signaling pathway via death domain receptors."" [GOC:TermGenie, PMID:17245429]"	28	101	4	15719	0.0396039603960396	0.1428571428571428	query_1	['GO:0008625', 'GO:1902041', 'GO:2001237']	['GSK3B', 'CFLAR', 'TNFAIP3', 'BCL2L1']
564	GO:BP	GO:0009651	response to salt stress	0.0001814882860696	True	"""Any process that results in a change in state or activity of a cell or an organism (in terms of movement, secretion, enzyme production, gene expression, etc.) as a result of a stimulus indicating an increase or decrease in the concentration of salt (particularly but not exclusively sodium and chloride ions) in the environment."" [GOC:jl]"	28	101	4	15719	0.0396039603960396	0.1428571428571428	query_1	['GO:0006970']	['BAX', 'TNF', 'HSP90AA1', 'TP53']
565	GO:BP	GO:0010332	response to gamma radiation	0.0001814882860696	True	"""Any process that results in a change in state or activity of a cell or an organism (in terms of movement, secretion, enzyme production, gene expression, etc.) as a result of a gamma radiation stimulus. Gamma radiation is a form of electromagnetic radiation (EMR) or light emission of a specific frequency produced from sub-atomic particle interaction, such as electron-positron annihilation and radioactive decay. Gamma rays are generally characterized as EMR having the highest frequency and energy, and also the shortest wavelength, within the electromagnetic radiation spectrum."" [GOC:tair_curators]"	56	101	5	15719	0.0495049504950495	0.0892857142857142	query_1	['GO:0010212']	['BAX', 'BCL2', 'BCL2L1', 'BAK1', 'TP53']
570	GO:BP	GO:0097400	interleukin-17-mediated signaling pathway	0.0001842323825576	True	"""The series of molecular signals initiated by interleukin-17 binding to its receptor on the surface of a target cell, and ending with the regulation of a downstream cellular process, e.g. transcription."" [GOC:ic, PMID:21602493]"	10	101	3	15719	0.0297029702970297	0.3	query_1	['GO:0019221', 'GO:0097398']	['IKBKE', 'TRAF2', 'TRAF6']
568	GO:BP	GO:1900226	negative regulation of NLRP3 inflammasome complex assembly	0.0001842323825576	True	"""Any process that stops, prevents or reduces the frequency, rate or extent of NLRP3 inflammasome complex assembly."" [GOC:TermGenie]"	10	101	3	15719	0.0297029702970297	0.3	query_1	['GO:0031333', 'GO:0044546', 'GO:1900225']	['PYDC2', 'CARD8', 'MEFV']
567	GO:BP	GO:0051709	regulation of killing of cells of another organism	0.0001842323825576	True	"""Any process that modulates the frequency, rate or extent of the killing by an organism of cells in another organism."" [GOC:ai]"	10	101	3	15719	0.0297029702970297	0.3	query_1	['GO:0031341', 'GO:0031640', 'GO:0035821']	['BCL2L11', 'BCL2L1', 'BAD']
566	GO:BP	GO:0006924	activation-induced cell death of T cells	0.0001842323825576	True	"""A T cell apoptotic process that occurs towards the end of the expansion phase following the initial activation of mature T cells by antigen and is triggered by T cell receptor stimulation and signals transmitted via various surface-expressed members of the TNF receptor family such as Fas ligand, Fas, and TNF and the p55 and p75 TNF receptors."" [GOC:add, GOC:mtg_apoptosis, ISBN:0781765196, PMID:12414721, PMID:12752672]"	10	101	3	15719	0.0297029702970297	0.3	query_1	['GO:0043029', 'GO:0070231']	['AKT1', 'FAS', 'FADD']
569	GO:BP	GO:0002676	regulation of chronic inflammatory response	0.0001842323825576	True	"""Any process that modulates the frequency, rate, or extent of a chronic inflammatory response."" [GOC:add]"	10	101	3	15719	0.0297029702970297	0.3	query_1	['GO:0002544', 'GO:0050727']	['TNF', 'LTA', 'TNFAIP3']
571	GO:BP	GO:0002252	immune effector process	0.0001900720481362	True	"""Any process of the immune system that executes a component of an immune response. An effector immune process takes place after its activation."" [GO_REF:0000022, GOC:add, ISBN:0781735149]"	604	101	14	15719	0.1386138613861386	0.0231788079470198	query_1	['GO:0002376']	['TNFRSF1B', 'TNF', 'FADD', 'NLRP3', 'LTA', 'MALT1', 'TRAF2', 'MAP3K7', 'RELB', 'PYCARD', 'TRAF6', 'APP', 'TP53', 'BCL10']
572	GO:BP	GO:0000302	response to reactive oxygen species	0.0001941108914444	True	"""Any process that results in a change in state or activity of a cell or an organism (in terms of movement, secretion, enzyme production, gene expression, etc.) as a result of a reactive oxygen species stimulus. Reactive oxygen species include singlet oxygen, superoxide, and oxygen free radicals."" [GOC:krc]"	191	101	8	15719	0.0792079207920792	0.0418848167539267	query_1	['GO:0006979', 'GO:1901700']	['AKT1', 'BCL2', 'CHUK', 'RELA', 'RIPK1', 'TNFAIP3', 'BAK1', 'BAD']
573	GO:BP	GO:0002763	positive regulation of myeloid leukocyte differentiation	0.0001948328560899	True	"""Any process that activates or increases the frequency, rate, or extent of myeloid leukocyte differentiation."" [GOC:add]"	57	101	5	15719	0.0495049504950495	0.087719298245614	query_1	['GO:0002573', 'GO:0002761', 'GO:0045639', 'GO:1902107']	['TNF', 'FADD', 'RIPK1', 'TRAF6', 'CASP8']
574	GO:BP	GO:2000630	positive regulation of miRNA metabolic process	0.0001948328560899	True	"""Any process that activates or increases the frequency, rate or extent of miRNA metabolic process."" [GOC:dph]"	57	101	5	15719	0.0495049504950495	0.087719298245614	query_1	['GO:0010586', 'GO:0051254', 'GO:2000628']	['FOXO3', 'RELA', 'TNF', 'NFKB1', 'TP53']
575	GO:BP	GO:0001773	myeloid dendritic cell activation	0.0002058537645227	True	"""The change in morphology and behavior of a dendritic cell resulting from exposure to a cytokine, chemokine, cellular ligand, or soluble factor."" [GOC:mgi_curators, ISBN:0781735149]"	29	101	4	15719	0.0396039603960396	0.1379310344827586	query_1	['GO:0002274']	['LTBR', 'RELB', 'PYCARD', 'TRAF6']
576	GO:BP	GO:0031324	negative regulation of cellular metabolic process	0.0002076339007206	True	"""Any process that stops, prevents, or reduces the frequency, rate or extent of the chemical reactions and pathways by which individual cells transform chemical substances."" [GOC:mah]"	2090	101	29	15719	0.2871287128712871	0.0138755980861244	query_1	['GO:0009892', 'GO:0031323', 'GO:0044237', 'GO:0048523']	['BAX', 'HSPA1A', 'GSK3B', 'AKT1', 'CREBBP', 'BCL2', 'TAB2', 'FOXO3', 'RELA', 'IKBKB', 'FASLG', 'MCL1', 'IKBKE', 'BTRC', 'TNF', 'NFKB1', 'CFLAR', 'FBXW11', 'TRAF2', 'TNFAIP3', 'RELB', 'PYCARD', 'TRAF6', 'BCL2L1', 'SFN', 'BAK1', 'TAB3', 'FBXW7', 'TP53']
577	GO:BP	GO:0050728	negative regulation of inflammatory response	0.0002086988275169	True	"""Any process that stops, prevents, or reduces the frequency, rate or extent of the inflammatory response."" [GOC:ai]"	141	101	7	15719	0.0693069306930693	0.0496453900709219	query_1	['GO:0006954', 'GO:0031348', 'GO:0032102', 'GO:0050727']	['SHARPIN', 'TNFRSF1B', 'PYDC2', 'TNFRSF1A', 'NFKB1', 'TNFAIP3', 'MEFV']
578	GO:BP	GO:0010212	response to ionizing radiation	0.0002280251796343	True	"""Any process that results in a change in state or activity of a cell or an organism (in terms of movement, secretion, enzyme production, gene expression, etc.) as a result of a ionizing radiation stimulus. Ionizing radiation is radiation with sufficient energy to remove electrons from atoms and may arise from spontaneous decay of unstable isotopes, resulting in alpha and beta particles and gamma rays. Ionizing radiation also includes X-rays."" [PMID:12509526]"	143	101	7	15719	0.0693069306930693	0.0489510489510489	query_1	['GO:0009314']	['BAX', 'TANK', 'BCL2', 'BBC3', 'BCL2L1', 'BAK1', 'TP53']
582	GO:BP	GO:1900101	regulation of endoplasmic reticulum unfolded protein response	0.0002335174135503	True	"""Any process that modulates the frequency, rate or extent of endoplasmic reticulum unfolded protein response."" [GOC:TermGenie]"	30	101	4	15719	0.0396039603960396	0.1333333333333333	query_1	['GO:0009966', 'GO:0030968', 'GO:1905897']	['BCL2L11', 'BAX', 'BBC3', 'BAK1']
580	GO:BP	GO:0051346	negative regulation of hydrolase activity	0.0002335174135503	True	"""Any process that stops or reduces the rate of hydrolase activity, the catalysis of the hydrolysis of various bonds."" [GOC:ai]"	319	101	10	15719	0.099009900990099	0.0313479623824451	query_1	['GO:0043086', 'GO:0051336']	['GSK3B', 'AKT1', 'CARD8', 'IKBKB', 'TNF', 'TNFSF14', 'BIRC3', 'BIRC2', 'SFN', 'APP']
579	GO:BP	GO:0051604	protein maturation	0.0002335174135503	True	"""Any process leading to the attainment of the full functional capacity of a protein."" [GOC:ai]"	319	101	10	15719	0.099009900990099	0.0313479623824451	query_1	['GO:0010467', 'GO:0019538']	['CREBBP', 'CARD8', 'NLRC4', 'FADD', 'XPNPEP3', 'PYCARD', 'BAK1', 'CASP1', 'CASP8', 'BAD']
581	GO:BP	GO:2000108	positive regulation of leukocyte apoptotic process	0.0002335174135503	True	"""Any process that activates or increases the frequency, rate or extent of leukocyte apoptotic process."" [GOC:BHF, GOC:mtg_apoptosis]"	30	101	4	15719	0.0396039603960396	0.1333333333333333	query_1	['GO:0043065', 'GO:0071887', 'GO:2000106']	['BCL2L11', 'BAX', 'BBC3', 'TP53']
598	GO:BP	GO:0019051	induction by virus of host apoptotic process	0.0002399503754718	True	"""Any viral process that activates or increases the frequency, rate or extent of cell death by apoptotic process."" [GOC:dph, GOC:mtg_apoptosis]"	2	101	2	15719	0.0198019801980198	1.0	query_1	['GO:0039526', 'GO:0052151']	['BCL2L11', 'BAD']
597	GO:BP	GO:0002876	positive regulation of chronic inflammatory response to antigenic stimulus	0.0002399503754718	True	"""Any process that activates or increases the frequency, rate, or extent of a chronic inflammatory response to an antigenic stimulus."" [GOC:add]"	2	101	2	15719	0.0198019801980198	1.0	query_1	['GO:0002439', 'GO:0002678', 'GO:0002863', 'GO:0002874']	['TNF', 'LTA']
596	GO:BP	GO:0001907	killing by symbiont of host cells	0.0002399503754718	True	"""Any process mediated by an organism that results in the death of cells in the host organism. The host is defined as the larger of the organisms involved in a symbiotic interaction."" [GOC:add]"	2	101	2	15719	0.0198019801980198	1.0	query_1	['GO:0051701']	['BCL2L11', 'BAD']
594	GO:BP	GO:1904270	pyroptosome complex assembly	0.0002399503754718	True	"""The aggregation, arrangement and bonding together of a set of components to form a pyroptosome complex."" [GO_REF:0000079, GOC:TermGenie, PMID:17964261]"	2	101	2	15719	0.0198019801980198	1.0	query_1	['GO:0065003']	['AIM2', 'MEFV']
595	GO:BP	GO:2000347	positive regulation of hepatocyte proliferation	0.0002399503754718	True	"""Any process that activates or increases the frequency, rate or extent of hepatocyte proliferation."" [GOC:BHF, GOC:mah]"	11	101	3	15719	0.0297029702970297	0.2727272727272727	query_1	['GO:0050679', 'GO:0072574', 'GO:2000345']	['TNF', 'CFLAR', 'TNFAIP3']
593	GO:BP	GO:0052151	positive regulation by symbiont of host apoptotic process	0.0002399503754718	True	"""Any process in which an organism activates, maintains or increases the frequency, rate or extent of programmed cell death in the host, where programmed cell death proceeds by apoptosis. The host is defined as the larger of the organisms involved in a symbiotic interaction."" [GOC:jl, GOC:mtg_pamgo_17jul06]"	2	101	2	15719	0.0198019801980198	1.0	query_1	['GO:0043065', 'GO:0052042', 'GO:0052150']	['BCL2L11', 'BAD']
583	GO:BP	GO:0052041	suppression by symbiont of host programmed cell death	0.0002399503754718	True	"""Any process in which an organism stops, prevents, or reduces the frequency, rate or extent of programmed cell death in the host organism. The host is defined as the larger of the organisms involved in a symbiotic interaction."" [GOC:mtg_pamgo_17jul06]"	2	101	2	15719	0.0198019801980198	1.0	query_1	['GO:0012501', 'GO:0052040']	['BCL2L1', 'BAD']
591	GO:BP	GO:0032615	interleukin-12 production	0.0002399503754718	True	"""The appearance of interleukin-12 due to biosynthesis or secretion following a cellular stimulus, resulting in an increase in its intracellular or extracellular levels."" [GOC:mah]"	60	101	5	15719	0.0495049504950495	0.0833333333333333	query_1	['GO:0001816']	['RELA', 'NFKB1', 'LTB', 'MEFV', 'TRAF6']
590	GO:BP	GO:1903378	positive regulation of oxidative stress-induced neuron intrinsic apoptotic signaling pathway	0.0002399503754718	True	"""Any process that activates or increases the frequency, rate or extent of oxidative stress-induced neuron intrinsic apoptotic signaling pathway."" [GO_REF:0000058, GOC:bf, GOC:PARL, GOC:TermGenie]"	2	101	2	15719	0.0198019801980198	1.0	query_1	['GO:0036480', 'GO:0043525', 'GO:1902177', 'GO:1903223', 'GO:1903376']	['MCL1', 'FBXW7']
589	GO:BP	GO:0032655	regulation of interleukin-12 production	0.0002399503754718	True	"""Any process that modulates the frequency, rate, or extent of interleukin-12 production."" [GOC:mah]"	60	101	5	15719	0.0495049504950495	0.0833333333333333	query_1	['GO:0001817', 'GO:0032615']	['RELA', 'NFKB1', 'LTB', 'MEFV', 'TRAF6']
588	GO:BP	GO:0002352	B cell negative selection	0.0002399503754718	True	"""Any process leading to negative selection in B cells. Mechanisms of negative selection include anergy and deletion."" [GOC:jal]"	2	101	2	15719	0.0198019801980198	1.0	query_1	['GO:0002339']	['BAX', 'BAK1']
587	GO:BP	GO:0033668	suppression by symbiont of host apoptotic process	0.0002399503754718	True	"""Any process in which an organism stops, prevents, or reduces the frequency, rate or extent of programmed cell death in the host, where programmed cell death proceeds by apoptosis. The host is defined as the larger of the organisms involved in a symbiotic interaction."" [GOC:pamgo_curators]"	2	101	2	15719	0.0198019801980198	1.0	query_1	['GO:0043066', 'GO:0052041', 'GO:0052150']	['BCL2L1', 'BAD']
586	GO:BP	GO:0097343	ripoptosome assembly	0.0002399503754718	True	"""The aggregation, arrangement and bonding together of a set of components to form a ripoptosome, a protein complex whose formation can induce an extrinsic apoptotic signaling pathway or a necroptotic signaling pathway. The composition of this protein complex may depend on several factors including nature of the signal, cell type and more."" [GOC:mtg_apoptosis, PMID:22274400]"	2	101	2	15719	0.0198019801980198	1.0	query_1	['GO:0065003']	['RIPK1', 'BIRC2']
585	GO:BP	GO:0010918	positive regulation of mitochondrial membrane potential	0.0002399503754718	True	"""Any process that activates or increases the frequency, rate or extent of establishment or extent of a mitochondrial membrane potential, the electric potential existing across any mitochondrial membrane arising from charges in the membrane itself and from the charges present in the media on either side of the membrane."" [GOC:dph, GOC:tb]"	11	101	3	15719	0.0297029702970297	0.2727272727272727	query_1	['GO:0045838', 'GO:0051881']	['AKT1', 'BID', 'BAD']
584	GO:BP	GO:0052042	induction by symbiont of host programmed cell death	0.0002399503754718	True	"""Any process in which an organism activates, maintains or increases the frequency, rate or extent of programmed cell death in the host organism. The host is defined as the larger of the organisms involved in a symbiotic interaction."" [GOC:jl, GOC:mtg_pamgo_17jul06]"	2	101	2	15719	0.0198019801980198	1.0	query_1	['GO:0001907', 'GO:0051712', 'GO:0052040']	['BCL2L11', 'BAD']
599	GO:BP	GO:0019050	suppression by virus of host apoptotic process	0.0002399503754718	True	"""Any viral process that inhibits apoptosis of infected host cells, facilitating prolonged cell survival during viral replication."" [GOC:mtg_apoptosis, ISBN:0781718325]"	2	101	2	15719	0.0198019801980198	1.0	query_1	['GO:0033668', 'GO:0039526']	['BCL2L1', 'BAD']
592	GO:BP	GO:1901026	ripoptosome assembly involved in necroptotic process	0.0002399503754718	True	"""The aggregation, arrangement and bonding together of ripoptosome components leading to a necroptotic process."" [GOC:mtg_apoptosis, GOC:TermGenie, PMID:22274400]"	2	101	2	15719	0.0198019801980198	1.0	query_1	['GO:0070266', 'GO:0097343']	['RIPK1', 'BIRC2']
38	GO:CC	GO:0098562	cytoplasmic side of membrane	0.0002417371723932	True	"""The side of a membrane that faces the cytoplasm."" [GOC:dos]"	197	101	8	16420	0.0792079207920792	0.0406091370558375	query_1	['GO:0098552']	['AKT1', 'TRAF3', 'CHUK', 'IKBKB', 'RNF31', 'TRAF2', 'TRAF6', 'BIRC2']
600	GO:BP	GO:0043410	positive regulation of MAPK cascade	0.0002451448108912	True	"""Any process that activates or increases the frequency, rate or extent of signal transduction mediated by the MAPK cascade."" [GOC:go_curators]"	464	101	12	15719	0.1188118811881188	0.0258620689655172	query_1	['GO:0000165', 'GO:0043408', 'GO:1902533']	['TRAF3', 'TNF', 'RIPK1', 'CFLAR', 'TAB1', 'TRAF2', 'MAP3K7', 'LTBR', 'PYCARD', 'TRAF6', 'APP', 'FBXW7']
39	GO:CC	GO:0098797	plasma membrane protein complex	0.0002566937667277	True	"""Any protein complex that is part of the plasma membrane."" [GOC:dos]"	632	101	14	16420	0.1386138613861386	0.0221518987341772	query_1	['GO:0005886', 'GO:0098796']	['TRAF3', 'CASP10', 'CHUK', 'IKBKB', 'FAS', 'RNF31', 'FADD', 'RIPK1', 'CFLAR', 'TRADD', 'TRAF2', 'TRAF6', 'BIRC2', 'CASP8']
601	GO:BP	GO:0043086	negative regulation of catalytic activity	0.0002576621676627	True	"""Any process that stops or reduces the activity of an enzyme."" [GOC:ebc, GOC:jl, GOC:tb, GOC:vw]"	624	101	14	15719	0.1386138613861386	0.0224358974358974	query_1	['GO:0044092', 'GO:0050790']	['GSK3B', 'AKT1', 'CARD8', 'IKBKB', 'TNF', 'NFKB1', 'TNFSF14', 'BIRC3', 'TNFAIP3', 'PYCARD', 'BIRC2', 'SFN', 'APP', 'TP53']
602	GO:BP	GO:0032692	negative regulation of interleukin-1 production	0.0002579451776543	True	"""Any process that stops, prevents, or reduces the frequency, rate, or extent of interleukin-1 production."" [GOC:mah]"	31	101	4	15719	0.0396039603960396	0.1290322580645161	query_1	['GO:0001818', 'GO:0032612', 'GO:0032652']	['PYDC2', 'CARD8', 'TNFAIP3', 'MEFV']
