Williams syndrome	source	native	name	Corrected p_value	significant	description	term_size	query_size	intersection_size	effective_domain_size	precision	recall	query	parents	intersections
0	REAC	REAC:R-HSA-1474244	Extracellular matrix organization	3.84272166600061e-36	True	Extracellular matrix organization	284	108	43	10022	0.3981481481481481	0.1514084507042253	query_1	['REAC:0000000']	['ITGB1', 'ITGA9', 'ITGB5', 'FN1', 'ITGAV', 'SPP1', 'ITGB3', 'TGFB3', 'LRP4', 'LTBP1', 'LOX', 'ITGA2B', 'ITGA5', 'ITGA4', 'SH3PXD2A', 'ADAM19', 'FBLN5', 'TNC', 'MFAP3', 'FBLN2', 'LOXL1', 'JAM3', 'FBN1', 'ITGAE', 'KDR', 'FBN2', 'MUSK', 'CDH1', 'AGRN', 'MFAP2', 'ADAM12', 'MFAP5', 'VTN', 'VCAM1', 'ITGB6', 'EMILIN1', 'THBS1', 'ITGB7', 'ADAM15', 'ITGA3', 'ELN', 'JAM2', 'MFAP4']
0	GO:BP	GO:0007169	transmembrane receptor protein tyrosine kinase signaling pathway	6.033394740888938e-31	True	"""The series of molecular signals initiated by an extracellular ligand binding to a receptor on the surface of the target cell where the receptor possesses tyrosine kinase activity, and ending with the regulation of a downstream cellular process, e.g. transcription."" [GOC:ceb, GOC:signaling]"	605	118	46	15719	0.3898305084745763	0.0760330578512396	query_1	['GO:0007167']	['MET', 'RAPGEF1', 'VEGFB', 'BCAR1', 'SRC', 'ITGB3', 'PIK3R1', 'CRK', 'HGF', 'RET', 'SHC1', 'SOS1', 'GAB1', 'LOX', 'ITGA5', 'PXN', 'FYN', 'NCF1', 'ZAP70', 'LYN', 'GRB2', 'NRP2', 'LCP2', 'EGFR', 'KDR', 'VAV1', 'SYK', 'PLCG1', 'ERBB2', 'MUSK', 'PTK2B', 'VEGFA', 'CRKL', 'VTN', 'GAB2', 'SHC3', 'PTK2', 'NRP1', 'LCK', 'EMILIN1', 'THBS1', 'CBL', 'PTPN11', 'PDGFRA', 'FLT1', 'PGF']
1	GO:BP	GO:0007155	cell adhesion	6.885891092185449e-31	True	"""The attachment of a cell, either to another cell or to an underlying substrate such as the extracellular matrix, via cell adhesion molecules."" [GOC:hb, GOC:pf]"	1409	118	62	15719	0.5254237288135594	0.0440028388928318	query_1	['GO:0009987']	['RAPGEF1', 'ITGB1', 'ITGA9', 'ITGB5', 'PLXNB1', 'FN1', 'ITGAV', 'BCAR1', 'SRC', 'SPP1', 'ITGB3', 'PIK3R1', 'CRK', 'RET', 'SHC1', 'ITGA2B', 'ITGA5', 'PXN', 'FYN', 'ITGA4', 'ZAP70', 'ADAM19', 'MADCAM1', 'LYN', 'FBLN5', 'TNC', 'NRP2', 'FBLN2', 'JAM3', 'EGFR', 'FBN1', 'ITGAE', 'KDR', 'VCL', 'VAV1', 'SYK', 'ERBB2', 'MUSK', 'CDH1', 'PTK2B', 'VEGFA', 'ADAM12', 'CRKL', 'VTN', 'TLN1', 'VCAM1', 'L1CAM', 'ITGB6', 'PTK2', 'NRP1', 'LCK', 'EMILIN1', 'THBS1', 'ITGB7', 'ADAM15', 'ITGA3', 'JAM2', 'PTPN11', 'PDGFRA', 'SEMA4D', 'PLXNA1', 'MFAP4']
2	GO:BP	GO:0007167	enzyme-linked receptor protein signaling pathway	6.885891092185449e-31	True	"""The series of molecular signals initiated by an extracellular ligand binding to a receptor on the surface of the target cell, where the receptor possesses catalytic activity or is closely associated with an enzyme such as a protein kinase, and ending with the regulation of a downstream cellular process, e.g. transcription."" [GOC:mah, GOC:signaling, ISBN:0815316194]"	927	118	53	15719	0.4491525423728814	0.0571736785329018	query_1	['GO:0007166']	['MET', 'RAPGEF1', 'ITGB5', 'VEGFB', 'BCAR1', 'SRC', 'ITGB3', 'TGFB3', 'PIK3R1', 'CRK', 'HGF', 'RET', 'SHC1', 'LTBP1', 'SOS1', 'GAB1', 'LOX', 'ITGA5', 'PXN', 'FYN', 'NCF1', 'ZAP70', 'LYN', 'GRB2', 'NRP2', 'LCP2', 'EGFR', 'FBN1', 'KDR', 'VAV1', 'FBN2', 'SYK', 'PLCG1', 'ERBB2', 'MUSK', 'PTK2B', 'VEGFA', 'CRKL', 'VTN', 'GAB2', 'SHC3', 'ITGB6', 'PTK2', 'NRP1', 'LCK', 'EMILIN1', 'THBS1', 'ITGA3', 'CBL', 'PTPN11', 'PDGFRA', 'FLT1', 'PGF']
1	REAC	REAC:R-HSA-1566948	Elastic fibre formation	1.4898640779669313e-30	True	Elastic fibre formation	43	108	22	10022	0.2037037037037037	0.5116279069767442	query_1	['REAC:R-HSA-1474244']	['ITGB1', 'ITGB5', 'FN1', 'ITGAV', 'ITGB3', 'TGFB3', 'LTBP1', 'LOX', 'ITGA5', 'FBLN5', 'MFAP3', 'FBLN2', 'LOXL1', 'FBN1', 'FBN2', 'MFAP2', 'MFAP5', 'VTN', 'ITGB6', 'EMILIN1', 'ELN', 'MFAP4']
2	REAC	REAC:R-HSA-9006934	Signaling by Receptor Tyrosine Kinases	1.0160396392838565e-29	True	Signaling by Receptor Tyrosine Kinases	495	108	46	10022	0.4259259259259259	0.0929292929292929	query_1	['REAC:R-HSA-162582']	['MET', 'RAPGEF1', 'ITGB1', 'VEGFB', 'FN1', 'ITGAV', 'BCAR1', 'SRC', 'SPP1', 'ITGB3', 'PIK3R1', 'CRK', 'HGF', 'SHC1', 'SOS1', 'GAB1', 'PXN', 'FYN', 'MEMO1', 'NCF1', 'LYN', 'NRP2', 'EGFR', 'KDR', 'VAV1', 'PLCG1', 'ERBB2', 'PTK2B', 'VEGFA', 'SH3KBP1', 'SH3GL2', 'ADAM12', 'CRKL', 'GAB2', 'SHC3', 'PTK2', 'NRP1', 'LCK', 'THBS1', 'ITGA3', 'CBL', 'PTPN11', 'PDGFRA', 'FLT1', 'PGF', 'GRAP2']
3	GO:BP	GO:0007160	cell-matrix adhesion	1.1003534841166559e-29	True	"""The binding of a cell to the extracellular matrix via adhesion molecules."" [GOC:hb]"	220	118	32	15719	0.2711864406779661	0.1454545454545454	query_1	['GO:0031589']	['ITGB1', 'ITGA9', 'ITGB5', 'FN1', 'ITGAV', 'SRC', 'ITGB3', 'PIK3R1', 'ITGA2B', 'ITGA5', 'PXN', 'ITGA4', 'MADCAM1', 'FBLN5', 'JAM3', 'ITGAE', 'KDR', 'VCL', 'PTK2B', 'VEGFA', 'VTN', 'TLN1', 'VCAM1', 'L1CAM', 'ITGB6', 'PTK2', 'NRP1', 'EMILIN1', 'THBS1', 'ITGB7', 'ADAM15', 'ITGA3']
4	GO:BP	GO:0007229	integrin-mediated signaling pathway	3.486513784522298e-29	True	"""The series of molecular signals initiated by an extracellular ligand binding to an integrin on the surface of a target cell, and ending with the regulation of a downstream cellular process, e.g. transcription."" [GOC:mah, GOC:signaling]"	113	118	26	15719	0.2203389830508474	0.2300884955752212	query_1	['GO:0007166']	['ITGB1', 'ITGA9', 'ITGB5', 'FN1', 'ITGAV', 'BCAR1', 'SRC', 'ITGB3', 'ITGA2B', 'ITGA5', 'ITGA4', 'LAT', 'MADCAM1', 'ITGAE', 'VAV1', 'SYK', 'PTK2B', 'ADAM12', 'TLN1', 'ITGB6', 'PTK2', 'NRP1', 'ITGB7', 'ADAM15', 'ITGA3', 'PTPN11']
5	GO:BP	GO:0016477	cell migration	7.563019679012473e-29	True	"""The controlled self-propelled movement of a cell from one site to a destination guided by molecular cues."" [GOC:cjm, GOC:dph, GOC:ems, GOC:pf, Wikipedia:Cell_migration]"	1427	118	60	15719	0.5084745762711864	0.0420462508759635	query_1	['GO:0048870']	['MET', 'ITGB1', 'ITGA9', 'MIIP', 'ITGB5', 'VEGFB', 'PLXNB1', 'FN1', 'ITGAV', 'BCAR1', 'SRC', 'ITGB3', 'PIK3R1', 'CRK', 'HGF', 'RET', 'PLCG2', 'SOS1', 'GAB1', 'LOX', 'ITGA5', 'PXN', 'FYN', 'ITGA4', 'ZAP70', 'MADCAM1', 'LYN', 'TNC', 'NRP2', 'JAM3', 'EGFR', 'KDR', 'VCL', 'VAV1', 'SYK', 'PLCG1', 'CDH1', 'PTK2B', 'VEGFA', 'SH3KBP1', 'CRKL', 'VTN', 'VCAM1', 'L1CAM', 'ITGB6', 'PTK2', 'NRP1', 'LCK', 'EMILIN1', 'THBS1', 'ITGB7', 'ADAM15', 'ITGA3', 'JAM2', 'PTPN11', 'PDGFRA', 'SEMA4D', 'FLT1', 'PGF', 'PLXNA1']
6	GO:BP	GO:0007166	cell surface receptor signaling pathway	2.734030250221112e-28	True	"""The series of molecular signals initiated by activation of a receptor on the surface of a cell. The pathway begins with binding of an extracellular ligand to a cell surface receptor, or for receptors that signal in the absence of a ligand, by ligand-withdrawal or the activity of a constitutively active receptor. The pathway ends with regulation of a downstream cellular process, e.g. transcription."" [GOC:bf, GOC:mah, GOC:pr, GOC:signaling]"	2638	118	76	15719	0.6440677966101694	0.0288097043214556	query_1	['GO:0007165']	['LIMK1', 'MET', 'RAPGEF1', 'ITGB1', 'ITGA9', 'ITGB5', 'VEGFB', 'PLXNB1', 'FN1', 'ITGAV', 'BCAR1', 'SRC', 'ITGB3', 'TGFB3', 'PIK3R1', 'CRK', 'HGF', 'RET', 'SHC1', 'ITK', 'PLCG2', 'LRP4', 'LTBP1', 'SOS1', 'GAB1', 'LOX', 'STX1A', 'ITGA2B', 'ITGA5', 'PXN', 'FYN', 'ITGA4', 'NCF1', 'LAT', 'BCL7B', 'ZAP70', 'MADCAM1', 'LYN', 'GRB2', 'NRP2', 'LCP2', 'EGFR', 'FBN1', 'ITGAE', 'KDR', 'VAV1', 'FBN2', 'SYK', 'PLCG1', 'FCGR1A', 'ERBB2', 'MUSK', 'PTK2B', 'VEGFA', 'ADAM12', 'CRKL', 'VTN', 'GAB2', 'SHC3', 'TLN1', 'ITGB6', 'PTK2', 'NRP1', 'LCK', 'EMILIN1', 'THBS1', 'ITGB7', 'ADAM15', 'ITGA3', 'CBL', 'PTPN11', 'PDGFRA', 'SEMA4D', 'FLT1', 'PGF', 'PLXNA1']
7	GO:BP	GO:0033627	cell adhesion mediated by integrin	1.4259269787730263e-27	True	"""The attachment of a cell, either to another cell or to an underlying substrate such as the extracellular matrix, via an integrin, a heterodimeric adhesion receptor formed by the non-covalent association of particular alpha and beta subunits."" [GOC:add, PMID:12213832, PMID:14754902]"	85	118	23	15719	0.1949152542372881	0.2705882352941176	query_1	['GO:0007155']	['ITGB1', 'ITGA9', 'ITGB5', 'ITGAV', 'ITGB3', 'CRK', 'RET', 'ITGA2B', 'ITGA5', 'ITGA4', 'LYN', 'JAM3', 'FBN1', 'ITGAE', 'SYK', 'CRKL', 'VTN', 'ITGB6', 'PTK2', 'EMILIN1', 'ITGB7', 'ITGA3', 'PTPN11']
8	GO:BP	GO:0031589	cell-substrate adhesion	1.4259269787730263e-27	True	"""The attachment of a cell to the underlying substrate via adhesion molecules."" [GOC:mah, GOC:pf]"	345	118	35	15719	0.2966101694915254	0.1014492753623188	query_1	['GO:0007155']	['ITGB1', 'ITGA9', 'ITGB5', 'FN1', 'ITGAV', 'SRC', 'ITGB3', 'PIK3R1', 'CRK', 'ITGA2B', 'ITGA5', 'PXN', 'ITGA4', 'MADCAM1', 'FBLN5', 'FBLN2', 'JAM3', 'ITGAE', 'KDR', 'VCL', 'PTK2B', 'VEGFA', 'CRKL', 'VTN', 'TLN1', 'VCAM1', 'L1CAM', 'ITGB6', 'PTK2', 'NRP1', 'EMILIN1', 'THBS1', 'ITGB7', 'ADAM15', 'ITGA3']
3	REAC	REAC:R-HSA-2129379	Molecules associated with elastic fibres	9.2046746018996e-27	True	Molecules associated with elastic fibres	36	108	19	10022	0.1759259259259259	0.5277777777777778	query_1	['REAC:R-HSA-1566948']	['ITGB1', 'ITGB5', 'FN1', 'ITGAV', 'ITGB3', 'TGFB3', 'LTBP1', 'FBLN5', 'MFAP3', 'FBLN2', 'FBN1', 'FBN2', 'MFAP2', 'MFAP5', 'VTN', 'ITGB6', 'EMILIN1', 'ELN', 'MFAP4']
4	REAC	REAC:R-HSA-216083	Integrin cell surface interactions	1.3992398908561742e-26	True	Integrin cell surface interactions	83	108	24	10022	0.2222222222222222	0.2891566265060241	query_1	['REAC:R-HSA-1474244']	['ITGB1', 'ITGA9', 'ITGB5', 'FN1', 'ITGAV', 'SPP1', 'ITGB3', 'ITGA2B', 'ITGA5', 'ITGA4', 'TNC', 'JAM3', 'FBN1', 'ITGAE', 'KDR', 'CDH1', 'AGRN', 'VTN', 'VCAM1', 'ITGB6', 'THBS1', 'ITGB7', 'ITGA3', 'JAM2']
9	GO:BP	GO:0048870	cell motility	3.390937705890217e-26	True	"""Any process involved in the controlled self-propelled movement of a cell that results in translocation of the cell from one place to another."" [GOC:dgh, GOC:dph, GOC:isa_complete, GOC:mlg]"	1609	118	60	15719	0.5084745762711864	0.0372902423865755	query_1	['GO:0009987']	['MET', 'ITGB1', 'ITGA9', 'MIIP', 'ITGB5', 'VEGFB', 'PLXNB1', 'FN1', 'ITGAV', 'BCAR1', 'SRC', 'ITGB3', 'PIK3R1', 'CRK', 'HGF', 'RET', 'PLCG2', 'SOS1', 'GAB1', 'LOX', 'ITGA5', 'PXN', 'FYN', 'ITGA4', 'ZAP70', 'MADCAM1', 'LYN', 'TNC', 'NRP2', 'JAM3', 'EGFR', 'KDR', 'VCL', 'VAV1', 'SYK', 'PLCG1', 'CDH1', 'PTK2B', 'VEGFA', 'SH3KBP1', 'CRKL', 'VTN', 'VCAM1', 'L1CAM', 'ITGB6', 'PTK2', 'NRP1', 'LCK', 'EMILIN1', 'THBS1', 'ITGB7', 'ADAM15', 'ITGA3', 'JAM2', 'PTPN11', 'PDGFRA', 'SEMA4D', 'FLT1', 'PGF', 'PLXNA1']
10	GO:BP	GO:0040011	locomotion	2.042315766291313e-25	True	"""Self-propelled movement of a cell or organism from one location to another."" [GOC:dgh]"	1285	118	54	15719	0.4576271186440678	0.0420233463035019	query_1	['GO:0008150']	['MET', 'ITGB1', 'ITGA9', 'MIIP', 'VEGFB', 'PLXNB1', 'FN1', 'ITGAV', 'BCAR1', 'SRC', 'ITGB3', 'PIK3R1', 'CRK', 'HGF', 'RET', 'PLCG2', 'SOS1', 'GAB1', 'LOX', 'ITGA5', 'FYN', 'ITGA4', 'MADCAM1', 'LYN', 'TNC', 'NRP2', 'JAM3', 'EGFR', 'KDR', 'VCL', 'VAV1', 'SYK', 'PLCG1', 'ERBB2', 'MUSK', 'CDH1', 'PTK2B', 'VEGFA', 'CRKL', 'VTN', 'VCAM1', 'L1CAM', 'PTK2', 'NRP1', 'EMILIN1', 'THBS1', 'ADAM15', 'ITGA3', 'JAM2', 'PDGFRA', 'SEMA4D', 'FLT1', 'PGF', 'PLXNA1']
11	GO:BP	GO:0071363	cellular response to growth factor stimulus	3.906592398056675e-25	True	"""Any process that results in a change in state or activity of a cell (in terms of movement, secretion, enzyme production, gene expression, etc.) as a result of a growth factor stimulus."" [GOC:mah]"	638	118	41	15719	0.3474576271186441	0.0642633228840125	query_1	['GO:0070848', 'GO:0071495']	['RAPGEF1', 'ITGB5', 'VEGFB', 'BCAR1', 'SRC', 'ITGB3', 'TGFB3', 'CRK', 'HGF', 'SHC1', 'LTBP1', 'SOS1', 'GAB1', 'LOX', 'ITGA5', 'PXN', 'FYN', 'GRB2', 'NRP2', 'EGFR', 'FBN1', 'KDR', 'FBN2', 'PLCG1', 'ERBB2', 'VEGFA', 'SH3GL2', 'CRKL', 'VTN', 'VCAM1', 'ITGB6', 'PTK2', 'NRP1', 'EMILIN1', 'THBS1', 'ITGA3', 'CBL', 'PTPN11', 'PDGFRA', 'FLT1', 'PGF']
12	GO:BP	GO:0070848	response to growth factor	1.9005431380671577e-24	True	"""Any process that results in a change in state or activity of a cell or an organism (in terms of movement, secretion, enzyme production, gene expression, etc.) as a result of a growth factor stimulus."" [GOC:BHF, GOC:mah]"	667	118	41	15719	0.3474576271186441	0.0614692653673163	query_1	['GO:0009719']	['RAPGEF1', 'ITGB5', 'VEGFB', 'BCAR1', 'SRC', 'ITGB3', 'TGFB3', 'CRK', 'HGF', 'SHC1', 'LTBP1', 'SOS1', 'GAB1', 'LOX', 'ITGA5', 'PXN', 'FYN', 'GRB2', 'NRP2', 'EGFR', 'FBN1', 'KDR', 'FBN2', 'PLCG1', 'ERBB2', 'VEGFA', 'SH3GL2', 'CRKL', 'VTN', 'VCAM1', 'ITGB6', 'PTK2', 'NRP1', 'EMILIN1', 'THBS1', 'ITGA3', 'CBL', 'PTPN11', 'PDGFRA', 'FLT1', 'PGF']
13	GO:BP	GO:0018108	peptidyl-tyrosine phosphorylation	1.9005431380671577e-24	True	"""The phosphorylation of peptidyl-tyrosine to form peptidyl-O4'-phospho-L-tyrosine."" [RESID:AA0039]"	362	118	33	15719	0.2796610169491525	0.0911602209944751	query_1	['GO:0006468', 'GO:0018212']	['MET', 'VEGFB', 'SRC', 'ITGB3', 'HGF', 'RET', 'SHC1', 'ITK', 'PLCG2', 'LRP4', 'ITGA5', 'FYN', 'NCF1', 'ZAP70', 'LYN', 'EGFR', 'KDR', 'SYK', 'FCGR1A', 'ERBB2', 'MUSK', 'PTK2B', 'VEGFA', 'VTN', 'BAZ1B', 'PTK2', 'NRP1', 'LCK', 'CBL', 'PTPN11', 'PDGFRA', 'SEMA4D', 'FLT1']
14	GO:BP	GO:0018212	peptidyl-tyrosine modification	1.9903499222731063e-24	True	"""The modification of peptidyl-tyrosine."" [GOC:go_curators]"	364	118	33	15719	0.2796610169491525	0.0906593406593406	query_1	['GO:0018193']	['MET', 'VEGFB', 'SRC', 'ITGB3', 'HGF', 'RET', 'SHC1', 'ITK', 'PLCG2', 'LRP4', 'ITGA5', 'FYN', 'NCF1', 'ZAP70', 'LYN', 'EGFR', 'KDR', 'SYK', 'FCGR1A', 'ERBB2', 'MUSK', 'PTK2B', 'VEGFA', 'VTN', 'BAZ1B', 'PTK2', 'NRP1', 'LCK', 'CBL', 'PTPN11', 'PDGFRA', 'SEMA4D', 'FLT1']
0	GO:CC	GO:0098636	protein complex involved in cell adhesion	4.413567534597735e-23	True	"""Any protein complex that is capable of carrying out some part of the process of cell adhesion to the cell matrix or to another cell."" [GOC:dos]"	56	118	18	16420	0.1525423728813559	0.3214285714285714	query_1	['GO:0032991']	['ITGB1', 'ITGA9', 'ITGB5', 'ITGAV', 'ITGB3', 'ITGA2B', 'ITGA5', 'ITGA4', 'LYN', 'TNC', 'JAM3', 'ITGAE', 'VTN', 'ITGB6', 'EMILIN1', 'ITGB7', 'ITGA3', 'JAM2']
15	GO:BP	GO:0030335	positive regulation of cell migration	5.010021885254672e-23	True	"""Any process that activates or increases the frequency, rate or extent of cell migration."" [GOC:go_curators]"	514	118	36	15719	0.3050847457627119	0.0700389105058365	query_1	['GO:0016477', 'GO:0030334', 'GO:2000147']	['MET', 'ITGB1', 'VEGFB', 'FN1', 'ITGAV', 'BCAR1', 'SRC', 'ITGB3', 'PIK3R1', 'CRK', 'HGF', 'RET', 'PLCG2', 'GAB1', 'ITGA5', 'ITGA4', 'MADCAM1', 'LYN', 'NRP2', 'JAM3', 'EGFR', 'KDR', 'PLCG1', 'PTK2B', 'VEGFA', 'CRKL', 'VTN', 'PTK2', 'NRP1', 'THBS1', 'ITGA3', 'JAM2', 'PDGFRA', 'SEMA4D', 'FLT1', 'PGF']
16	GO:BP	GO:0030334	regulation of cell migration	8.277468422269509e-23	True	"""Any process that modulates the frequency, rate or extent of cell migration."" [GOC:go_curators]"	886	118	44	15719	0.3728813559322034	0.0496613995485327	query_1	['GO:0016477', 'GO:2000145']	['MET', 'ITGB1', 'MIIP', 'VEGFB', 'PLXNB1', 'FN1', 'ITGAV', 'BCAR1', 'SRC', 'ITGB3', 'PIK3R1', 'CRK', 'HGF', 'RET', 'PLCG2', 'GAB1', 'ITGA5', 'ITGA4', 'MADCAM1', 'LYN', 'TNC', 'NRP2', 'JAM3', 'EGFR', 'KDR', 'VCL', 'PLCG1', 'CDH1', 'PTK2B', 'VEGFA', 'CRKL', 'VTN', 'PTK2', 'NRP1', 'EMILIN1', 'THBS1', 'ADAM15', 'ITGA3', 'JAM2', 'PDGFRA', 'SEMA4D', 'FLT1', 'PGF', 'PLXNA1']
17	GO:BP	GO:2000147	positive regulation of cell motility	1.5587012803310612e-22	True	"""Any process that activates or increases the frequency, rate or extent of cell motility."" [GOC:mah]"	533	118	36	15719	0.3050847457627119	0.0675422138836773	query_1	['GO:0040017', 'GO:0048522', 'GO:0048870', 'GO:2000145']	['MET', 'ITGB1', 'VEGFB', 'FN1', 'ITGAV', 'BCAR1', 'SRC', 'ITGB3', 'PIK3R1', 'CRK', 'HGF', 'RET', 'PLCG2', 'GAB1', 'ITGA5', 'ITGA4', 'MADCAM1', 'LYN', 'NRP2', 'JAM3', 'EGFR', 'KDR', 'PLCG1', 'PTK2B', 'VEGFA', 'CRKL', 'VTN', 'PTK2', 'NRP1', 'THBS1', 'ITGA3', 'JAM2', 'PDGFRA', 'SEMA4D', 'FLT1', 'PGF']
1	GO:CC	GO:0070161	anchoring junction	3.6707688302935464e-22	True	"""A cell junction that mechanically attaches a cell (and its cytoskeleton) to neighboring cells or to the extracellular matrix."" [ISBN:0815332181]"	855	118	42	16420	0.3559322033898305	0.0491228070175438	query_1	['GO:0030054']	['LIMK1', 'ITGB1', 'ITGB5', 'ITGAV', 'BCAR1', 'SRC', 'ITGB3', 'PIK3R1', 'ITK', 'GAB1', 'ITGA2B', 'ITGA5', 'PXN', 'ITGA4', 'LAT', 'SH3PXD2A', 'ZAP70', 'LYN', 'GRB2', 'TNC', 'LCP2', 'JAM3', 'EGFR', 'KDR', 'VCL', 'VAV1', 'PLCG1', 'CDH1', 'PTK2B', 'VEGFA', 'SH3KBP1', 'TLN1', 'L1CAM', 'ITGB6', 'PTK2', 'NRP1', 'ITGB7', 'ADAM15', 'ITGA3', 'CBL', 'JAM2', 'FLT1']
18	GO:BP	GO:0040017	positive regulation of locomotion	4.0817405308657044e-22	True	"""Any process that activates or increases the frequency, rate or extent of locomotion of a cell or organism."" [GOC:go_curators]"	549	118	36	15719	0.3050847457627119	0.0655737704918032	query_1	['GO:0040011', 'GO:0040012', 'GO:0048518']	['MET', 'ITGB1', 'VEGFB', 'FN1', 'ITGAV', 'BCAR1', 'SRC', 'ITGB3', 'PIK3R1', 'CRK', 'HGF', 'RET', 'PLCG2', 'GAB1', 'ITGA5', 'ITGA4', 'MADCAM1', 'LYN', 'NRP2', 'JAM3', 'EGFR', 'KDR', 'PLCG1', 'PTK2B', 'VEGFA', 'CRKL', 'VTN', 'PTK2', 'NRP1', 'THBS1', 'ITGA3', 'JAM2', 'PDGFRA', 'SEMA4D', 'FLT1', 'PGF']
19	GO:BP	GO:2000145	regulation of cell motility	7.1367571418566965e-22	True	"""Any process that modulates the frequency, rate or extent of cell motility."" [GOC:mah]"	938	118	44	15719	0.3728813559322034	0.0469083155650319	query_1	['GO:0040012', 'GO:0048870', 'GO:0050794']	['MET', 'ITGB1', 'MIIP', 'VEGFB', 'PLXNB1', 'FN1', 'ITGAV', 'BCAR1', 'SRC', 'ITGB3', 'PIK3R1', 'CRK', 'HGF', 'RET', 'PLCG2', 'GAB1', 'ITGA5', 'ITGA4', 'MADCAM1', 'LYN', 'TNC', 'NRP2', 'JAM3', 'EGFR', 'KDR', 'VCL', 'PLCG1', 'CDH1', 'PTK2B', 'VEGFA', 'CRKL', 'VTN', 'PTK2', 'NRP1', 'EMILIN1', 'THBS1', 'ADAM15', 'ITGA3', 'JAM2', 'PDGFRA', 'SEMA4D', 'FLT1', 'PGF', 'PLXNA1']
20	GO:BP	GO:0009653	anatomical structure morphogenesis	1.0912827765851592e-21	True	"""The process in which anatomical structures are generated and organized. Morphogenesis pertains to the creation of form."" [GOC:go_curators, ISBN:0521436125]"	2539	118	67	15719	0.5677966101694916	0.0263883418668767	query_1	['GO:0032502', 'GO:0048856']	['LIMK1', 'MET', 'ITGB1', 'MLXIPL', 'ITGB5', 'VEGFB', 'PLXNB1', 'FN1', 'ITGAV', 'SRC', 'SPP1', 'ITGB3', 'TGFB3', 'CRK', 'HGF', 'RET', 'SHC1', 'LRP4', 'SOS1', 'GAB1', 'LOX', 'ITGA2B', 'ITGA5', 'FYN', 'ITGA4', 'SH3PXD2A', 'GTF2I', 'GRB2', 'TNC', 'NRP2', 'JAM3', 'EGFR', 'FBN1', 'KDR', 'VCL', 'FBN2', 'SYK', 'PLCG1', 'ERBB2', 'MUSK', 'CDH1', 'PTK2B', 'VEGFA', 'SH3KBP1', 'AGRN', 'MFAP2', 'SH3GL2', 'ADAM12', 'MFAP5', 'CRKL', 'VTN', 'L1CAM', 'ITGB6', 'PTK2', 'NRP1', 'EMILIN1', 'THBS1', 'ADAM15', 'ITGA3', 'ELN', 'JAM2', 'PTPN11', 'PDGFRA', 'SEMA4D', 'FLT1', 'PGF', 'PLXNA1']
2	GO:CC	GO:0008305	integrin complex	4.021222296705256e-21	True	"""A protein complex that is composed of one alpha subunit and one beta subunit, both of which are members of the integrin superfamily of cell adhesion receptors; the complex spans the plasma membrane and binds to extracellular matrix ligands, cell-surface ligands, and soluble ligands."" [PMID:17543136]"	29	118	14	16420	0.1186440677966101	0.4827586206896552	query_1	['GO:0098636', 'GO:0098802']	['ITGB1', 'ITGA9', 'ITGB5', 'ITGAV', 'ITGB3', 'ITGA2B', 'ITGA5', 'ITGA4', 'LYN', 'ITGAE', 'ITGB6', 'EMILIN1', 'ITGB7', 'ITGA3']
21	GO:BP	GO:0040012	regulation of locomotion	4.118988127495575e-21	True	"""Any process that modulates the frequency, rate or extent of locomotion of a cell or organism."" [GOC:ems]"	982	118	44	15719	0.3728813559322034	0.0448065173116089	query_1	['GO:0040011', 'GO:0050789']	['MET', 'ITGB1', 'MIIP', 'VEGFB', 'PLXNB1', 'FN1', 'ITGAV', 'BCAR1', 'SRC', 'ITGB3', 'PIK3R1', 'CRK', 'HGF', 'RET', 'PLCG2', 'GAB1', 'ITGA5', 'ITGA4', 'MADCAM1', 'LYN', 'TNC', 'NRP2', 'JAM3', 'EGFR', 'KDR', 'VCL', 'PLCG1', 'CDH1', 'PTK2B', 'VEGFA', 'CRKL', 'VTN', 'PTK2', 'NRP1', 'EMILIN1', 'THBS1', 'ADAM15', 'ITGA3', 'JAM2', 'PDGFRA', 'SEMA4D', 'FLT1', 'PGF', 'PLXNA1']
22	GO:BP	GO:0030155	regulation of cell adhesion	1.467515945835728e-20	True	"""Any process that modulates the frequency, rate or extent of attachment of a cell to another cell or to the extracellular matrix."" [GOC:mah]"	753	118	39	15719	0.3305084745762712	0.0517928286852589	query_1	['GO:0007155', 'GO:0050794']	['PLXNB1', 'FN1', 'ITGAV', 'SRC', 'ITGB3', 'PIK3R1', 'CRK', 'RET', 'ITGA5', 'FYN', 'ITGA4', 'ZAP70', 'ADAM19', 'LYN', 'TNC', 'FBLN2', 'JAM3', 'KDR', 'VCL', 'VAV1', 'SYK', 'ERBB2', 'CDH1', 'PTK2B', 'VEGFA', 'CRKL', 'VTN', 'TLN1', 'VCAM1', 'PTK2', 'NRP1', 'LCK', 'EMILIN1', 'THBS1', 'ADAM15', 'ITGA3', 'PTPN11', 'SEMA4D', 'PLXNA1']
23	GO:BP	GO:0050900	leukocyte migration	1.8086181305183387e-20	True	"""The movement of a leukocyte within or between different tissues and organs of the body."" [GOC:add, ISBN:0781735149, PMID:14680625, PMID:14708592, PMID:7507411, PMID:8600538]"	378	118	30	15719	0.2542372881355932	0.0793650793650793	query_1	['GO:0002376', 'GO:0016477']	['ITGB1', 'ITGA9', 'VEGFB', 'SRC', 'ITGB3', 'PIK3R1', 'CRK', 'RET', 'SOS1', 'FYN', 'ITGA4', 'ZAP70', 'MADCAM1', 'LYN', 'JAM3', 'VAV1', 'SYK', 'PTK2B', 'VEGFA', 'CRKL', 'VCAM1', 'PTK2', 'LCK', 'EMILIN1', 'THBS1', 'ITGB7', 'ITGA3', 'JAM2', 'FLT1', 'PGF']
3	GO:CC	GO:0071944	cell periphery	4.411369070843e-20	True	"""The broad region around and including the plasma membrane of a cell,  encompassing the cell cortex (inside the cell), the plasma membrane, and any external encapsulating structures."" [GOC:pdt]"	5277	118	89	16420	0.7542372881355932	0.0168656433579685	query_1	['GO:0110165']	['MET', 'RAPGEF1', 'ITGB1', 'ITGA9', 'ITGB5', 'PLXNB1', 'FN1', 'ITGAV', 'BCAR1', 'SRC', 'ITGB3', 'TGFB3', 'PIK3R1', 'CRK', 'RET', 'SHC1', 'ITK', 'PLCG2', 'LRP4', 'LTBP1', 'SOS1', 'LOX', 'STX1A', 'ITGA2B', 'ITGA5', 'PXN', 'FYN', 'ITGA4', 'NCF1', 'LAT', 'ZAP70', 'ADAM19', 'MADCAM1', 'LYN', 'FBLN5', 'GRB2', 'TNC', 'MFAP3', 'NRP2', 'LCP2', 'FBLN2', 'LOXL1', 'JAM3', 'EGFR', 'FBN1', 'ITGAE', 'KDR', 'VCL', 'VAV1', 'FBN2', 'SYK', 'PLCG1', 'FCGR1A', 'ERBB2', 'MUSK', 'CDH1', 'PTK2B', 'VEGFA', 'SH3KBP1', 'AGRN', 'MFAP2', 'SH3GL2', 'ADAM12', 'MFAP5', 'CRKL', 'VTN', 'GAB2', 'SHC3', 'TLN1', 'VCAM1', 'L1CAM', 'ITGB6', 'PTK2', 'NRP1', 'LCK', 'EMILIN1', 'THBS1', 'ITGB7', 'ADAM15', 'ITGA3', 'CBL', 'ELN', 'JAM2', 'PDGFRA', 'SEMA4D', 'FLT1', 'PLXNA1', 'MFAP4', 'GRAP2']
24	GO:BP	GO:0051239	regulation of multicellular organismal process	4.87055323960508e-20	True	"""Any process that modulates the frequency, rate or extent of a multicellular organismal process, the processes pertinent to the function of a multicellular organism above the cellular level; includes the integrated processes of tissues and organs."" [GOC:ai, GOC:dph, GOC:tb]"	2810	118	68	15719	0.576271186440678	0.0241992882562277	query_1	['GO:0032501', 'GO:0050789']	['LIMK1', 'MET', 'ITGB1', 'VEGFB', 'PLXNB1', 'FN1', 'ITGAV', 'BCAR1', 'SRC', 'SPP1', 'ITGB3', 'TGFB3', 'PIK3R1', 'HGF', 'RET', 'SHC1', 'ITK', 'PLCG2', 'LRP4', 'LTBP1', 'SOS1', 'GAB1', 'LOX', 'STX1A', 'ITGA5', 'FYN', 'NCF1', 'LAT', 'BCL7B', 'ZAP70', 'GTF2I', 'LYN', 'NRP2', 'EGFR', 'FBN1', 'KDR', 'VCL', 'VAV1', 'FBN2', 'SYK', 'PLCG1', 'ERBB2', 'CDH1', 'PTK2B', 'VEGFA', 'SH3KBP1', 'AGRN', 'MFAP2', 'ADAM12', 'VTN', 'GAB2', 'GTF2IRD1', 'VCAM1', 'L1CAM', 'ITGB6', 'PTK2', 'NRP1', 'LCK', 'EMILIN1', 'THBS1', 'ITGA3', 'JAM2', 'PTPN11', 'PDGFRA', 'SEMA4D', 'FLT1', 'PGF', 'PLXNA1']
25	GO:BP	GO:0006935	chemotaxis	4.87055323960508e-20	True	"""The directed movement of a motile cell or organism, or the directed growth of a cell guided by a specific chemical concentration gradient. Movement may be towards a higher concentration (positive chemotaxis) or towards a lower concentration (negative chemotaxis)."" [ISBN:0198506732]"	593	118	35	15719	0.2966101694915254	0.0590219224283305	query_1	['GO:0042221', 'GO:0042330']	['MET', 'ITGA9', 'VEGFB', 'PLXNB1', 'ITGAV', 'BCAR1', 'ITGB3', 'CRK', 'HGF', 'RET', 'SOS1', 'GAB1', 'LOX', 'FYN', 'LYN', 'NRP2', 'JAM3', 'KDR', 'VAV1', 'SYK', 'ERBB2', 'MUSK', 'PTK2B', 'VEGFA', 'CRKL', 'VCAM1', 'L1CAM', 'PTK2', 'NRP1', 'THBS1', 'PDGFRA', 'SEMA4D', 'FLT1', 'PGF', 'PLXNA1']
26	GO:BP	GO:0042330	taxis	5.2391618664111084e-20	True	"""The directed movement of a motile cell or organism in response to an external stimulus."" [GOC:jl, ISBN:0192801023]"	595	118	35	15719	0.2966101694915254	0.0588235294117647	query_1	['GO:0009605', 'GO:0040011']	['MET', 'ITGA9', 'VEGFB', 'PLXNB1', 'ITGAV', 'BCAR1', 'ITGB3', 'CRK', 'HGF', 'RET', 'SOS1', 'GAB1', 'LOX', 'FYN', 'LYN', 'NRP2', 'JAM3', 'KDR', 'VAV1', 'SYK', 'ERBB2', 'MUSK', 'PTK2B', 'VEGFA', 'CRKL', 'VCAM1', 'L1CAM', 'PTK2', 'NRP1', 'THBS1', 'PDGFRA', 'SEMA4D', 'FLT1', 'PGF', 'PLXNA1']
27	GO:BP	GO:0048010	vascular endothelial growth factor receptor signaling pathway	5.4061677990206677e-20	True	"""The series of molecular signals initiated by a ligand binding to a vascular endothelial growth factor receptor (VEGFR) on the surface of the target cell, and ending with the regulation of a downstream cellular process, e.g. transcription."" [GOC:ceb, GOC:signaling]"	53	118	16	15719	0.135593220338983	0.3018867924528302	query_1	['GO:0007169']	['VEGFB', 'BCAR1', 'SRC', 'ITGB3', 'ITGA5', 'FYN', 'KDR', 'VAV1', 'PTK2B', 'VEGFA', 'VTN', 'PTK2', 'NRP1', 'EMILIN1', 'FLT1', 'PGF']
28	GO:BP	GO:0098609	cell-cell adhesion	2.302922673025898e-18	True	"""The attachment of one cell to another cell via adhesion molecules."" [GOC:dos]"	873	118	39	15719	0.3305084745762712	0.0446735395189003	query_1	['GO:0007155']	['RAPGEF1', 'ITGB1', 'ITGA9', 'ITGB5', 'FN1', 'ITGAV', 'SRC', 'ITGB3', 'RET', 'SHC1', 'ITGA2B', 'ITGA5', 'FYN', 'ITGA4', 'ZAP70', 'ADAM19', 'MADCAM1', 'LYN', 'JAM3', 'EGFR', 'ITGAE', 'VCL', 'VAV1', 'SYK', 'ERBB2', 'CDH1', 'VEGFA', 'TLN1', 'VCAM1', 'L1CAM', 'PTK2', 'LCK', 'EMILIN1', 'ITGB7', 'ITGA3', 'JAM2', 'PTPN11', 'PDGFRA', 'SEMA4D']
