Williams syndrome	source	native	name	Corrected p_value	significant	description	term_size	query_size	intersection_size	effective_domain_size	precision	recall	query	parents	intersections
532	GO:BP	GO:0035685	helper T cell diapedesis	0.0003760901159213	True	"""The passage of a helper T cell between the tight junctions of endothelial cells lining blood vessels, typically the fourth and final step of cellular extravasation."" [CL:0000912, GOC:BHF]"	2	118	2	15719	0.0169491525423728	1.0	query_1	['GO:0035684', 'GO:0050904', 'GO:0072678']	['CRK', 'CRKL']
537	GO:BP	GO:1900220	semaphorin-plexin signaling pathway involved in bone trabecula morphogenesis	0.0003760901159213	True	"""Any semaphorin-plexin signaling pathway that contributes to bone trabecula morphogenesis."" [GOC:BHF, GOC:TermGenie]"	2	118	2	15719	0.0169491525423728	1.0	query_1	['GO:0061430', 'GO:0071526']	['PLXNB1', 'SEMA4D']
524	GO:BP	GO:1904835	dorsal root ganglion morphogenesis	0.0003760901159213	True	"""The developmental process by which a dorsal root ganglion is generated and organized."" [GO_REF:0000083, GOC:bf, GOC:PARL, GOC:TermGenie, PMID:18936100]"	2	118	2	15719	0.0169491525423728	1.0	query_1	['GO:0061552', 'GO:1990791']	['NRP2', 'NRP1']
525	GO:BP	GO:0048585	negative regulation of response to stimulus	0.0003760901159213	True	"""Any process that stops, prevents, or reduces the frequency, rate or extent of a response to a stimulus. Response to stimulus is a change in state or activity of a cell or an organism (in terms of movement, secretion, enzyme production, gene expression, etc.) as a result of a stimulus."" [GOC:jid]"	1532	118	26	15719	0.2203389830508474	0.0169712793733681	query_1	['GO:0048519', 'GO:0048583', 'GO:0050896']	['MET', 'RAPGEF1', 'ITGB1', 'ITGAV', 'SRC', 'SPP1', 'TGFB3', 'CRK', 'HGF', 'LRP4', 'LTBP1', 'FYN', 'LYN', 'EGFR', 'FBN1', 'FBN2', 'SYK', 'PLCG1', 'VTN', 'NRP1', 'EMILIN1', 'THBS1', 'ITGA3', 'CBL', 'PDGFRA', 'SEMA4D']
526	GO:BP	GO:1903379	regulation of mitotic chromosome condensation	0.0003760901159213	True	"""Any process that modulates the frequency, rate or extent of mitotic chromosome condensation."" [GO_REF:0000058, GOC:TermGenie, PMID:9490640]"	2	118	2	15719	0.0169491525423728	1.0	query_1	['GO:0007076', 'GO:0010564', 'GO:0060623']	['SMARCA5', 'BAZ1B']
536	GO:BP	GO:1902340	negative regulation of chromosome condensation	0.0003760901159213	True	"""Any process that stops, prevents or reduces the frequency, rate or extent of chromosome condensation."" [GOC:TermGenie, PMID:23219725]"	2	118	2	15719	0.0169491525423728	1.0	query_1	['GO:0030261', 'GO:0060623', 'GO:2001251']	['SMARCA5', 'BAZ1B']
535	GO:BP	GO:0070476	rRNA (guanine-N7)-methylation	0.0003760901159213	True	"""The addition of a methyl group to the N7 atom in the base portion of a guanine nucleotide residue in an rRNA molecule."" [GOC:mah]"	2	118	2	15719	0.0169491525423728	1.0	query_1	['GO:0036265', 'GO:0070475']	['BUD23', 'TRMT112']
534	GO:BP	GO:1905213	negative regulation of mitotic chromosome condensation	0.0003760901159213	True	"""Any process that stops, prevents or reduces the frequency, rate or extent of mitotic chromosome condensation."" [GO_REF:0000058, GOC:TermGenie, PMID:23219725]"	2	118	2	15719	0.0169491525423728	1.0	query_1	['GO:0007076', 'GO:0010948', 'GO:1902340', 'GO:1903379']	['SMARCA5', 'BAZ1B']
533	GO:BP	GO:0003366	cell-matrix adhesion involved in ameboidal cell migration	0.0003760901159213	True	"""The binding of a cell to the extracellular matrix that contributes to the directed movement of an ameboid cell."" [GOC:ascb_2009, GOC:dph, GOC:tb]"	2	118	2	15719	0.0169491525423728	1.0	query_1	['GO:0001667', 'GO:0007160']	['ITGA4', 'ITGB7']
531	GO:BP	GO:0140039	cell-cell adhesion in response to extracellular stimulus	0.0003760901159213	True	"""The attachment of one cell to another cell via adhesion molecules as a result of an extracellular stimulus."" [PMID:14996911]"	2	118	2	15719	0.0169491525423728	1.0	query_1	['GO:0031668', 'GO:0098609']	['ITGA4', 'VCAM1']
530	GO:BP	GO:1903375	facioacoustic ganglion development	0.0003760901159213	True	"""The process whose specific outcome is the progression of an acoustico-facial VII-VIII ganglion complex over time, from its formation to the mature structure."" [GO_REF:0000094, GOC:bf, GOC:mat, GOC:PARL, GOC:TermGenie, PMID:18356247]"	2	118	2	15719	0.0169491525423728	1.0	query_1	['GO:0061550']	['NRP2', 'NRP1']
529	GO:BP	GO:0038190	VEGF-activated neuropilin signaling pathway	0.0003760901159213	True	"""The series of molecular signals initiated by vascular endothelial growth factor (VEGF) binding to a neuropilin protein on the surface of a target cell, and ending with the regulation of a downstream cellular process, e.g. transcription."" [GOC:BHF, GOC:rl, PMID:12852851]"	2	118	2	15719	0.0169491525423728	1.0	query_1	['GO:0038084', 'GO:0038189']	['VEGFA', 'NRP1']
528	GO:BP	GO:0061552	ganglion morphogenesis	0.0003760901159213	True	"""The process in which the anatomical structures of ganglion are generated and organized."" [GOC:dph]"	2	118	2	15719	0.0169491525423728	1.0	query_1	['GO:0048729', 'GO:0061548']	['NRP2', 'NRP1']
527	GO:BP	GO:0021649	vestibulocochlear nerve structural organization	0.0003760901159213	True	"""The process that contributes to the act of creating the structural organization of the vestibulocochlear nerve. This process pertains to the physical shaping of a rudimentary structure. This sensory nerve innervates the membranous labyrinth of the inner ear. The vestibular branch innervates the vestibular apparatus that senses head position changes relative to gravity. The auditory branch innervates the cochlear duct, which is connected to the three bony ossicles which transduce sound waves into fluid movement in the cochlea."" [GO_REF:0000021, GOC:cls, GOC:dgh, GOC:dph, GOC:jid, ISBN:0838580343]"	2	118	2	15719	0.0169491525423728	1.0	query_1	['GO:0021604', 'GO:0021648']	['NRP2', 'NRP1']
538	GO:BP	GO:1905475	regulation of protein localization to membrane	0.0003782317273529	True	"""Any process that modulates the frequency, rate or extent of protein localization to membrane."" [GO_REF:0000058, GOC:bc, GOC:PARL, GOC:TermGenie, PMID:26911690]"	177	118	8	15719	0.0677966101694915	0.0451977401129943	query_1	['GO:0032880', 'GO:0072657']	['ITGB1', 'PIK3R1', 'LRP4', 'FYN', 'EGFR', 'ERBB2', 'CRKL', 'ITGA3']
539	GO:BP	GO:0002448	mast cell mediated immunity	0.0003784536984906	True	"""Any process involved in the carrying out of an immune response by a mast cell."" [GO_REF:0000022, GOC:add, ISBN:0781735149]"	55	118	5	15719	0.0423728813559322	0.0909090909090909	query_1	['GO:0002444']	['LAT', 'LYN', 'SYK', 'GAB2', 'CBL']
540	GO:BP	GO:0042113	B cell activation	0.0003816883737264	True	"""The change in morphology and behavior of a mature or immature B cell resulting from exposure to a mitogen, cytokine, chemokine, cellular ligand, or an antigen for which it is specific."" [GOC:mgi_curators, ISBN:0781735149]"	285	118	10	15719	0.0847457627118644	0.0350877192982456	query_1	['GO:0046649']	['ITGB1', 'PIK3R1', 'PLCG2', 'ITGA4', 'ZAP70', 'LYN', 'SYK', 'PTK2B', 'SH3KBP1', 'VCAM1']
541	GO:BP	GO:0007010	cytoskeleton organization	0.0003844272764921	True	"""A process that is carried out at the cellular level which results in the assembly, arrangement of constituent parts, or disassembly of cytoskeletal structures."" [GOC:dph, GOC:jl, GOC:mah]"	1444	118	25	15719	0.211864406779661	0.0173130193905817	query_1	['GO:0006996']	['LIMK1', 'MET', 'ITGB1', 'ITGB5', 'PLXNB1', 'BCAR1', 'SRC', 'ITGB3', 'TGFB3', 'PIK3R1', 'CRK', 'SHC1', 'GAB1', 'PXN', 'GRB2', 'JAM3', 'PTK2B', 'SH3KBP1', 'AGRN', 'CLIP2', 'TLN1', 'PTK2', 'NRP1', 'ELN', 'PDGFRA']
542	GO:BP	GO:0051492	regulation of stress fiber assembly	0.0003912681664516	True	"""Any process that modulates the frequency, rate or extent of the assembly of a stress fiber, a bundle of microfilaments and other proteins found in fibroblasts."" [GOC:ai]"	90	118	6	15719	0.0508474576271186	0.0666666666666666	query_1	['GO:0032231', 'GO:0043149', 'GO:0110020']	['LIMK1', 'MET', 'TGFB3', 'PIK3R1', 'PXN', 'NRP1']
543	GO:BP	GO:0060348	bone development	0.0003926808406012	True	"""The process whose specific outcome is the progression of bone over time, from its formation to the mature structure. Bone is the hard skeletal connective tissue consisting of both mineral and cellular components."" [GOC:dph]"	230	118	9	15719	0.0762711864406779	0.0391304347826087	query_1	['GO:0001501', 'GO:0048513']	['PLXNB1', 'SRC', 'TGFB3', 'LOX', 'FBN1', 'KDR', 'ITGB6', 'PTPN11', 'SEMA4D']
544	GO:BP	GO:0007423	sensory organ development	0.0004027521101191	True	"""The process whose specific outcome is the progression of sensory organs over time, from its formation to the mature structure."" [GOC:go_curators]"	547	118	14	15719	0.1186440677966101	0.0255941499085923	query_1	['GO:0048513']	['TGFB3', 'RET', 'SOS1', 'EGFR', 'FBN1', 'KDR', 'FBN2', 'VEGFA', 'MFAP2', 'MFAP5', 'NRP1', 'PTPN11', 'PDGFRA', 'FLT1']
545	GO:BP	GO:0010035	response to inorganic substance	0.0004027521101191	True	"""Any process that results in a change in state or activity of a cell or an organism (in terms of movement, secretion, enzyme production, gene expression, etc.) as a result of an inorganic substance stimulus."" [GOC:sm]"	547	118	14	15719	0.1186440677966101	0.0255941499085923	query_1	['GO:0042221']	['MET', 'SRC', 'CRK', 'HGF', 'PLCG2', 'FYN', 'NCF1', 'FBLN5', 'EGFR', 'KDR', 'CDH1', 'PTK2B', 'VCAM1', 'THBS1']
546	GO:BP	GO:0061138	morphogenesis of a branching epithelium	0.0004034523912288	True	"""The process in which the anatomical structures of a branched epithelium are generated and organized."" [GOC:dph]"	179	118	8	15719	0.0677966101694915	0.0446927374301676	query_1	['GO:0001763', 'GO:0002009']	['MET', 'SRC', 'HGF', 'GRB2', 'KDR', 'VEGFA', 'NRP1', 'PLXNA1']
547	GO:BP	GO:0001755	neural crest cell migration	0.0004070518099159	True	"""The characteristic movement of cells from the dorsal ridge of the neural tube to a variety of locations in a vertebrate embryo."" [GOC:ascb_2009, GOC:dph, GOC:tb, ISBN:0878932437]"	56	118	5	15719	0.0423728813559322	0.0892857142857142	query_1	['GO:0014032', 'GO:0090497']	['FN1', 'RET', 'NRP2', 'NRP1', 'SEMA4D']
548	GO:BP	GO:0051491	positive regulation of filopodium assembly	0.0004081234390734	True	"""Any process that activates or increases the frequency, rate or extent of the assembly of a filopodium, a thin, stiff protrusion extended by the leading edge of a motile cell such as a crawling fibroblast or amoeba, or an axonal growth cone."" [GOC:ai, GOC:dph, GOC:tb]"	29	118	4	15719	0.0338983050847457	0.1379310344827586	query_1	['GO:0046847', 'GO:0051489', 'GO:0120034']	['TGFB3', 'PIK3R1', 'AGRN', 'NRP1']
549	GO:BP	GO:0032369	negative regulation of lipid transport	0.0004081234390734	True	"""Any process that stops, prevents, or reduces the frequency, rate or extent of the directed movement of lipids into, out of or within a cell, or between cells, by means of some agent such as a transporter or pore."" [GOC:mah]"	29	118	4	15719	0.0338983050847457	0.1379310344827586	query_1	['GO:0006869', 'GO:0032368', 'GO:0051051', 'GO:1905953']	['ITGAV', 'ITGB3', 'THBS1', 'PTPN11']
63	GO:CC	GO:0002102	podosome	0.0004128857789164	True	"""An actin-rich adhesion structure characterized by formation upon cell substrate contact and localization at the substrate-attached part of the cell, contain an F-actin-rich core surrounded by a ring structure containing proteins such as vinculin and talin, and have a diameter of 0.5 mm."" [PMID:12837608, PMID:15890982]"	31	118	4	16420	0.0338983050847457	0.1290322580645161	query_1	['GO:0015629', 'GO:0043232']	['SRC', 'SH3PXD2A', 'VCL', 'VCAM1']
550	GO:BP	GO:0032879	regulation of localization	0.0004149250325554	True	"""Any process that modulates the frequency, rate or extent of any process in which a cell, a substance, or a cellular entity is transported to, or maintained in, a specific location."" [GOC:mah]"	2021	118	31	15719	0.2627118644067797	0.0153389411182582	query_1	['GO:0050789', 'GO:0051179']	['RAPGEF1', 'ITGB1', 'ITGAV', 'SRC', 'SPP1', 'ITGB3', 'TGFB3', 'PIK3R1', 'PLCG2', 'LRP4', 'STX1A', 'FYN', 'LYN', 'EGFR', 'VCL', 'SYK', 'PLCG1', 'FCGR1A', 'ERBB2', 'CDH1', 'PTK2B', 'VEGFA', 'CRKL', 'VTN', 'GAB2', 'NRP1', 'LCK', 'THBS1', 'ITGA3', 'CBL', 'PTPN11']
551	GO:BP	GO:0010749	regulation of nitric oxide mediated signal transduction	0.0004271779604998	True	"""Any process that modulates the rate, frequency or extent of nitric oxide mediated signal transduction. Nitric oxide mediated signal transduction is The series of molecular signals mediated by the detection of nitric oxide (NO)."" [GOC:BHF, GOC:dph, GOC:tb]"	11	118	3	15719	0.0254237288135593	0.2727272727272727	query_1	['GO:0007263', 'GO:1902531']	['EGFR', 'VEGFA', 'THBS1']
552	GO:BP	GO:0046578	regulation of Ras protein signal transduction	0.0004315551914441	True	"""Any process that modulates the frequency, rate or extent of Ras protein signal transduction."" [GOC:bf]"	181	118	8	15719	0.0677966101694915	0.0441988950276243	query_1	['GO:0007265', 'GO:0051056']	['MET', 'RAPGEF1', 'ITGB1', 'SRC', 'CRK', 'NRP1', 'ITGA3', 'CBL']
553	GO:BP	GO:0048762	mesenchymal cell differentiation	0.0004404189042968	True	"""The process in which a relatively unspecialized cell acquires specialized features of a mesenchymal cell. A mesenchymal cell is a loosely associated cell that is part of the connective tissue in an organism. Mesenchymal cells give rise to more mature connective tissue cell types."" [GOC:dph, GOC:jid]"	234	118	9	15719	0.0762711864406779	0.0384615384615384	query_1	['GO:0030154', 'GO:0060485']	['FN1', 'TGFB3', 'HGF', 'RET', 'NRP2', 'PTK2', 'NRP1', 'ADAM15', 'SEMA4D']
164	REAC	REAC:R-HSA-9734091	Drug-mediated inhibition of MET activation	0.0004407326316808	True	Drug-mediated inhibition of MET activation	2	108	2	10022	0.0185185185185185	1.0	query_1	['REAC:R-HSA-6807004']	['MET', 'HGF']
165	REAC	REAC:R-HSA-190236	Signaling by FGFR	0.0004550433044272	True	Signaling by FGFR	72	108	6	10022	0.0555555555555555	0.0833333333333333	query_1	['REAC:R-HSA-9006934']	['PIK3R1', 'SOS1', 'GAB1', 'PLCG1', 'CBL', 'PTPN11']
554	GO:BP	GO:0150117	positive regulation of cell-substrate junction organization	0.0004639741383224	True	"""Any process that activates or increases the frequency, rate or extent of cell-substrate junction organization."" [GOC:aruk]"	30	118	4	15719	0.0338983050847457	0.1333333333333333	query_1	['GO:0051130', 'GO:0150115', 'GO:0150116']	['PIK3R1', 'KDR', 'VEGFA', 'NRP1']
555	GO:BP	GO:0090497	mesenchymal cell migration	0.0004755452942807	True	"""The orderly movement of a mesenchymal cell from one site to another, often during the development of a multicellular organism."" [GOC:dph, GOC:tb]"	58	118	5	15719	0.0423728813559322	0.0862068965517241	query_1	['GO:0001667']	['FN1', 'RET', 'NRP2', 'NRP1', 'SEMA4D']
556	GO:BP	GO:0002690	positive regulation of leukocyte chemotaxis	0.0004868185512511	True	"""Any process that activates or increases the frequency, rate, or extent of leukocyte chemotaxis."" [GOC:add]"	94	118	6	15719	0.0508474576271186	0.0638297872340425	query_1	['GO:0002687', 'GO:0002688', 'GO:0030595', 'GO:0050921']	['VEGFB', 'PTK2B', 'VEGFA', 'PTK2', 'THBS1', 'PGF']
557	GO:BP	GO:0090066	regulation of anatomical structure size	0.0004911811592142	True	"""Any process that modulates the size of an anatomical structure."" [GOC:dph, GOC:tb]"	488	118	13	15719	0.1101694915254237	0.026639344262295	query_1	['GO:0065008']	['LIMK1', 'FN1', 'SPP1', 'RET', 'GRB2', 'VAV1', 'CDH1', 'PTK2B', 'VEGFA', 'L1CAM', 'NRP1', 'ELN', 'SEMA4D']
558	GO:BP	GO:1903037	regulation of leukocyte cell-cell adhesion	0.0004912348580263	True	"""Any process that modulates the frequency, rate or extent of leukocyte cell-cell adhesion."" [GO_REF:0000058, GOC:BHF, GOC:rl, GOC:TermGenie, PMID:21106532]"	356	118	11	15719	0.0932203389830508	0.0308988764044943	query_1	['GO:0007159', 'GO:0022407']	['SRC', 'FYN', 'ITGA4', 'ZAP70', 'LYN', 'VAV1', 'SYK', 'ERBB2', 'VCAM1', 'LCK', 'PTPN11']
66	GO:CC	GO:0043230	extracellular organelle	0.0005051432772394	True	"""Organized structure of distinctive morphology and function, occurring outside the cell. Includes, for example, extracellular membrane vesicles (EMVs) and the cellulosomes of anaerobic bacteria and fungi."" [GOC:jl, PMID:9914479]"	2045	118	30	16420	0.2542372881355932	0.0146699266503667	query_1	['GO:0005576', 'GO:0043226']	['ITGB1', 'ITGB5', 'FN1', 'ITGAV', 'SRC', 'PSAT1', 'SPP1', 'ITGB3', 'VPS37D', 'CRK', 'PLCG2', 'ITGA2B', 'ITGA4', 'LYN', 'FBLN5', 'GRB2', 'FBLN2', 'VCL', 'CDH1', 'AGRN', 'VTN', 'TLN1', 'VCAM1', 'LCK', 'EMILIN1', 'THBS1', 'ITGB7', 'ADAM15', 'ITGA3', 'PLXNA1']
65	GO:CC	GO:1903561	extracellular vesicle	0.0005051432772394	True	"""Any vesicle that is part of the extracellular region."" [GO_REF:0000064, GOC:pm, GOC:TermGenie, PMID:24769233]"	2044	118	30	16420	0.2542372881355932	0.0146771037181996	query_1	['GO:0031982', 'GO:0065010']	['ITGB1', 'ITGB5', 'FN1', 'ITGAV', 'SRC', 'PSAT1', 'SPP1', 'ITGB3', 'VPS37D', 'CRK', 'PLCG2', 'ITGA2B', 'ITGA4', 'LYN', 'FBLN5', 'GRB2', 'FBLN2', 'VCL', 'CDH1', 'AGRN', 'VTN', 'TLN1', 'VCAM1', 'LCK', 'EMILIN1', 'THBS1', 'ITGB7', 'ADAM15', 'ITGA3', 'PLXNA1']
64	GO:CC	GO:0065010	extracellular membrane-bounded organelle	0.0005051432772394	True	"""Organized structure of distinctive morphology and function, bounded by a lipid bilayer membrane and occurring outside the cell."" [GOC:isa_complete]"	2045	118	30	16420	0.2542372881355932	0.0146699266503667	query_1	['GO:0043227', 'GO:0043230']	['ITGB1', 'ITGB5', 'FN1', 'ITGAV', 'SRC', 'PSAT1', 'SPP1', 'ITGB3', 'VPS37D', 'CRK', 'PLCG2', 'ITGA2B', 'ITGA4', 'LYN', 'FBLN5', 'GRB2', 'FBLN2', 'VCL', 'CDH1', 'AGRN', 'VTN', 'TLN1', 'VCAM1', 'LCK', 'EMILIN1', 'THBS1', 'ITGB7', 'ADAM15', 'ITGA3', 'PLXNA1']
168	REAC	REAC:R-HSA-9673770	Signaling by PDGFRA extracellular domain mutants	0.000516933754485	True	Signaling by PDGFRA extracellular domain mutants	10	108	3	10022	0.0277777777777777	0.3	query_1	['REAC:R-HSA-9671555']	['PIK3R1', 'SOS1', 'PDGFRA']
167	REAC	REAC:R-HSA-9673767	Signaling by PDGFRA transmembrane, juxtamembrane and kinase domain mutants	0.000516933754485	True	Signaling by PDGFRA transmembrane, juxtamembrane and kinase domain mutants	10	108	3	10022	0.0277777777777777	0.3	query_1	['REAC:R-HSA-9671555']	['PIK3R1', 'SOS1', 'PDGFRA']
166	REAC	REAC:R-HSA-9702518	STAT5 activation downstream of FLT3 ITD mutants	0.000516933754485	True	STAT5 activation downstream of FLT3 ITD mutants	10	108	3	10022	0.0277777777777777	0.3	query_1	['REAC:R-HSA-9703648']	['GRB2', 'GAB2', 'PTPN11']
559	GO:BP	GO:0031098	stress-activated protein kinase signaling cascade	0.0005291638838288	True	"""The series of molecular signals in which a stress-activated protein kinase (SAPK) cascade relays a signal."" [GOC:mah]"	240	118	9	15719	0.0762711864406779	0.0375	query_1	['GO:0033554', 'GO:0035556']	['RAPGEF1', 'CRK', 'HGF', 'NCF1', 'LYN', 'EGFR', 'PTK2B', 'VEGFA', 'CRKL']
560	GO:BP	GO:0071902	positive regulation of protein serine/threonine kinase activity	0.0005347336475889	True	"""Any process that increases the rate, frequency, or extent of protein serine/threonine kinase activity."" [GOC:mah]"	187	118	8	15719	0.0677966101694915	0.0427807486631016	query_1	['GO:0045860', 'GO:0071900']	['SRC', 'EGFR', 'SYK', 'ERBB2', 'PTK2B', 'VEGFA', 'THBS1', 'FLT1']
561	GO:BP	GO:0002275	myeloid cell activation involved in immune response	0.0005427044304113	True	"""A change in the morphology or behavior of a myeloid cell resulting from exposure to an activating factor such as a cellular or soluble ligand, leading to the initiation or perpetuation of an immune response."" [GOC:add, ISBN:0781735149]"	96	118	6	15719	0.0508474576271186	0.0625	query_1	['GO:0002274', 'GO:0002366']	['PLCG2', 'LAT', 'LYN', 'SYK', 'GAB2', 'CBL']
67	GO:CC	GO:0045202	synapse	0.000546818356859	True	"""The junction between an axon of one neuron and a dendrite of another neuron, a muscle fiber or a glial cell. As the axon approaches the synapse it enlarges into a specialized structure, the presynaptic terminal bouton, which contains mitochondria and synaptic vesicles. At the tip of the terminal bouton is the presynaptic membrane; facing it, and separated from it by a minute cleft (the synaptic cleft) is a specialized area of membrane on the receiving cell, known as the postsynaptic membrane. In response to the arrival of nerve impulses, the presynaptic terminal bouton secretes molecules of neurotransmitters into the synaptic cleft. These diffuse across the cleft and transmit the signal to the postsynaptic membrane."" [GOC:aruk, ISBN:0198506732, PMID:24619342, PMID:29383328, PMID:31998110]"	1367	118	23	16420	0.1949152542372881	0.0168251645940014	query_1	['GO:0030054']	['ITGB1', 'SRC', 'ITGB3', 'CRK', 'LRP4', 'SOS1', 'STX1A', 'ITGA5', 'FYN', 'LYN', 'NRP2', 'PLCG1', 'ERBB2', 'MUSK', 'CDH1', 'PTK2B', 'SH3KBP1', 'AGRN', 'SH3GL2', 'CRKL', 'PTK2', 'NRP1', 'ITGA3']
562	GO:BP	GO:0002551	mast cell chemotaxis	0.0005534193386758	True	"""The movement of a mast cell in response to an external stimulus."" [GOC:add, PMID:11292027, PMID:12789214, PMID:16448392]"	12	118	3	15719	0.0254237288135593	0.25	query_1	['GO:0030595', 'GO:0097531']	['VEGFB', 'VEGFA', 'PGF']
563	GO:BP	GO:0061430	bone trabecula morphogenesis	0.0005534193386758	True	"""The process of shaping a trabecula in bone. A trabecula is a tissue element in the form of a small beam, strut or rod."" [GOC:BHF, GOC:dph, GOC:vk]"	12	118	3	15719	0.0254237288135593	0.25	query_1	['GO:0061383']	['PLXNB1', 'FBN2', 'SEMA4D']
564	GO:BP	GO:0048563	post-embryonic animal organ morphogenesis	0.0005534193386758	True	"""Morphogenesis, during the post-embryonic phase, of an animal tissue or tissues that work together to perform a specific function or functions. Morphogenesis pertains to process in which anatomical structures are generated and organized. Organs are commonly observed as visibly distinct structures, but may also exist as loosely associated clusters of cells that work together to perform a specific function or functions."" [GOC:jid]"	12	118	3	15719	0.0254237288135593	0.25	query_1	['GO:0009886', 'GO:0009887', 'GO:0048569']	['FBN1', 'KDR', 'MFAP2']
565	GO:BP	GO:0050870	positive regulation of T cell activation	0.0005578640684944	True	"""Any process that activates or increases the frequency, rate or extent of T cell activation."" [GOC:ai]"	242	118	9	15719	0.0762711864406779	0.0371900826446281	query_1	['GO:0042110', 'GO:0050863', 'GO:0051251', 'GO:1903039']	['SRC', 'FYN', 'ZAP70', 'LYN', 'VAV1', 'SYK', 'VCAM1', 'LCK', 'PTPN11']
169	REAC	REAC:R-HSA-912526	Interleukin receptor SHC signaling	0.000590473510331	True	Interleukin receptor SHC signaling	26	108	4	10022	0.037037037037037	0.1538461538461538	query_1	['REAC:R-HSA-451927', 'REAC:R-HSA-512988']	['PIK3R1', 'SHC1', 'SOS1', 'GAB2']
566	GO:BP	GO:0070302	regulation of stress-activated protein kinase signaling cascade	0.0005912605080468	True	"""Any process that modulates the frequency, rate or extent of signaling via a stress-activated protein kinase signaling cascade."" [GOC:mah]"	190	118	8	15719	0.0677966101694915	0.0421052631578947	query_1	['GO:0031098', 'GO:0080135', 'GO:1902531']	['RAPGEF1', 'CRK', 'HGF', 'NCF1', 'LYN', 'EGFR', 'PTK2B', 'VEGFA']
567	GO:BP	GO:0051249	regulation of lymphocyte activation	0.0005917992748628	True	"""Any process that modulates the frequency, rate or extent of lymphocyte activation."" [GOC:ai]"	498	118	13	15719	0.1101694915254237	0.0261044176706827	query_1	['GO:0002694', 'GO:0046649']	['SRC', 'SOS1', 'FYN', 'LAT', 'ZAP70', 'LYN', 'VAV1', 'SYK', 'ERBB2', 'SH3KBP1', 'VCAM1', 'LCK', 'PTPN11']
568	GO:BP	GO:1900024	regulation of substrate adhesion-dependent cell spreading	0.0005926043108106	True	"""Any process that modulates the frequency, rate or extent of substrate adhesion-dependent cell spreading."" [GOC:TermGenie, GOC:yaf]"	61	118	5	15719	0.0423728813559322	0.081967213114754	query_1	['GO:0010810', 'GO:0034446']	['ITGB3', 'CRK', 'CRKL', 'PTK2', 'NRP1']
569	GO:BP	GO:0019538	protein metabolic process	0.0005935729072046	True	"""The chemical reactions and pathways involving a protein. Includes protein modification."" [GOC:ma]"	5066	118	58	15719	0.4915254237288136	0.0114488748519542	query_1	['GO:0043170', 'GO:0044238', 'GO:1901564']	['LIMK1', 'MET', 'EIF4H', 'MLXIPL', 'VEGFB', 'FN1', 'ITGAV', 'SRC', 'ITGB3', 'TGFB3', 'PIK3R1', 'VPS37D', 'HGF', 'RET', 'SHC1', 'ITK', 'PLCG2', 'LRP4', 'SOS1', 'LOX', 'STX1A', 'ITGA5', 'FYN', 'NCF1', 'LAT', 'ZAP70', 'ADAM19', 'SMARCA5', 'LYN', 'LCP2', 'LOXL1', 'EGFR', 'KDR', 'SYK', 'FCGR1A', 'ERBB2', 'MUSK', 'CDH1', 'TRMT112', 'PTK2B', 'VEGFA', 'SH3GL2', 'ADAM12', 'CRKL', 'VTN', 'BAZ1B', 'PTK2', 'NRP1', 'LCK', 'EMILIN1', 'THBS1', 'ADAM15', 'CBL', 'PTPN11', 'PDGFRA', 'SEMA4D', 'FLT1', 'PGF']
570	GO:BP	GO:0110020	regulation of actomyosin structure organization	0.0006339554894249	True	"""Any process that modulates the frequency, rate or extent of the assembly, arrangement of constituent parts, or disassembly of cytoskeletal structures containing both actin and myosin or paramyosin."" [GOC:lf, PMID:22790195]"	99	118	6	15719	0.0508474576271186	0.0606060606060606	query_1	['GO:0031032', 'GO:0032956']	['LIMK1', 'MET', 'TGFB3', 'PIK3R1', 'PXN', 'NRP1']
68	GO:CC	GO:0030175	filopodium	0.0006428758669271	True	"""Thin, stiff, actin-based protrusion extended by the leading edge of a motile cell such as a crawling fibroblast or amoeba, or an axonal or dendritic growth cone, or a dendritic shaft."" [GOC:mah, GOC:pr, ISBN:0815316194]"	106	118	6	16420	0.0508474576271186	0.0566037735849056	query_1	['GO:0098858']	['ITGB1', 'ITGAV', 'SRC', 'ITGB3', 'VCAM1', 'ITGA3']
