Williams syndrome	source	native	name	Corrected p_value	significant	description	term_size	query_size	intersection_size	effective_domain_size	precision	recall	query	parents	intersections
869	GO:BP	GO:0033006	regulation of mast cell activation involved in immune response	0.0079187893533238	True	"""Any process that modulates the frequency, rate, or extent of mast cell activation as part of an immune response."" [GOC:mah]"	33	118	3	15719	0.0254237288135593	0.0909090909090909	query_1	['GO:0002279', 'GO:0002699', 'GO:0033003', 'GO:0050776']	['LYN', 'SYK', 'GAB2']
880	GO:BP	GO:0060982	coronary artery morphogenesis	0.007987878420768	True	"""The process in which the anatomical structures of coronary arteries are generated and organized. Coronary arteries are blood vessels that transport blood to the heart muscle."" [GOC:mtg_heart]"	9	118	2	15719	0.0169491525423728	0.2222222222222222	query_1	['GO:0048844', 'GO:0060977']	['VEGFA', 'NRP1']
879	GO:BP	GO:0098742	cell-cell adhesion via plasma-membrane adhesion molecules	0.007987878420768	True	"""The attachment of one cell to another cell via adhesion molecules that are at least partially embedded in the plasma membrane."" [GOC:dos]"	234	118	7	15719	0.059322033898305	0.0299145299145299	query_1	['GO:0098609']	['ITGB1', 'RET', 'ITGA5', 'CDH1', 'VCAM1', 'L1CAM', 'ITGA3']
878	GO:BP	GO:0032959	inositol trisphosphate biosynthetic process	0.007987878420768	True	"""The chemical reactions and pathways resulting in the formation of inositol trisphosphate, 1,2,3,4,5,6-cyclohexanehexol, with three phosphate groups attached."" [GOC:mah]"	9	118	2	15719	0.0169491525423728	0.2222222222222222	query_1	['GO:0032957', 'GO:0032958']	['PLCG2', 'PTK2B']
877	GO:BP	GO:0060385	axonogenesis involved in innervation	0.007987878420768	True	"""The neurite development process that generates a long process of a neuron, as it invades a target tissue."" [GOC:dph, GOC:sart]"	9	118	2	15719	0.0169491525423728	0.2222222222222222	query_1	['GO:0007409', 'GO:0060384']	['ITGA4', 'NRP1']
876	GO:BP	GO:1903010	regulation of bone development	0.007987878420768	True	"""Any process that modulates the frequency, rate or extent of bone development."" [GO_REF:0000058, GOC:mr, GOC:TermGenie, PMID:22510437]"	9	118	2	15719	0.0169491525423728	0.2222222222222222	query_1	['GO:0060348', 'GO:2000026']	['LOX', 'KDR']
875	GO:BP	GO:0035701	hematopoietic stem cell migration	0.007987878420768	True	"""The orderly movement of a hematopoietic stem cell from one site to another. A hematopoietic stem cell is a cell from which all cells of the lymphoid and myeloid lineages develop, including blood cells and cells of the immune system."" [CL:0000037, GOC:BHF, PMID:20234092]"	9	118	2	15719	0.0169491525423728	0.2222222222222222	query_1	['GO:0016477']	['JAM3', 'JAM2']
874	GO:BP	GO:0070475	rRNA base methylation	0.007987878420768	True	"""The addition of a methyl group to an atom in the nucleoside base portion of a nucleotide residue in an rRNA molecule."" [GOC:mah]"	9	118	2	15719	0.0169491525423728	0.2222222222222222	query_1	['GO:0031167']	['BUD23', 'TRMT112']
873	GO:BP	GO:0038026	reelin-mediated signaling pathway	0.007987878420768	True	"""The series of molecular signals initiated by the binding of reelin (a secreted glycoprotein) to a receptor on the surface of a target cell, and ending with the regulation of a downstream cellular process, e.g. transcription."" [GOC:bf, PMID:12827279, PMID:20223215]"	9	118	2	15719	0.0169491525423728	0.2222222222222222	query_1	['GO:0007166']	['CRK', 'CRKL']
881	GO:BP	GO:0060341	regulation of cellular localization	0.008098078654935	True	"""Any process that modulates the frequency, rate or extent of a process in which a cell, a substance, or a cellular entity is transported to, or maintained in a specific location within or in the membrane of a cell."" [GOC:dph, GOC:tb]"	951	118	16	15719	0.135593220338983	0.0168243953732912	query_1	['GO:0032879', 'GO:0050794', 'GO:0051641']	['ITGB1', 'SRC', 'ITGB3', 'TGFB3', 'PIK3R1', 'LRP4', 'STX1A', 'FYN', 'EGFR', 'VCL', 'ERBB2', 'CDH1', 'VEGFA', 'CRKL', 'ITGA3', 'PTPN11']
882	GO:BP	GO:0048863	stem cell differentiation	0.0080995955765829	True	"""The process in which a relatively unspecialized cell acquires specialized features of a stem cell. A stem cell is a cell that retains the ability to divide and proliferate throughout life to provide progenitor cells that can differentiate into specialized cells."" [CL:0000034, GOC:isa_complete]"	235	118	7	15719	0.059322033898305	0.0297872340425531	query_1	['GO:0030154']	['ITGB1', 'FN1', 'RET', 'NRP2', 'NRP1', 'PDGFRA', 'SEMA4D']
885	GO:BP	GO:0042058	regulation of epidermal growth factor receptor signaling pathway	0.008134714612594	True	"""Any process that modulates the frequency, rate or extent of epidermal growth factor receptor signaling pathway activity."" [GOC:go_curators]"	71	118	4	15719	0.0338983050847457	0.056338028169014	query_1	['GO:0007173', 'GO:1901184']	['SOS1', 'NCF1', 'EGFR', 'CBL']
884	GO:BP	GO:0061045	negative regulation of wound healing	0.008134714612594	True	"""Any process that decreases the rate, frequency, or extent of the series of events that restore integrity to a damaged tissue, following an injury."" [GOC:dph]"	71	118	4	15719	0.0338983050847457	0.056338028169014	query_1	['GO:0032102', 'GO:0042060', 'GO:0061041', 'GO:1903035']	['CRK', 'VTN', 'THBS1', 'PDGFRA']
883	GO:BP	GO:1900046	regulation of hemostasis	0.008134714612594	True	"""Any process that modulates the frequency, rate or extent of hemostasis."" [GOC:TermGenie]"	71	118	4	15719	0.0338983050847457	0.056338028169014	query_1	['GO:0007599', 'GO:0050789', 'GO:0050878']	['VTN', 'EMILIN1', 'THBS1', 'PDGFRA']
886	GO:BP	GO:0051054	positive regulation of DNA metabolic process	0.0081380562354673	True	"""Any process that activates or increases the frequency, rate or extent of the chemical reactions and pathways involving DNA."" [GOC:ai]"	302	118	8	15719	0.0677966101694915	0.0264900662251655	query_1	['GO:0006259', 'GO:0010604', 'GO:0045935', 'GO:0051052']	['SRC', 'HGF', 'BCL7B', 'SMARCA5', 'EGFR', 'RFC2', 'PTK2B', 'VEGFA']
219	REAC	REAC:R-HSA-194315	Signaling by Rho GTPases	0.0082195796009602	True	Signaling by Rho GTPases	691	108	16	10022	0.1481481481481481	0.0231548480463096	query_1	['REAC:R-HSA-9716542']	['LIMK1', 'RAPGEF1', 'ITGB1', 'PLXNB1', 'SRC', 'PIK3R1', 'SOS1', 'NCF1', 'SH3PXD2A', 'ZAP70', 'VAV1', 'CDH1', 'PTK2B', 'PTK2', 'LCK', 'PLXNA1']
95	GO:CC	GO:0031983	vesicle lumen	0.0084200158498464	True	"""The volume enclosed by the membrane or protein that forms a vesicle."" [GOC:mah, GOC:vesicles]"	318	118	8	16420	0.0677966101694915	0.0251572327044025	query_1	['GO:0031982', 'GO:0043233']	['VEGFB', 'FN1', 'TGFB3', 'HGF', 'EGFR', 'VCL', 'VEGFA', 'THBS1']
887	GO:BP	GO:0030900	forebrain development	0.0084415424492371	True	"""The process whose specific outcome is the progression of the forebrain over time, from its formation to the mature structure. The forebrain is the anterior of the three primary divisions of the developing chordate brain or the corresponding part of the adult brain (in vertebrates, includes especially the cerebral hemispheres, the thalamus, and the hypothalamus and especially in higher vertebrates is the main control center for sensory and associative information processing, visceral functions, and voluntary motor functions)."" [http://www2.merriam-webster.com/cgi-bin/mwmednlm?book=Medical&va=forebrain]"	375	118	9	15719	0.0762711864406779	0.024	query_1	['GO:0007420', 'GO:0048856']	['SRC', 'CRK', 'FYN', 'NRP2', 'EGFR', 'CDH1', 'CRKL', 'NRP1', 'PLXNA1']
888	GO:BP	GO:0072001	renal system development	0.0084602294394838	True	"""The process whose specific outcome is the progression of the renal system over time, from its formation to the mature structure. The renal system maintains fluid balance and contributes to electrolyte balance, acid/base balance, and disposal of nitrogenous waste products. In humans, the renal system comprises a pair of kidneys, a pair of ureters, urinary bladder, urethra, sphincter muscle and associated blood vessels."" [GOC:mtg_kidney_jan10, GOC:yaf, http://en.wikibooks.org/wiki/Human_Physiology/The_Urinary_System]"	304	118	8	15719	0.0677966101694915	0.0263157894736842	query_1	['GO:0048731']	['ITGB3', 'RET', 'LRP4', 'FBN1', 'VEGFA', 'NRP1', 'ITGA3', 'PDGFRA']
890	GO:BP	GO:0045943	positive regulation of transcription by RNA polymerase I	0.0084634206027613	True	"""Any process that activates or increases the frequency, rate or extent of transcription mediated by RNA polymerase I."" [GOC:go_curators, GOC:txnOH]"	34	118	3	15719	0.0254237288135593	0.088235294117647	query_1	['GO:0006356', 'GO:0006360', 'GO:0045893']	['SMARCA5', 'ERBB2', 'BAZ1B']
889	GO:BP	GO:0034405	response to fluid shear stress	0.0084634206027613	True	"""Any process that results in a change in state or activity of a cell or an organism (in terms of movement, secretion, enzyme production, gene expression, etc.) as a result of a fluid shear stress stimulus. Fluid shear stress is the force acting on an object in a system where the fluid is moving across a solid surface."" [GOC:sl]"	34	118	3	15719	0.0254237288135593	0.088235294117647	query_1	['GO:0006950']	['SRC', 'TGFB3', 'PTK2B']
891	GO:BP	GO:0071345	cellular response to cytokine stimulus	0.008708345585265	True	"""Any process that results in a change in state or activity of a cell (in terms of movement, secretion, enzyme production, gene expression, etc.) as a result of a cytokine stimulus."" [GOC:mah]"	781	118	14	15719	0.1186440677966101	0.0179257362355953	query_1	['GO:0034097', 'GO:0071310']	['SRC', 'SOS1', 'LOX', 'ITGA4', 'SMARCA5', 'LYN', 'NRP2', 'SYK', 'PTK2B', 'CRKL', 'VCAM1', 'THBS1', 'CBL', 'PTPN11']
220	REAC	REAC:R-HSA-375165	NCAM signaling for neurite out-growth	0.0087113402587143	True	NCAM signaling for neurite out-growth	56	108	4	10022	0.037037037037037	0.0714285714285714	query_1	['REAC:R-HSA-422475']	['SOS1', 'FYN', 'AGRN', 'PTK2']
221	REAC	REAC:R-HSA-418886	Netrin mediated repulsion signals	0.0087914293508552	True	Netrin mediated repulsion signals	8	108	2	10022	0.0185185185185185	0.25	query_1	['REAC:R-HSA-373752']	['SRC', 'PTPN11']
892	GO:BP	GO:0021536	diencephalon development	0.0089279099684145	True	"""The process whose specific outcome is the progression of the diencephalon over time, from its formation to the mature structure. The diencephalon is the paired caudal parts of the prosencephalon from which the thalamus, hypothalamus, epithalamus and subthalamus are derived; these regions regulate autonomic, visceral and endocrine function, and process information directed to the cerebral cortex."" [GO_REF:0000021, GOC:cls, GOC:dgh, GOC:dph, GOC:jid, ISBN:0838580343]"	73	118	4	15719	0.0338983050847457	0.0547945205479452	query_1	['GO:0030900', 'GO:0048856']	['NRP2', 'CDH1', 'NRP1', 'PLXNA1']
893	GO:BP	GO:0050818	regulation of coagulation	0.0089279099684145	True	"""Any process that modulates the frequency, rate or extent of coagulation, the process in which a fluid solution, or part of it, changes into a solid or semisolid mass."" [GOC:ai]"	73	118	4	15719	0.0338983050847457	0.0547945205479452	query_1	['GO:0050817', 'GO:0051239']	['VTN', 'EMILIN1', 'THBS1', 'PDGFRA']
96	GO:CC	GO:0005769	early endosome	0.0090112085985192	True	"""A membrane-bounded organelle that receives incoming material from primary endocytic vesicles that have been generated by clathrin-dependent and clathrin-independent endocytosis; vesicles fuse with the early endosome to deliver cargo for sorting into recycling or degradation pathways."" [GOC:mah, NIF_Subcellular:nlx_subcell_20090701, PMID:19696797]"	397	118	9	16420	0.0762711864406779	0.0226700251889168	query_1	['GO:0005768']	['RAPGEF1', 'RET', 'EGFR', 'KDR', 'FCGR1A', 'ERBB2', 'SH3GL2', 'VCAM1', 'NRP1']
895	GO:BP	GO:0034097	response to cytokine	0.0090632456549699	True	"""Any process that results in a change in state or activity of a cell or an organism (in terms of movement, secretion, enzyme production, gene expression, etc.) as a result of a cytokine stimulus."" [GOC:sl]"	873	118	15	15719	0.1271186440677966	0.0171821305841924	query_1	['GO:0010033']	['SRC', 'SPP1', 'SOS1', 'LOX', 'ITGA4', 'SMARCA5', 'LYN', 'NRP2', 'SYK', 'PTK2B', 'CRKL', 'VCAM1', 'THBS1', 'CBL', 'PTPN11']
894	GO:BP	GO:0050777	negative regulation of immune response	0.0090632456549699	True	"""Any process that stops, prevents, or reduces the frequency, rate or extent of the immune response, the immunological reaction of an organism to an immunogenic stimulus."" [GOC:ai]"	178	118	6	15719	0.0508474576271186	0.0337078651685393	query_1	['GO:0002683', 'GO:0006955', 'GO:0048585', 'GO:0050776']	['SRC', 'CRK', 'FYN', 'LYN', 'SYK', 'PLCG1']
896	GO:BP	GO:0001933	negative regulation of protein phosphorylation	0.0092773532692228	True	"""Any process that stops, prevents or reduces the rate of addition of phosphate groups to amino acids within a protein."" [GOC:hjd]"	309	118	8	15719	0.0677966101694915	0.0258899676375404	query_1	['GO:0001932', 'GO:0006468', 'GO:0031400', 'GO:0042326']	['MLXIPL', 'HGF', 'LYN', 'SH3GL2', 'CRKL', 'EMILIN1', 'CBL', 'SEMA4D']
897	GO:BP	GO:0002443	leukocyte mediated immunity	0.0092912939609555	True	"""Any process involved in the carrying out of an immune response by a leukocyte."" [GO_REF:0000022, GOC:add, ISBN:0781735149]"	381	118	9	15719	0.0762711864406779	0.0236220472440944	query_1	['GO:0002252']	['CRK', 'PLCG2', 'LAT', 'LYN', 'VAV1', 'SYK', 'FCGR1A', 'GAB2', 'CBL']
898	GO:BP	GO:0021561	facial nerve development	0.0096938448729799	True	"""The process whose specific outcome is the progression of the facial nerve over time, from its formation to the mature structure. This sensory and motor nerve supplies the muscles of facial expression and the expression and taste at the anterior two-thirds of the tongue. The principal branches are the superficial opthalmic, buccal, palatine and hyomandibular. The main trunk synapses within pterygopalatine ganglion in the parotid gland and this ganglion then gives off nerve branches which supply the lacrimal gland and the mucous secreting glands of the nasal and oral cavities."" [GO_REF:0000021, GOC:cls, GOC:dgh, GOC:dph, GOC:jid, ISBN:0838580343]"	10	118	2	15719	0.0169491525423728	0.2	query_1	['GO:0021545', 'GO:0021783']	['NRP2', 'NRP1']
900	GO:BP	GO:2000234	positive regulation of rRNA processing	0.0096938448729799	True	"""Any process that activates or increases the frequency, rate or extent of rRNA processing."" [GOC:mah]"	10	118	2	15719	0.0169491525423728	0.2	query_1	['GO:0006364', 'GO:0051254', 'GO:2000232']	['BUD23', 'TRMT112']
901	GO:BP	GO:0021610	facial nerve morphogenesis	0.0096938448729799	True	"""The process in which the anatomical structure of the facial nerve is generated and organized. This sensory and motor nerve supplies the muscles of facial expression and the expression and taste at the anterior two-thirds of the tongue. The principal branches are the superficial opthalmic, buccal, palatine and hyomandibular. The main trunk synapses within pterygopalatine ganglion in the parotid gland and this ganglion then gives of nerve branches which supply the lacrimal gland and the mucous secreting glands of the nasal and oral cavities."" [GO_REF:0000021, GOC:cls, GOC:dgh, GOC:dph, GOC:jid, ISBN:0838580343]"	10	118	2	15719	0.0169491525423728	0.2	query_1	['GO:0021561', 'GO:0021602']	['NRP2', 'NRP1']
902	GO:BP	GO:1901298	regulation of hydrogen peroxide-mediated programmed cell death	0.0096938448729799	True	"""Any process that modulates the frequency, rate or extent of hydrogen peroxide-mediated programmed cell death."" [GOC:BHF, GOC:TermGenie]"	10	118	2	15719	0.0169491525423728	0.2	query_1	['GO:0010421', 'GO:0043067', 'GO:1903205']	['MET', 'HGF']
899	GO:BP	GO:0021562	vestibulocochlear nerve development	0.0096938448729799	True	"""The process whose specific outcome is the progression of the vestibulocochlear nerve over time, from its formation to the mature structure. This sensory nerve innervates the membranous labyrinth of the inner ear. The vestibular branch innervates the vestibular apparatus that senses head position changes relative to gravity. The auditory branch innervates the cochlear duct, which is connected to the three bony ossicles which transduce sound waves into fluid movement in the cochlea."" [GO_REF:0000021, GOC:cls, GOC:dgh, GOC:dph, GOC:jid, ISBN:0838580343]"	10	118	2	15719	0.0169491525423728	0.2	query_1	['GO:0021545']	['NRP2', 'NRP1']
903	GO:BP	GO:0034103	regulation of tissue remodeling	0.0097470141916784	True	"""Any process that modulates the frequency, rate, or extent of tissue remodeling."" [GOC:add]"	75	118	4	15719	0.0338983050847457	0.0533333333333333	query_1	['GO:0048771', 'GO:0051239']	['SRC', 'SPP1', 'ITGB3', 'SYK']
904	GO:BP	GO:0031099	regeneration	0.0097555697116998	True	"""The regrowth of a lost or destroyed body part, such as an organ or tissue. This process may occur via renewal, repair, and/or growth alone (i.e. increase in size or mass)."" [GOC:mah, GOC:pr]"	181	118	6	15719	0.0508474576271186	0.0331491712707182	query_1	['GO:0048856']	['SPP1', 'HGF', 'TNC', 'VTN', 'ADAM15', 'PGF']
905	GO:BP	GO:0032570	response to progesterone	0.0098019740040299	True	"""Any process that results in a change in state or activity of a cell or an organism (in terms of movement, secretion, enzyme production, gene expression, etc.) as a result of a progesterone stimulus."" [GOC:sl]"	36	118	3	15719	0.0254237288135593	0.0833333333333333	query_1	['GO:0048545', 'GO:1901654']	['SRC', 'TGFB3', 'THBS1']
906	GO:BP	GO:0060323	head morphogenesis	0.0098019740040299	True	"""The process in which the anatomical structures of the head are generated and organized. The head is the anterior-most division of the body."" [GOC:dph]"	36	118	3	15719	0.0254237288135593	0.0833333333333333	query_1	['GO:0009653', 'GO:0010171', 'GO:0060322']	['TGFB3', 'PTPN11', 'PDGFRA']
907	GO:BP	GO:0045742	positive regulation of epidermal growth factor receptor signaling pathway	0.0098019740040299	True	"""Any process that activates or increases the frequency, rate or extent of epidermal growth factor receptor signaling pathway activity."" [GOC:go_curators]"	36	118	3	15719	0.0254237288135593	0.0833333333333333	query_1	['GO:0007173', 'GO:0042058', 'GO:1901186']	['SOS1', 'NCF1', 'CBL']
908	GO:BP	GO:2000278	regulation of DNA biosynthetic process	0.0099976094117577	True	"""Any process that modulates the frequency, rate or extent of DNA biosynthetic process."" [GOC:obol]"	125	118	5	15719	0.0423728813559322	0.04	query_1	['GO:0010556', 'GO:0031326', 'GO:0051052', 'GO:0071897']	['SRC', 'HGF', 'RFC2', 'PTK2B', 'VEGFA']
222	REAC	REAC:R-HSA-9716542	Signaling by Rho GTPases, Miro GTPases and RHOBTB3	0.0100299116186136	True	Signaling by Rho GTPases, Miro GTPases and RHOBTB3	706	108	16	10022	0.1481481481481481	0.0226628895184136	query_1	['REAC:R-HSA-162582']	['LIMK1', 'RAPGEF1', 'ITGB1', 'PLXNB1', 'SRC', 'PIK3R1', 'SOS1', 'NCF1', 'SH3PXD2A', 'ZAP70', 'VAV1', 'CDH1', 'PTK2B', 'PTK2', 'LCK', 'PLXNA1']
909	GO:BP	GO:0022414	reproductive process	0.0101247835895349	True	"""A biological process that directly contributes to the process of producing new individuals by one or two organisms. The new individuals inherit some proportion of their genetic material from the parent or parents."" [GOC:dph, GOC:isa_complete]"	1453	118	21	15719	0.1779661016949152	0.0144528561596696	query_1	['GO:0000003', 'GO:0008150']	['FKBP6', 'ITGB1', 'SRC', 'SPP1', 'ITGB3', 'TGFB3', 'SOS1', 'ITGA5', 'TNC', 'JAM3', 'KDR', 'PTK2B', 'VEGFA', 'CRKL', 'ADAM15', 'ITGA3', 'CBL', 'JAM2', 'PTPN11', 'PDGFRA', 'PGF']
911	GO:BP	GO:0043154	negative regulation of cysteine-type endopeptidase activity involved in apoptotic process	0.0101288287238546	True	"""Any process that stops, prevents, or reduces the frequency, rate or extent of a cysteine-type endopeptidase activity involved in the apoptotic process."" [GOC:jl, GOC:mtg_apoptosis]"	76	118	4	15719	0.0338983050847457	0.0526315789473684	query_1	['GO:0043066', 'GO:0043281', 'GO:2000117']	['SRC', 'HGF', 'VEGFA', 'THBS1']
910	GO:BP	GO:1901184	regulation of ERBB signaling pathway	0.0101288287238546	True	"""Any process that modulates the frequency, rate or extent of ERBB signaling pathway."" [GOC:BHF, GOC:TermGenie]"	76	118	4	15719	0.0338983050847457	0.0526315789473684	query_1	['GO:0009966', 'GO:0038127']	['SOS1', 'NCF1', 'EGFR', 'CBL']
912	GO:BP	GO:0050848	regulation of calcium-mediated signaling	0.0101288287238546	True	"""Any process that modulates the frequency, rate or extent of calcium-mediated signaling, the process in which a cell uses calcium ions to convert an extracellular signal into a response."" [GOC:ai]"	76	118	4	15719	0.0338983050847457	0.0526315789473684	query_1	['GO:0019722', 'GO:1902531']	['PLCG2', 'ZAP70', 'SYK', 'PTK2B']
913	GO:BP	GO:1903169	regulation of calcium ion transmembrane transport	0.01020357018559	True	"""Any process that modulates the frequency, rate or extent of calcium ion transmembrane transport."" [GO_REF:0000058, GOC:BHF, GOC:rl, GOC:TermGenie, PMID:24125847]"	183	118	6	15719	0.0508474576271186	0.0327868852459016	query_1	['GO:0051924', 'GO:0070588', 'GO:1904062']	['ITGB3', 'PLCG2', 'FYN', 'LYN', 'PLCG1', 'PTK2B']
914	GO:BP	GO:0042476	odontogenesis	0.0102814816157029	True	"""The process whose specific outcome is the progression of a tooth or teeth over time, from formation to the mature structure(s). A tooth is any hard bony, calcareous, or chitinous organ found in the mouth or pharynx of an animal and used in procuring or masticating food."" [GOC:jl, GOC:mah]"	126	118	5	15719	0.0423728813559322	0.0396825396825396	query_1	['GO:0009887']	['SRC', 'TGFB3', 'LRP4', 'ITGB6', 'PDGFRA']
915	GO:BP	GO:0034110	regulation of homotypic cell-cell adhesion	0.0105162886847081	True	"""Any process that modulates the frequency, rate, or extent of homotypic cell-cell adhesion."" [GOC:add]"	37	118	3	15719	0.0254237288135593	0.081081081081081	query_1	['GO:0022407', 'GO:0034109']	['LYN', 'SYK', 'EMILIN1']
916	GO:BP	GO:0031400	negative regulation of protein modification process	0.0107177311304323	True	"""Any process that stops, prevents, or reduces the frequency, rate or extent of the covalent alteration of one or more amino acid residues within a protein."" [GOC:mah, GOC:tb]"	467	118	10	15719	0.0847457627118644	0.0214132762312633	query_1	['GO:0031399', 'GO:0036211', 'GO:0051248']	['LIMK1', 'MLXIPL', 'HGF', 'FYN', 'LYN', 'SH3GL2', 'CRKL', 'EMILIN1', 'CBL', 'SEMA4D']
97	GO:CC	GO:0032279	asymmetric synapse	0.0107589205338749	True	"""A type of synapse occurring between an axon and a dendritic spine or dendritic shaft. Asymmetric synapses, the most abundant synapse type in the central nervous system, involve axons that contain predominantly spherical vesicles and contain a thickened postsynaptic density. Most or all synapses of this type are excitatory."" [GOC:dgh, GOC:ef]"	332	118	8	16420	0.0677966101694915	0.0240963855421686	query_1	['GO:0098984']	['ITGB1', 'SRC', 'LRP4', 'SOS1', 'STX1A', 'FYN', 'LYN', 'PTK2B']
917	GO:BP	GO:0002699	positive regulation of immune effector process	0.0107781913581031	True	"""Any process that activates or increases the frequency, rate, or extent of an immune effector process."" [GOC:add]"	249	118	7	15719	0.059322033898305	0.0281124497991967	query_1	['GO:0002252', 'GO:0002684', 'GO:0002697']	['RAPGEF1', 'PLCG2', 'LYN', 'VAV1', 'SYK', 'FCGR1A', 'GAB2']
918	GO:BP	GO:0006612	protein targeting to membrane	0.0109234280526457	True	"""The process of directing proteins towards a membrane, usually using signals contained within the protein."" [GOC:curators]"	128	118	5	15719	0.0423728813559322	0.0390625	query_1	['GO:0006605', 'GO:0090150']	['VPS37D', 'FYN', 'NCF1', 'ERBB2', 'GTF2IRD2']
919	GO:BP	GO:0070304	positive regulation of stress-activated protein kinase signaling cascade	0.0109234280526457	True	"""Any process that activates or increases the frequency, rate or extent of signaling via the stress-activated protein kinase signaling cascade."" [GOC:mah]"	128	118	5	15719	0.0423728813559322	0.0390625	query_1	['GO:0031098', 'GO:0070302', 'GO:1902533']	['CRK', 'NCF1', 'LYN', 'PTK2B', 'VEGFA']
921	GO:BP	GO:0001101	response to acid chemical	0.0109234280526457	True	"""Any process that results in a change in state or activity of a cell or an organism (in terms of movement, secretion, enzyme production, gene expression, etc.) as a result of a stimulus by the chemical structure of the anion portion of a dissociated acid (rather than the acid acting as a proton donor). The acid chemical may be in gaseous, liquid or solid form."" [GOC:go_curators, GOC:rn]"	128	118	5	15719	0.0423728813559322	0.0390625	query_1	['GO:0042221']	['FYN', 'LYN', 'EGFR', 'VEGFA', 'PDGFRA']
920	GO:BP	GO:0090101	negative regulation of transmembrane receptor protein serine/threonine kinase signaling pathway	0.0109234280526457	True	"""Any process that decreases the rate, frequency, or extent of the series of molecular signals generated as a consequence of a transmembrane receptor serine/threonine kinase binding to its physiological ligand."" [GOC:dph, GOC:tb]"	128	118	5	15719	0.0423728813559322	0.0390625	query_1	['GO:0007178', 'GO:0009968', 'GO:0090092']	['TGFB3', 'LTBP1', 'FBN1', 'FBN2', 'EMILIN1']
226	REAC	REAC:R-HSA-212718	EGFR interacts with phospholipase C-gamma	0.0109285733132214	True	EGFR interacts with phospholipase C-gamma	9	108	2	10022	0.0185185185185185	0.2222222222222222	query_1	['REAC:R-HSA-177929']	['EGFR', 'PLCG1']
223	REAC	REAC:R-HSA-9028731	Activated NTRK2 signals through FRS2 and FRS3	0.0109285733132214	True	Activated NTRK2 signals through FRS2 and FRS3	9	108	2	10022	0.0185185185185185	0.2222222222222222	query_1	['REAC:R-HSA-9006115']	['SOS1', 'PTPN11']
224	REAC	REAC:R-HSA-447041	CHL1 interactions	0.0109285733132214	True	CHL1 interactions	9	108	2	10022	0.0185185185185185	0.2222222222222222	query_1	['REAC:R-HSA-373760']	['ITGB1', 'NRP1']
