COG7-CDG	source	native	name	Corrected p_value	significant	description	term_size	query_size	intersection_size	effective_domain_size	precision	recall	query	parents	intersections
944	GO:BP	GO:0050864	regulation of B cell activation	0.0087638034641885	True	"""Any process that modulates the frequency, rate or extent of B cell activation."" [GOC:ai]"	144	101	5	15719	0.0495049504950495	0.0347222222222222	query_1	['GO:0042113', 'GO:0051249']	['CARD11', 'BCL2', 'TNIP2', 'TNFAIP3', 'BAD']
945	GO:BP	GO:0061008	hepaticobiliary system development	0.0087638034641885	True	"""The progression of the hepaticobiliary system over time, from its formation to the mature structure. The hepaticobiliary system is responsible for metabolic and catabolic processing of small molecules absorbed from the blood or gut, hormones and serum proteins, detoxification, storage of glycogen, triglycerides, metals and lipid soluble vitamins and excretion of bile. Included are the synthesis of albumin, blood coagulation factors, complement, and specific binding proteins."" [GOC:dph]"	144	101	5	15719	0.0495049504950495	0.0347222222222222	query_1	['GO:0048731']	['RELA', 'TNF', 'CFLAR', 'TNFAIP3', 'FBXW7']
946	GO:BP	GO:0035304	regulation of protein dephosphorylation	0.0088276495905245	True	"""Any process that modulates the frequency, rate or extent of removal of phosphate groups from a protein."" [GOC:bf]"	87	101	4	15719	0.0396039603960396	0.0459770114942528	query_1	['GO:0006470', 'GO:0031399', 'GO:0035303']	['GSK3B', 'HSP90AB1', 'IKBKB', 'TNF']
947	GO:BP	GO:0050671	positive regulation of lymphocyte proliferation	0.0090122087308197	True	"""Any process that activates or increases the rate or extent of lymphocyte proliferation."" [GOC:ai]"	145	101	5	15719	0.0495049504950495	0.0344827586206896	query_1	['GO:0032946', 'GO:0046651', 'GO:0050670', 'GO:0051251']	['CARD11', 'BCL2', 'FADD', 'PYCARD', 'TRAF6']
948	GO:BP	GO:2000516	positive regulation of CD4-positive, alpha-beta T cell activation	0.0091260898230726	True	"""Any process that activates or increases the frequency, rate or extent of CD4-positive, alpha-beta T cell activation."" [GOC:obol]"	42	101	3	15719	0.0297029702970297	0.0714285714285714	query_1	['GO:0035710', 'GO:0046635', 'GO:2000514']	['CARD11', 'NLRP3', 'MALT1']
949	GO:BP	GO:0010658	striated muscle cell apoptotic process	0.0091260898230726	True	"""A form of programmed cell death induced by external or internal signals that trigger the activity of proteolytic caspases, whose actions dismantle a striated muscle cell and result in its death. Striated muscle cells make up striated muscle fibers which are divided by transverse bands into striations."" [CL:0000737, GOC:dph, GOC:mtg_apoptosis, GOC:tb]"	42	101	3	15719	0.0297029702970297	0.0714285714285714	query_1	['GO:0010657']	['CFLAR', 'HSP90AA1', 'TP53']
950	GO:BP	GO:0035239	tube morphogenesis	0.0092242348155429	True	"""The process in which the anatomical structures of a tube are generated and organized. Epithelial and endothelial tubes transport gases, liquids and cells from one site to another and form the basic structure of many organs and tissues, with tube shape and organization varying from the single-celled excretory organ in Caenorhabditis elegans to the branching trees of the mammalian kidney and insect tracheal system."" [GOC:bf, PMID:14624839]"	830	101	13	15719	0.1287128712871287	0.0156626506024096	query_1	['GO:0009653', 'GO:0035295']	['BCL2L11', 'BAX', 'AKT1', 'BCL2', 'FASLG', 'BTRC', 'TNF', 'TNFAIP3', 'TRAF6', 'BAK1', 'CASP8', 'FBXW7', 'BCL10']
954	GO:BP	GO:0061912	selective autophagy	0.0094706455030515	True	"""The macroautophagy process in which specific structures are targeted by the autophagy process."" [PMID:20484971, PMID:21997368, PMID:22966490]"	89	101	4	15719	0.0396039603960396	0.0449438202247191	query_1	['GO:0016236']	['TBK1', 'RNF31', 'TP53', 'CDC37']
955	GO:BP	GO:0031665	negative regulation of lipopolysaccharide-mediated signaling pathway	0.0094706455030515	True	"""Any process that stops, prevents, or reduces the frequency, rate or extent of signaling in response to detection of lipopolysaccharide."" [GOC:mah]"	12	101	2	15719	0.0198019801980198	0.1666666666666666	query_1	['GO:0002832', 'GO:0009968', 'GO:0031663', 'GO:0031664', 'GO:0032102']	['CARD8', 'TNFAIP3']
956	GO:BP	GO:0090085	regulation of protein deubiquitination	0.0094706455030515	True	"""Any process that modulates the frequency, rate or extent of protein deubiquitination. Protein deubiquitination is the removal of one or more ubiquitin groups from a protein."" [GOC:BHF, GOC:dph, GOC:tb]"	12	101	2	15719	0.0198019801980198	0.1666666666666666	query_1	['GO:0016579', 'GO:0030162', 'GO:1903320']	['TANK', 'TNIP1']
957	GO:BP	GO:0002687	positive regulation of leukocyte migration	0.0094706455030515	True	"""Any process that activates or increases the frequency, rate, or extent of leukocyte migration."" [GOC:add]"	147	101	5	15719	0.0495049504950495	0.0340136054421768	query_1	['GO:0002684', 'GO:0002685', 'GO:0030335', 'GO:0050900']	['TNF', 'FADD', 'TNFSF14', 'PYCARD', 'APP']
953	GO:BP	GO:0097048	dendritic cell apoptotic process	0.0094706455030515	True	"""Any apoptotic process in a dendritic cell, a cell of hematopoietic origin, typically resident in particular tissues, specialized in the uptake, processing, and transport of antigens to lymph nodes for the purpose of stimulating an immune response via T cell activation."" [CL:0000451, GOC:BHF, GOC:mtg_apoptosis, PMID:15059845]"	12	101	2	15719	0.0198019801980198	0.1666666666666666	query_1	['GO:0071887']	['BCL2', 'BCL2L1']
959	GO:BP	GO:0030656	regulation of vitamin metabolic process	0.0094706455030515	True	"""Any process that modulates the frequency, rate or extent of the chemical reactions and pathways involving a vitamin, one of a number of unrelated organic substances that occur in many foods in small amounts and that are necessary in trace amounts for the normal metabolic functioning of the body."" [GOC:mah]"	12	101	2	15719	0.0198019801980198	0.1666666666666666	query_1	['GO:0006766', 'GO:0062012']	['TNF', 'NFKB1']
960	GO:BP	GO:0014889	muscle atrophy	0.0094706455030515	True	"""A process, occurring in the muscle, that is characterized by a decrease in protein content, fiber diameter, force production and fatigue resistance in response to different conditions such as starvation, aging and disuse."" [GOC:mtg_muscle]"	12	101	2	15719	0.0198019801980198	0.1666666666666666	query_1	['GO:0043500']	['FOXO3', 'CFLAR']
952	GO:BP	GO:0001942	hair follicle development	0.0094706455030515	True	"""The process whose specific outcome is the progression of the hair follicle over time, from its formation to the mature structure. A hair follicle is a tube-like opening in the epidermis where the hair shaft develops and into which the sebaceous glands open."" [GOC:dph, UBERON:0002073]"	89	101	4	15719	0.0396039603960396	0.0449438202247191	query_1	['GO:0022405', 'GO:0048856', 'GO:0098773']	['BCL2', 'RELA', 'TNF', 'TRADD']
951	GO:BP	GO:2000668	regulation of dendritic cell apoptotic process	0.0094706455030515	True	"""Any process that modulates the frequency, rate or extent of dendritic cell apoptotic process."" [GOC:mtg_apoptosis, GOC:obol]"	12	101	2	15719	0.0198019801980198	0.1666666666666666	query_1	['GO:0097048', 'GO:2000106']	['BCL2', 'BCL2L1']
958	GO:BP	GO:0051798	positive regulation of hair follicle development	0.0094706455030515	True	"""Any process that activates or increases the frequency, rate or extent of hair follicle development."" [GOC:ai]"	12	101	2	15719	0.0198019801980198	0.1666666666666666	query_1	['GO:0001942', 'GO:0051094', 'GO:0051240', 'GO:0051797']	['TNF', 'TRADD']
961	GO:BP	GO:0002263	cell activation involved in immune response	0.0095334152099014	True	"""A change in the morphology or behavior of a cell resulting from exposure to an activating factor such as a cellular or soluble ligand, leading to the initiation or perpetuation of an immune response."" [GO_REF:0000022, GOC:add, ISBN:0781735149]"	289	101	7	15719	0.0693069306930693	0.0242214532871972	query_1	['GO:0001775', 'GO:0002252', 'GO:0006955']	['TNF', 'NLRP3', 'MALT1', 'RELB', 'PYCARD', 'APP', 'TP53']
962	GO:BP	GO:0051649	establishment of localization in cell	0.0095662642262849	True	"""Any process, occuring in a cell, that localizes a substance or cellular component. This may occur via movement, tethering or selective degradation."" [GOC:ai, GOC:dos, GOC:dph, GOC:tb]"	2072	101	24	15719	0.2376237623762376	0.0115830115830115	query_1	['GO:0051234', 'GO:0051641']	['BCL2L11', 'BAX', 'HSPA1A', 'GSK3B', 'AKT1', 'BCL2', 'RNF31', 'BID', 'BBC3', 'MALT1', 'HSP90AA1', 'FBXW11', 'SNX33', 'IKBKG', 'COG7', 'BCL2L1', 'SFN', 'NFKBIA', 'BAK1', 'APP', 'FBXW7', 'TP53', 'BAD', 'CDC37']
964	GO:BP	GO:0032735	positive regulation of interleukin-12 production	0.0095934755131534	True	"""Any process that activates or increases the frequency, rate, or extent of interleukin-12 production."" [GOC:mah]"	43	101	3	15719	0.0297029702970297	0.0697674418604651	query_1	['GO:0001819', 'GO:0032615', 'GO:0032655']	['RELA', 'LTB', 'TRAF6']
965	GO:BP	GO:0072593	reactive oxygen species metabolic process	0.0095934755131534	True	"""The chemical reactions and pathways involving a reactive oxygen species, any molecules or ions formed by the incomplete one-electron reduction of oxygen. They contribute to the microbicidal activity of phagocytes, regulation of signal transduction and gene expression, and the oxidative damage to biopolymers."" [GOC:mah]"	215	101	6	15719	0.0594059405940594	0.027906976744186	query_1	['GO:0044237']	['BCL2', 'TNF', 'RIPK1', 'CFLAR', 'BIRC2', 'TP53']
966	GO:BP	GO:2000378	negative regulation of reactive oxygen species metabolic process	0.0095934755131534	True	"""Any process that stops, prevents or reduces the frequency, rate or extent of reactive oxygen species metabolic process."" [GOC:mah]"	43	101	3	15719	0.0297029702970297	0.0697674418604651	query_1	['GO:0031324', 'GO:0072593', 'GO:2000377']	['BCL2', 'CFLAR', 'TP53']
963	GO:BP	GO:0006509	membrane protein ectodomain proteolysis	0.0095934755131534	True	"""The proteolytic cleavage of transmembrane proteins and release of their ectodomain (extracellular domain)."" [GOC:jl, http://www.copewithcytokines.de/]"	43	101	3	15719	0.0297029702970297	0.0697674418604651	query_1	['GO:0033619']	['TNFRSF1B', 'TNF', 'SNX33']
207	REAC	REAC:R-HSA-400253	Circadian Clock	0.0098131095064204	True	Circadian Clock	67	94	4	10022	0.0425531914893617	0.0597014925373134	query_1	['REAC:0000000']	['CREBBP', 'BTRC', 'SKP1', 'CUL1']
208	REAC	REAC:R-HSA-1474151	Tetrahydrobiopterin (BH4) synthesis, recycling, salvage and regulation	0.0102301284508922	True	Tetrahydrobiopterin (BH4) synthesis, recycling, salvage and regulation	10	94	2	10022	0.0212765957446808	0.2	query_1	['REAC:R-HSA-8978934']	['AKT1', 'HSP90AA1']
209	REAC	REAC:R-HSA-9617629	Regulation of FOXO transcriptional activity by acetylation	0.0102301284508922	True	Regulation of FOXO transcriptional activity by acetylation	10	94	2	10022	0.0212765957446808	0.2	query_1	['REAC:R-HSA-9614085']	['CREBBP', 'FOXO3']
967	GO:BP	GO:0031641	regulation of myelination	0.010237221791894	True	"""Any process that modulates the frequency, rate or extent of the formation of a myelin sheath around nerve axons."" [GOC:mah]"	44	101	3	15719	0.0297029702970297	0.0681818181818181	query_1	['GO:0042552', 'GO:0050794', 'GO:0051960']	['AKT1', 'TNFRSF1B', 'TNF']
62	GO:CC	GO:0017119	Golgi transport complex	0.0102516011013619	True	"""A multisubunit tethering complex of the CATCHR family (complexes associated with tethering containing helical rods) that has a role in tethering vesicles to the Golgi prior to fusion. Composed of 8 subunits COG1-8."" [GOC:krc, PMID:11980916, PMID:20972446, PMID:9792665]"	11	101	2	16420	0.0198019801980198	0.1818181818181818	query_1	['GO:0005794', 'GO:0099023']	['COG5', 'COG7']
63	GO:CC	GO:0101031	protein folding chaperone complex	0.0103199166770014	True	"""A protein complex required for the non-covalent folding or unfolding, maturation, stabilization or assembly or disassembly of macromolecular structures. Usually active during or immediately after completion of translation. Many chaperone complexes contain heat shock proteins."" [GOC:bhm, PMID:21855797]"	41	101	3	16420	0.0297029702970297	0.073170731707317	query_1	['GO:0140535']	['STIP1', 'HSP90AB1', 'CDC37']
970	GO:BP	GO:0022405	hair cycle process	0.0105252006555921	True	"""A multicellular organismal process involved in the cyclical phases of growth (anagen), regression (catagen), quiescence (telogen), and shedding (exogen) in the life of a hair; one of the collection or mass of filaments growing from the skin of an animal, and forming a covering for a part of the head or for any part or the whole of the body."" [GOC:isa_complete]"	92	101	4	15719	0.0396039603960396	0.0434782608695652	query_1	['GO:0022404', 'GO:0042633']	['BCL2', 'RELA', 'TNF', 'TRADD']
971	GO:BP	GO:0032436	positive regulation of proteasomal ubiquitin-dependent protein catabolic process	0.0105252006555921	True	"""Any process that activates or increases the frequency, rate or extent of the breakdown of a protein or peptide by hydrolysis of its peptide bonds, initiated by the covalent attachment of ubiquitin, and mediated by the proteasome."" [GOC:mah]"	92	101	4	15719	0.0396039603960396	0.0434782608695652	query_1	['GO:0032434', 'GO:0043161', 'GO:1901800', 'GO:2000060']	['HSPA1A', 'GSK3B', 'AKT1', 'RBX1']
969	GO:BP	GO:0032642	regulation of chemokine production	0.0105252006555921	True	"""Any process that modulates the frequency, rate, or extent of chemokine production."" [GOC:mah]"	92	101	4	15719	0.0396039603960396	0.0434782608695652	query_1	['GO:0001817', 'GO:0032602']	['TNF', 'MEFV', 'PYCARD', 'APP']
968	GO:BP	GO:0032602	chemokine production	0.0105252006555921	True	"""The appearance of a chemokine due to biosynthesis or secretion following a cellular stimulus, resulting in an increase in its intracellular or extracellular levels. All chemokines possess a number of conserved cysteine residues involved in intramolecular disulfide bond formation. Some chemokines are considered pro-inflammatory and can be induced during an immune response to recruit cells of the immune system to a site of infection, while others are considered homeostatic and are involved in controlling the migration of cells during normal processes of tissue maintenance or development. Chemokines are found in all vertebrates, some viruses and some bacteria."" [GOC:BHF, GOC:rl, ISBN:0198506732, PMID:12183377, Wikipedia:Chemokine]"	92	101	4	15719	0.0396039603960396	0.0434782608695652	query_1	['GO:0001816']	['TNF', 'MEFV', 'PYCARD', 'APP']
972	GO:BP	GO:0022404	molting cycle process	0.0105252006555921	True	"""A multicellular organismal process involved in the periodic casting off and regeneration of an outer covering of cuticle, feathers, hair, horns, skin."" [GOC:isa_complete]"	92	101	4	15719	0.0396039603960396	0.0434782608695652	query_1	['GO:0032501', 'GO:0042303']	['BCL2', 'RELA', 'TNF', 'TRADD']
973	GO:BP	GO:0032880	regulation of protein localization	0.0106227612861957	True	"""Any process that modulates the frequency, rate or extent of any process in which a protein is transported to, or maintained in, a specific location."" [GOC:dph, GOC:mah, GOC:tb]"	846	101	13	15719	0.1287128712871287	0.0153664302600472	query_1	['GO:0008104', 'GO:0060341']	['GSK3B', 'AKT1', 'BCL2', 'HSP90AB1', 'TNF', 'RNF31', 'BBC3', 'HSP90AA1', 'SNX33', 'BCL2L1', 'SFN', 'FBXW7', 'BAD']
974	GO:BP	GO:0071495	cellular response to endogenous stimulus	0.0106392268805296	True	"""Any process that results in a change in state or activity of a cell (in terms of movement, secretion, enzyme production, gene expression, etc.) as a result of a stimulus arising within the organism."" [GOC:mah]"	1385	101	18	15719	0.1782178217821782	0.0129963898916967	query_1	['GO:0009719']	['BCL2L11', 'HSPA1A', 'GSK3B', 'AKT1', 'TNFRSF1B', 'CREBBP', 'HSP90AB1', 'RELA', 'TNF', 'NFKB1', 'NLRP3', 'RIPK1', 'CFLAR', 'TAB1', 'MAP3K7', 'BCL2L1', 'APP', 'TP53']
975	GO:BP	GO:0002685	regulation of leukocyte migration	0.0106392268805296	True	"""Any process that modulates the frequency, rate, or extent of leukocyte migration."" [GOC:add]"	220	101	6	15719	0.0594059405940594	0.0272727272727272	query_1	['GO:0002682', 'GO:0030334', 'GO:0050900']	['AKT1', 'TNF', 'FADD', 'TNFSF14', 'PYCARD', 'APP']
976	GO:BP	GO:0009791	post-embryonic development	0.0108999177391124	True	"""The process whose specific outcome is the progression of the organism over time, from the completion of embryonic development to the mature structure. See embryonic development."" [GOC:go_curators]"	93	101	4	15719	0.0396039603960396	0.043010752688172	query_1	['GO:0007275', 'GO:0032501']	['BCL2L11', 'BAX', 'BCL2', 'BAK1']
977	GO:BP	GO:0010225	response to UV-C	0.0109185732983519	True	"""Any process that results in a change in state or activity of a cell or an organism (in terms of movement, secretion, enzyme production, gene expression, etc.) as a result of a UV-C radiation stimulus. UV-C radiation (UV-C light) spans the wavelengths 100 to 280 nm."" [GOC:tb]"	13	101	2	15719	0.0198019801980198	0.1538461538461538	query_1	['GO:0009411']	['BAK1', 'TP53']
978	GO:BP	GO:0098792	xenophagy	0.0109185732983519	True	"""The selective autophagy process in which a region of cytoplasm containing an intracellular pathogen or some part of an intracellular pathogen (e.g. viral capsid) is enclosed in a double membrane bound autophagosome, which then fuses with the lysosome leading to degradation of the contents."" [GOC:autophagy, GOC:pad, GOC:PARL, PMID:19802565, PMID:20159618, PMID:25497060]"	13	101	2	15719	0.0198019801980198	0.1538461538461538	query_1	['GO:0061912', 'GO:0098542']	['TBK1', 'RNF31']
979	GO:BP	GO:0002863	positive regulation of inflammatory response to antigenic stimulus	0.0109185732983519	True	"""Any process that activates or increases the frequency, rate, or extent of an inflammatory response to an antigenic stimulus."" [GOC:add]"	13	101	2	15719	0.0198019801980198	0.1538461538461538	query_1	['GO:0002437', 'GO:0002861', 'GO:0050729', 'GO:0050778']	['TNF', 'LTA']
980	GO:BP	GO:0032494	response to peptidoglycan	0.0109185732983519	True	"""Any process that results in a change in state or activity of an organism (in terms of movement, secretion, enzyme production, gene expression, etc.) as a result of a peptidoglycan stimulus. Peptidoglycan is a bacterial cell wall macromolecule."" [GOC:add, ISBN:0721601464]"	13	101	2	15719	0.0198019801980198	0.1538461538461538	query_1	['GO:0002237', 'GO:0010243', 'GO:1901700']	['RELA', 'NLRP3']
981	GO:BP	GO:0060429	epithelium development	0.0110206655565521	True	"""The process whose specific outcome is the progression of an epithelium over time, from its formation to the mature structure. An epithelium is a tissue that covers the internal or external surfaces of an anatomical structure."" [GOC:dph, GOC:mtg_lung]"	1168	101	16	15719	0.1584158415841584	0.0136986301369863	query_1	['GO:0009888']	['SHARPIN', 'BAX', 'GSK3B', 'AKT1', 'BCL2', 'TNFRSF1A', 'RELA', 'IKBKB', 'BTRC', 'TNF', 'TRADD', 'TRAF6', 'SFN', 'TP53', 'BCL10', 'BAD']
211	REAC	REAC:R-HSA-8939211	ESR-mediated signaling	0.0112145459365999	True	ESR-mediated signaling	216	94	7	10022	0.0744680851063829	0.0324074074074074	query_1	['REAC:R-HSA-9006931']	['AKT1', 'CREBBP', 'BCL2', 'HSP90AB1', 'FOXO3', 'FKBP5', 'HSP90AA1']
210	REAC	REAC:R-HSA-5610787	Hedgehog 'off' state	0.0112145459365999	True	Hedgehog 'off' state	113	94	5	10022	0.0531914893617021	0.0442477876106194	query_1	['REAC:R-HSA-5358351']	['GSK3B', 'RBX1', 'BTRC', 'SKP1', 'CUL1']
212	REAC	REAC:R-HSA-1980143	Signaling by NOTCH1	0.0112215994081447	True	Signaling by NOTCH1	70	94	4	10022	0.0425531914893617	0.0571428571428571	query_1	['REAC:R-HSA-157118']	['CREBBP', 'RBX1', 'SKP1', 'CUL1']
982	GO:BP	GO:0014013	regulation of gliogenesis	0.0112598242792055	True	"""Any process that modulates the frequency, rate or extent of gliogenesis, the formation of mature glia."" [GOC:ef]"	94	101	4	15719	0.0396039603960396	0.0425531914893617	query_1	['GO:0042063', 'GO:0050767']	['TNFRSF1B', 'TNF', 'LTA', 'TP53']
213	REAC	REAC:R-HSA-9706574	RHOBTB GTPase Cycle	0.0113281896359171	True	RHOBTB GTPase Cycle	35	94	3	10022	0.0319148936170212	0.0857142857142857	query_1	['REAC:R-HSA-9012999']	['HSP90AB1', 'HSP90AA1', 'CDC37']
986	GO:BP	GO:0048066	developmental pigmentation	0.011401632324416	True	"""The developmental process that results in the deposition of coloring matter in an organism, tissue or cell."" [ISBN:0582227089]"	46	101	3	15719	0.0297029702970297	0.0652173913043478	query_1	['GO:0043473']	['BCL2L11', 'BAX', 'BCL2']
985	GO:BP	GO:0060443	mammary gland morphogenesis	0.011401632324416	True	"""The process in which anatomical structures of the mammary gland are generated and organized. Morphogenesis refers to the creation of shape. The mammary gland is a large compound sebaceous gland that in female mammals is modified to secrete milk."" [GOC:dph]"	46	101	3	15719	0.0297029702970297	0.0652173913043478	query_1	['GO:0022612', 'GO:0030879']	['BAX', 'BTRC', 'NFKB1']
984	GO:BP	GO:0009409	response to cold	0.011401632324416	True	"""Any process that results in a change in state or activity of a cell or an organism (in terms of movement, secretion, enzyme production, gene expression, etc.) as a result of a cold stimulus, a temperature stimulus below the optimal temperature for that organism."" [GOC:lr]"	46	101	3	15719	0.0297029702970297	0.0652173913043478	query_1	['GO:0006950', 'GO:0009266']	['HSP90AA1', 'NFKBIA', 'CASP8']
983	GO:BP	GO:0061756	leukocyte adhesion to vascular endothelial cell	0.011401632324416	True	"""The attachment of a leukocyte to vascular endothelial cell via adhesion molecules."" [GOC:add, GOC:bc, GOC:BHF, GOC:BHF_miRNA, PMID:23897866]"	46	101	3	15719	0.0297029702970297	0.0652173913043478	query_1	['GO:0007159']	['RELA', 'TNF', 'TRAF6']
987	GO:BP	GO:0031667	response to nutrient levels	0.0114031562179782	True	"""Any process that results in a change in state or activity of a cell or an organism (in terms of movement, secretion, enzyme production, gene expression, etc.) as a result of a stimulus reflecting the presence, absence, or concentration of nutrients."" [GOC:mah]"	469	101	9	15719	0.0891089108910891	0.0191897654584221	query_1	['GO:0009991']	['BAX', 'AKT1', 'BCL2', 'FOXO3', 'TNF', 'FAS', 'LTA', 'TP53', 'BCL10']
988	GO:BP	GO:0043588	skin development	0.0114076599715854	True	"""The process whose specific outcome is the progression of the skin over time, from its formation to the mature structure. The skin is the external membranous integument of an animal. In vertebrates the skin generally consists of two layers, an outer nonsensitive and nonvascular epidermis (cuticle or skarfskin) composed of cells which are constantly growing and multiplying in the deeper, and being thrown off in the superficial layers, as well as an inner vascular dermis (cutis, corium or true skin) composed mostly of connective tissue."" [GOC:jl, UBERON:0002097]"	300	101	7	15719	0.0693069306930693	0.0233333333333333	query_1	['GO:0048513']	['SHARPIN', 'BCL2', 'RELA', 'TNF', 'TRADD', 'LTB', 'SFN']
64	GO:CC	GO:0005740	mitochondrial envelope	0.0114310735020956	True	"""The double lipid bilayer enclosing the mitochondrion and separating its contents from the cell cytoplasm; includes the intermembrane space."" [GOC:ai, GOC:pz]"	755	101	12	16420	0.1188118811881188	0.0158940397350993	query_1	['GO:0005739', 'GO:0031967']	['BCL2L11', 'BAX', 'BCL2', 'FOXO3', 'MCL1', 'IKBKE', 'BID', 'BBC3', 'BCL2L1', 'BAK1', 'CASP8', 'BAD']
214	REAC	REAC:R-HSA-8939902	Regulation of RUNX2 expression and activity	0.0116975867035429	True	Regulation of RUNX2 expression and activity	71	94	4	10022	0.0425531914893617	0.056338028169014	query_1	['REAC:R-HSA-8878166']	['GSK3B', 'RBX1', 'SKP1', 'CUL1']
989	GO:BP	GO:0071241	cellular response to inorganic substance	0.0117099838921791	True	"""Any process that results in a change in state or activity of a cell (in terms of movement, secretion, enzyme production, gene expression, etc.) as a result of an inorganic substance stimulus."" [GOC:mah]"	225	101	6	15719	0.0594059405940594	0.0266666666666666	query_1	['GO:0010035', 'GO:0070887']	['AKT1', 'CHUK', 'CFLAR', 'TRAF2', 'APP', 'BAD']
990	GO:BP	GO:0033157	regulation of intracellular protein transport	0.0119558659258853	True	"""Any process that modulates the frequency, rate or extent of the directed movement of proteins within cells."" [GOC:mah]"	226	101	6	15719	0.0594059405940594	0.0265486725663716	query_1	['GO:0006886', 'GO:0032386', 'GO:0051223']	['GSK3B', 'RNF31', 'BBC3', 'HSP90AA1', 'SFN', 'FBXW7']
991	GO:BP	GO:1903321	negative regulation of protein modification by small protein conjugation or removal	0.0120366113886913	True	"""Any process that stops, prevents or reduces the frequency, rate or extent of protein modification by small protein conjugation or removal."" [GO_REF:0000058, GOC:TermGenie, GOC:vw]"	96	101	4	15719	0.0396039603960396	0.0416666666666666	query_1	['GO:0031400', 'GO:0070647', 'GO:1903320']	['HSPA1A', 'AKT1', 'RELA', 'TNFAIP3']
993	GO:BP	GO:0140895	cell surface toll-like receptor signaling pathway	0.0120373501590719	True	"""The series of molecular signals initiated by a ligand binding to a cell surface pattern recognition receptor (PRR) of the toll-like family."" [GOC:add, GOC:ar, ISBN:0781735149, PMID:15199967]"	47	101	3	15719	0.0297029702970297	0.0638297872340425	query_1	['GO:0002752']	['TNIP2', 'TNFAIP3', 'NFKBIA']
992	GO:BP	GO:0035305	negative regulation of dephosphorylation	0.0120373501590719	True	"""Any process the stops, prevents, or reduces the frequency, rate or extent of removal of phosphate groups from a molecule."" [GOC:bf]"	47	101	3	15719	0.0297029702970297	0.0638297872340425	query_1	['GO:0016311', 'GO:0035303', 'GO:0045936']	['GSK3B', 'IKBKB', 'TNF']
