KID syndrome	source	native	name	Corrected p_value	significant	description	term_size	query_size	intersection_size	effective_domain_size	precision	recall	query	parents	intersections
305	GO:BP	GO:0043412	macromolecule modification	1.5786650696785702e-08	True	"""The covalent alteration of one or more monomeric units in a polypeptide, polynucleotide, polysaccharide, or other biological macromolecule, resulting in a change in its properties."" [GOC:go_curators]"	3600	101	51	15719	0.504950495049505	0.0141666666666666	query_1	['GO:0043170']	['MET', 'C3', 'PIK3CB', 'ADRA1A', 'VEGFB', 'FN1', 'SRC', 'ITGB3', 'TGFB3', 'PIK3R1', 'HGF', 'SHC1', 'ITK', 'PLCG2', 'TFRC', 'CTNNB1', 'SOS1', 'PIK3CD', 'ITGA5', 'HFE', 'FYN', 'LAT', 'ZAP70', 'LYN', 'LCP2', 'VKORC1', 'EGFR', 'APOA1', 'GALNT12', 'PIK3CA', 'KDR', 'SYK', 'FCGR1A', 'ERBB2', 'PTK2B', 'VEGFA', 'PIK3R3', 'SH3GL2', 'CRKL', 'VTN', 'CD81', 'PTK2', 'NRP1', 'LCK', 'CBL', 'PTPN11', 'PDGFRA', 'HPX', 'SEMA4D', 'FLT1', 'PGF']
306	GO:BP	GO:0050920	regulation of chemotaxis	1.6549858070324712e-08	True	"""Any process that modulates the frequency, rate or extent of the directed movement of a motile cell or organism in response to a specific chemical concentration gradient."" [GOC:ai]"	217	101	13	15719	0.1287128712871287	0.0599078341013824	query_1	['GO:0006935', 'GO:0032101', 'GO:0040012']	['MET', 'VEGFB', 'CXCL12', 'LYN', 'CXCR4', 'KDR', 'PTK2B', 'VEGFA', 'PTK2', 'NRP1', 'PDGFRA', 'SEMA4D', 'PGF']
307	GO:BP	GO:0030038	contractile actin filament bundle assembly	1.6862339339607942e-08	True	"""Assembly of actin filament bundles in which the filaments are loosely packed (approximately 30-60 nm apart) and arranged with opposing polarities; the loose packing allows myosin (usually myosin-II) to enter the bundle."" [GOC:mah, ISBN:0815316194]"	105	101	10	15719	0.099009900990099	0.0952380952380952	query_1	['GO:0051017']	['MET', 'ITGB5', 'PIK3R2', 'SRC', 'TGFB3', 'PIK3R1', 'PXN', 'APOA1', 'PTK2B', 'NRP1']
308	GO:BP	GO:0043149	stress fiber assembly	1.6862339339607942e-08	True	"""The aggregation, arrangement and bonding together of a set of components to form a stress fiber. A stress fiber is a contractile actin filament bundle that consists of short actin filaments with alternating polarity."" [GOC:go_curators, GOC:mah, PMID:16651381]"	105	101	10	15719	0.099009900990099	0.0952380952380952	query_1	['GO:0030038', 'GO:0031032']	['MET', 'ITGB5', 'PIK3R2', 'SRC', 'TGFB3', 'PIK3R1', 'PXN', 'APOA1', 'PTK2B', 'NRP1']
309	GO:BP	GO:0043552	positive regulation of phosphatidylinositol 3-kinase activity	1.7297258810821265e-08	True	"""Any process that activates or increases the frequency, rate or extent of phosphatidylinositol 3-kinase activity."" [GOC:bf]"	33	101	7	15719	0.0693069306930693	0.2121212121212121	query_1	['GO:0043551', 'GO:0090218']	['SRC', 'LYN', 'PTK2B', 'PTK2', 'CD19', 'PDGFRA', 'FLT1']
313	GO:BP	GO:2000811	negative regulation of anoikis	1.9218107112261983e-08	True	"""Any process that stops, prevents or reduces the frequency, rate or extent of anoikis."" [GOC:obol]"	19	101	6	15719	0.0594059405940594	0.3157894736842105	query_1	['GO:0043066', 'GO:0043276', 'GO:2000209']	['ITGB1', 'SRC', 'ITGA5', 'PIK3CA', 'PIK3R3', 'PTK2']
312	GO:BP	GO:0045780	positive regulation of bone resorption	1.9218107112261983e-08	True	"""Any process that activates or increases the frequency, rate or extent of bone resorption."" [GOC:go_curators]"	19	101	6	15719	0.0594059405940594	0.3157894736842105	query_1	['GO:0045124', 'GO:0045453', 'GO:0051240']	['SRC', 'SPP1', 'ITGB3', 'TFRC', 'TF', 'SYK']
311	GO:BP	GO:0048260	positive regulation of receptor-mediated endocytosis	1.9218107112261983e-08	True	"""Any process that activates or increases the frequency, rate or extent of receptor mediated endocytosis, the uptake of external materials by cells, utilizing receptors to ensure specificity of transport."" [GOC:go_curators, GOC:tb]"	53	101	8	15719	0.0792079207920792	0.1509433962264151	query_1	['GO:0006898', 'GO:0045807', 'GO:0048259']	['C3', 'PLCG2', 'HFE', 'TF', 'SYK', 'VEGFA', 'VTN', 'CBL']
310	GO:BP	GO:0002685	regulation of leukocyte migration	1.9218107112261983e-08	True	"""Any process that modulates the frequency, rate, or extent of leukocyte migration."" [GOC:add]"	220	101	13	15719	0.1287128712871287	0.059090909090909	query_1	['GO:0002682', 'GO:0030334', 'GO:0050900']	['VEGFB', 'ITGB3', 'PIK3R1', 'CRK', 'ITGA4', 'CXCL12', 'LYN', 'PTK2B', 'VEGFA', 'CRKL', 'CD81', 'PTK2', 'PGF']
314	GO:BP	GO:0045595	regulation of cell differentiation	1.9483433679233016e-08	True	"""Any process that modulates the frequency, rate or extent of cell differentiation, the process in which relatively unspecialized cells acquire specialized structural and functional features."" [GOC:go_curators]"	1479	101	31	15719	0.3069306930693069	0.0209601081812035	query_1	['GO:0030154', 'GO:0050793', 'GO:0050794']	['ITGB1', 'PLXNB1', 'FN1', 'ITGAV', 'SPP1', 'ITGB3', 'TGFB3', 'PIK3R1', 'HGF', 'CTNNB1', 'SOS1', 'ZAP70', 'CXCL12', 'LYN', 'CXCR4', 'EGFR', 'KDR', 'VCL', 'SYK', 'ERBB2', 'CERS2', 'PTK2B', 'VEGFA', 'L1CAM', 'PTK2', 'NRP1', 'PTPN11', 'PDGFRA', 'SEMA4D', 'PLXNA1', 'NANOG']
315	GO:BP	GO:0007267	cell-cell signaling	1.994649603859638e-08	True	"""Any process that mediates the transfer of information from one cell to another. This process includes signal transduction in the receiving cell and, where applicable, release of a ligand and any processes that actively facilitate its transport and presentation to the receiving cell. Examples include signaling via soluble ligands, via cell adhesion molecules and via gap junctions."" [GOC:dos, GOC:mah]"	1572	101	32	15719	0.3168316831683168	0.0203562340966921	query_1	['GO:0007154', 'GO:0023052']	['GJB6', 'RAPGEF1', 'C3', 'ITGB1', 'ADRA1A', 'ITGAV', 'SRC', 'SPP1', 'FGA', 'HGF', 'PLCG2', 'CTNNB1', 'HFE', 'FYN', 'GJB1', 'CXCL12', 'LYN', 'GJB2', 'TNC', 'EGFR', 'TFR2', 'FGB', 'SYK', 'PLCG1', 'FGG', 'SH3KBP1', 'PTK2B', 'CRKL', 'ITGB6', 'NRP1', 'PTPN11', 'PGF']
316	GO:BP	GO:0002431	Fc receptor mediated stimulatory signaling pathway	2.1189324116021583e-08	True	"""The series of molecular signals generated as a consequence of a the binding of the Fc portion of an immunoglobulin by an Fc receptor capable of activating or perpetuating an immune response. The Fc portion of an immunoglobulin is its C-terminal constant region."" [GO_REF:0000022, GOC:add, ISBN:0781735149]"	34	101	7	15719	0.0693069306930693	0.2058823529411764	query_1	['GO:0002429']	['RAPGEF1', 'SRC', 'FYN', 'LYN', 'VAV1', 'SYK', 'PTK2']
86	REAC	REAC:R-HSA-3000170	Syndecan interactions	2.3017509823158093e-08	True	Syndecan interactions	25	100	7	10022	0.07	0.28	query_1	['REAC:R-HSA-3000171']	['ITGB1', 'ITGB5', 'FN1', 'ITGAV', 'ITGB3', 'TNC', 'VTN']
317	GO:BP	GO:0010975	regulation of neuron projection development	2.357619371359405e-08	True	"""Any process that modulates the rate, frequency or extent of neuron projection development. Neuron projection development is the process whose specific outcome is the progression of a neuron projection over time, from its formation to the mature structure. A neuron projection is any process extending from a neural cell, such as axons or dendrites (collectively called neurites)."" [GOC:dph, GOC:tb]"	430	101	17	15719	0.1683168316831683	0.0395348837209302	query_1	['GO:0031175', 'GO:0120035']	['RAPGEF1', 'PLXNB1', 'FN1', 'SPP1', 'CRK', 'HGF', 'FYN', 'CXCL12', 'LYN', 'CERS2', 'PTK2B', 'VEGFA', 'CRKL', 'L1CAM', 'NRP1', 'SEMA4D', 'PLXNA1']
318	GO:BP	GO:0007369	gastrulation	2.418358995430616e-08	True	"""A complex and coordinated series of cellular movements that occurs at the end of cleavage during embryonic development of most animals. The details of gastrulation vary from species to species, but usually result in the formation of the three primary germ layers, ectoderm, mesoderm and endoderm."" [GOC:curators, ISBN:9780878933846]"	182	101	12	15719	0.1188118811881188	0.0659340659340659	query_1	['GO:0048598']	['ITGB1', 'ITGB5', 'FN1', 'ITGAV', 'ITGB3', 'CTNNB1', 'ITGA5', 'ITGA4', 'GRB2', 'APOA1', 'VTN', 'NANOG']
319	GO:BP	GO:0048513	animal organ development	2.4767890133318865e-08	True	"""Development of a tissue or tissues that work together to perform a specific function or functions. Development pertains to the process whose specific outcome is the progression of a structure over time, from its formation to the mature structure. Organs are commonly observed as visibly distinct structures, but may also exist as loosely associated clusters of cells that work together to perform a specific function or functions."" [GOC:dph, GOC:jid]"	2936	101	45	15719	0.4455445544554455	0.0153269754768392	query_1	['GO:0048856']	['MET', 'GJB6', 'ITGB1', 'ADRA1A', 'VEGFB', 'PLXNB1', 'FN1', 'SRC', 'SPP1', 'ITGB3', 'TGFB3', 'CRK', 'HGF', 'SHC1', 'CTNNB1', 'SOS1', 'FYN', 'CXCL12', 'GJB2', 'GRB2', 'TNC', 'NRP2', 'CXCR4', 'VKORC1', 'EGFR', 'APOA1', 'PIK3CA', 'KDR', 'SYK', 'ERBB2', 'PTK2B', 'VEGFA', 'CRKL', 'VTN', 'VCAM1', 'PTK2', 'ITGB6', 'NRP1', 'CBL', 'PTPN11', 'PDGFRA', 'SEMA4D', 'FLT1', 'PGF', 'PLXNA1']
320	GO:BP	GO:0030595	leukocyte chemotaxis	2.742426851263998e-08	True	"""The movement of a leukocyte in response to an external stimulus."" [GOC:add, GOC:jl]"	227	101	13	15719	0.1287128712871287	0.0572687224669603	query_1	['GO:0050900', 'GO:0060326']	['ITGA9', 'VEGFB', 'PIK3CD', 'CXCL12', 'LYN', 'CXCR4', 'VAV1', 'SYK', 'PTK2B', 'VEGFA', 'PTK2', 'FLT1', 'PGF']
38	GO:CC	GO:0019897	extrinsic component of plasma membrane	2.7858069305260863e-08	True	"""The component of a plasma membrane consisting of gene products and protein complexes that are loosely bound to one of its surfaces, but not integrated into the hydrophobic region."" [GOC:curators, GOC:dos]"	154	102	11	16420	0.1078431372549019	0.0714285714285714	query_1	['GO:0005886', 'GO:0019898']	['SRC', 'CTNNB1', 'FYN', 'ZAP70', 'LYN', 'TF', 'SYK', 'PTK2B', 'CRKL', 'PTK2', 'LCK']
321	GO:BP	GO:0051897	positive regulation of protein kinase B signaling	2.800755020551244e-08	True	"""Any process that activates or increases the frequency, rate or extent of protein kinase B signaling, a series of reactions mediated by the intracellular serine/threonine kinase protein kinase B."" [GOC:ai]"	111	101	10	15719	0.099009900990099	0.09009009009009	query_1	['GO:0043491', 'GO:0051896', 'GO:1902533']	['MET', 'ITGB1', 'PIK3CB', 'VEGFB', 'SRC', 'PIK3CD', 'EGFR', 'PIK3CA', 'VEGFA', 'PTK2']
322	GO:BP	GO:0007492	endoderm development	2.8126478208503192e-08	True	"""The process whose specific outcome is the progression of the endoderm over time, from its formation to the mature structure. The endoderm is the innermost germ layer that develops into the gastrointestinal tract, the lungs and associated tissues."" [GOC:dph, GOC:tb]"	81	101	9	15719	0.0891089108910891	0.1111111111111111	query_1	['GO:0009888']	['ITGB5', 'FN1', 'ITGAV', 'CTNNB1', 'ITGA5', 'ITGA4', 'GRB2', 'VTN', 'NANOG']
323	GO:BP	GO:0000904	cell morphogenesis involved in differentiation	2.859003305134985e-08	True	"""The change in form (cell shape and size) that occurs when relatively unspecialized cells, e.g. embryonic or regenerative cells, acquire specialized structural and/or functional features that characterize the cells, tissues, or organs of the mature organism or some other relatively stable phase of the organism's life history."" [GOC:go_curators]"	625	101	20	15719	0.198019801980198	0.032	query_1	['GO:0000902', 'GO:0048468']	['MET', 'ITGB1', 'PLXNB1', 'FN1', 'SPP1', 'CTNNB1', 'SOS1', 'FYN', 'ITGA4', 'CXCL12', 'NRP2', 'VCL', 'ERBB2', 'VEGFA', 'L1CAM', 'PTK2', 'NRP1', 'PTPN11', 'SEMA4D', 'PLXNA1']
324	GO:BP	GO:0008360	regulation of cell shape	3.0698565032181005e-08	True	"""Any process that modulates the surface configuration of a cell."" [GOC:dph, GOC:go_curators, GOC:tb]"	147	101	11	15719	0.1089108910891089	0.0748299319727891	query_1	['GO:0022604', 'GO:0065008']	['PLXNB1', 'FN1', 'CRK', 'FYN', 'KDR', 'SH3KBP1', 'PTK2B', 'VEGFA', 'PTK2', 'SEMA4D', 'PLXNA1']
87	REAC	REAC:R-HSA-194313	VEGF ligand-receptor interactions	3.3304266929203405e-08	True	VEGF ligand-receptor interactions	8	100	5	10022	0.05	0.625	query_1	['REAC:R-HSA-194138']	['VEGFB', 'KDR', 'VEGFA', 'FLT1', 'PGF']
88	REAC	REAC:R-HSA-195399	VEGF binds to VEGFR leading to receptor dimerization	3.3304266929203405e-08	True	VEGF binds to VEGFR leading to receptor dimerization	8	100	5	10022	0.05	0.625	query_1	['REAC:R-HSA-194313']	['VEGFB', 'KDR', 'VEGFA', 'FLT1', 'PGF']
325	GO:BP	GO:0009725	response to hormone	3.3368007499214614e-08	True	"""Any process that results in a change in state or activity of a cell or an organism (in terms of movement, secretion, enzyme production, gene expression, etc.) as a result of a hormone stimulus."" [GOC:jl]"	845	101	23	15719	0.2277227722772277	0.0272189349112426	query_1	['GO:0009719', 'GO:0010033']	['ADRA1A', 'PIK3R2', 'BCAR1', 'SRC', 'SPP1', 'ITGB3', 'TGFB3', 'PIK3R1', 'CRK', 'SHC1', 'SOS1', 'PXN', 'CXCL12', 'LYN', 'GJB2', 'GRB2', 'PIK3CA', 'FGB', 'PTK2B', 'PIK3R3', 'PTK2', 'PTPN11', 'PGF']
326	GO:BP	GO:0071674	mononuclear cell migration	3.4144486509819225e-08	True	"""The movement of a mononuclear cell within or between different tissues and organs of the body."" [GOC:mah]"	188	101	12	15719	0.1188118811881188	0.0638297872340425	query_1	['GO:0050900']	['ITGB3', 'CRK', 'PIK3CD', 'ITGA4', 'ZAP70', 'CXCL12', 'LYN', 'CXCR4', 'PTK2B', 'CRKL', 'PTK2', 'FLT1']
39	GO:CC	GO:0031252	cell leading edge	3.640600377636136e-08	True	"""The area of a motile cell closest to the direction of movement."" [GOC:pg]"	406	102	16	16420	0.1568627450980392	0.0394088669950738	query_1	['GO:0110165']	['ITGB1', 'ITGAV', 'BCAR1', 'SRC', 'ITGB3', 'PLCG2', 'CTNNB1', 'ITGA5', 'PXN', 'CXCR4', 'EGFR', 'PIK3CA', 'PLCG1', 'ERBB2', 'PTK2B', 'TLN1']
327	GO:BP	GO:0030029	actin filament-based process	3.9962538862131273e-08	True	"""Any cellular process that depends upon or alters the actin cytoskeleton, that part of the cytoskeleton comprising actin filaments and their associated proteins."" [GOC:mah]"	779	101	22	15719	0.2178217821782178	0.0282413350449293	query_1	['GO:0009987']	['MET', 'ITGB1', 'ITGB5', 'PIK3R2', 'BCAR1', 'SRC', 'ITGB3', 'TGFB3', 'PIK3R1', 'CRK', 'SHC1', 'PXN', 'CXCL12', 'GRB2', 'APOA1', 'TF', 'PIK3CA', 'SH3KBP1', 'PTK2B', 'TLN1', 'NRP1', 'PDGFRA']
89	REAC	REAC:R-HSA-180292	GAB1 signalosome	4.21931296601373e-08	True	GAB1 signalosome	16	100	6	10022	0.06	0.375	query_1	['REAC:R-HSA-177929']	['SRC', 'PIK3R1', 'PXN', 'EGFR', 'PIK3CA', 'PTPN11']
328	GO:BP	GO:0002040	sprouting angiogenesis	4.225190851567192e-08	True	"""The extension of new blood vessels from existing vessels into avascular tissues, this process includes the specialization of endothelial cells into leading tip and stalk cells, proliferation and migration of the endothelial cells and cell adhesion resulting in angiogenic sprout fusion or lumen formation."" [PMID:16391003, PMID:23031691]"	116	101	10	15719	0.099009900990099	0.0862068965517241	query_1	['GO:0001525']	['ITGB1', 'PIK3CB', 'VEGFB', 'ITGA5', 'KDR', 'PTK2B', 'VEGFA', 'PIK3R3', 'NRP1', 'PGF']
329	GO:BP	GO:0007507	heart development	4.829073612851046e-08	True	"""The process whose specific outcome is the progression of the heart over time, from its formation to the mature structure. The heart is a hollow, muscular organ, which, by contracting rhythmically, keeps up the circulation of the blood."" [GOC:jid, UBERON:0000948]"	578	101	19	15719	0.1881188118811881	0.0328719723183391	query_1	['GO:0048513', 'GO:0072359']	['GJB6', 'ITGB1', 'ADRA1A', 'VEGFB', 'FN1', 'SHC1', 'CTNNB1', 'SOS1', 'NRP2', 'EGFR', 'KDR', 'ERBB2', 'VEGFA', 'CRKL', 'VCAM1', 'PTK2', 'NRP1', 'PTPN11', 'PDGFRA']
330	GO:BP	GO:0031032	actomyosin structure organization	5.7333046445430516e-08	True	"""A process that is carried out at the cellular level which results in the assembly, arrangement of constituent parts, or disassembly of cytoskeletal structures containing both actin and myosin or paramyosin. The myosin may be organized into filaments."" [GOC:dph, GOC:jl, GOC:mah]"	197	101	12	15719	0.1188118811881188	0.0609137055837563	query_1	['GO:0030036']	['MET', 'ITGB1', 'ITGB5', 'PIK3R2', 'SRC', 'TGFB3', 'PIK3R1', 'PXN', 'APOA1', 'PTK2B', 'NRP1', 'PDGFRA']
90	REAC	REAC:R-HSA-194306	Neurophilin interactions with VEGF and VEGFR	6.215938053268836e-08	True	Neurophilin interactions with VEGF and VEGFR	4	100	4	10022	0.04	1.0	query_1	['REAC:R-HSA-194138']	['NRP2', 'KDR', 'NRP1', 'FLT1']
331	GO:BP	GO:0038083	peptidyl-tyrosine autophosphorylation	6.623613071861352e-08	True	"""The phosphorylation by a protein of one or more of its own tyrosine amino acid residues, or a tyrosine residue on an identical protein."" [PMID:10037737, PMID:10068444, PMID:10940390]"	23	101	6	15719	0.0594059405940594	0.2608695652173913	query_1	['GO:0018108', 'GO:0046777']	['SRC', 'EGFR', 'KDR', 'PTK2B', 'VEGFA', 'LCK']
91	REAC	REAC:R-HSA-6802952	Signaling by BRAF and RAF1 fusions	6.795181754777905e-08	True	Signaling by BRAF and RAF1 fusions	63	100	9	10022	0.09	0.1428571428571428	query_1	['REAC:R-HSA-6802957']	['FN1', 'SRC', 'FGA', 'ITGB3', 'ITGA2B', 'FGB', 'VCL', 'FGG', 'TLN1']
332	GO:BP	GO:0008286	insulin receptor signaling pathway	6.832738524353336e-08	True	"""The series of molecular signals generated as a consequence of the insulin receptor binding to insulin."" [GOC:ceb]"	122	101	10	15719	0.099009900990099	0.081967213114754	query_1	['GO:0007169', 'GO:0032869']	['PIK3R2', 'BCAR1', 'SRC', 'PIK3R1', 'SHC1', 'SOS1', 'GRB2', 'PIK3CA', 'PIK3R3', 'PTPN11']
92	REAC	REAC:R-HSA-187037	Signaling by NTRK1 (TRKA)	6.848070294135314e-08	True	Signaling by NTRK1 (TRKA)	110	100	11	10022	0.11	0.1	query_1	['REAC:R-HSA-166520']	['RAPGEF1', 'PIK3CB', 'PIK3R2', 'PIK3R1', 'CRK', 'SHC1', 'SOS1', 'PIK3CA', 'PLCG1', 'SH3GL2', 'CRKL']
333	GO:BP	GO:0045859	regulation of protein kinase activity	7.245908559398416e-08	True	"""Any process that modulates the frequency, rate or extent of protein kinase activity."" [GOC:go_curators]"	593	101	19	15719	0.1881188118811881	0.0320404721753794	query_1	['GO:0001932', 'GO:0043549']	['PIK3CB', 'ADRA1A', 'SRC', 'ITGB3', 'HGF', 'SHC1', 'SOS1', 'LAT', 'LYN', 'LCP2', 'EGFR', 'SYK', 'FCGR1A', 'ERBB2', 'PTK2B', 'VEGFA', 'PTK2', 'CBL', 'FLT1']
40	GO:CC	GO:0034774	secretory granule lumen	7.396144732052059e-08	True	"""The volume enclosed by the membrane of a secretory granule."" [GOC:rph]"	313	102	14	16420	0.1372549019607843	0.0447284345047923	query_1	['GO:0030141', 'GO:0060205']	['C3', 'VEGFB', 'FN1', 'FGA', 'TGFB3', 'HGF', 'APOA1', 'TF', 'FGB', 'VCL', 'FGG', 'VEGFA', 'SERPINA1', 'ALB']
334	GO:BP	GO:0050918	positive chemotaxis	7.444841861979011e-08	True	"""The directed movement of a motile cell or organism towards a higher concentration of a chemical."" [GOC:ai, GOC:bf, GOC:isa_complete]"	63	101	8	15719	0.0792079207920792	0.1269841269841269	query_1	['GO:0006935']	['MET', 'VEGFB', 'HGF', 'CXCL12', 'KDR', 'VEGFA', 'NRP1', 'PGF']
93	REAC	REAC:R-HSA-373755	Semaphorin interactions	7.675571363559492e-08	True	Semaphorin interactions	64	100	9	10022	0.09	0.140625	query_1	['REAC:R-HSA-422475']	['MET', 'ITGB1', 'PLXNB1', 'FYN', 'ERBB2', 'TLN1', 'NRP1', 'SEMA4D', 'PLXNA1']
335	GO:BP	GO:0022604	regulation of cell morphogenesis	8.017575588120432e-08	True	"""Any process that modulates the frequency, rate or extent of cell morphogenesis. Cell morphogenesis is the developmental process in which the shape of a cell is generated and organized."" [GOC:isa_complete]"	249	101	13	15719	0.1287128712871287	0.0522088353413654	query_1	['GO:0000902', 'GO:0022603']	['PLXNB1', 'FN1', 'SRC', 'CRK', 'FYN', 'CXCR4', 'KDR', 'SH3KBP1', 'PTK2B', 'VEGFA', 'PTK2', 'SEMA4D', 'PLXNA1']
41	GO:CC	GO:0060205	cytoplasmic vesicle lumen	8.150228342095063e-08	True	"""The volume enclosed by a cytoplasmic vesicle."" [GOC:dph, GOC:vesicles]"	316	102	14	16420	0.1372549019607843	0.0443037974683544	query_1	['GO:0031410', 'GO:0031983', 'GO:0070013']	['C3', 'VEGFB', 'FN1', 'FGA', 'TGFB3', 'HGF', 'APOA1', 'TF', 'FGB', 'VCL', 'FGG', 'VEGFA', 'SERPINA1', 'ALB']
336	GO:BP	GO:0030307	positive regulation of cell growth	8.258689191286976e-08	True	"""Any process that activates or increases the frequency, rate, extent or direction of cell growth."" [GOC:go_curators]"	162	101	11	15719	0.1089108910891089	0.0679012345679012	query_1	['GO:0001558', 'GO:0016049', 'GO:0045927', 'GO:0048522']	['FN1', 'CRK', 'CXCL12', 'CXCR4', 'EGFR', 'ERBB2', 'PTK2B', 'VEGFA', 'L1CAM', 'NRP1', 'SEMA4D']
337	GO:BP	GO:0038095	Fc-epsilon receptor signaling pathway	8.629798948377112e-08	True	"""The series of molecular signals initiated by the binding of the Fc portion of immunoglobulin E (IgE) to an Fc-epsilon receptor on the surface of a target cell, and ending with the regulation of a downstream cellular process, e.g. transcription. The Fc portion of an immunoglobulin is its C-terminal constant region."" [GOC:phg, PMID:12413516, PMID:15048725]"	24	101	6	15719	0.0594059405940594	0.25	query_1	['GO:0038093']	['PLCG2', 'SOS1', 'LYN', 'VAV1', 'SYK', 'PLCG1']
338	GO:BP	GO:0051896	regulation of protein kinase B signaling	9.337924595773353e-08	True	"""Any process that modulates the frequency, rate or extent of protein kinase B signaling, a series of reactions mediated by the intracellular serine/threonine kinase protein kinase B."" [GOC:ai]"	164	101	11	15719	0.1089108910891089	0.0670731707317073	query_1	['GO:0043491', 'GO:1902531']	['MET', 'RAPGEF1', 'ITGB1', 'PIK3CB', 'VEGFB', 'SRC', 'PIK3CD', 'EGFR', 'PIK3CA', 'VEGFA', 'PTK2']
339	GO:BP	GO:0045453	bone resorption	9.45958853523406e-08	True	"""The process in which specialized cells known as osteoclasts degrade the organic and inorganic portions of bone, and endocytose and transport the degradation products."" [GOC:mah, PMID:10968780]"	65	101	8	15719	0.0792079207920792	0.123076923076923	query_1	['GO:0001894', 'GO:0046849']	['SRC', 'SPP1', 'ITGB3', 'TFRC', 'CTNNB1', 'TF', 'SYK', 'PTK2B']
94	REAC	REAC:R-HSA-373760	L1CAM interactions	9.791157842924025e-08	True	L1CAM interactions	114	100	11	10022	0.11	0.0964912280701754	query_1	['REAC:R-HSA-422475']	['ITGB1', 'ITGA9', 'ITGAV', 'ITGB3', 'ITGA2B', 'ITGA5', 'NRP2', 'EGFR', 'SH3GL2', 'L1CAM', 'NRP1']
340	GO:BP	GO:0048729	tissue morphogenesis	9.824336161183204e-08	True	"""The process in which the anatomical structures of a tissue are generated and organized."" [GOC:dph, GOC:jid]"	605	101	19	15719	0.1881188118811881	0.0314049586776859	query_1	['GO:0009653', 'GO:0009888']	['MET', 'ITGB1', 'SRC', 'ITGB3', 'HGF', 'CTNNB1', 'SOS1', 'PIK3CD', 'ITGA5', 'GRB2', 'TNC', 'NRP2', 'CXCR4', 'EGFR', 'KDR', 'VCL', 'VEGFA', 'NRP1', 'PLXNA1']
341	GO:BP	GO:0050678	regulation of epithelial cell proliferation	9.948148178566753e-08	True	"""Any process that modulates the frequency, rate or extent of epithelial cell proliferation."" [GOC:ai]"	358	101	15	15719	0.1485148514851485	0.0418994413407821	query_1	['GO:0042127', 'GO:0050673']	['VEGFB', 'ITGB3', 'CTNNB1', 'PIK3CD', 'ITGA4', 'CXCL12', 'NRP2', 'EGFR', 'KDR', 'PLCG1', 'ERBB2', 'VEGFA', 'NRP1', 'FLT1', 'PGF']
42	GO:CC	GO:0001726	ruffle	1.0902565029231213e-07	True	"""Projection at the leading edge of a crawling cell; the protrusions are supported by a microfilament meshwork."" [ISBN:0124325653]"	177	102	11	16420	0.1078431372549019	0.0621468926553672	query_1	['GO:0031252', 'GO:0120025']	['ITGB1', 'ITGAV', 'BCAR1', 'SRC', 'ITGB3', 'PLCG2', 'ITGA5', 'EGFR', 'PLCG1', 'ERBB2', 'TLN1']
95	REAC	REAC:R-HSA-388841	Costimulation by the CD28 family	1.1384283056219428e-07	True	Costimulation by the CD28 family	67	100	9	10022	0.09	0.1343283582089552	query_1	['REAC:R-HSA-1280218']	['PIK3R2', 'PIK3R1', 'FYN', 'LYN', 'PIK3CA', 'VAV1', 'PIK3R3', 'LCK', 'PTPN11']
43	GO:CC	GO:0048471	perinuclear region of cytoplasm	1.1627622234840847e-07	True	"""Cytoplasm situated near, or occurring around, the nucleus."" [GOC:jid]"	717	102	20	16420	0.196078431372549	0.0278940027894002	query_1	['GO:0005737', 'GO:0110165']	['RAPGEF1', 'ITGB1', 'SRC', 'SPP1', 'PIK3R1', 'PLCG2', 'TFRC', 'CTNNB1', 'HFE', 'FYN', 'LYN', 'GJB2', 'EGFR', 'TF', 'PIK3CA', 'ERBB2', 'PTK2B', 'SH3GL2', 'PTK2', 'CBL']
342	GO:BP	GO:0002697	regulation of immune effector process	1.19483786860894e-07	True	"""Any process that modulates the frequency, rate, or extent of an immune effector process."" [GOC:add]"	363	101	15	15719	0.1485148514851485	0.0413223140495867	query_1	['GO:0002252', 'GO:0002682']	['RAPGEF1', 'C3', 'TGFB3', 'CRK', 'PLCG2', 'TFRC', 'HFE', 'LYN', 'APOA1', 'VAV1', 'SYK', 'FCGR1A', 'CD81', 'HPX', 'CR2']
343	GO:BP	GO:0150116	regulation of cell-substrate junction organization	1.1955066701056106e-07	True	"""Any process that modulates the frequency, rate or extent of cell-substrate junction organization."" [GOC:aruk]"	67	101	8	15719	0.0792079207920792	0.1194029850746268	query_1	['GO:0051128', 'GO:0150115']	['SRC', 'PIK3R1', 'KDR', 'VCL', 'VEGFA', 'TLN1', 'PTK2', 'NRP1']
344	GO:BP	GO:0010035	response to inorganic substance	1.2320675260136282e-07	True	"""Any process that results in a change in state or activity of a cell or an organism (in terms of movement, secretion, enzyme production, gene expression, etc.) as a result of an inorganic substance stimulus."" [GOC:sm]"	547	101	18	15719	0.1782178217821782	0.0329067641681901	query_1	['GO:0042221']	['MET', 'SRC', 'FGA', 'CRK', 'HGF', 'PLCG2', 'TFRC', 'HFE', 'FYN', 'EGFR', 'TF', 'TFR2', 'PIK3CA', 'KDR', 'FGB', 'FGG', 'PTK2B', 'VCAM1']
96	REAC	REAC:R-HSA-8876384	Listeria monocytogenes entry into host cells	1.2946632173894908e-07	True	Listeria monocytogenes entry into host cells	19	100	6	10022	0.06	0.3157894736842105	query_1	['REAC:R-HSA-5663205']	['MET', 'SRC', 'CTNNB1', 'SH3KBP1', 'SH3GL2', 'CBL']
345	GO:BP	GO:0071526	semaphorin-plexin signaling pathway	1.312221145781014e-07	True	"""The series of molecular signals generated as a consequence of a semaphorin receptor (composed of a plexin and a neurophilin) binding to a semaphorin ligand."" [GOC:BHF, GOC:mah, GOC:vk, PMID:15239959]"	44	101	7	15719	0.0693069306930693	0.1590909090909091	query_1	['GO:0007166']	['MET', 'PLXNB1', 'NRP2', 'KDR', 'NRP1', 'SEMA4D', 'PLXNA1']
