KID syndrome	source	native	name	Corrected p_value	significant	description	term_size	query_size	intersection_size	effective_domain_size	precision	recall	query	parents	intersections
706	GO:BP	GO:0009887	animal organ morphogenesis	0.00036191189833	True	"""Morphogenesis of an animal organ. An organ is defined as a tissue or set of tissues that work together to perform a specific function or functions. Morphogenesis is the process in which anatomical structures are generated and organized. Organs are commonly observed as visibly distinct structures, but may also exist as loosely associated clusters of cells that work together to perform a specific function or functions."" [GOC:dgh, GOC:go_curators, ISBN:0471245208, ISBN:0721662544]"	1005	101	18	15719	0.1782178217821782	0.017910447761194	query_1	['GO:0009653', 'GO:0048513']	['GJB6', 'SRC', 'TGFB3', 'HGF', 'CTNNB1', 'SOS1', 'TNC', 'NRP2', 'EGFR', 'KDR', 'SYK', 'VEGFA', 'CRKL', 'PTK2', 'ITGB6', 'NRP1', 'PDGFRA', 'PLXNA1']
707	GO:BP	GO:0048639	positive regulation of developmental growth	0.0003624349755599	True	"""Any process that activates, maintains or increases the rate of developmental growth."" [GOC:go_curators]"	156	101	7	15719	0.0693069306930693	0.0448717948717948	query_1	['GO:0045927', 'GO:0048589', 'GO:0048638', 'GO:0051094']	['FN1', 'CXCL12', 'CXCR4', 'VEGFA', 'L1CAM', 'NRP1', 'SEMA4D']
181	REAC	REAC:R-HSA-6785807	Interleukin-4 and Interleukin-13 signaling	0.0003648268726748	True	Interleukin-4 and Interleukin-13 signaling	110	100	7	10022	0.07	0.0636363636363636	query_1	['REAC:R-HSA-449147']	['ITGB1', 'FN1', 'PIK3R1', 'HGF', 'VEGFA', 'VCAM1', 'NANOG']
709	GO:BP	GO:0021979	hypothalamus cell differentiation	0.0003889829652588	True	"""The differentiation of cells that will contribute to the structure and function of the hypothalamus."" [GO_REF:0000021, GOC:cls, GOC:dgh, GOC:dph, GOC:jid, GOC:mgi_curators]"	13	101	3	15719	0.0297029702970297	0.2307692307692307	query_1	['GO:0021854', 'GO:0030154']	['NRP2', 'NRP1', 'PLXNA1']
708	GO:BP	GO:0002863	positive regulation of inflammatory response to antigenic stimulus	0.0003889829652588	True	"""Any process that activates or increases the frequency, rate, or extent of an inflammatory response to an antigenic stimulus."" [GOC:add]"	13	101	3	15719	0.0297029702970297	0.2307692307692307	query_1	['GO:0002437', 'GO:0002861', 'GO:0050729', 'GO:0050778']	['C3', 'FCGR1A', 'CD81']
710	GO:BP	GO:0021761	limbic system development	0.0003974746696483	True	"""The progression of the limbic system over time from its initial formation until its mature state. The limbic system is a collection of structures in the brain involved in emotion, motivation and emotional aspects of memory."" [GO_REF:0000021, GOC:cls, GOC:dgh, GOC:dph, GOC:jid, ISBN:0878937420]"	109	101	6	15719	0.0594059405940594	0.055045871559633	query_1	['GO:0030900', 'GO:0048731']	['CRK', 'CTNNB1', 'NRP2', 'CRKL', 'NRP1', 'PLXNA1']
711	GO:BP	GO:0002440	production of molecular mediator of immune response	0.0004032139041367	True	"""The synthesis or release of any molecular mediator of the immune response, resulting in an increase in its intracellular or extracellular levels."" [GO_REF:0000022, GOC:add, ISBN:0781735149]"	215	101	8	15719	0.0792079207920792	0.0372093023255813	query_1	['GO:0002376', 'GO:0010467']	['TGFB3', 'PLCG2', 'TFRC', 'HFE', 'APOA1', 'SYK', 'CD81', 'HPX']
182	REAC	REAC:R-HSA-1483255	PI Metabolism	0.0004041145451434	True	PI Metabolism	78	100	6	10022	0.06	0.0769230769230769	query_1	['REAC:R-HSA-1483257']	['PIK3CB', 'PIK3R2', 'PIK3R1', 'PIK3CD', 'PIK3CA', 'PIK3R3']
712	GO:BP	GO:0010942	positive regulation of cell death	0.000423658559895	True	"""Any process that increases the rate or frequency of cell death. Cell death is the specific activation or halting of processes within a cell so that its vital functions markedly cease, rather than simply deteriorating gradually over time, which culminates in cell death."" [GOC:dph, GOC:tb]"	574	101	13	15719	0.1287128712871287	0.0226480836236933	query_1	['GO:0008219', 'GO:0010941', 'GO:0048522']	['ITGB1', 'PIK3CB', 'SRC', 'TGFB3', 'CTNNB1', 'PIK3CD', 'FYN', 'ITGA4', 'LYN', 'SYK', 'PLCG1', 'LCK', 'HPR']
713	GO:BP	GO:1905952	regulation of lipid localization	0.0004385340597362	True	"""Any process that modulates the frequency, rate or extent of lipid localization."" [GO_REF:0000058, GOC:TermGenie, PMID:17564681]"	161	101	7	15719	0.0693069306930693	0.0434782608695652	query_1	['GO:0010876', 'GO:0032879']	['C3', 'ITGAV', 'SPP1', 'ITGB3', 'APOA1', 'SYK', 'PTPN11']
714	GO:BP	GO:0050766	positive regulation of phagocytosis	0.000442043258599	True	"""Any process that activates or increases the frequency, rate or extent of phagocytosis."" [GOC:ai]"	69	101	5	15719	0.0495049504950495	0.072463768115942	query_1	['GO:0006909', 'GO:0045807', 'GO:0050764']	['RAPGEF1', 'C3', 'PLCG2', 'APOA1', 'FCGR1A']
715	GO:BP	GO:0071900	regulation of protein serine/threonine kinase activity	0.0004607896492222	True	"""Any process that modulates the rate, frequency, or extent of protein serine/threonine kinase activity."" [GOC:mah]"	350	101	10	15719	0.099009900990099	0.0285714285714285	query_1	['GO:0045859']	['PIK3CB', 'SRC', 'SOS1', 'LYN', 'EGFR', 'SYK', 'ERBB2', 'PTK2B', 'VEGFA', 'FLT1']
716	GO:BP	GO:0051651	maintenance of location in cell	0.0004701867539982	True	"""Any process in which a substance or cellular entity, such as a protein complex or organelle, is maintained in a specific location within, or in the membrane of, a cell, and is prevented from moving elsewhere."" [GOC:ai]"	220	101	8	15719	0.0792079207920792	0.0363636363636363	query_1	['GO:0009987', 'GO:0051235', 'GO:0051641']	['ITGB3', 'PLCG2', 'LYN', 'PLCG1', 'PTK2B', 'LCK', 'CD19', 'ALB']
717	GO:BP	GO:1903036	positive regulation of response to wounding	0.0004716591944318	True	"""Any process that activates or increases the frequency, rate or extent of response to wounding."" [GO_REF:0000058, GOC:kmv, GOC:TermGenie, PMID:19164535]"	70	101	5	15719	0.0495049504950495	0.0714285714285714	query_1	['GO:0009611', 'GO:0048584', 'GO:1903034']	['ITGB1', 'VEGFB', 'CXCR4', 'VTN', 'PTK2']
183	REAC	REAC:R-HSA-9658195	Leishmania infection	0.0004748198477403	True	Leishmania infection	242	100	10	10022	0.1	0.0413223140495867	query_1	['REAC:R-HSA-5663205']	['C3', 'CRK', 'PLCG2', 'FYN', 'LYN', 'VAV1', 'SYK', 'PLCG1', 'FCGR1A', 'PTK2']
184	REAC	REAC:R-HSA-977606	Regulation of Complement cascade	0.0004783870295023	True	Regulation of Complement cascade	51	100	5	10022	0.05	0.0980392156862745	query_1	['REAC:R-HSA-166658']	['C3', 'VTN', 'CD81', 'CD19', 'CR2']
719	GO:BP	GO:1902287	semaphorin-plexin signaling pathway involved in axon guidance	0.0004859161357696	True	"""Any semaphorin-plexin signaling pathway that is involved in axon guidance."" [GOC:BHF, GOC:rl, GOC:TermGenie, PMID:22790009]"	14	101	3	15719	0.0297029702970297	0.2142857142857142	query_1	['GO:0007411', 'GO:1902285']	['PLXNB1', 'NRP1', 'PLXNA1']
718	GO:BP	GO:0050966	detection of mechanical stimulus involved in sensory perception of pain	0.0004859161357696	True	"""The series of events involved in the perception of pain in which a mechanical stimulus is received and converted into a molecular signal."" [GOC:ai, GOC:dos]"	14	101	3	15719	0.0297029702970297	0.2142857142857142	query_1	['GO:0050974', 'GO:0062149']	['FYN', 'CXCL12', 'CXCR4']
185	REAC	REAC:R-HSA-389359	CD28 dependent Vav1 pathway	0.0004888353783334	True	CD28 dependent Vav1 pathway	11	100	3	10022	0.03	0.2727272727272727	query_1	['REAC:R-HSA-389356']	['FYN', 'VAV1', 'LCK']
186	REAC	REAC:R-HSA-372790	Signaling by GPCR	0.0004888353783334	True	Signaling by GPCR	631	100	17	10022	0.17	0.0269413629160063	query_1	['REAC:R-HSA-162582']	['C3', 'ITGB1', 'ADRA1A', 'PLXNB1', 'FN1', 'PIK3R2', 'SRC', 'PIK3R1', 'SOS1', 'ITGA5', 'CXCL12', 'CXCR4', 'EGFR', 'PIK3CA', 'VAV1', 'PIK3R3', 'ACKR3']
720	GO:BP	GO:0097191	extrinsic apoptotic signaling pathway	0.0004980126433374	True	"""The series of molecular signals in which a signal is conveyed from the cell surface to trigger the apoptotic death of a cell. The pathway starts with either a ligand binding to a cell surface receptor, or a ligand being withdrawn from a cell surface receptor (e.g. in the case of signaling by dependence receptors), and ends when the execution phase of apoptosis is triggered."" [GOC:mtg_apoptosis, GOC:yaf, PMID:17340152]"	222	101	8	15719	0.0792079207920792	0.036036036036036	query_1	['GO:0007166', 'GO:0097190']	['ITGAV', 'SRC', 'FGA', 'PIK3R1', 'HGF', 'FGB', 'FGG', 'NRP1']
721	GO:BP	GO:0002367	cytokine production involved in immune response	0.0005009683758721	True	"""The appearance of a cytokine due to biosynthesis or secretion following a cellular stimulus contributing to an immune response, resulting in an increase in its intracellular or extracellular levels."" [GO_REF:0000022, GOC:add, ISBN:0781735149]"	114	101	6	15719	0.0594059405940594	0.0526315789473684	query_1	['GO:0001816', 'GO:0002440', 'GO:0006955']	['TGFB3', 'PLCG2', 'HFE', 'APOA1', 'SYK', 'CD81']
723	GO:BP	GO:0002718	regulation of cytokine production involved in immune response	0.0005009683758721	True	"""Any process that modulates the frequency, rate, or extent of cytokine production that contributes to an immune response."" [GOC:add]"	114	101	6	15719	0.0594059405940594	0.0526315789473684	query_1	['GO:0001817', 'GO:0002367', 'GO:0002700']	['TGFB3', 'PLCG2', 'HFE', 'APOA1', 'SYK', 'CD81']
722	GO:BP	GO:0002708	positive regulation of lymphocyte mediated immunity	0.0005009683758721	True	"""Any process that activates or increases the frequency, rate, or extent of lymphocyte mediated immunity."" [GOC:add]"	114	101	6	15719	0.0594059405940594	0.0526315789473684	query_1	['GO:0002449', 'GO:0002705', 'GO:0002706']	['C3', 'TFRC', 'VAV1', 'FCGR1A', 'CD81', 'HPX']
724	GO:BP	GO:0070665	positive regulation of leukocyte proliferation	0.0005038631510859	True	"""Any process that activates or increases the frequency, rate or extent of leukocyte proliferation."" [GOC:add, GOC:mah]"	165	101	7	15719	0.0693069306930693	0.0424242424242424	query_1	['GO:0008284', 'GO:0070661', 'GO:0070663']	['TFRC', 'ZAP70', 'LYN', 'SYK', 'CD81', 'VCAM1', 'PTK2']
82	GO:CC	GO:0035868	alphav-beta3 integrin-HMGB1 complex	0.0005062040221456	True	"""A protein complex that consists of an alphav-beta3 integrin complex bound to high mobility group box 1 protein."" [GOC:BHF, GOC:ebc, PMID:20826760]"	3	102	2	16420	0.0196078431372549	0.6666666666666666	query_1	['GO:0098797']	['ITGAV', 'ITGB3']
81	GO:CC	GO:0034666	integrin alpha2-beta1 complex	0.0005062040221456	True	"""An integrin complex that comprises one alpha2 subunit and one beta1 subunit."" [PMID:12297042]"	3	102	2	16420	0.0196078431372549	0.6666666666666666	query_1	['GO:0008305']	['ITGB1', 'LYN']
80	GO:CC	GO:0034668	integrin alpha4-beta1 complex	0.0005062040221456	True	"""An integrin complex that comprises one alpha4 subunit and one beta1 subunit."" [PMID:12297042]"	3	102	2	16420	0.0196078431372549	0.6666666666666666	query_1	['GO:0008305']	['ITGB1', 'ITGA4']
79	GO:CC	GO:0034683	integrin alphav-beta3 complex	0.0005062040221456	True	"""An integrin complex that comprises one alphav subunit and one beta3 subunit."" [PMID:12297042]"	3	102	2	16420	0.0196078431372549	0.6666666666666666	query_1	['GO:0008305']	['ITGAV', 'ITGB3']
78	GO:CC	GO:0035866	alphav-beta3 integrin-PKCalpha complex	0.0005062040221456	True	"""A protein complex that consists of an alphav-beta3 integrin complex bound to protein kinase C alpha."" [GOC:BHF, GOC:ebc, PMID:16014375]"	3	102	2	16420	0.0196078431372549	0.6666666666666666	query_1	['GO:0098797']	['ITGAV', 'ITGB3']
725	GO:BP	GO:0006874	intracellular calcium ion homeostasis	0.0005173817954831	True	"""A homeostatic process involved in the maintenance of a steady state level of calcium ions within a cell."" [GOC:ceb, GOC:mah]"	287	101	9	15719	0.0891089108910891	0.0313588850174216	query_1	['GO:0030003', 'GO:0055074']	['PIK3CB', 'ITGB3', 'PLCG2', 'CXCL12', 'LYN', 'PLCG1', 'PTK2B', 'LCK', 'CD19']
726	GO:BP	GO:0006650	glycerophospholipid metabolic process	0.0005173817954831	True	"""The chemical reactions and pathways involving glycerophospholipids, any derivative of glycerophosphate that contains at least one O-acyl, O-alkyl, or O-alkenyl group attached to the glycerol residue."" [ISBN:0198506732]"	287	101	9	15719	0.0891089108910891	0.0313588850174216	query_1	['GO:0006644', 'GO:0046486']	['PIK3CB', 'PIK3R2', 'PIK3R1', 'PLCG2', 'PIK3CD', 'APOA1', 'PIK3CA', 'PLCG1', 'PIK3R3']
727	GO:BP	GO:0097190	apoptotic signaling pathway	0.00052877000256	True	"""The series of molecular signals which triggers the apoptotic death of a cell. The pathway starts with reception of a signal, and ends when the execution phase of apoptosis is triggered."" [GOC:mtg_apoptosis]"	588	101	13	15719	0.1287128712871287	0.0221088435374149	query_1	['GO:0006915', 'GO:0007165']	['PIK3CB', 'ITGAV', 'SRC', 'FGA', 'PIK3R1', 'HGF', 'CTNNB1', 'CXCL12', 'FGB', 'FGG', 'NRP1', 'LCK', 'ACKR3']
728	GO:BP	GO:1904646	cellular response to amyloid-beta	0.0005394584434424	True	"""Any process that results in a change in state or activity of a cell (in terms of movement, secretion, enzyme production, gene expression, etc.) as a result of a amyloid-beta stimulus."" [GO_REF:0000071, GOC:TermGenie, PMID:23555824]"	38	101	4	15719	0.0396039603960396	0.1052631578947368	query_1	['GO:1901653', 'GO:1904645']	['FYN', 'ITGA4', 'ABCC1', 'VCAM1']
729	GO:BP	GO:0060416	response to growth hormone	0.0005394584434424	True	"""Any process that results in a change in state or activity of a cell or an organism (in terms of movement, secretion, enzyme production, gene expression, etc.) as a result of a growth hormone stimulus. Growth hormone is a peptide hormone that binds to the growth hormone receptor and stimulates growth."" [GOC:BHF, GOC:dph]"	38	101	4	15719	0.0396039603960396	0.1052631578947368	query_1	['GO:0043434']	['PIK3R1', 'PXN', 'LYN', 'PTK2']
730	GO:BP	GO:0002460	adaptive immune response based on somatic recombination of immune receptors built from immunoglobulin superfamily domains	0.0005424643629112	True	"""An immune response mediated by lymphocytes expressing specific receptors for antigen produced through a somatic diversification process that includes somatic recombination of germline gene segments encoding immunoglobulin superfamily domains. Recombined receptors for antigen encoded by immunoglobulin superfamily domains include T cell receptors and immunoglobulins (antibodies) produced by B cells. The first encounter with antigen elicits a primary immune response that is slow and not of great magnitude. T and B cells selected by antigen become activated and undergo clonal expansion. A fraction of antigen-reactive T and B cells become memory cells, whereas others differentiate into effector cells. The memory cells generated during the primary response enable a much faster and stronger secondary immune response upon subsequent exposures to the same antigen (immunological memory). An example of this is the adaptive immune response found in Mus musculus."" [GOC:add, GOC:mtg_sensu, ISBN:0781735149, ISBN:1405196831]"	289	101	9	15719	0.0891089108910891	0.0311418685121107	query_1	['GO:0002250']	['C3', 'TFRC', 'HFE', 'FCGR1A', 'IGHM', 'CD81', 'CD19', 'HPX', 'CR2']
187	REAC	REAC:R-HSA-9006936	Signaling by TGFB family members	0.0005483896989324	True	Signaling by TGFB family members	118	100	7	10022	0.07	0.059322033898305	query_1	['REAC:R-HSA-162582']	['ITGB1', 'ITGB5', 'ITGAV', 'ITGB3', 'TGFB3', 'ITGB6', 'CBL']
731	GO:BP	GO:0002220	innate immune response activating cell surface receptor signaling pathway	0.0005654847113399	True	"""The series of molecular signals initiated by a ligand binding to a cell surface receptor that leads to the activation of an innate immune response."" [GOC:add, ISBN:0781735149, PMID:15199967]"	73	101	5	15719	0.0495049504950495	0.0684931506849315	query_1	['GO:0002429', 'GO:0002758']	['SRC', 'PLCG2', 'FYN', 'LYN', 'SYK']
732	GO:BP	GO:0007568	aging	0.000578951858426	True	"""A developmental process that is a deterioration and loss of function over time. Aging includes loss of functions such as resistance to disease, homeostasis, and fertility, as well as wear and tear. Aging includes cellular senescence, but is more inclusive. May precede death and may succeed developmental maturation (GO:0021700)."" [GOC:PO_curators]"	169	101	7	15719	0.0693069306930693	0.0414201183431952	query_1	['GO:0032502']	['GJB6', 'ADRA1A', 'TGFB3', 'TFRC', 'GJB2', 'GRB2', 'VCAM1']
733	GO:BP	GO:2001028	positive regulation of endothelial cell chemotaxis	0.0005930316189817	True	"""Any process that activates or increases the frequency, rate or extent of endothelial cell chemotaxis."" [GOC:BHF]"	15	101	3	15719	0.0297029702970297	0.2	query_1	['GO:0010595', 'GO:0035767', 'GO:0050921', 'GO:2001026']	['MET', 'KDR', 'VEGFA']
734	GO:BP	GO:0034764	positive regulation of transmembrane transport	0.0006060137151537	True	"""Any process that activates or increases the frequency, rate or extent of the directed movement of a solute from one side of a membrane to the other."" [GOC:mah]"	229	101	8	15719	0.0792079207920792	0.0349344978165938	query_1	['GO:0034762', 'GO:0048522', 'GO:0051050', 'GO:0055085']	['C3', 'ITGB1', 'PIK3R1', 'PLCG2', 'MS4A1', 'PLCG1', 'CD19', 'PTPN11']
735	GO:BP	GO:1902905	positive regulation of supramolecular fiber organization	0.000620510920174	True	"""Any process that activates or increases the frequency, rate or extent of supramolecular fiber organization."" [GO_REF:0000058, GOC:PARL, GOC:rl, GOC:TermGenie, PMID:23921388]"	171	101	7	15719	0.0693069306930693	0.0409356725146198	query_1	['GO:0051130', 'GO:0097435', 'GO:1902903']	['MET', 'TGFB3', 'PXN', 'GRB2', 'APOA1', 'PTK2B', 'NRP1']
736	GO:BP	GO:0060348	bone development	0.00062286623017	True	"""The process whose specific outcome is the progression of bone over time, from its formation to the mature structure. Bone is the hard skeletal connective tissue consisting of both mineral and cellular components."" [GOC:dph]"	230	101	8	15719	0.0792079207920792	0.0347826086956521	query_1	['GO:0001501', 'GO:0048513']	['PLXNB1', 'SRC', 'TGFB3', 'VKORC1', 'KDR', 'ITGB6', 'PTPN11', 'SEMA4D']
83	GO:CC	GO:0001772	immunological synapse	0.0006299306464186	True	"""An area of close contact between a lymphocyte (T-, B-, or natural killer cell) and a target cell formed through the clustering of particular signaling and adhesion molecules and their associated membrane rafts on both the lymphocyte and the target cell and facilitating activation of the lymphocyte, transfer of membrane from the target cell to the lymphocyte, and in some situations killing of the target cell through release of secretory granules and/or death-pathway ligand-receptor interaction."" [GOC:mgi_curators, PMID:11244041, PMID:11376300]"	43	102	4	16420	0.0392156862745098	0.0930232558139534	query_1	['GO:0005886', 'GO:0110165']	['LAT', 'ZAP70', 'CD81', 'LCK']
188	REAC	REAC:R-HSA-5654710	PI-3K cascade:FGFR3	0.0006303066482653	True	PI-3K cascade:FGFR3	12	100	3	10022	0.03	0.25	query_1	['REAC:R-HSA-5654708']	['PIK3R1', 'PIK3CA', 'PTPN11']
189	REAC	REAC:R-HSA-1963640	GRB2 events in ERBB2 signaling	0.0006303066482653	True	GRB2 events in ERBB2 signaling	12	100	3	10022	0.03	0.25	query_1	['REAC:R-HSA-1227986']	['SOS1', 'EGFR', 'ERBB2']
190	REAC	REAC:R-HSA-180336	SHC1 events in EGFR signaling	0.0006303066482653	True	SHC1 events in EGFR signaling	12	100	3	10022	0.03	0.25	query_1	['REAC:R-HSA-177929']	['SHC1', 'SOS1', 'EGFR']
750	GO:BP	GO:0097374	sensory neuron axon guidance	0.0006365229588286	True	"""The process in which the migration of an axon growth cone of a sensory neuron is directed to a specific target site in response to a combination of attractive and repulsive cues. A sensory neuron is an afferent neuron conveying sensory impulses."" [CL:0000101, GOC:pr]"	3	101	2	15719	0.0198019801980198	0.6666666666666666	query_1	['GO:0007411']	['NRP2', 'NRP1']
746	GO:BP	GO:1905322	positive regulation of mesenchymal stem cell migration	0.0006365229588286	True	"""Any process that activates or increases the frequency, rate or extent of mesenchymal stem cell migration."" [GO_REF:0000058, GOC:TermGenie, PMID:26846297]"	3	101	2	15719	0.0198019801980198	0.6666666666666666	query_1	['GO:0030335', 'GO:1905319', 'GO:1905320']	['CXCR4', 'ACKR3']
751	GO:BP	GO:1905320	regulation of mesenchymal stem cell migration	0.0006365229588286	True	"""Any process that modulates the frequency, rate or extent of mesenchymal stem cell migration."" [GO_REF:0000058, GOC:TermGenie, PMID:26846297]"	3	101	2	15719	0.0198019801980198	0.6666666666666666	query_1	['GO:0030334', 'GO:1905319']	['CXCR4', 'ACKR3']
749	GO:BP	GO:2000573	positive regulation of DNA biosynthetic process	0.0006365229588286	True	"""Any process that activates or increases the frequency, rate or extent of DNA biosynthetic process."" [GOC:obol]"	75	101	5	15719	0.0495049504950495	0.0666666666666666	query_1	['GO:0010557', 'GO:0031328', 'GO:0051054', 'GO:0071897', 'GO:2000278']	['SRC', 'HGF', 'CTNNB1', 'PTK2B', 'VEGFA']
748	GO:BP	GO:0001798	positive regulation of type IIa hypersensitivity	0.0006365229588286	True	"""Any process that activates or increases the frequency, rate or extent of type IIa hypersensitivity, a type of inflammatory response."" [GOC:add, ISBN:0781735149]"	3	101	2	15719	0.0198019801980198	0.6666666666666666	query_1	['GO:0001794', 'GO:0001796', 'GO:0002894']	['C3', 'FCGR1A']
747	GO:BP	GO:1902336	positive regulation of retinal ganglion cell axon guidance	0.0006365229588286	True	"""Any process that activates or increases the frequency, rate or extent of retinal ganglion cell axon guidance."" [GOC:BHF, GOC:rl, GOC:TermGenie, PMID:21658587]"	3	101	2	15719	0.0198019801980198	0.6666666666666666	query_1	['GO:0031290', 'GO:0090259', 'GO:1902669']	['VEGFA', 'NRP1']
745	GO:BP	GO:0031348	negative regulation of defense response	0.0006365229588286	True	"""Any process that stops, prevents, or reduces the frequency, rate or extent of a defense response."" [GOC:mah]"	231	101	8	15719	0.0792079207920792	0.0346320346320346	query_1	['GO:0006952', 'GO:0031347', 'GO:0048585']	['SRC', 'CRK', 'HGF', 'FYN', 'LYN', 'APOA1', 'SYK', 'PLCG1']
752	GO:BP	GO:0035684	helper T cell extravasation	0.0006365229588286	True	"""The migration of a helper T cell from the blood vessels into the surrounding tissue. A helper T-cell is an effector T cell that provides help in the form of secreted cytokines to other immune cells."" [CL:0000912, GOC:BHF]"	3	101	2	15719	0.0198019801980198	0.6666666666666666	query_1	['GO:0072683']	['CRK', 'CRKL']
744	GO:BP	GO:0043366	beta selection	0.0006365229588286	True	"""The process in which successful recombination of a T cell receptor beta chain into a translatable protein coding sequence leads to rescue from apoptosis and subsequent proliferation of an immature T cell."" [ISBN:0781735149, PMID:12220932]"	3	101	2	15719	0.0198019801980198	0.6666666666666666	query_1	['GO:0045058', 'GO:0046632']	['ZAP70', 'SYK']
742	GO:BP	GO:0002894	positive regulation of type II hypersensitivity	0.0006365229588286	True	"""Any process that activates or increases the frequency, rate, or extent of type II hypersensitivity."" [GOC:add]"	3	101	2	15719	0.0198019801980198	0.6666666666666666	query_1	['GO:0002445', 'GO:0002885', 'GO:0002888', 'GO:0002891', 'GO:0002892']	['C3', 'FCGR1A']
741	GO:BP	GO:1905604	negative regulation of blood-brain barrier permeability	0.0006365229588286	True	"""Any process that decreases blood-brain barrier permeability, the quality of the blood-brain barrier that allows for a controlled passage of substances (e.g. macromolecules, small molecules, ions) into and out of the brain."" [GO_REF:0000058, GOC:als, GOC:aruk, GOC:bc, GOC:TermGenie, PMID:22524708, PMID:30280653]"	3	101	2	15719	0.0198019801980198	0.6666666666666666	query_1	['GO:0043116', 'GO:1905603']	['VEGFA', 'SH3GL2']
740	GO:BP	GO:0038086	VEGF-activated platelet-derived growth factor receptor signaling pathway	0.0006365229588286	True	"""The series of molecular signals initiated by vascular endothelial growth factor (VEGF) binding to a platelet-derived growth factor receptor (PDGFR) on the surface of a cell, and ending with the regulation of a downstream cellular process, e.g. transcription."" [GOC:signaling, PMID:17470632]"	3	101	2	15719	0.0198019801980198	0.6666666666666666	query_1	['GO:0038084', 'GO:0048008']	['VEGFA', 'PDGFRA']
739	GO:BP	GO:0098749	cerebellar neuron development	0.0006365229588286	True	"""The process whose specific outcome is the progression of a cerebellar neuron over time, from initial commitment of the cell to a specific fate, to the fully functional differentiated cell."" [GOC:dos]"	3	101	2	15719	0.0198019801980198	0.6666666666666666	query_1	['GO:0021549', 'GO:0048666']	['CRK', 'CRKL']
738	GO:BP	GO:1903997	positive regulation of non-membrane spanning protein tyrosine kinase activity	0.0006365229588286	True	"""Any process that activates or increases the frequency, rate or extent of non-membrane spanning protein tyrosine kinase activity."" [GO_REF:0000059, GOC:BHF, GOC:nc, GOC:TermGenie, PMID:10518561]"	3	101	2	15719	0.0198019801980198	0.6666666666666666	query_1	['GO:0061098', 'GO:1903995']	['ADRA1A', 'SRC']
737	GO:BP	GO:0038091	positive regulation of cell proliferation by VEGF-activated platelet derived growth factor receptor signaling pathway	0.0006365229588286	True	"""The series of molecular signals initiated by vascular endothelial growth factor (VEGF) binding to a platelet-derived growth factor receptor (PDGFR) on the surface of a cell, which activates or increases the frequency, rate or extent of cell proliferation."" [GOC:signaling, PMID:17470632]"	3	101	2	15719	0.0198019801980198	0.6666666666666666	query_1	['GO:0008284', 'GO:0038086']	['VEGFA', 'PDGFRA']
