COG7-CDG	source	native	name	Corrected p_value	significant	description	term_size	query_size	intersection_size	effective_domain_size	precision	recall	query	parents	intersections
0	GO:BP	GO:0007249	I-kappaB kinase/NF-kappaB signaling	3.8667027630702006e-54	True	"""The process in which a signal is passed on to downstream components within the cell through the I-kappaB-kinase (IKK)-dependent activation of NF-kappaB. The cascade begins with activation of a trimeric IKK complex (consisting of catalytic kinase subunits IKKalpha and/or IKKbeta, and the regulatory scaffold protein NEMO) and ends with the regulation of transcription of target genes by NF-kappaB. In a resting state, NF-kappaB dimers are bound to I-kappaB proteins, sequestering NF-kappaB in the cytoplasm. Phosphorylation of I-kappaB targets I-kappaB for ubiquitination and proteasomal degradation, thus releasing the NF-kappaB dimers, which can translocate to the nucleus to bind DNA and regulate transcription."" [GOC:bf, GOC:jl, PMID:12773372, Reactome:R-HSA-209560]"	279	101	48	15719	0.4752475247524752	0.1720430107526881	query_1	['GO:0035556']	['SHARPIN', 'CARD11', 'TANK', 'AKT1', 'NFKBIB', 'UBE2V1', 'MAP3K14', 'TRAF3', 'CASP10', 'CHUK', 'CARD8', 'TNFRSF1A', 'TAB2', 'RELA', 'IKBKB', 'TBKBP1', 'FASLG', 'IKBKE', 'RBCK1', 'AZI2', 'BTRC', 'TBK1', 'TNF', 'RNF31', 'FADD', 'TNIP2', 'RIPK1', 'CFLAR', 'TRADD', 'MALT1', 'TNIP1', 'IKBKG', 'BIRC3', 'TRAF2', 'MAP3K7', 'TNFAIP3', 'LTBR', 'RELB', 'PYCARD', 'REL', 'TRAF6', 'BIRC2', 'NFKBIA', 'CASP1', 'CASP8', 'TAB3', 'BCL10', 'UBE2N']
1	GO:BP	GO:0043122	regulation of I-kappaB kinase/NF-kappaB signaling	4.0049021930730826e-48	True	"""Any process that modulates I-kappaB kinase/NF-kappaB signaling."" [GOC:jl, PMID:12773372]"	248	101	43	15719	0.4257425742574257	0.1733870967741935	query_1	['GO:0007249', 'GO:1902531']	['SHARPIN', 'CARD11', 'TANK', 'NFKBIB', 'UBE2V1', 'MAP3K14', 'TRAF3', 'CASP10', 'CHUK', 'CARD8', 'TNFRSF1A', 'TAB2', 'RELA', 'IKBKB', 'FASLG', 'IKBKE', 'RBCK1', 'BTRC', 'TBK1', 'TNF', 'RNF31', 'FADD', 'TNIP2', 'RIPK1', 'CFLAR', 'TRADD', 'MALT1', 'TNIP1', 'IKBKG', 'BIRC3', 'TRAF2', 'MAP3K7', 'TNFAIP3', 'LTBR', 'PYCARD', 'REL', 'TRAF6', 'BIRC2', 'CASP1', 'CASP8', 'TAB3', 'BCL10', 'UBE2N']
1	REAC	REAC:R-HSA-168164	Toll Like Receptor 3 (TLR3) Cascade	1.807295913994512e-41	True	Toll Like Receptor 3 (TLR3) Cascade	100	94	33	10022	0.351063829787234	0.33	query_1	['REAC:R-HSA-168898']	['MAP3K8', 'TANK', 'NFKBIB', 'UBE2V1', 'TRAF3', 'CHUK', 'TAB2', 'RELA', 'IKBKB', 'IKBKE', 'BTRC', 'TBK1', 'FADD', 'NFKB1', 'TNIP2', 'RIPK1', 'SKP1', 'NFKB2', 'FBXW11', 'IKBKG', 'TAB1', 'BIRC3', 'TRAF2', 'MAP3K7', 'TRAF6', 'BIRC2', 'NFKBIA', 'CASP8', 'APP', 'TAB3', 'CUL1', 'TP53', 'UBE2N']
0	REAC	REAC:R-HSA-168643	Nucleotide-binding domain, leucine rich repeat containing receptor (NLR) signaling pathways	1.807295913994512e-41	True	Nucleotide-binding domain, leucine rich repeat containing receptor (NLR) signaling pathways	55	94	28	10022	0.2978723404255319	0.509090909090909	query_1	['REAC:R-HSA-168249']	['UBE2V1', 'BCL2', 'HSP90AB1', 'CHUK', 'TAB2', 'RELA', 'IKBKB', 'NLRC4', 'NFKB1', 'PSTPIP1', 'NFKB2', 'IKBKG', 'TAB1', 'BIRC3', 'MAP3K7', 'TNFAIP3', 'AIM2', 'MEFV', 'PYCARD', 'NLRP1', 'TRAF6', 'BIRC2', 'BCL2L1', 'CASP1', 'CASP8', 'APP', 'TAB3', 'UBE2N']
2	REAC	REAC:R-HSA-166166	MyD88-independent TLR4 cascade 	2.761786461581361e-41	True	MyD88-independent TLR4 cascade 	104	94	33	10022	0.351063829787234	0.3173076923076923	query_1	['REAC:R-HSA-166016']	['MAP3K8', 'TANK', 'NFKBIB', 'UBE2V1', 'TRAF3', 'CHUK', 'TAB2', 'RELA', 'IKBKB', 'IKBKE', 'BTRC', 'TBK1', 'FADD', 'NFKB1', 'TNIP2', 'RIPK1', 'SKP1', 'NFKB2', 'FBXW11', 'IKBKG', 'TAB1', 'BIRC3', 'TRAF2', 'MAP3K7', 'TRAF6', 'BIRC2', 'NFKBIA', 'CASP8', 'APP', 'TAB3', 'CUL1', 'TP53', 'UBE2N']
3	REAC	REAC:R-HSA-937061	TRIF(TICAM1)-mediated TLR4 signaling 	2.761786461581361e-41	True	TRIF(TICAM1)-mediated TLR4 signaling 	104	94	33	10022	0.351063829787234	0.3173076923076923	query_1	['REAC:R-HSA-166166']	['MAP3K8', 'TANK', 'NFKBIB', 'UBE2V1', 'TRAF3', 'CHUK', 'TAB2', 'RELA', 'IKBKB', 'IKBKE', 'BTRC', 'TBK1', 'FADD', 'NFKB1', 'TNIP2', 'RIPK1', 'SKP1', 'NFKB2', 'FBXW11', 'IKBKG', 'TAB1', 'BIRC3', 'TRAF2', 'MAP3K7', 'TRAF6', 'BIRC2', 'NFKBIA', 'CASP8', 'APP', 'TAB3', 'CUL1', 'TP53', 'UBE2N']
2	GO:BP	GO:0043123	positive regulation of I-kappaB kinase/NF-kappaB signaling	1.5919767949402094e-39	True	"""Any process that activates or increases the frequency, rate or extent of I-kappaB kinase/NF-kappaB signaling."" [GOC:jl]"	187	101	35	15719	0.3465346534653465	0.1871657754010695	query_1	['GO:0007249', 'GO:0043122', 'GO:1902533']	['SHARPIN', 'CARD11', 'UBE2V1', 'MAP3K14', 'CASP10', 'CHUK', 'TNFRSF1A', 'TAB2', 'RELA', 'IKBKB', 'FASLG', 'IKBKE', 'RBCK1', 'TBK1', 'TNF', 'RNF31', 'FADD', 'TNIP2', 'RIPK1', 'CFLAR', 'TRADD', 'MALT1', 'IKBKG', 'BIRC3', 'TRAF2', 'MAP3K7', 'LTBR', 'REL', 'TRAF6', 'BIRC2', 'CASP1', 'CASP8', 'TAB3', 'BCL10', 'UBE2N']
3	GO:BP	GO:0035556	intracellular signal transduction	7.731754766672289e-38	True	"""The process in which a signal is passed on to downstream components within the cell, which become activated themselves to further propagate the signal and finally trigger a change in the function or state of the cell."" [GOC:bf, GOC:jl, GOC:signaling, ISBN:3527303782]"	2545	101	77	15719	0.7623762376237624	0.0302554027504911	query_1	['GO:0007165']	['SHARPIN', 'BCL2L11', 'CARD11', 'BAX', 'MAP3K8', 'TANK', 'HSPA1A', 'GSK3B', 'AKT1', 'TNFRSF1B', 'NFKBIB', 'UBE2V1', 'MAP3K14', 'TRAF3', 'PYDC2', 'BCL2', 'CASP10', 'HSP90AB1', 'CHUK', 'CARD8', 'TNFRSF1A', 'TAB2', 'RELA', 'IKBKB', 'TBKBP1', 'FASLG', 'MCL1', 'IKBKE', 'RBX1', 'RBCK1', 'AZI2', 'BTRC', 'TBK1', 'TNF', 'FAS', 'RNF31', 'FADD', 'NFKB1', 'TNIP2', 'BID', 'BBC3', 'RIPK1', 'CFLAR', 'TNFSF14', 'TRADD', 'MALT1', 'TNIP1', 'NFKB2', 'HSP90AA1', 'FBXW11', 'IKBKG', 'TAB1', 'BIRC3', 'TRAF2', 'MAP3K7', 'TNFAIP3', 'LTBR', 'RELB', 'PYCARD', 'REL', 'NLRP1', 'TRAF6', 'BIRC2', 'BCL2L1', 'SFN', 'NFKBIA', 'BAK1', 'CASP1', 'CASP8', 'APP', 'TAB3', 'CUL1', 'FBXW7', 'TP53', 'BCL10', 'UBE2N', 'BAD']
4	REAC	REAC:R-HSA-166016	Toll Like Receptor 4 (TLR4) Cascade	1.6138916080027782e-36	True	Toll Like Receptor 4 (TLR4) Cascade	140	94	33	10022	0.351063829787234	0.2357142857142857	query_1	['REAC:R-HSA-168898']	['MAP3K8', 'TANK', 'NFKBIB', 'UBE2V1', 'TRAF3', 'CHUK', 'TAB2', 'RELA', 'IKBKB', 'IKBKE', 'BTRC', 'TBK1', 'FADD', 'NFKB1', 'TNIP2', 'RIPK1', 'SKP1', 'NFKB2', 'FBXW11', 'IKBKG', 'TAB1', 'BIRC3', 'TRAF2', 'MAP3K7', 'TRAF6', 'BIRC2', 'NFKBIA', 'CASP8', 'APP', 'TAB3', 'CUL1', 'TP53', 'UBE2N']
4	GO:BP	GO:1902531	regulation of intracellular signal transduction	4.2489668047719136e-36	True	"""Any process that modulates the frequency, rate or extent of intracellular signal transduction."" [GOC:dph, GOC:signaling, GOC:tb, GOC:TermGenie]"	1654	101	65	15719	0.6435643564356436	0.0392986698911729	query_1	['GO:0009966', 'GO:0035556']	['SHARPIN', 'BCL2L11', 'CARD11', 'BAX', 'TANK', 'HSPA1A', 'GSK3B', 'AKT1', 'NFKBIB', 'UBE2V1', 'MAP3K14', 'TRAF3', 'PYDC2', 'BCL2', 'CASP10', 'HSP90AB1', 'CHUK', 'CARD8', 'TNFRSF1A', 'TAB2', 'RELA', 'IKBKB', 'FASLG', 'MCL1', 'IKBKE', 'RBCK1', 'BTRC', 'TBK1', 'TNF', 'FAS', 'RNF31', 'FADD', 'TNIP2', 'BID', 'BBC3', 'RIPK1', 'CFLAR', 'TNFSF14', 'TRADD', 'MALT1', 'TNIP1', 'HSP90AA1', 'FBXW11', 'IKBKG', 'TAB1', 'BIRC3', 'TRAF2', 'MAP3K7', 'TNFAIP3', 'LTBR', 'PYCARD', 'REL', 'TRAF6', 'BIRC2', 'BCL2L1', 'NFKBIA', 'CASP1', 'CASP8', 'APP', 'TAB3', 'FBXW7', 'TP53', 'BCL10', 'UBE2N', 'BAD']
5	GO:BP	GO:0033209	tumor necrosis factor-mediated signaling pathway	1.129504129501664e-34	True	"""The series of molecular signals initiated by tumor necrosis factor binding to its receptor on the surface of a cell, and ending with the regulation of a downstream cellular process, e.g. transcription."" [GOC:mah, GOC:signaling]"	100	101	27	15719	0.2673267326732673	0.27	query_1	['GO:0019221', 'GO:0071356']	['SHARPIN', 'HSPA1A', 'TNFRSF1B', 'TRAF3', 'PYDC2', 'CHUK', 'CARD8', 'TNFRSF1A', 'FOXO3', 'RELA', 'IKBKB', 'TNF', 'FAS', 'RIPK1', 'TRADD', 'BIRC3', 'TRAF2', 'TNFAIP3', 'AIM2', 'PYCARD', 'TRAF6', 'BIRC2', 'NFKBIA', 'CASP1', 'CASP8', 'TP53', 'NLRP2']
6	GO:BP	GO:0009607	response to biotic stimulus	1.129504129501664e-34	True	"""Any process that results in a change in state or activity of a cell or an organism (in terms of movement, secretion, enzyme production, gene expression, etc.) as a result of a biotic stimulus, a stimulus caused or produced by a living organism."" [GOC:hb]"	1463	101	61	15719	0.6039603960396039	0.0416951469583048	query_1	['GO:0050896']	['SHARPIN', 'BCL2L11', 'BAX', 'TANK', 'HSPA1A', 'GSK3B', 'AKT1', 'TNFRSF1B', 'CREBBP', 'NFKBIB', 'MAP3K14', 'TRAF3', 'PYDC2', 'BCL2', 'CHUK', 'CARD8', 'TNFRSF1A', 'TAB2', 'RELA', 'IKBKB', 'NLRC4', 'FKBP5', 'TBKBP1', 'FASLG', 'IKBKE', 'RBCK1', 'AZI2', 'TBK1', 'TNF', 'RNF31', 'FADD', 'NFKB1', 'TNIP2', 'PSTPIP1', 'NLRP3', 'LTA', 'MALT1', 'TNIP1', 'HSP90AA1', 'TAX1BP1', 'IKBKG', 'BIRC3', 'MAP3K7', 'TNFAIP3', 'AIM2', 'MEFV', 'RELB', 'PYCARD', 'REL', 'NLRP1', 'TRAF6', 'BIRC2', 'BCL2L1', 'NFKBIA', 'BAK1', 'CASP1', 'CASP8', 'TP53', 'BCL10', 'NLRP2', 'CDC37']
5	REAC	REAC:R-HSA-168898	Toll-like Receptor Cascades	2.6538980904149788e-34	True	Toll-like Receptor Cascades	162	94	33	10022	0.351063829787234	0.2037037037037037	query_1	['REAC:R-HSA-168249']	['MAP3K8', 'TANK', 'NFKBIB', 'UBE2V1', 'TRAF3', 'CHUK', 'TAB2', 'RELA', 'IKBKB', 'IKBKE', 'BTRC', 'TBK1', 'FADD', 'NFKB1', 'TNIP2', 'RIPK1', 'SKP1', 'NFKB2', 'FBXW11', 'IKBKG', 'TAB1', 'BIRC3', 'TRAF2', 'MAP3K7', 'TRAF6', 'BIRC2', 'NFKBIA', 'CASP8', 'APP', 'TAB3', 'CUL1', 'TP53', 'UBE2N']
7	GO:BP	GO:0080134	regulation of response to stress	8.165972223264967e-34	True	"""Any process that modulates the frequency, rate or extent of a response to stress. Response to stress is a change in state or activity of a cell or an organism (in terms of movement, secretion, enzyme production, gene expression, etc.) as a result of a disturbance in organismal or cellular homeostasis, usually, but not necessarily, exogenous (e.g. temperature, humidity, ionizing radiation)."" [GOC:dhl]"	1380	101	59	15719	0.5841584158415841	0.0427536231884057	query_1	['GO:0006950', 'GO:0048583']	['SHARPIN', 'BCL2L11', 'BAX', 'HSPA1A', 'GSK3B', 'AKT1', 'TNFRSF1B', 'CREBBP', 'UBE2V1', 'TRAF3', 'PYDC2', 'BCL2', 'TNFRSF1A', 'RELA', 'IKBKB', 'NLRC4', 'MCL1', 'CASP5', 'IKBKE', 'TBK1', 'TNF', 'FAS', 'RNF31', 'FADD', 'NFKB1', 'TNIP2', 'BID', 'NLRP3', 'LTA', 'BBC3', 'RIPK1', 'TRADD', 'TNIP1', 'HSP90AA1', 'BIRC3', 'TRAF2', 'NLRP4', 'MAP3K7', 'TNFAIP3', 'AIM2', 'MEFV', 'LTBR', 'PYCARD', 'NLRP1', 'TRAF6', 'BIRC2', 'BCL2L1', 'NFKBIA', 'BAK1', 'CASP1', 'CASP8', 'APP', 'FBXW7', 'TP53', 'BCL10', 'UBE2N', 'BAD', 'NLRP2', 'CDC37']
8	GO:BP	GO:0044419	biological process involved in interspecies interaction between organisms	8.258781533660061e-34	True	"""Any process evolved to enable an interaction with an organism of a different species."" [GOC:cc]"	1592	101	62	15719	0.6138613861386139	0.0389447236180904	query_1	['GO:0008150']	['SHARPIN', 'BCL2L11', 'BAX', 'TANK', 'HSPA1A', 'AKT1', 'TNFRSF1B', 'CREBBP', 'NFKBIB', 'MAP3K14', 'TRAF3', 'PYDC2', 'BCL2', 'HSP90AB1', 'CHUK', 'CARD8', 'TNFRSF1A', 'TAB2', 'RELA', 'IKBKB', 'NLRC4', 'FKBP5', 'TBKBP1', 'FASLG', 'IKBKE', 'RBCK1', 'AZI2', 'TBK1', 'TNF', 'RNF31', 'FADD', 'NFKB1', 'TNIP2', 'PSTPIP1', 'NLRP3', 'LTA', 'MALT1', 'TNIP1', 'HSP90AA1', 'TAX1BP1', 'IKBKG', 'BIRC3', 'MAP3K7', 'TNFAIP3', 'AIM2', 'MEFV', 'RELB', 'PYCARD', 'REL', 'NLRP1', 'TRAF6', 'BIRC2', 'BCL2L1', 'NFKBIA', 'BAK1', 'CASP1', 'CASP8', 'TP53', 'BCL10', 'BAD', 'NLRP2', 'CDC37']
6	REAC	REAC:R-HSA-73887	Death Receptor Signaling	1.56746568535322e-33	True	Death Receptor Signaling	138	94	31	10022	0.3297872340425531	0.2246376811594203	query_1	['REAC:R-HSA-162582']	['SHARPIN', 'BCL2L11', 'CASP10', 'CHUK', 'TNFRSF1A', 'TAB2', 'RELA', 'IKBKB', 'FASLG', 'RBCK1', 'TNF', 'FAS', 'RNF31', 'FADD', 'NFKB1', 'RIPK1', 'CFLAR', 'TRADD', 'TAX1BP1', 'IKBKG', 'TAB1', 'BIRC3', 'TRAF2', 'MAP3K7', 'TNFAIP3', 'TRAF6', 'BIRC2', 'NFKBIA', 'CASP8', 'TAB3', 'BAD']
9	GO:BP	GO:0034097	response to cytokine	2.0739378356774912e-33	True	"""Any process that results in a change in state or activity of a cell or an organism (in terms of movement, secretion, enzyme production, gene expression, etc.) as a result of a cytokine stimulus."" [GOC:sl]"	873	101	50	15719	0.495049504950495	0.0572737686139748	query_1	['GO:0010033']	['SHARPIN', 'STIP1', 'TANK', 'HSPA1A', 'GSK3B', 'AKT1', 'TNFRSF1B', 'TRAF3', 'PYDC2', 'BCL2', 'HSP90AB1', 'CHUK', 'CARD8', 'TNFRSF1A', 'FOXO3', 'RELA', 'IKBKB', 'TBKBP1', 'FASLG', 'MCL1', 'IKBKE', 'AZI2', 'TBK1', 'TNF', 'FAS', 'FADD', 'NFKB1', 'TNIP2', 'RIPK1', 'TRADD', 'BIRC3', 'TRAF2', 'MAP3K7', 'TNFAIP3', 'AIM2', 'MEFV', 'RELB', 'PYCARD', 'REL', 'TRAF6', 'BIRC2', 'BCL2L1', 'NFKBIA', 'CASP1', 'CASP8', 'APP', 'TP53', 'BAD', 'NLRP2', 'CDC37']
10	GO:BP	GO:0051707	response to other organism	3.751510650052261e-33	True	"""Any process that results in a change in state or activity of a cell or an organism (in terms of movement, secretion, enzyme production, gene expression, etc.) as a result of a stimulus from another living organism."" [GOC:ai]"	1426	101	59	15719	0.5841584158415841	0.0413744740532959	query_1	['GO:0043207', 'GO:0044419']	['SHARPIN', 'BAX', 'TANK', 'HSPA1A', 'AKT1', 'TNFRSF1B', 'CREBBP', 'NFKBIB', 'MAP3K14', 'TRAF3', 'PYDC2', 'BCL2', 'CHUK', 'CARD8', 'TNFRSF1A', 'TAB2', 'RELA', 'IKBKB', 'NLRC4', 'FKBP5', 'TBKBP1', 'FASLG', 'IKBKE', 'RBCK1', 'AZI2', 'TBK1', 'TNF', 'RNF31', 'FADD', 'NFKB1', 'TNIP2', 'PSTPIP1', 'NLRP3', 'LTA', 'MALT1', 'TNIP1', 'HSP90AA1', 'TAX1BP1', 'IKBKG', 'BIRC3', 'MAP3K7', 'TNFAIP3', 'AIM2', 'MEFV', 'RELB', 'PYCARD', 'REL', 'NLRP1', 'TRAF6', 'BIRC2', 'BCL2L1', 'NFKBIA', 'BAK1', 'CASP1', 'CASP8', 'TP53', 'BCL10', 'NLRP2', 'CDC37']
11	GO:BP	GO:0043207	response to external biotic stimulus	3.8692984372995785e-33	True	"""Any process that results in a change in state or activity of a cell or an organism (in terms of movement, secretion, enzyme production, gene expression, etc.) as a result of an external biotic stimulus, an external stimulus caused by, or produced by living things."" [GOC:go_curators]"	1429	101	59	15719	0.5841584158415841	0.0412876137158852	query_1	['GO:0009605', 'GO:0009607']	['SHARPIN', 'BAX', 'TANK', 'HSPA1A', 'AKT1', 'TNFRSF1B', 'CREBBP', 'NFKBIB', 'MAP3K14', 'TRAF3', 'PYDC2', 'BCL2', 'CHUK', 'CARD8', 'TNFRSF1A', 'TAB2', 'RELA', 'IKBKB', 'NLRC4', 'FKBP5', 'TBKBP1', 'FASLG', 'IKBKE', 'RBCK1', 'AZI2', 'TBK1', 'TNF', 'RNF31', 'FADD', 'NFKB1', 'TNIP2', 'PSTPIP1', 'NLRP3', 'LTA', 'MALT1', 'TNIP1', 'HSP90AA1', 'TAX1BP1', 'IKBKG', 'BIRC3', 'MAP3K7', 'TNFAIP3', 'AIM2', 'MEFV', 'RELB', 'PYCARD', 'REL', 'NLRP1', 'TRAF6', 'BIRC2', 'BCL2L1', 'NFKBIA', 'BAK1', 'CASP1', 'CASP8', 'TP53', 'BCL10', 'NLRP2', 'CDC37']
7	REAC	REAC:R-HSA-168256	Immune System	2.443625453503876e-32	True	Immune System	1957	94	73	10022	0.776595744680851	0.0373019928461931	query_1	['REAC:0000000']	['BCL2L11', 'CARD11', 'MAP3K8', 'TANK', 'HSPA1A', 'AKT1', 'TNFRSF1B', 'NFKBIE', 'CREBBP', 'NFKBIB', 'UBE2V1', 'MAP3K14', 'TRAF3', 'BCL2', 'CASP10', 'HSP90AB1', 'CHUK', 'TNFRSF1A', 'TAB2', 'FOXO3', 'RELA', 'IKBKB', 'NLRC4', 'FASLG', 'MCL1', 'IKBKE', 'RBX1', 'FYB1', 'RBCK1', 'BTRC', 'TBK1', 'TNF', 'FADD', 'NFKB1', 'TNIP2', 'PSTPIP1', 'LTA', 'RIPK1', 'SKP1', 'TNFSF14', 'MALT1', 'LTB', 'NFKB2', 'HSP90AA1', 'TAX1BP1', 'FBXW11', 'IKBKG', 'TAB1', 'BIRC3', 'TRAF2', 'NLRP4', 'MAP3K7', 'TNFAIP3', 'AIM2', 'MEFV', 'LTBR', 'RELB', 'PYCARD', 'REL', 'NLRP1', 'TRAF6', 'BIRC2', 'BCL2L1', 'NFKBIA', 'CASP1', 'CASP8', 'APP', 'TAB3', 'CUL1', 'FBXW7', 'TP53', 'BCL10', 'UBE2N']
12	GO:BP	GO:0048584	positive regulation of response to stimulus	3.525956450319981e-32	True	"""Any process that activates, maintains or increases the rate of a response to a stimulus. Response to stimulus is a change in state or activity of a cell or an organism (in terms of movement, secretion, enzyme production, gene expression, etc.) as a result of a stimulus."" [GOC:jid]"	2113	101	67	15719	0.6633663366336634	0.0317084713677236	query_1	['GO:0048518', 'GO:0048583', 'GO:0050896']	['SHARPIN', 'BCL2L11', 'CARD11', 'BAX', 'HSPA1A', 'CREBBP', 'UBE2V1', 'MAP3K14', 'TRAF3', 'BCL2', 'CASP10', 'HSP90AB1', 'CHUK', 'TNFRSF1A', 'TAB2', 'FOXO3', 'RELA', 'IKBKB', 'NLRC4', 'FASLG', 'MCL1', 'IKBKE', 'FYB1', 'RBCK1', 'TBK1', 'TNF', 'FAS', 'RNF31', 'FADD', 'NFKB1', 'TNIP2', 'BID', 'NLRP3', 'LTA', 'BBC3', 'RIPK1', 'CFLAR', 'TNFSF14', 'TRADD', 'MALT1', 'TNIP1', 'HSP90AA1', 'IKBKG', 'TAB1', 'BIRC3', 'TRAF2', 'MAP3K7', 'TNFAIP3', 'AIM2', 'MEFV', 'LTBR', 'PYCARD', 'REL', 'NLRP1', 'TRAF6', 'BIRC2', 'NFKBIA', 'BAK1', 'CASP1', 'CASP8', 'APP', 'TAB3', 'FBXW7', 'TP53', 'BCL10', 'UBE2N', 'BAD']
13	GO:BP	GO:0002376	immune system process	4.5932205700018485e-32	True	"""Any process involved in the development or functioning of the immune system, an organismal system for calibrated responses to potential internal or invasive threats."" [GO_REF:0000022, GOC:add]"	2394	101	70	15719	0.693069306930693	0.0292397660818713	query_1	['GO:0008150']	['BCL2L11', 'CARD11', 'BAX', 'MAP3K8', 'TANK', 'HSPA1A', 'AKT1', 'TNFRSF1B', 'CREBBP', 'MAP3K14', 'TRAF3', 'PYDC2', 'BCL2', 'CHUK', 'CARD8', 'FOXO3', 'RELA', 'IKBKB', 'NLRC4', 'TBKBP1', 'FASLG', 'IKBKE', 'FYB1', 'RBCK1', 'AZI2', 'TBK1', 'TNF', 'FAS', 'RNF31', 'FADD', 'NFKB1', 'TNIP2', 'PSTPIP1', 'BID', 'NLRP3', 'LTA', 'RIPK1', 'TNFSF14', 'MALT1', 'LTB', 'TNIP1', 'NFKB2', 'HSP90AA1', 'TAX1BP1', 'IKBKG', 'BIRC3', 'TRAF2', 'MAP3K7', 'TNFAIP3', 'AIM2', 'MEFV', 'LTBR', 'RELB', 'PYCARD', 'REL', 'NLRP1', 'TRAF6', 'BIRC2', 'NFKBIA', 'BAK1', 'CASP1', 'CASP8', 'APP', 'FBXW7', 'TP53', 'BCL10', 'UBE2N', 'BAD', 'NLRP2', 'CDC37']
14	GO:BP	GO:0048583	regulation of response to stimulus	6.806954215808895e-32	True	"""Any process that modulates the frequency, rate or extent of a response to a stimulus. Response to stimulus is a change in state or activity of a cell or an organism (in terms of movement, secretion, enzyme production, gene expression, etc.) as a result of a stimulus."" [GOC:jid]"	3723	101	82	15719	0.8118811881188119	0.0220252484555466	query_1	['GO:0050789', 'GO:0050896']	['SHARPIN', 'BCL2L11', 'CARD11', 'BAX', 'TANK', 'HSPA1A', 'GSK3B', 'AKT1', 'TNFRSF1B', 'CREBBP', 'NFKBIB', 'UBE2V1', 'MAP3K14', 'TRAF3', 'PYDC2', 'BCL2', 'CASP10', 'HSP90AB1', 'CHUK', 'CARD8', 'TNFRSF1A', 'TAB2', 'FOXO3', 'RELA', 'IKBKB', 'NLRC4', 'FASLG', 'MCL1', 'CASP5', 'IKBKE', 'RBX1', 'FYB1', 'RBCK1', 'BTRC', 'TBK1', 'TNF', 'FAS', 'RNF31', 'FADD', 'NFKB1', 'TNIP2', 'BID', 'NLRP3', 'LTA', 'BBC3', 'RIPK1', 'CFLAR', 'TNFSF14', 'TRADD', 'MALT1', 'TNIP1', 'HSP90AA1', 'FBXW11', 'IKBKG', 'TAB1', 'BIRC3', 'TRAF2', 'NLRP4', 'MAP3K7', 'TNFAIP3', 'AIM2', 'MEFV', 'LTBR', 'PYCARD', 'REL', 'NLRP1', 'TRAF6', 'BIRC2', 'BCL2L1', 'NFKBIA', 'BAK1', 'CASP1', 'CASP8', 'APP', 'TAB3', 'FBXW7', 'TP53', 'BCL10', 'UBE2N', 'BAD', 'NLRP2', 'CDC37']
15	GO:BP	GO:0006955	immune response	7.931567629966371e-32	True	"""Any immune system process that functions in the calibrated response of an organism to a potential internal or invasive threat."" [GO_REF:0000022, GOC:add]"	1662	101	61	15719	0.6039603960396039	0.0367027677496991	query_1	['GO:0002376', 'GO:0050896']	['CARD11', 'BAX', 'TANK', 'HSPA1A', 'TNFRSF1B', 'CREBBP', 'MAP3K14', 'TRAF3', 'PYDC2', 'BCL2', 'CHUK', 'CARD8', 'RELA', 'IKBKB', 'NLRC4', 'TBKBP1', 'FASLG', 'IKBKE', 'FYB1', 'RBCK1', 'AZI2', 'TBK1', 'TNF', 'FAS', 'RNF31', 'FADD', 'NFKB1', 'TNIP2', 'PSTPIP1', 'NLRP3', 'LTA', 'TNFSF14', 'MALT1', 'LTB', 'TNIP1', 'NFKB2', 'HSP90AA1', 'TAX1BP1', 'IKBKG', 'BIRC3', 'TRAF2', 'MAP3K7', 'TNFAIP3', 'AIM2', 'MEFV', 'LTBR', 'RELB', 'PYCARD', 'REL', 'NLRP1', 'TRAF6', 'BIRC2', 'NFKBIA', 'CASP1', 'CASP8', 'APP', 'TP53', 'BCL10', 'UBE2N', 'NLRP2', 'CDC37']
16	GO:BP	GO:1902533	positive regulation of intracellular signal transduction	1.3256025819101055e-31	True	"""Any process that activates or increases the frequency, rate or extent of intracellular signal transduction."" [GOC:BHF, GOC:dph, GOC:signaling, GOC:tb, GOC:TermGenie]"	962	101	50	15719	0.495049504950495	0.0519750519750519	query_1	['GO:0009967', 'GO:0035556', 'GO:1902531']	['SHARPIN', 'BCL2L11', 'CARD11', 'BAX', 'UBE2V1', 'MAP3K14', 'TRAF3', 'CASP10', 'HSP90AB1', 'CHUK', 'TNFRSF1A', 'TAB2', 'RELA', 'IKBKB', 'FASLG', 'MCL1', 'IKBKE', 'RBCK1', 'TBK1', 'TNF', 'RNF31', 'FADD', 'TNIP2', 'BID', 'BBC3', 'RIPK1', 'CFLAR', 'TNFSF14', 'TRADD', 'MALT1', 'HSP90AA1', 'IKBKG', 'TAB1', 'BIRC3', 'TRAF2', 'MAP3K7', 'LTBR', 'PYCARD', 'REL', 'TRAF6', 'BIRC2', 'CASP1', 'CASP8', 'APP', 'TAB3', 'FBXW7', 'TP53', 'BCL10', 'UBE2N', 'BAD']
17	GO:BP	GO:0012501	programmed cell death	2.132107448437313e-31	True	"""A process which begins when a cell receives an internal or external signal and activates a series of biochemical events (signaling pathway). The process ends with the death of the cell."" [GOC:lr, GOC:mtg_apoptosis]"	1850	101	63	15719	0.6237623762376238	0.034054054054054	query_1	['GO:0008219']	['SHARPIN', 'BCL2L11', 'CARD11', 'BAX', 'HSPA1A', 'GSK3B', 'AKT1', 'TNFRSF1B', 'TRAF3', 'BCL2', 'CASP10', 'HSP90AB1', 'CARD8', 'TNFRSF1A', 'FOXO3', 'RELA', 'NLRC4', 'FASLG', 'MCL1', 'CASP5', 'IKBKE', 'RBCK1', 'TNF', 'FAS', 'RNF31', 'FADD', 'NFKB1', 'TNIP2', 'BID', 'LTA', 'BBC3', 'RIPK1', 'CFLAR', 'TNFSF14', 'TRADD', 'MALT1', 'HSP90AA1', 'TAX1BP1', 'IKBKG', 'BIRC3', 'TRAF2', 'MAP3K7', 'TNFAIP3', 'AIM2', 'MEFV', 'LTBR', 'PYCARD', 'NLRP1', 'TRAF6', 'BIRC2', 'BCL2L1', 'SFN', 'NFKBIA', 'BAK1', 'CASP1', 'CASP8', 'APP', 'CUL1', 'FBXW7', 'TP53', 'BCL10', 'BAD', 'NLRP2']
18	GO:BP	GO:0006952	defense response	5.799247134555719e-31	True	"""Reactions, triggered in response to the presence of a foreign body or the occurrence of an injury, which result in restriction of damage to the organism attacked or prevention/recovery from the infection caused by the attack."" [GOC:go_curators]"	1650	101	60	15719	0.594059405940594	0.0363636363636363	query_1	['GO:0006950']	['SHARPIN', 'TANK', 'HSPA1A', 'AKT1', 'TNFRSF1B', 'CREBBP', 'NFKBIB', 'MAP3K14', 'TRAF3', 'PYDC2', 'BCL2', 'CHUK', 'CARD8', 'TNFRSF1A', 'RELA', 'IKBKB', 'NLRC4', 'TBKBP1', 'FASLG', 'CASP5', 'IKBKE', 'RBCK1', 'AZI2', 'TBK1', 'TNF', 'RNF31', 'FADD', 'NFKB1', 'TNIP2', 'PSTPIP1', 'NLRP3', 'LTA', 'RIPK1', 'TRADD', 'MALT1', 'TNIP1', 'HSP90AA1', 'TAX1BP1', 'IKBKG', 'BIRC3', 'NLRP4', 'MAP3K7', 'TNFAIP3', 'AIM2', 'MEFV', 'RELB', 'PYCARD', 'REL', 'NLRP1', 'TRAF6', 'BIRC2', 'BCL2L1', 'NFKBIA', 'CASP1', 'CASP8', 'APP', 'TP53', 'BCL10', 'NLRP2', 'CDC37']
8	REAC	REAC:R-HSA-75893	TNF signaling	7.054599938303333e-31	True	TNF signaling	42	94	21	10022	0.2234042553191489	0.5	query_1	['REAC:R-HSA-73887']	['SHARPIN', 'CHUK', 'TNFRSF1A', 'TAB2', 'IKBKB', 'RBCK1', 'TNF', 'RNF31', 'FADD', 'RIPK1', 'TRADD', 'TAX1BP1', 'IKBKG', 'TAB1', 'BIRC3', 'TRAF2', 'MAP3K7', 'TNFAIP3', 'BIRC2', 'CASP8', 'TAB3']
19	GO:BP	GO:0008219	cell death	2.084451359750392e-30	True	"""Any biological process that results in permanent cessation of all vital functions of a cell. A cell should be considered dead when any one of the following molecular or morphological criteria is met: (1) the cell has lost the integrity of its plasma membrane; (2) the cell, including its nucleus, has undergone complete fragmentation into discrete bodies (frequently referred to as apoptotic bodies). The cell corpse (or its fragments) may be engulfed by an adjacent cell in vivo, but engulfment of whole cells should not be considered a strict criteria to define cell death as, under some circumstances, live engulfed cells can be released from phagosomes (see PMID:18045538)."" [GOC:mah, GOC:mtg_apoptosis, PMID:25236395]"	2011	101	64	15719	0.6336633663366337	0.0318249627051218	query_1	['GO:0009987']	['SHARPIN', 'BCL2L11', 'CARD11', 'BAX', 'HSPA1A', 'GSK3B', 'AKT1', 'TNFRSF1B', 'TRAF3', 'BCL2', 'CASP10', 'HSP90AB1', 'CARD8', 'TNFRSF1A', 'FOXO3', 'RELA', 'NLRC4', 'FASLG', 'MCL1', 'CASP5', 'IKBKE', 'RBCK1', 'TBK1', 'TNF', 'FAS', 'RNF31', 'FADD', 'NFKB1', 'TNIP2', 'BID', 'LTA', 'BBC3', 'RIPK1', 'CFLAR', 'TNFSF14', 'TRADD', 'MALT1', 'HSP90AA1', 'TAX1BP1', 'IKBKG', 'BIRC3', 'TRAF2', 'MAP3K7', 'TNFAIP3', 'AIM2', 'MEFV', 'LTBR', 'PYCARD', 'NLRP1', 'TRAF6', 'BIRC2', 'BCL2L1', 'SFN', 'NFKBIA', 'BAK1', 'CASP1', 'CASP8', 'APP', 'CUL1', 'FBXW7', 'TP53', 'BCL10', 'BAD', 'NLRP2']
20	GO:BP	GO:0051247	positive regulation of protein metabolic process	2.084451359750392e-30	True	"""Any process that activates or increases the frequency, rate or extent of the chemical reactions and pathways involving a protein."" [GOC:ai]"	1401	101	56	15719	0.5544554455445545	0.0399714489650249	query_1	['GO:0010604', 'GO:0019538', 'GO:0051173', 'GO:0051246']	['BCL2L11', 'BAX', 'TANK', 'HSPA1A', 'GSK3B', 'AKT1', 'TNFRSF1B', 'UBE2V1', 'BCL2', 'CASP10', 'HSP90AB1', 'CARD8', 'TNFRSF1A', 'TAB2', 'RELA', 'NLRC4', 'FASLG', 'RBX1', 'BTRC', 'TBK1', 'TNF', 'FAS', 'FADD', 'BID', 'NLRP3', 'BBC3', 'RIPK1', 'SKP1', 'CFLAR', 'MALT1', 'TNIP1', 'HSP90AA1', 'FBXW11', 'SNX33', 'TAB1', 'BIRC3', 'TRAF2', 'MAP3K7', 'TNFAIP3', 'AIM2', 'MEFV', 'PYCARD', 'NLRP1', 'TRAF6', 'BIRC2', 'NFKBIA', 'BAK1', 'CASP1', 'CASP8', 'APP', 'FBXW7', 'TP53', 'BCL10', 'UBE2N', 'BAD', 'NLRP2']
21	GO:BP	GO:0045862	positive regulation of proteolysis	2.118078219852334e-30	True	"""Any process that activates or increases the frequency, rate or extent of the hydrolysis of a peptide bond or bonds within a protein."" [GOC:go_curators]"	351	101	35	15719	0.3465346534653465	0.0997150997150997	query_1	['GO:0006508', 'GO:0030162', 'GO:0051247']	['BCL2L11', 'BAX', 'TANK', 'HSPA1A', 'GSK3B', 'AKT1', 'TNFRSF1B', 'CASP10', 'CARD8', 'NLRC4', 'FASLG', 'RBX1', 'BTRC', 'TNF', 'FAS', 'FADD', 'BID', 'NLRP3', 'BBC3', 'CFLAR', 'MALT1', 'TNIP1', 'FBXW11', 'SNX33', 'AIM2', 'MEFV', 'PYCARD', 'NLRP1', 'BAK1', 'CASP1', 'CASP8', 'FBXW7', 'BCL10', 'BAD', 'NLRP2']
